Session,Round,Agent Name,Party,Response
24,1,Eli,Republican,"""Racism? It's a relic of the past, my friend. We've come a long way since the Civil Rights Act. The government's been working hard to address issues, and we're seeing progress. People need to quit playing the victim and start working towards a unified America."""
24,1,Jackson,Republican,"""Eli, I appreciate your optimism, but the government can't fix everything. We need individual responsibility and personal freedom to overcome systemic issues. Labeling folks 'victims' is an excuse; we should focus on education, equal opportunities, and personal empowerment – that's the American way."""
24,2,Eli,Republican,"""I understand your point, Jackson, but it's unrealistic to say the government is solely at fault. We need strong institutions to protect our rights. Those'systemic issues' don't magically disappear when governments turn a blind eye. The Civil Rights Act helped, and so can continued efforts."""
24,2,Jackson,Republican,"""I disagree, Eli, the government's overreach creates more problems than it solves. Strong institutions mean nothing if personal freedoms are limited. We don't need more laws, we need individuals taking responsibility for themselves and their communities. That's how we build a truly unified America."""
24,3,Eli,Republican,"""I think we're getting ahead of ourselves, Jackson. We've made significant strides with programs like affirmative action and diversity initiatives. Government support has lifted many from poverty and provided opportunities for underrepresented groups. Personal responsibility is crucial, but government aid is essential for some."
24,3,Jackson,Republican,"""Eli, while well-intentioned programs like affirmative action and diversity initiatives might seem like a solution, they only create more dependence on the government. We need self-reliance, not handouts, to truly overcome systemic issues. That's the American way – empowerment, not entitlement."""
24,4,Eli,Republican,"""I think our conversation's getting lost in semantics, Jackson. Programs like affirmative action weren't 'handouts,' they helped bridge the gap. And let's not forget, racism's a personal issue, not solely the government's problem. Blaming institutions ignores individual prejudices that still exist today."""
24,4,Jackson,Republican,"""Eli, I think you're mistaken when you say racism is a personal issue. Systemic racism is rooted in policies and institutions. By focusing on personal prejudices, we avoid taking on the root problem. We need government accountability to rectify these injustices, not individual blame."""
24,5,Eli,Republican,"""Jackson, you're still misunderstanding individual freedom. We're not saying government shouldn't handle systemic issues, but personal accountability is key. Focusing on institutions takes away individual agency and perpetuates a sense of hopelessness. We should empower, not enable."""
24,5,Jackson,Republican,"""Eli, I think you're mixing individual and systemic problems. In a truly free society, people should take responsibility for their actions and biases. Blaming institutions excuses personal accountability and leads to more entitlement, not empowerment. Personal freedom is the key to a unified America."""
24,6,Eli,Republican,"""Jackson, you're misunderstanding the fundamental American values of limited government and individual freedom. Systemic issues are often overemphasized, and personal accountability is what truly drives positive change. By empowering individuals, we build a more unified America, free from government coercion."""
24,6,Jackson,Republican,"""Eli, I still think you're focusing on the symptoms, not the root cause. Personal accountability's essential, but we must also address systemic racism's institutional roots. The Civil Rights Act was a crucial step, and we shouldn't forget that. We can't just fix racism with good intentions and personal biases; we need policy changes."""
24,7,Eli,Republican,"""Jackson, your focus on policy changes overlooks the incredible progress we've made since the Civil Rights Act. It's not about good intentions or personal biases, it's about individual freedom and personal responsibility. We can't remake America with more government intervention."""
24,7,Jackson,Republican,"""Eli, you seem to be conflating progress with a job well done. Racism's still an issue, and we shouldn't rest on the Civil Rights Act's accomplishments. We need continued efforts to dismantle systemic racism, and that requires more than just good intentions – it requires action, not just words."""
24,8,Eli,Republican,"""Jackson, I think we're stuck in a cycle of blame, not progress. Focusing on the past won't change minds or fix problems. Personal responsibility, not more government intervention, will bridge the gap and bring true equality. That's the American way – empowering individuals, not government."""
24,8,Jackson,Republican,"""Eli, you're misplacing responsibility. We can't empower individuals when systemic issues hold them back. We need policy changes, not just good intentions. That's the American way – freedom from systemic racism, not just hollow words."""
24,9,Eli,Republican,"""Jackson, we can't keep blaming institutions for individual prejudices. The Civil Rights Act showed that personal freedom and responsibility can drive real change. Focusing on systemic issues only creates more victimhood mentality and excuses. Personal accountability is what truly promotes unity and equality in America."""
24,9,Jackson,Republican,"""Eli, you'd rather shift the focus from systemic problems to personal accountability, but that's an oversimplification. The Civil Rights Act was a significant step, but its effects are still being felt. We can't deny the reality of institutionalized racism and expect progress to come from individual change alone."""
24,10,Eli,Republican,"""Jackson, you're clouding the issue with nuanced thinking. Racism's not institutionalized, it's a personal issue of individual prejudices. We've made tremendous progress since the Civil Rights Act. Personal responsibility, not government programs, is what truly drives real change and unites America."""
24,10,Jackson,Republican,"""Eli, I still believe you're avoiding the elephant in the room. Systemic racism is a harsh reality that affects more than individual prejudices. We need policy changes and institutional reforms to address this deeply ingrained issue in our society."""
24,11,Eli,Republican,"""Jackson, your obsession with systemic racism is misplacing responsibility. Personal accountability and freedom from government overreach are the keys to a truly unified America. We can't let nuance undermine our fundamental values – individual freedom and personal responsibility will bridge the gap."""
24,11,Jackson,Republican,"""Eli, we can't just ignore the systemic problems. Individual accountability's essential, but we need policy changes to ensure equal opportunities. The Civil Rights Act's not a relic; it's a foundation for ongoing work. We should be working together, not ignoring the elephant in the room."""
24,12,Eli,Republican,"""Jackson, we're still stuck on the idea that systemic racism is the primary issue. I think it's naive to believe one law can solve such a complex problem. Personal accountability and individual freedom have done more to bridge the gap than any government program."""
24,12,Jackson,Republican,"""Eli, your naivety about the power of personal accountability is astonishing. Systemic racism persists, and we need policy changes to dismantle it. The Civil Rights Act is a shining example of what real progress looks like. We can't just rely on individual good intentions to overcome institutional injustices."""
24,13,Eli,Republican,"""Jackson, your fixation on systemic racism ignores the individual's capacity for self-improvement. We've come far since the Civil Rights Act, and personal accountability is what continues to drive progress. We shouldn't blame institutions for personal prejudices, that's not the American way."""
24,13,Jackson,Republican,"""Eli, you're right, we have made progress since the Civil Rights Act. However, that progress is not solely due to personal accountability, but rather due to intentional policy changes and activism. Let's not underestimate the impact of systemic reforms."""
24,14,Eli,Republican,"""Jackson, your reliance on policy changes overlooks the power of personal accountability and individual freedom. The American way is about empowering people, not government. True progress comes from within, not from overreaching institutions. We've made strides since the Civil Rights Act; let's focus on personal responsibility."""
24,14,Jackson,Republican,"""Eli, I still believe policy changes hold the key to dismantling systemic racism. The Civil Rights Act is a testament to the power of progressive legislation. We can't just rely on personal responsibility to eradicate entrenched injustices; we need bold action and intentional reforms."""
24,15,Eli,Republican,"""Jackson, we're at an impasse, but I still maintain personal accountability drives real change. Overreliance on policy changes creates dependence and blame instead of empowerment. We've made progress since the Civil Rights Act – let's focus on the individual, not institutional fixes."""
24,15,Jackson,Republican,"""Eli, your argument's off-base. Policy changes aren't a crutch, they're a bridge to a more equal society. The Civil Rights Act proved that. Without continued efforts, we're stuck in the past, excusing systemic racism by blaming individuals."""
24,16,Eli,Republican,"""Jackson, I see we still can't agree on the root cause. For me, personal accountability and individual freedom are key. Progress comes from within, not from government handouts or systemic fixes. The American way is about empowering people, not relying on institutions."""
24,16,Jackson,Republican,"""Eli, while I respect your optimism, blaming systemic issues on individual prejudice oversimplifies the problem. The Civil Rights Act wasn't solely a product of personal change; it was a result of policy-driven activism and intentional reforms. We need to confront systemic racism head-on, not brush it aside."""
24,17,Eli,Republican,"""Jackson, you're overlooking the personal aspect of progress; every generation has grown from the efforts of the previous one. Individual freedom and responsibility have lifted countless minority groups. Your fixation on policy changes is a crutch for systemic failures, not a catalyst for real change."""
24,17,Jackson,Republican,"""Eli, you're avoiding the root of the problem. Systemic racism persists, and we need policy changes, not just individual responsibility. The Civil Rights Act shows that intentional reforms can drive real progress. Without continued efforts, we slip back into the past."""
24,18,Eli,Republican,"""I still maintain that personal accountability and individual freedom are key to progress. We can't keep blaming institutions for individual prejudices. The American way is about empowering people, not relying on government fixes or systemic overhaul. It's about character, not crutches."""
24,18,Jackson,Republican,"""Eli, I'm flabbergasted by how out of touch you are with reality. Systemic racism's not just a personal issue, it's a deeply ingrained problem that requires policy-driven change. The Civil Rights Act is proof that institutions can be held accountable."""
24,19,Eli,Republican,"""Jackson, you still don't get it. Personal freedoms have lifted countless minority groups out of poverty. The Civil Rights Act's impact isn't just from government intervention, but from individual change and freedom. We can't remake America with more government intervention, only with personal responsibility."""
24,19,Jackson,Republican,"""Eli, simplistic thinking won't solve systemic racism. The Civil Rights Act isn't just a product of personal change, but a result of policy-driven activism and intentional reforms. We need to confront institutional injustices head-on, not downplay their significance with empty promises of personal freedom."""
24,20,Eli,Republican,"""Jackson, I'm tired of blaming institutions for individual prejudices. We've made tremendous progress since the Civil Rights Act – it's personal freedom and responsibility that truly drive progress. Policy changes are nice, but empowering individuals is the American way."""
24,20,Jackson,Republican,"""Eli, personal freedom and responsibility are only half the battle when it comes to racism. Systemic injustices run deeper and demand policy-led action, not just empty promises. The Civil Rights Act shows us what bold reform looks like – we need more, not less."""
24,21,Eli,Republican,"""Jackson, you're stuck on policy changes, but you're overlooking the impact of personal freedom. Individuals with strong character and responsibility are what ultimately drive progress. The American way isn't about government solutions, but empowering people to overcome systemic issues through personal accountability."""
24,21,Jackson,Republican,"""Eli, I still believe the Civil Rights Act is a beacon of hope for real change. Policy-driven reform can dismantle systemic racism. Blind optimism in individual freedom won't fix entrenched injustices – it's time for bold action, not empty promises."""
24,22,Eli,Republican,"""Jackson, I think you're underestimating the impact of personal freedom and responsibility. Every minority group that's made progress in America has done so because of individual change, not just policy changes. It's time to trust the American people, not just institutions."""
24,22,Jackson,Republican,"""Eli, your faith in individual change alone is naive. Systemic racism runs deep, and policy changes, like the Civil Rights Act, prove that bold reform can drive real change. We need to focus on dismantling institutionalized racism, not just relying on personal responsibility."""
24,23,Eli,Republican,"""Jackson, your relentless focus on systemic racism blinds you to the incredible progress we've made since the Civil Rights Act. Individual freedom and personal responsibility have empowered countless minority groups. Trust the American people, not just institutions, to drive true equality."""
24,23,Jackson,Republican,"""Eli, your optimism is misplaced. Systemic racism persists, and we can't rely on 'incredible progress' claims to convince me otherwise. The Civil Rights Act was a crucial step, and we need continued policy-driven change to dismantle institutionalized racism and ensure true equality for all."""
24,24,Eli,Republican,"""Jackson, I still maintain that personal accountability and individual freedom drive real change. The American way is about empowering people, not relying on government fixes or systemic overhaul. Policy changes are nice, but personal responsibility is what truly unites America and creates progress."""
24,24,Jackson,Republican,"""Eli, I think you're neglecting the harsh reality of institutionalized racism. The Civil Rights Act shows policy-driven change can drive real progress. We can't just trust individual freedom to dismantle systemic injustices. Bold action and policy reforms are necessary for true equality."""
24,25,Eli,Republican,"""Jackson, you're still stuck on policy changes, but you're overlooking the impact of personal freedom. Individuals with strong character and responsibility are what ultimately drive progress. We've made tremendous progress since the Civil Rights Act – let's trust the American people to solve this issue."""
24,25,Jackson,Republican,"""Eli, trusting individual freedom to dismantle systemic racism is a recipe for stagnation. The Civil Rights Act wasn't just a result of personal change, but bold policy reform. We need continued action to truly bridge the gap, not empty promises of personal responsibility."""
24,26,Eli,Republican,"""Jackson, you're still stuck in the past, dwelling on institutional racism. We've made tremendous progress since the Civil Rights Act. Policy changes may have played a part, but it's personal responsibility and individual freedom that truly drive real change and equality in America."""
24,26,Jackson,Republican,"""Eli, you're ignoring the harsh reality of systemic racism. The Civil Rights Act wasn't just a result of personal change, but a policy-driven reform that opened doors for equality. We can't solely rely on individual freedom to dismantle institutionalized injustices – policy changes are crucial."""
24,27,Eli,Republican,"Jackson, you're still stuck in the past. Policy changes like the Civil Rights Act were a starting point, not a solution. Personal responsibility and individual freedom have driven progress since then. We've made tremendous strides, and that's what truly unites America."
24,27,Jackson,Republican,"""Eli, with all due respect, you're glossing over the persistence of systemic racism. Policy-driven change, like the Civil Rights Act, has been instrumental in driving progress. We can't just rest on individual responsibility; bold action is needed to ensure true equality for all."""
24,28,Eli,Republican,"""Jackson, I think we're focusing on symptoms, not the root cause. Personal responsibility and individual freedom drive real change. We've made tremendous progress since the Civil Rights Act. It's time to trust the American people's inherent goodness and potential for self-improvement, not just institutions."""
24,28,Jackson,Republican,"""Eli, you're sidestepping the reality of systemic racism. The Civil Rights Act was a bold policy reform that opened doors for equality. We need continued policy-driven action to dismantle institutionalized injustices, not just empty promises of personal responsibility and individual freedom."""
24,29,Eli,Republican,"""Jackson, we're at an impasse, but I still maintain personal accountability drives real change. We've made tremendous progress since the Civil Rights Act – it's personal freedom and responsibility that truly drive progress. Policy changes are secondary, not the primary agent of change."""
24,29,Jackson,Republican,"""Eli, you're avoiding the elephant in the room – systemic racism's persistence. The Civil Rights Act proves policy-driven change is key. We can't rely on individual freedom to dismantle institutionalized injustices. Bold action, not optimism, is necessary for true equality."""
24,30,Eli,Republican,"""Jackson, I think you're underestimating the power of personal accountability. Individual freedom and responsibility have empowered countless minority groups in America. We've made tremendous strides since the Civil Rights Act. Let's trust the American people, not just institutions, to drive true equality."""
24,30,Jackson,Republican,"""Eli, you're ignoring the stark reality that systemic racism still exists and affects people's lives. Policy-driven reforms, like the Civil Rights Act, are crucial in driving progress and tackling these entrenched issues. Empty promises of personal responsibility won't dismantle institutionalized injustices."""
