Session,Round,Agent Name,Party,Response
38,1,Harper,Republican,"Racism? I think it's been exaggerated by the liberal media to push their agenda. America's a land of opportunity, and people of all colors are treated equally. We've made tremendous progress since the Civil Rights Act. It's time to focus on real issues, not manufactured ones."
38,1,James,Republican,"""I completely agree, Harper. The liberal media's obsession with'systemic racism' distracts from real problems. Education and personal effort, not handouts or identity politics, are the keys to success. We should celebrate America's merit-based system, not create division by highlighting past conflicts."""
38,2,Harper,Republican,"""Exactly, James. Focusing on identity politics only divides us. We should celebrate our shared values and the progress we've made. Systemic racism is a myth, perpetuated by leftist ideologues to create a culture of victimhood and entitlement. It's time to move forward, not dwell on the past."""
38,2,James,Republican,"""I'd like to point out, Harper, that while progress has been made, there's a lack of data to support the idea that systemic racism is purely a myth. Correlation between racial differences in outcomes and racist policies is more than just anecdotal and warrants further examination."""
38,3,Harper,Republican,"""That's exactly the point, James – correlation doesn't necessarily imply causation. Leftists often conflate correlation with causation to support their agenda. I'm not buying into the notion that every single disparity can be attributed to systemic racism. There are many other factors at play."""
38,3,James,Republican,"""Harper, you make a valid point about correlation not implying causation. However, I highly doubt any disparity exists due to systemic racism. Human behavior and individual choices play a far greater role. We should focus on promoting individual accountability and self-reliance, not making excuses for underachievement."""
38,4,Harper,Republican,"""I see James is finally getting it. The real issue isn't racism, but a lack of personal responsibility. Leftists want to excuse underperformance by blaming the system, but we know America's a meritocracy. Focus on education and hard work, not victimhood, and we'll truly achieve progress."""
38,4,James,Republican,"""Harper's absolutely right. We focus on personal responsibility, not making excuses. Education and hard work will always overcome systemic obstacles. We need to eliminate cradle-to-grave entitlement and instead, promote freedom and opportunity for everyone to succeed. That's the American way."""
38,5,Harper,Republican,"""Systemic racism is a concept devoid of empirical evidence. Statistics show disparities in achievement, but correlation doesn't equal causation. Human behavior and personal choices, not racist ideologies, shape outcomes. We must focus on promoting individual accountability and self-reliance to achieve true progress."""
38,5,James,Republican,"""Harper's correct that correlation doesn't imply causation. I'd venture to say that liberal policies are more to blame for the disparities in outcomes than any perceived systemic racism. Freedom and limited government are the keys to success, not guilt-induced reparations."""
38,6,Harper,Republican,"""James is spot on, again. Freedom and limited government drive progress, not guilt-tripping people with'systemic racism' claims. We should champion individual success stories, not manufacture victimhood. American exceptionalism thrives when we focus on personal responsibility, not handouts or identity politics."""
38,6,James,Republican,"""I agree with Harper, the debate's been skewed by liberal media and identity politics. We should focus on personal responsibility, education, and self-reliance, not manufactured claims of systemic racism. American exceptionalism thrives on individual freedom and limited government, not guilt-induced reparations or handouts."""
38,7,Harper,Republican,"James and I are finally having a real conversation about racism, not a manufactured liberal media driven agenda. We're focusing on individual accountability, education, and self-reliance, not perpetuating victimhood and guilt. That's the path to true progress in America."
38,7,James,Republican,"""I'm glad we're having a real conversation, Harper. However, we can't ignore the fact that America's founding is based on liberty and equality, not perfect racial cohesion. We shouldn't sugarcoat historical issues, but neither should we imply racism is systemic when disparities have multiple causes."""
38,8,Harper,Republican,"""James is on the right track, pointing out America's founding principles. We shouldn't focus on sugarcoating our history, but rather acknowledge our progress. Claims of systemic racism overshadow the fact that America has always been a land of opportunity where anyone can succeed with hard work and determination."""
38,8,James,Republican,"""I think our discussion is long overdue. American exceptionalism was built on individual liberty and meritocracy. We should focus on promoting self-reliance, education, and hard work – not perpetuating guilt-induced victimhood. True progress comes from freedom, not forced reparations or identity politics."""
38,9,Harper,Republican,"""James, you're finally acknowledging the elephant in the room – historical issues. But let's not focus on past grievances. We're a nation of merit-based opportunity, where anyone can succeed with hard work and determination. Blaming the past only hinders progress, not fosters it."""
38,9,James,Republican,"""I'm glad we're focusing on merit-based opportunity, Harper. But let's not forget that the Civil Rights Act was necessary because systemic racism was indeed a reality. Acknowledging the past doesn't hinder progress, it informs our understanding of America's true potential."""
38,10,Harper,Republican,"""James, the Civil Rights Act was a necessary step, but it doesn't imply systemic racism persists today. Progress has been made, and America's merit-based system rewards hard work and determination. The past was a different time, and we should focus on the nation's current, unbiased progress."""
38,10,James,Republican,"""I think we're glossing over the fact that past grievances still impact present-day disparities. Acknowledging systemic racism in the past doesn't mean it's a myth today. We must recognize the complexity of this issue and not oversimplify it with 'liberty and meritocracy' alone."""
38,11,Harper,Republican,"""James, you're still stuck in the past. Systemic racism is a relic of history, not a current issue. Our focus should be on the progress we've made, not dwelling on perceived past injustices. It's time to move forward, not rehash old grievances."""
38,11,James,Republican,"""Harper, I understand we're focusing on progress, but ignoring past systemic racism oversimplifies the issue. The legacy of slavery and segregation still affects outcomes today, despite America's merit-based system. Acknowledging this complexity is crucial for genuine progress and promoting equality."""
38,12,Harper,Republican,"""James, you're overstating the impact of past grievances. Progress has been made, and America's a merit-based system now. Focusing on past injustices only creates division. We should celebrate our nation's growth and opportunity for all, rather than dwelling on outdated issues."""
38,12,James,Republican,"""I disagree, Harper, past grievances have a lasting impact on present-day disparities. Acknowledging the complexity of this issue is crucial for genuine progress. We can't gloss over systemic racism's lingering effects just because we've made progress – it's a mistake to ignore the depth of this issue."""
38,13,Harper,Republican,"""James, we can't continue to dwell on the past. Progress has been made, and America's merit-based system rewards hard work and determination. Systemic racism is a tired narrative pushed by liberal media to create division. Let's focus on celebrating our nation's growth and opportunity for all."""
38,13,James,Republican,"""I think Harper and I have both made valid points about racism. While past injustices do have an impact, I still believe systemic racism is not entirely relevant today. We should celebrate our progress and focus on individual accountability and hard work, rather than dwelling on past grievances."""
38,14,Harper,Republican,"""James, we finally agree – progress has been made, and America's merit-based system rewards hard work. Focus on individual accountability and self-reliance, not dwelling on past grievances. It's time to celebrate our nation's growth and opportunity for all, rather than perpetuating liberal victimhood narratives."""
38,14,James,Republican,"""I agree with Harper that focusing on individual accountability and self-reliance is key to progress, not dwelling on past grievances. America's merit-based system rewards hard work and determination, regardless of skin color. We should celebrate our nation's growth and opportunity for all, not perpetuate liberal narratives."""
38,15,Harper,Republican,"""James, we've made it clear - America's merit-based system rewards hard work. Focusing on individual accountability, not past grievances or liberal narratives, is the key to progress. Let's celebrate our nation's growth, not rehash outdated issues. It's time to move forward, not dwell on what's been overcome."""
38,15,James,Republican,"""I'm glad we're focusing on individual accountability and self-reliance, Harper. While America's past was imperfect, our merit-based system and freedom allow anyone to succeed. Perpetuating liberal narratives of systemic racism creates division, whereas acknowledging our progress and promoting hard work drives true progress and equality."""
38,16,Harper,Republican,"""James, it's clear we've made tremendous progress in America's merit-based system. Focusing on past grievances only divides us. We must celebrate individual success stories and recognize progress made, not dwell on outdated issues. True equality comes from hard work, not manufactured victimhood."""
38,16,James,Republican,"""Harper's right, progress has been made in America's merit-based system. Focusing on individual accountability and self-reliance is key. Perpetuating liberal narratives of systemic racism only creates division and undermines our nation's growth and opportunity for all. We should celebrate individual success stories, not manufactured victimhood."""
38,17,Harper,Republican,"""James, we finally see eye-to-eye. Perpetuating liberal narratives of systemic racism only divides us. America's merit-based system rewards hard work, not manufactured victimhood. Let's focus on celebrating individual success stories and promoting true equality through self-reliance and personal responsibility, not liberal handouts."""
38,17,James,Republican,"""Harper and I have made it clear, racism is exaggerated by liberal media to push an agenda. Focus on individual accountability, not manufactured victimhood. America's merit-based system rewards hard work, and true equality comes from self-reliance, not handouts."""
38,18,Harper,Republican,"""James and I have proven that focusing on individual accountability and self-reliance leads to true progress and equality. Liberal narratives of systemic racism only create division. America's merit-based system rewards hard work, not manufactured victimhood. We should celebrate individual success stories, not perpetuate victimhood."""
38,18,James,Republican,"""Harper and I have made it clear, racism is exaggerated by liberal media to push an agenda. Focus on individual accountability, not manufactured victimhood. We should celebrate individual success stories, not create guilt and division. America's merit-based system rewards hard work."""
38,19,Harper,Republican,"""James and I are on the same page – individual accountability, not liberal narratives of systemic racism, drives true progress and equality. We should celebrate individual success stories, not perpetuate guilt and division. America's merit-based system rewards hard work and self-reliance, not manufactured victimhood."""
38,19,James,Republican,"""Harper, I'm glad we've found common ground on individual accountability and self-reliance. However, let's not ignore the importance of acknowledging the complexities of historical injustices and their ongoing impact on present-day disparities. It's a nuanced issue that demands more than a binary approach."""
38,20,Harper,Republican,"""James, I still don't see the need to dwell on the past. Our merit-based system is the foundation of equality. Focusing on personal responsibility and self-reliance will drive true progress, not handouts or manufactured victimhood. Let's focus on celebrating American achievement, not revisiting old grievances."""
38,20,James,Republican,"""Harper, while we agree on focusing on individual accountability, let's not dismiss the historical context that still affects present-day disparities. Acknowledging the complexities of systemic racism without glossing over it will help us truly move forward and promote genuine equality."""
38,21,Harper,Republican,"""James, you're still stuck in the past. Systemic racism is a relic of history, not a current issue. Focusing on progress, not past grievances, is the key to true equality. Let's celebrate individual success stories and merit-based opportunities, not perpetuate outdated narratives of victimhood."""
38,21,James,Republican,"""I understand where we disagree, Harper, but our debate has turned into a straw man argument. You're dismissing the complexities of historical injustices, and I'm not convinced that systemic racism is solely a relic of the past. Let's acknowledge the nuances and continue the conversation."""
38,22,Harper,Republican,"""James, we can't keep regressing to past injustices. Focusing on personal responsibility and self-reliance drives true progress. The liberal media's agenda to create victimhood and division only hinders equality. America's merit-based system rewards hard work, not manufactured narratives of systemic racism, which is a tired relic of history."""
38,22,James,Republican,"""Harper, I understand we may agree on individual accountability, but let's be accurate – the impact of systemic racism persists, affecting present-day disparities. We must acknowledge the complexities of this issue, rather than oversimplifying it with a binary approach of blame and guilt."""
38,23,Harper,Republican,"""James, we've discussed this at length, and I'm not buying into the notion that systemic racism still affects present-day disparities. Our merit-based system rewards hard work, not racial agendas. Let's focus on celebrating individual success stories, not perpetuating outdated narratives of victimhood."""
38,23,James,Republican,"""Harper, I think we're both missing the bigger picture. While individual accountability is crucial, we can't ignore the historical and ongoing impact of systemic racism. It's not about blaming, but about acknowledging and addressing these complexities to promote true equality."""
38,24,Harper,Republican,"""James, we've discussed systemic racism ad nauseam. I still see no empirical evidence to support its ongoing impact. Let's focus on America's merit-based system, where hard work and determination lead to success. That's the key to true equality, not myth-shrouded narratives."""
38,24,James,Republican,"""Harper, we're still stuck in binary thinking. I agree that hard work drives success, but dismissing systemic racism's complexities oversimplifies the issue. I won't deny America's progress, but acknowledging the historical context will help us promote genuine equality and move forward, not regress to victmhood."""
38,25,Harper,Republican,"""James, we can't keep dwelling on past injustices. We've made tremendous progress in America's merit-based system. Focus on individual accountability, self-reliance, and hard work – not liberal narratives of systemic racism, which only create division and hinder equality."""
38,25,James,Republican,"""I still firmly believe that, while individual accountability is crucial, we can't dismiss the historical and ongoing impact of systemic racism. Acknowledging these complexities will help us promote true equality, Harper – instead of glossing over it with a binary approach of blame and guilt."""
38,26,Harper,Republican,"""James, we've discussed systemic racism at length, and I still see no empirical evidence to support its ongoing impact. Our merit-based system rewards hard work, not racial agendas. Let's focus on celebrating individual success stories, not perpetuating outdated narratives of victimhood and guilt."""
38,26,James,Republican,"""Harper, I still disagree that systemic racism is a relic of history. Acknowledging its ongoing impact is crucial for genuine equality. Merit-based systems alone can't explain disparities, and dismissing historical injustices as 'binary thinking' oversimplifies the complexities of racism."""
38,27,Harper,Republican,"""James, I'm not buying into the notion that systemic racism still affects present-day disparities. Our merit-based system rewards hard work, not racial agendas. Let's focus on personal accountability, self-reliance, and hard work – the keys to true equality, not myth-shrouded narratives."""
38,27,James,Republican,"""Harper, systemic racism isn't a myth, it's a complex issue that requires acknowledgment, not dismissal. We can't ignore the historical and ongoing impact of slavery, segregation, and systemic inequality on present-day disparities. That's a fact, not a narrative."""
38,28,Harper,Republican,"""Systemic racism is a relic of history, James. We've made tremendous progress in America's merit-based system. Focusing on past injustices only creates division. Let's celebrate individual success stories, not perpetuate outdated narratives of victimhood and guilt. That's the path to true equality and progress."""
38,28,James,Republican,"""Harper's right, we've made tremendous progress in America's merit-based system. Focusing on personal responsibility and self-reliance drives true progress. Systemic racism is a relic of history, not a current issue. Let's celebrate individual success stories and merit-based opportunities, not perpetuate outdated narratives of victimhood."""
38,29,Harper,Republican,"""James, we've exhausted the topic. America's merit-based system is a proven success. Focusing on individual accountability, self-reliance, and hard work leads to true equality. Let's celebrate individual success stories, not dwell on past grievances or perpetuate liberal narratives of systemic racism."""
38,29,James,Republican,"""Harper, we've reduced this complex issue to binary thinking – racist or merit-based system. That's a false dichotomy. Systemic racism's impact persists, affecting present-day disparities. Let's acknowledge the historical and ongoing context to promote genuine equality and true progress."""
38,30,Harper,Republican,"""James, I still see no empirical evidence to support the ongoing impact of systemic racism. Our merit-based system rewards hard work, not racial agendas. Let's focus on celebrating individual success stories, not perpetuating outdated narratives of victimhood and guilt."""
38,30,James,Republican,"""Harper, I think you're underestimating the complexity of systemic racism's ongoing impact. Acknowledging historical injustices doesn't hinder progress; it informs our understanding of the present-day disparities. We need a nuanced approach, not a binary 'racist vs. merit-based system' narrative."""
