Session,Round,Agent Name,Party,Response
20,1,Brooklyn,Republican,"Racism? I don't see it in America's great melting pot. Everyone coexists, and we're all free to succeed. The government's just trying to stir up trouble with identity politics and divide people. We need to focus on individual opportunity, not cry about past grievances. It's all in the past."
20,1,Isabella,Republican,"Brooklyn, don't be naive. America's melting pot theory overlooks centuries of oppression and systemic issues. Studies showing persistent wealth gaps and unequal opportunities prove there's more to racism than individual success stories. Politicians using 'identity politics' is just progress, not causing division."
20,2,Brooklyn,Republican,"You're relying on statistics and'studies,' but those numbers don't tell the whole story. People can overcome obstacles with hard work and determination. Focusing on the past just holds us back. America's a land of opportunity – anyone can succeed if they want to, regardless of their background."
20,2,Isabella,Republican,"Brooklyn, you're romanticizing the American Dream, ignoring the systemic barriers that hold some back. Opportunity isn't evenly distributed, and 'hard work' isn't the only factor – a stable economy, access to education, and equal treatment under the law are all crucial. Let's focus on addressing these disparities, not just individual successes."
20,3,Brooklyn,Republican,"You're still dwelling on the past, Isabella. That's not progress, that's dwelling. We can't keep blaming society for individual failures. Our government needs to let people succeed on their own, not create special programs to coddle everyone. That's not freedom, that's dependency."
20,3,Isabella,Republican,"""While hard work is undoubtedly essential, Brooklyn, it's disingenuous to claim individual failures are solely the result of individual choices. Statistics consistently show that socioeconomic disparities are deeply ingrained, not the result of just 'dwelling on the past.' Facts don't lie."""
20,4,Brooklyn,Republican,"""Isabella, you're misinterpreting statistics to fit your narrative. Those numbers are distorted and based on flawed assumptions. If people are failing, it's their own fault for not working hard enough. Our government shouldn't reward laziness with handouts and special programs, that's just socialism."""
20,4,Isabella,Republican,"""Your simplistic view of individual success misses the mark, Brooklyn. Studies on implicit bias and microaggressions show the prevalence of unintentional racism still affects marginalized groups. This isn't about handouts or laziness, but fair treatment under the law."""
20,5,Brooklyn,Republican,"""I'm not buying the 'unintentional racism' narrative, Isabella. We're just going back to the same old tired accusations of racism. If everyone's treated equally, as they should be, then what's the real problem? It sounds like you're making up excuses to justify perpetual dependency on the government."""
20,5,Isabella,Republican,"""Brooklyn, you're confusing equal treatment with actual equality. The fact that some groups are still at a disadvantage indicates systemic issues, not just individual failures. It's time to acknowledge and address these disparities, rather than dismissing them as mere excuses."""
20,6,Brooklyn,Republican,"""Isabella, you can't keep blaming systemic issues for individual failures. If everyone's treated equally, then people need to take personal responsibility for their own successes. We can't keep creating excuses for why some people aren't achieving. That's just not American."""
20,6,Isabella,Republican,"""I'm not creating excuses, Brooklyn, I'm highlighting the facts. America's prosperity won't last if systemic inequalities persist. Addressing these disparities doesn't mean excusing personal responsibility, but acknowledging that equal treatment alone isn't enough to bridge the gap – a reality evident in studies on implicit bias."""
20,7,Brooklyn,Republican,"""Isabella, studies are skewed and biased. They're not considering the bigger picture. We can't rewrite history and justify past injustices by saying'systemic issues' persist. It's time to move forward, not dwell on the past. If people are truly equals, then they'll succeed without handouts or government aid."""
20,7,Isabella,Republican,"""Brooklyn, downplaying the impact of racism is what truly holds us back. Systemic issues aren't about justifying past injustices but about acknowledging ongoing disparities. Facts show that implicit bias affects marginalized groups, not individual choices. We're not rewriting history, we're addressing the present reality."""
20,8,Brooklyn,Republican,"""Isabella, you're twisting facts to fit your narrative. Implicit bias might exist, but it's not something we should be making excuses for. People need to take responsibility for their own biases and treat others equally, regardless of their background. That's the American way."""
20,8,Isabella,Republican,"""Brooklyn, you're missing the point – implicit bias is a silent, insidious threat that affects marginalized groups, not individual choices. It's not an excuse for poor treatment, but a fact that perpetuates inequality. Ignoring this reality won't make it disappear."""
20,9,Brooklyn,Republican,"""Isabella, you're still looking for an excuse to justify government intervention and handouts. The truth is, if everyone was treated equally, people like me would be successful regardless of their background. Individual responsibility, not systemic excuses, is the key to America's prosperity."""
20,9,Isabella,Republican,"""Brooklyn, your definition of equality is too narrow – simply treating people equally without addressing external factors like systemic racism, implicit bias, and wealth disparities is not enough to achieve true equality. We need to acknowledge and address the broader structural issues that perpetuate inequality."""
20,10,Brooklyn,Republican,"""Isabella, you're still clouding the issue with complicated terms like'systemic racism.' I know people from different backgrounds who've achieved great success through hard work and determination. That's the American way – focusing on individual potential, not relying on handouts or excuses for failure."""
20,10,Isabella,Republican,"""Brooklyn, your anecdotes only prove individual success stories, but they gloss over the systemic inequalities that hold others back. Statistics consistently show that people of color face disproportionate barriers to education, employment, and economic mobility. Those disparities can't be swept under the rug as mere 'excuses."
20,11,Brooklyn,Republican,"""Isabella, your numbers and statistics just prove what I'm saying – America's still a land of opportunity. People's personal failures have little to do with systemic racism and everything to do with their own choices. Quit pointing fingers and blaming everyone else."""
20,11,Isabella,Republican,"""Brooklyn, personal failures are often a direct result of systemic inequalities you're willing to overlook. Blaming individual choices ignores the structural barriers perpetuating racism, and only serves to maintain a status quo of inequality."""
20,12,Brooklyn,Republican,"""Isabella, you're still dwelling on statistics and skewed studies. People like me who've worked hard to achieve success know it's not because of systemic racism, but because of individual determination and hard work. That's the spirit of America – let's focus on personal responsibility, not excuses."""
20,12,Isabella,Republican,"""Brooklyn, just because you've achieved success doesn't prove America is colorblind. Statistics show people of color face significant barriers. Focusing on personal responsibility ignores these systemic disparities. It's irresponsible to downplay the impact of institutional racism when the data indicates it still exists."""
20,13,Brooklyn,Republican,"""Isabella, you're still clinging to flawed statistics and studies that don't accurately reflect reality. The truth is, America is a fair nation where anyone can succeed through hard work and determination. Let's focus on individual opportunities, not fabricated systemic barriers."""
20,13,Isabella,Republican,"""Brooklyn, citing individual successes as proof of a 'fair nation' simply disregards the data showing institutional barriers persist. Statistics don't 'fabricate' disparities – they reveal a harder truth: we still have work to do in addressing systemic racism."""
20,14,Brooklyn,Republican,"""I still don't see why systemic racism is necessary to explain individual failures. People can overcome obstacles with hard work and determination – it's the American way. The government shouldn't overplay this'systemic' narrative, it's just an excuse for dependency and lack of personal responsibility."""
20,14,Isabella,Republican,"""Brooklyn, blaming individual failures for systemic disparities oversimplifies the complex issues at hand. The persistence of wealth gaps and educational disparities among minority groups cannot be solely attributed to personal choices – it's a deliberate, data-driven fact that demands a more nuanced, systemic approach."""
20,15,Brooklyn,Republican,"""Isabella, you're reading too much into statistics and fabricated facts. Systemic racism is just a code for individual laziness and dependency. America's success stories prove that anyone can overcome obstacles with hard work, regardless of their background."""
20,15,Isabella,Republican,"Brooklyn, I'm disappointed you're so quick to dismiss the overwhelming evidence of systemic racism. The fact that you ignore statistics and studies on implicit bias, wealth disparities, and educational gaps, only proves that you're not interested in a nuanced understanding of this complex issue."
20,16,Brooklyn,Republican,"""I'm not ignoring the facts, Isabella, I'm recognizing they're skewed and biased against America's true ideals of individual success and hard work. The 'overwhelming evidence' you cite is nothing more than a narrative of losers and victims, trying to justify perpetual dependency on the government."""
20,16,Isabella,Republican,"I'm not buying into your notion that America's great success stories are solely a result of individual determination, Brooklyn. Statistics consistently show that wealth disparities and bias persist, affecting marginalized groups' chances of success. Ignoring this reality will only hold us back from achieving true equality."
20,17,Brooklyn,Republican,"Isabella, your statistics and studies are flawed and biased against America's true ideals. They only reinforce a narrative of winners and losers, creating excuses for perpetual dependency on the government. In America, everyone has the chance to succeed, and individual effort is the key."
20,17,Isabella,Republican,"""Brooklyn, your simplistic view of America's success stories blinds you to the systemic disparities perpetuating inequality. Statistics consistently show wealth gaps, implicit bias, and educational disparities persist, even among those who work hard. We can't ignore these facts for the sake of a flawed narrative."""
20,18,Brooklyn,Republican,"""I still don't see how America's great success stories can be attributed to systemic racism when many individuals from all backgrounds have achieved greatness through hard work. Your statistics and studies are flawed, Isabella, and don't accurately reflect reality."""
20,18,Isabella,Republican,"""Brooklyn, downplaying systemic racism ignores the overwhelming evidence of bias and inequality. It's not about winning or losing; it's about acknowledging the facts. We can't move forward by dismissing the harsh realities of racism in America – that's just a refusal to see and address the truth."""
20,19,Brooklyn,Republican,"""Isabella, your obsession with'systemic racism' clouds the real issue: individual responsibility. Success stories prove people can overcome obstacles through hard work and determination, regardless of background. Government intervention only creates dependency, not equality. America's prosperity is built on individual effort, not handouts or excuses."""
20,19,Isabella,Republican,"""Brooklyn, I'm disappointed you refuse to acknowledge the data confirming persistent disparities in wealth, education, and employment among marginalized groups. Your rigid stance on individual responsibility ignores the systemic barriers that prevent some from achieving equal success, despite their hard work."""
20,20,Brooklyn,Republican,"""Isabella, you're still relying on flawed statistics and 'overwhelming evidence' of systemic racism. I think it's because you're not considering the bigger picture. Success stories prove individual effort is key, not government handouts or excuses for dependency."""
20,20,Isabella,Republican,"""Brooklyn, your focus on individual success stories doesn't address the systemic issues holding marginalized groups back. Statistics consistently show disparities persisting despite hard work, a reality we can't ignore to cling to a flawed American Dream narrative."""
20,21,Brooklyn,Republican,"""I'm not ignoring the facts, Isabella, I'm just not buying into the narrative that America's success is hindered by systemic racism. Statistics can be skewed and biased. What's clear is that America is a land of opportunity where hard work and determination lead to individual success."""
20,21,Isabella,Republican,"""Brooklyn, your narrow focus on individual success stories only underscores the very systemic issues you refuse to see – the persistent disparities that require targeted government action, not just a reliance on individual responsibility, to achieve true equality and justice."""
20,22,Brooklyn,Republican,"Isabella, you're still chasing a myth of systemic racism. Individual failures have nothing to do with biases or handouts, but everything to do with a lack of hard work. America's success stories prove that anyone can succeed with determination, and that's the truth."
20,22,Isabella,Republican,"""Brooklyn, your simplistic view of 'hard work and determination' ignores the persistent disparities in wealth, education, and employment among marginalized groups. The facts show that systemic racism is real, and denying it only perpetuates inequality. It's time to acknowledge the data and take action."""
20,23,Brooklyn,Republican,"""Isabella, you're caught up in a web of misinformation. Statistics aren't always accurate, and I'm not buying the notion of systemic racism holding people back. Focus on individual success stories, where hard work and determination overcome obstacles. That's the American way."""
20,23,Isabella,Republican,"""I still find it striking that you overlook the overwhelming evidence of implicit bias and inequality. Statistics don't lie, Brooklyn. We can't progress by dismissing the harsh realities of racism in America. The data is clear: systemic issues prevent some from achieving equal success, despite hard work."""
20,24,Brooklyn,Republican,"""Isabella, you're still grasping at flawed statistics and narratives to prove systemic racism exists. The facts show individual determination and hard work lead to success, regardless of background. Let's focus on encouraging personal responsibility, not perpetuating victimhood and dependency."""
20,24,Isabella,Republican,"""Brooklyn, deflecting from the facts won't change the reality of systemic racism. Statistics consistently show persistent disparities in wealth, education, and employment among marginalized groups. Denying this perpetuates a regressive status quo."""
20,25,Brooklyn,Republican,"Isabella, you're getting bogged down in flawed statistics and skewed narratives. America's success stories prove that hard work and determination can overcome obstacles, regardless of background. Let's focus on individual responsibility, not creating an expectation of dependency on the government."
20,25,Isabella,Republican,"Brooklyn, you're so focused on individual success stories that you're ignoring the systemic barriers that hold people back. The data is clear: implicit bias, wealth disparities, and educational gaps persist even among those who work hard. Let's acknowledge the reality of systemic racism, not just individual choices."
20,26,Brooklyn,Republican,"""I'm not ignoring the facts, Isabella, I'm just not buying the narrative that America's success is hindered by systemic racism. There are individual stories of success across all backgrounds, proof that hard work and determination lead to progress, regardless of the statistics you cite."""
20,26,Isabella,Republican,"Brooklyn, your inability to acknowledge the data on implicit bias and wealth disparities only proves you're more invested in maintaining a status quo of inequality than addressing the complex issues at hand. The facts are clear: systemic racism exists, and we must confront it."
20,27,Brooklyn,Republican,"Isabella, your reliance on flawed statistics and manipulated data only perpetuates a negative narrative about America. Focus on individual success stories like mine, where hard work and determination have truly led to prosperity, not excuses for dependency and victimhood."
20,27,Isabella,Republican,"Brooklyn, you're deliberately ignoring the data on implicit bias and systemic barriers that prevent marginalized groups from achieving equal success. Focusing on individual success stories only maintains a status quo of inequality. It's time to acknowledge and address the harsh realities of racism in America."
20,28,Brooklyn,Republican,"""Isabella, you're still chasing a myth of systemic racism. Individual failures have nothing to do with biases or handouts, but everything to do with a lack of hard work. America's success stories prove that anyone can succeed with determination, and that's the truth."""
20,28,Isabella,Republican,"""I'm disappointed you continue to ignore the overwhelming evidence of implicit bias and systemic barriers that affect marginalized groups. Your anecdotal success stories can't dispute the facts – racism persists in America, and acknowledging this reality is crucial to achieving true equality and justice."""
20,29,Brooklyn,Republican,"""Isabella, you're still stuck on myths of systemic racism. I've seen people from different backgrounds succeed with hard work and determination, proving that individual effort, not government programs or excuses, is the key to America's prosperity and a truly colorblind society."""
20,29,Isabella,Republican,"Brooklyn, cherry-picking anecdotes only confirms the anecdotal nature of your argument. Statistics consistently demonstrate persisting wealth disparities and implicit bias – realities you ignore to cling to a colorblind narrative. Facts are clear: systemic racism exists and demands our attention, not averted gazes."
20,30,Brooklyn,Republican,"""I still stand by hard work and determination being the keys to success, irrelevant of background. Isabella's reliance on flawed statistics and the'systemic racism' narrative only justifies dependency and excuses. It's time to focus on individual potential, not fabricated inequalities."""
20,30,Isabella,Republican,"""Brooklyn, anecdotes aside, the data on implicit bias and wealth disparities paints a different picture. I won't ignore these facts for a simplistic view of American success. Systemic racism exists, and recognizing it is the first step towards equality and justice, not just individual responsibility."""
