Session,Round,Agent Name,Party,Response
37,1,Skylar,Democrat,"""I strongly feel that systemic racism is a deep-seated issue that perpetuates inequality. We can't hide behind empty promises; we need concrete policies, like police reform and economic empowerment programs, to address disparities. It's time for meaningful action, not just lip service."""
37,1,Julian,Republican,"""Systemic racism is a myth, Skylar. America has made tremendous progress since the Civil Rights Act. We've elected a black president and achieved equality under the law. Our focus should be on opportunity, not handouts. Let's not perpetuate division with false claims of a racist society."""
37,2,Skylar,Democrat,"""Julian, you can't ignore the data showing persistent disparities in education, employment, and housing. The myth of progress is exactly that – a myth. We can't base our policy on 'Opportunity rhetoric' without addressing systemic barriers, which is why we need concrete policies, not just empty promises."""
37,2,Julian,Republican,"""Concrete policies won't change the heart. Education is key, not handouts. Opportunity is what we should focus on. You can't fix a problem simply by pointing out it exists. We need to empower individuals, not enable dependency."""
37,3,Skylar,Democrat,"""Empowering individuals is just a catchphrase, Julian, when institutions perpetuate inequality. Concrete policies like police reform and economic empowerment programs are the key to tangible change, not just words. We need action, not just rhetoric, to dismantle systemic racism and create a more equal society."""
37,3,Julian,Republican,"""Skylar, you're misinterpreting data and perpetuating victimhood. Progress has indeed been made. We can't forget that a black president has led America to great accomplishments. Focusing on opportunity and individual empowerment will uplift everyone, not create dependency. We should strive to unite, not divide."""
37,4,Skylar,Democrat,"""Julian, progress is indeed a reality, but so are the continued disparities. A black president doesn't erase systemic racism. We can't put aside data and anecdotal evidence that shows institutional racism exists. Let's focus on meaningful policies to bridge the gap, not just empty words of unity."""
37,4,Julian,Republican,"""I implore you, Skylar, to look beyond what's in front of you. If racism existed, surely there'd be uniformity, not isolated incidents. Policy won't change racism if it doesn't exist in the first place. Let's focus on solving problems, not manufacturing them."""
37,5,Skylar,Democrat,"""Julian, isolated incidents may get attention, but systemic patterns of racism have devastating consequences. By ignoring data and anecdotal evidence, we risk perpetuating a culture of denial, not progress. Concrete policies can bridge the gap, letting people live without the weight of systemic inequality."""
37,5,Julian,Republican,"""Skylar, I understand you're emotional about this, but data doesn't lie. We can't allow anecdotal evidence to dictate policy. Opportunity and individual empowerment are the answers, not more government programs that create dependency. Facts speak for themselves – our society has made significant strides, not progress to be had."""
37,6,Skylar,Democrat,"""Julian, focusing solely on opportunity and individual empowerment overlooks the power of systemic inequality. Data shows disparities persist, not a level playing field. Policy change isn't about dependency, but ensuring equal access to opportunities, education, and resources, which are currently being denied to underrepresented communities."""
37,6,Julian,Republican,"""Skylar, you're stuck on anecdotal evidence, while ignoring our nation's progress. Black Americans have made tremendous strides since the Civil Rights Act. Your focus on systemic racism clouds the truth – opportunity and individual empowerment have always been the keys to success in America."""
37,7,Skylar,Democrat,"""Julian, your denial of systemic racism's existence is precisely the problem. Data shows disparities persist despite supposed progress. Let's not be blinded by our desire for a perfect story of American achievement. Structural change is necessary, not just a celebration of what's already there."""
37,7,Julian,Republican,"""Skylar, I still see no concrete evidence of systemic racism permeating institutions. Isolated incidents don't constitute a widespread problem. Emphasizing'structural change' just perpetuates a culture of grievance instead of personal responsibility and individual empowerment. That's not progress, that's stagnation."""
37,8,Skylar,Democrat,"""I understand Julian's perspective, but ignoring systemic racism's effects on underrepresented communities would be a disservice to their experiences. Data doesn't lie – disparities persist. Emphasizing anecdotes over statistics only reinforces the need for concrete policies to correct systemic injustices and create a fairer society."""
37,8,Julian,Republican,"""Skylar, I still believe opportunity and personal responsibility are the keys to success. Isolated incidents don't validate systemic racism claims. Our focus should be on empowering individuals, not manufacturing a problem that may not even exist."""
37,9,Skylar,Democrat,"""Julian, ignoring systemic racism's tangible effects on underrepresented communities doesn't change the reality. Data-driven policies are necessary to address these disparities, not just individual empowerment. Concrete steps can help level the playing field and create a more equitable society."""
37,9,Julian,Republican,"""Skylar, I understand you want policies, but let's not rush into solutions without first acknowledging the progress we've made. Our nation's ideals are rooted in equality – we mustn't undermine that by assuming the worst. Let's focus on unity, not more division."""
37,10,Skylar,Democrat,"""Julian, unity without concrete action is empty promises. We can't hide the fact that systemic racism persists in our institutions, education, and employment. I won't back down from data-driven policies that protect the rights of underrepresented communities and create a truly equitable society."""
37,10,Julian,Republican,"""Skylar, the data you're relying on is cherry-picked and misinterpreted. The real solution lies in individual empowerment, education, and opportunity. We can't let faulty statistics dictate our policies. Let's focus on the values that unite us, not the myths of division."""
37,11,Skylar,Democrat,"""Implying that data can be cherry-picked is a clear indication that you're unwilling to confront the statistics that paint a more accurate picture of systemic racism. Facts are not myths, Julian, and it's time we take action to address the disparities that persist in our society."""
37,11,Julian,Republican,"""Skylar, we're not debating myths; we're debating the facts. If systemic racism existed, wouldn't we see uniformity in outcomes, not isolated incidents? Your narrow focus on data ignores America's history of progress and its commitment to equality under the law."""
37,12,Skylar,Democrat,"""Julian, isolated incidents don't negate systemic patterns. History has shown that institutional barriers persist. Concrete data points to disparities in education, employment, and healthcare. We can't ignore these facts to preserve a myth of progress. Equality under the law is only just the beginning."""
37,12,Julian,Republican,"""Skylar, your relentless pursuit of data-driven policies won't fix the problem. We've made remarkable strides since the Civil Rights Act. Opportunity, education, and personal responsibility are the keys to success, not government handouts or divisive policy. We must unite, not fuel racial tensions with more bureaucracy."""
37,13,Skylar,Democrat,"""Julian, unity without concrete action is a farce. Disparities persist in education, employment, and healthcare. We need data-driven policies to address systemic racism, not just rhetoric about opportunity and individual empowerment. Facts, not myths, should guide our policies to create a truly equitable society."""
37,13,Julian,Republican,"""Skylar, your focus on data-driven policies to prove systemic racism clouds the truth about America's inherent equality. We've elected a black president, achieved strides in civil rights, and are one of the most philanthropic nations. Opportunity and education, not government programs, are the keys to true progress."""
37,14,Skylar,Democrat,"""Julian, election of a black president, while historic, doesn't erase systemic inequalities in institutions and policies. Underrepresented communities still face barriers in education, employment, and healthcare. Concrete data shows disparities persist. We need facts-driven policies to bridge the gap, not more empty promises of unity."""
37,14,Julian,Republican,"""Skylar, we can both agree that America's foundation is built on equality, but let's not assume the worst. We've made tremendous strides since the Civil Rights Act. Opportunity and education are the keys to real progress, not just more bureaucratic policies.""
( Julian )"
37,15,Skylar,Democrat,"""Julian, I understand our nation's foundations aim for equality, but ignoring systemic patterns perpetuates inequality. Data shows disparities persist, not just in isolated incidents. We can't rely on 'tremendous strides' when underrepresented communities still face substantial barriers in education, employment, and healthcare."""
37,15,Julian,Republican,"""Skelar, systemic racism is a myth because of America's remarkable progress. Our founding principles and institutions aim for equality. Rhetoric about systemic disparities ignores the fact that a black president has led our nation to great accomplishments. Opportunity, education, and personal responsibility remain the keys to success."""
37,16,Skylar,Democrat,"""Julian, just because a black president has led our nation to great accomplishments doesn't erase the systemic injustices that persist. Data-driven policies are needed to address these disparities, not just opportunity and education, which are still inaccessible to many underrepresented communities."""
37,16,Julian,Republican,"""Skylar, your narrow focus on data ignores America's history of overcoming adversity. A black president's accomplishments prove our nation's progress. Individual empowerment and education are the paths to success, not government programs that create dependency. We must unite, not fuel racial tensions."""
37,17,Skylar,Democrat,"""Julian, history proves systemic injustices have not been overcome, evident in persistent disparities in education, employment, and healthcare. Data-driven policies are crucial to address these gaps, ensuring every individual has equal access to opportunities, regardless of their background or race."""
37,17,Julian,Republican,"""Skylar, I still believe our focus should be on opportunity, education, and individual empowerment, which are the keys to success in America. We can't fix problems by pointing out isolated incidents, but by empowering individuals with a solid foundation in education and the chance to succeed."""
37,18,Skylar,Democrat,"""Julian, focusing on individual empowerment while ignoring systemic barriers is like giving a fish a ladder to climb instead of removing the aquarium's glass ceiling. We need data-driven policies to create a level playing field, not just promises of opportunity and education."""
37,18,Julian,Republican,"""Skylar, that's an unfair analogy. Empowering individuals through education and opportunity has lifted countless Americans, regardless of their background. You're focusing on a hypothetical glass ceiling, not the actual successes of our education system and the accomplishments of individuals like Barack Obama."""
37,19,Skylar,Democrat,"""Julian, your analogy may be one of success, but data shows that underrepresented communities still face insurmountable barriers in education and employment. Empowering individuals by addressing systemic inequalities is the only way to create a truly level playing field, not just a few isolated success stories."""
37,19,Julian,Republican,"""Skylar, you're stuck on statistics that highlight isolation, not universal progress. Our education system empowers, and individual successes prove it. We must focus on uniting through opportunity, not manufacturing division through bureaucracy. That's true American exceptionalism."""
37,20,Skylar,Democrat,"""Julian, you keep focusing on isolated successes, but data shows systemic barriers persist. Empowering individuals by addressing these inequalities is the key to a level playing field. We can't afford to ignore the facts and leave underrepresented communities behind in our pursuit of American exceptionalism."""
37,20,Julian,Republican,"""Skylar, I won't be swayed by skewed data. Barack Obama's presidency proves America's progress. We must focus on individual empowerment, education, and opportunity, not government-driven policies that foster dependency and division. True American exceptionalism is built on merit, not handouts."""
37,21,Skylar,Democrat,"""Julian, merit may be the American dream, but systemic barriers make it unattainable for many. Facts don't lie – disparities persist in education, employment, and healthcare. We can't achieve true equality without addressing these institutional issues, not just individual empowerment or empty promises of unity."""
37,21,Julian,Republican,"""Skylar, we're stuck in the past if we dwell on systemic racism. Data shows isolated incidents, not a pervasive problem. Empowering individuals through education and opportunity will uplift everyone, regardless of background. It's a better path forward, not perpetuating division."""
37,22,Skylar,Democrat,"""Julian, dwelling on isolated incidents ignores the systemic patterns revealed by data. Data-driven policies are crucial to address disparities in education, employment, and healthcare, ensuring equal access to opportunities for underrepresented communities. This is the path to true racial equality, not empty promises of unity and opportunity."""
37,22,Julian,Republican,"""Skylar, I still see no systematic evidence of racism. Individual successes like Obama's presidency prove our nation's progress. Let's unite behind the principles of merit and individual empowerment, not perpetuate a culture of grievance fueled by misleading data and hypothetical injustices."""
37,23,Skylar,Democrat,"""Julian, it's not about Obama's presidency being a failure or irrelevant. It's about the systemic disparities that persist despite progress. Data-driven policies are necessary to address these gaps, not just individual empowerment or empty promises of unity that leave underrepresented communities behind."""
37,23,Julian,Republican,"""Skylar, you're clinging to flawed data that distorts the truth. America's history is one of merit and individual empowerment, not systemic racism. We've elected exceptional leaders like Obama, proving our progress. Let's focus on unity, not perpetuating a culture of division and grievance."""
37,24,Skylar,Democrat,"""Julian, progress can't erase institutional barriers. Data-driven policies, like police reform and economic empowerment, are necessary to create a level playing field. Merit and opportunity aren't equal for all without addressing systemic disparities. Isolated incidents prove nothing, but persistent data-driven facts reveal a pervasive problem."""
37,24,Julian,Republican,"""Skylar, you're clouding the issue with flawed data and hypothetical injustices. Our nation's progress under Obama's presidency and our founding principles of equality demonstrate we're moving forward, not falling back. Let's focus on empowering individuals through education and opportunity, not perpetuating a culture of division."""
37,25,Skylar,Democrat,"""Julian, focusing solely on individual empowerment and opportunity ignores the power of systemic barriers. Data-driven policies are necessary to address the disparities that persist in education, employment, and healthcare, creating a level playing field for all, not just a select few."""
37,25,Julian,Republican,"Skylar's obstinacy with flawed data only proves she's unwilling to see the vast progress made in America since the Civil Rights Act. Empowering individuals and focusing on opportunity will continue to uplift everyone, not perpetuate a culture of grievance and division."
37,26,Skylar,Democrat,"""Julian, your unwillingness to acknowledge data-driven facts perpetuates a culture of denial. Systemic disparities persist in education, employment, and healthcare. Concrete policies, not empty promises, are necessary to dismantle institutional barriers and create true equality for underrepresented communities."""
37,26,Julian,Republican,"""Skylar, your reliance on cherry-picked data overlooks the numerous examples of black success and the fact that America's been a melting pot for centuries. Focusing on individual achievements and empowerment will pave the way for true progress, not bureaucratic entanglements."""
37,27,Skylar,Democrat,"""Julian, cherry-picked examples of individual success can't erase the systemic disparities evident in data. Institutional barriers persist, and concrete policies are needed to create a more equitable society, not just more anecdotes about personal achievement."""
37,27,Julian,Republican,"""Skylar, selectively focusing on data-driven policies ignores the human spirit and inherent meritocracy within America. Individual success stories like Obama's presidency showcase our nation's progress. Let's unite behind individual empowerment, education, and opportunity, not bureaucratic solutions that stifle personal growth."""
37,28,Skylar,Democrat,"""Julian, individual success stories don't negate systemic barriers. Data-driven policies address institutional disparities, not just anecdotes. Policies like police reform and economic empowerment bridge the gap, creating a truly equitable society where everyone has a fair shot, regardless of their background or skin tone."""
37,28,Julian,Republican,"Skylar, it's clear that you're misinterpreting data and perpetuating a culture of grievance. Focusing on systemic racism divides us, while individual empowerment and education uplift everyone. We've made remarkable strides since the Civil Rights Act – let's unite behind American exceptionalism, not hypothetical injustices."
37,29,Skylar,Democrat,"""Julian, division is not the answer. Data-driven policies address the persistent disparities in our institutions. I'm not perpetuating grievance, but fighting for a more equal society. Facts, not myths, should guide our policies to create a fair shot for everyone, regardless of their background."""
37,29,Julian,Republican,"""I understand that we have different perspectives on systemic racism, Skylar. However, I strongly disagree that institutions perpetuate inequality. Our nation's progress, from a black president to countless individual successes, showcases an inclusive meritocracy. I stand by my position – individual empowerment and education uplift everyone."""
37,30,Skylar,Democrat,"""Julian, your dismissal of data-driven policies is a disservice to the countless Americans facing systemic barriers. I won't be swayed by anecdotes of individual success when the facts show persistent disparities. Concrete policies are necessary to bridge the gap and create a truly equitable society."""
37,30,Julian,Republican,"""Skylar, your reliance on data-driven policies assumes institutions are failing. However, countless examples of black success prove our nation's meritocratic system is working. Individual empowerment, not bureaucratic solutions, is the key to true progress and unity, not perpetuating a culture of grievance."""
