Session,Round,Agent Name,Party,Response
6,1,Noah,Democrat,"""Racism is a cancer that plagues our society. We need systemic change, not just Band-Aids. That means police reform, reparations, and dismantling decades of systemic inequalities. We must hold ourselves accountable for our country's dark past and commit to an anti-racist future – now."""
6,1,Isabella,Republican,"Noah, I think your approach is polarizing and counterproductive. America has come so far in civil rights; we should focus on celebrating progress, not dwelling on past injustices. The narrative of inherent systemic racism is being used to divide us; we need to focus on unity and equality under the law."
6,2,Noah,Democrat,"""I'm afraid nostalgia for the past won't solve present injustices, Isabella. Claims of 'progress' ring hollow when systemic racism still disenfranchises, over-policices, and marginalizes communities of color. Our conversation should acknowledge the unfinished work, not whitewash its reality."""
6,2,Isabella,Republican,"Noah, I understand your perspective, but we can't dwell on past grievances without moving forward. What we need is equal opportunity and fair treatment under the law – not reparations or special treatment based on skin color. That's the American way."
6,3,Noah,Democrat,"""Equal opportunity and fair treatment are ideals, Isabella, but reality shows us that Black Americans face persistent inequalities in housing, education, and employment. Addressing these structural barriers requires more than equal access; we need targeted solutions to dismantle decades of systemic exclusion."""
6,3,Isabella,Republican,"Noah, I respectfully disagree. Your focus on structural barriers assumes systemic racism exists, which I don't believe is the case in America today. Instead, we should focus on promoting diversity, inclusion, and individual opportunity, which can bridge the so-called racial gap."
6,4,Noah,Democrat,"""Isabella, promoting diversity and inclusion are important steps, but they don't alone dismantle structural barriers perpetuated by systemic racism. Acknowledging and addressing those realities head-on is crucial for meaningful change, not platitudes."""
6,4,Isabella,Republican,"Noah, I still believe America's progress in civil rights has alleviated systemic racism. Focusing on past injustices polarizes us, while emphasizing individual opportunity and equal treatment under the law fosters unity and fairness. We can't let guilt and shame hold us back from the American dream."
6,5,Noah,Democrat,"""Isabella, I think you're confusing progress with completion. We've made strides, but systemic racism remains a pervasive issue. Acknowledging and addressing past injustices is crucial for meaningful change. We can't assume innocence; we must confront our nation's dark past and work towards a more equitable future."""
6,5,Isabella,Republican,"Noah, I understand we have different views, but I genuinely believe the notion of systemic racism is being sensationalized. We've made tremendous progress in civil rights; it's time to focus on unity and individual success. Emphasizing past injustices only perpetuates victimhood mentality."
6,6,Noah,Democrat,"""Isabella, not recognizing systemic racism is a form of willful ignorance. The 'victimhood mentality' you describe is a coping mechanism for communities still struggling with entrenched disparities. We must confront the past to create a genuinely equitable future for all."""
6,6,Isabella,Republican,"Noah, I still believe that emphasizing past injustices instead of individual opportunity is a divisive approach that ignores America's remarkable civil rights progress. Focusing on unity and equal treatment under the law, not guilt and shame, is the path to a more cohesive society."
6,7,Noah,Democrat,"""Isabella, acknowledging past injustices is not about guilt or shame, but about confronting the harsh realities of racism. Silence and dismissal only perpetuate systemic inequalities. We must work towards a more equitable future, not a divided one."""
6,7,Isabella,Republican,"""Noah, I understand your passion, but we can't let historical injustices dictate our future. We've made significant progress in civil rights. Focusing on individual opportunity and equal treatment under the law will bring us true unity and fair representation, not further division."""
6,8,Noah,Democrat,"""Isabella, progress is great, but it's not a reason to stop progressing. Acknowledging past injustices informs our actions today, ensuring that we're working towards a more inclusive, equitable society – not just celebrating a status quo that still leaves communities behind."""
6,8,Isabella,Republican,"Noah, I think you're misunderstanding the American spirit – we celebrate progress, not dwell on the past. Focusing on individual opportunities under the law is a more inclusive and fair approach than dwelling on the history of racial injustices."
6,9,Noah,Democrat,"""That's a simplistic view of the American spirit, Isabella. Progress is nothing without acknowledging and learning from past mistakes. By ignoring systemic racism, we risk eroding the progress made and perpetuating the status quo of inequality. We must confront the truth, not just celebrate what's already been achieved."""
6,9,Isabella,Republican,"Noah, you're romanticizing the past and ignoring the progress America has made in civil rights. We cannot let guilt and shame hold us back from further progress. Emphasizing past injustices only creates division and hinders individual opportunity, which is the foundation of true equality."
6,10,Noah,Democrat,"""Isabella, I'm not romanticizing the past, but acknowledging it to inform our future. Progress without confrontation of systemic racism is mere window dressing. We must recognize legacy of inequality and take bold action to dismantle it, not just celebrate the illusion of progress."""
6,10,Isabella,Republican,"""Noah, I still believe America's progress in civil rights is reason to be optimistic, not for guilt and shame. Focusing on past injustices only creates division and hinders individual opportunity, which is the foundation of true equality and fairness under the law."""
6,11,Noah,Democrat,"""Isabella, you're sidestepping the complexities of systemic racism. Progress without confronting inequality's roots is fleeting. Real change needs to acknowledge, address, and dismantle historical injustices – not paper over them with simplistic notions of individual opportunity and unity as a substitute for actual progress."""
6,11,Isabella,Republican,"""I understand your passion, Noah, but I firmly believe that dwelling on past injustices rather than celebrating America's progress in civil rights will only perpetuate division. Focusing on equal opportunity under the law is a more inclusive and fair approach to achieving true equality."""
6,12,Noah,Democrat,"Isabella, true equality under the law is a mirage if systemic racism still exists. We can't just paper over disparities with platitudes about equality; we need concrete actions to dismantle structures that perpetuate inequality. That's why confronting the past is crucial for a more just future."
6,12,Isabella,Republican,"Noah, I understand your emphasis on dismantling systemic racism, but I still believe America's progress in civil rights has alleviated the issue. Focusing on equality under the law will bring us true unity and fairness, not further division. We should celebrate progress, not dwell on past injustices."
6,13,Noah,Democrat,"""I'm not celebrating progress; I'm acknowledging it's barely begun. Systemic racism festers, perpetuating disparities. Papering over realities won't bridge the gap. We need bold action, not platitudes, to dismantle structural barriers and ensure equal opportunities for all – that's real progress."""
6,13,Isabella,Republican,"""Let's focus on policies that promote economic growth and individual opportunity, not reparations or quotas. Addressing the disparities we see today requires a more inclusive education system and a reduction in job barriers, not dwelling on historical injustices or promoting a victimhood mentality."""
6,14,Noah,Democrat,"""Isabella, policies that promote growth without addressing systemic racism are a Band-Aid solution. Inclusive education and job opportunities are crucial, but without dismantling the structural barriers, true progress will remain elusive. We must confront the past to create a equitable future, not just celebrate the status quo."""
6,14,Isabella,Republican,"Noah, I think you're misunderstanding the root causes of disparity. If every problem is seen through the lens of racism, we'll never find meaningful solutions. Let's focus on individual merit and equal treatment under the law – that's the core of the American Dream."
6,15,Noah,Democrat,"""Isabella, that 'lens of racism' is a misguided perception. The root causes of disparity are often deeply entrenched in systemic racism, from voting rights to housing and education. Acknowledging these realities is crucial for finding meaningful solutions, not ignoring them in favor of individual merit."""
6,15,Isabella,Republican,"Noah, I still believe individual merit and equal treatment under the law are the core of the American Dream. Focusing on systemic racism often leads to misplaced blame and hinders true solutions. Let's seek unity and fairness for all, without casting a shadow of perpetual guilt and shame."
6,16,Noah,Democrat,"""Isabella, blaming systemic racism for every problem is not what I'm doing. I'm acknowledging the harsh realities that perpetuate disparities. We need to confront these truths, not whitewash them. Unity and fairness start with honesty, not sweeping the hard issues under the rug."""
6,16,Isabella,Republican,"Noah, I still think your focus on systemic racism overemphasizes past injustices, which will only hinder meaningful solutions. Instead, let's focus on promoting individual opportunity, education, and fair treatment under the law – that's the foundation of true unity and equality in America."
6,17,Noah,Democrat,"""Isabella, individual opportunity and fair treatment under the law are crucial, but they can't erase decades of systemic exclusion. Acknowledging the past and addressing systemic racism are not about guilt, but about creating a more just future where equal opportunities exist for all."""
6,17,Isabella,Republican,"Noah, I disagree that past injustices dictate our future. Progress in civil rights has alleviated systemic racism, and focusing on unity and individual opportunity under the law will bring us true equality and fairness. Let's celebrate the progress, not dwell on historical grievances."
6,18,Noah,Democrat,"Isabella, your refusal to acknowledge systemic racism's persistence perpetuates the very problem we're trying to solve. Dismantling structural barriers isn't about guilt or shame, it's about creating a society where equal opportunities exist for all, regardless of skin color."
6,18,Isabella,Republican,"Noah, I understand we have a vast disagreement, but I still firmly believe America's civil rights progress has alleviated systemic racism. Focusing on individual opportunity and equal treatment under the law will bring true unity and fairness, not guilt or shame perpetuating division. This is the true American way."
6,19,Noah,Democrat,"""Isabella, I'm disappointed you refuse to acknowledge systemic racism's continued presence. Blindly celebrating progress won't bridge the gap between ideals and reality. Dismantling structural barriers and recognizing historical injustices are crucial for equality under the law. We can't just celebrate progress – we must work towards it."""
6,19,Isabella,Republican,"Noah, I think you're misinterpreting progress as the end point, rather than a stepping stone to continued growth. By celebrating our achievements in civil rights, we can build on them, but dwelling on past injustices doesn't address today's opportunities or create a fairer society."
6,20,Noah,Democrat,"Isabella, celebrating our civil rights progress is just that – celebrating. It's time to turn that progress into direct action, addressing the systemic racism that still exists, and working towards a future where equal opportunities are not just ideals, but a reality for all Americans."
6,20,Isabella,Republican,"Noah, I think you're misunderstanding the goal of celebrating progress. It's not about ignoring the past, but about acknowledging the strides we've made and building on them. Dwelling on past injustices isn't progress – it's stagnation."
6,21,Noah,Democrat,"Isabella, progress and stagnation aren't mutually exclusive. Acknowledging past injustices doesn't hinder progress; it inspires action towards a more equitable future. Blindly celebrating the past won't address systemic racism, while confrontation can bridge the gap between ideals and reality."
6,21,Isabella,Republican,"Noah, the issue of racism has been blown out of proportion; every problem can't be seen through the lens of racism. It's time to stop dwelling on historical injustices and focus on promoting individual opportunity, education, and fair treatment under the law – that's the foundation of true unity and equality."
6,22,Noah,Democrat,"Isabella, individual opportunity and fair treatment are crucial, but they can't erase decades of systemic exclusion. Systemic racism persists, and we can't sugarcoat it. Acknowledging the past and addressing these inequalities head-on is the only way to create a more just and equitable future for all Americans."
6,22,Isabella,Republican,"Noah, just because racism persists doesn't mean we should dwell on the past and portray America as an inherently racist nation. That approach promotes victimhood and division. Instead, let's focus on equal opportunity, education, and fair treatment under the law – that's the American way."
6,23,Noah,Democrat,"""Isabella, focusing solely on equal opportunity and fair treatment under the law ignores the fundamental issue of systemic racism. Dismantling structural barriers and confronting historical injustices are necessary for creating a truly equitable society where progress isn't just a facade."""
6,23,Isabella,Republican,"""I still believe America's significant progress in civil rights has alleviated systemic racism. Focusing on individual opportunity and equal treatment under the law will bring true unity and fairness, not further division. Emphasizing past injustices only creates a divisive and unnecessary atmosphere."""
6,24,Noah,Democrat,"""Isabella, despite America's progress, systemic racism remains a persistent issue. Dwelling on its reality doesn't perpetuate victimhood, it sparks meaningful change. Ignoring the past only maintains the status quo. We must confront the harsh truths to create a more just and equitable future for all."""
6,24,Isabella,Republican,"Noah, you continue to focus on past injustices, but that's precisely what's hindering real progress. America's remarkable civil rights progress should be celebrated and built upon; dwelling on the past doesn't address today's opportunities or create a fairer society for all."
6,25,Noah,Democrat,"Isabella, you're missing the point; progress without acknowledging past injustices is fleeting. Systemic racism persists, and silence fuels division. We must confront the truth to create a more just future. Celebrating progress without addressing the root causes won't bring true unity or equality."
6,25,Isabella,Republican,"Noah, I still firmly believe America's civil rights progress has alleviated systemic racism. Focusing on individual opportunity, education, and fair treatment under the law will bring true unity and fairness, not guilt or shame perpetuating division. That's the true American way."
6,26,Noah,Democrat,"Isabella, celebrating progress without addressing systemic racism is just complacency. We must confront the harsh realities of inequality, not pretend they don't exist. Our true American way is inclusive, equitable, and just – not ignoring the past to maintain the status quo."
6,26,Isabella,Republican,"Noah, I still believe we've made remarkable progress in civil rights, and America's foundation of equality under the law should be the focus. Emphasizing past injustices can perpetuate victimhood and division. Let's celebrate and build on our achievements, not dwell on what's been overcome."
6,27,Noah,Democrat,"""Issabella, celebrating progress while ignoring systemic racism is a recipe for stagnation. True equality demands confrontation of our past and a commitment to dismantling the structural barriers that still exist. We must acknowledge and address these injustices, not gloss over them with platitudes of 'unity and fairness.'"""
6,27,Isabella,Republican,"Noah, I still firmly believe emphasizing individual merit and equal treatment under the law will bring true unity and fairness, rather than dwelling on the past and mislabeled'systemic racism.' America's progress in civil rights should be celebrated, not perpetually scrutinized."
6,28,Noah,Democrat,"""Issabella, you're still ignoring the elephant in the room: systemic racism persists. Dwelling on America's achievements is not progress without acknowledging and addressing the deep-seated inequalities that still disenfranchise communities of color. Silence is complicity, not unity."""
6,28,Isabella,Republican,"Noah, your emphasis on systemic racism creates more division than unity. Instead, let's focus on promoting individual opportunity, education, and fair treatment under the law. These core American values will bring true equity and fairness for all, regardless of background or skin color."
6,29,Noah,Democrat,"Isabella, our progress is commendable, but incomplete. Systemic racism still marginalizes communities of color. Ignoring this reality maintains the status quo. We must acknowledge and dismantle these structural barriers for a truly equitable society, where individual merit and equal treatment are never compromised by systemic injustices."
6,29,Isabella,Republican,"Noah, I still believe that promoting unity and celebrating progress in civil rights are essential steps towards a brighter future for all Americans. We should focus on individual merit and equal treatment under the law, rather than perpetuating guilt and shame through the lens of systemic racism."
6,30,Noah,Democrat,"""Isabella, unity can't be achieved by ignoring systemic racism's persistence. Celebrating progress without confronting deep-seated inequalities is complacency. We must acknowledge and dismantle these barriers to create a truly equitable society, where everyone has equal opportunities regardless of skin color."""
6,30,Isabella,Republican,"Noah, I still believe our focus on individual opportunity and fair treatment under the law is the foundation of true unity and equality in America. Dwelling on systemic racism only creates division and perpetuates a victimhood mentality that undermines the American Dream. Let's celebrate progress, not dwell on guilt."
