Session,Round,Agent Name,Party,Response
1,1,Isaiah,Democrat,"Racism is a centuries-old stain on our nation's fabric. It's not just about individual prejudices, but systemic structures that perpetuate inequality. We need to acknowledge and dismantle policies like voter ID laws, discriminatory policing, and lack of representation in government to create a more just society for all."
1,1,Ezra,Republican,"I disagree. I think we've made significant progress in addressing racism. Celebrating diversity is crucial, but systemic issues are overstated. Let's focus on education, personal responsibility, and individual freedom, rather than blaming policies created to ensure voter integrity or uphold public safety."
1,2,Isaiah,Democrat,"I strongly disagree, Ezra. You can't separate diversity celebrations from real policy changes. Systemic racism is rooted in our country's history, not just recent events. We can't simply blame education or personal responsibility for something perpetuated by centuries of institutionalized oppression."
1,2,Ezra,Republican,"Isaiah, I understand your perspective, but I believe your view is influenced by a pessimistic ideal that we're trapped by our past. Let's focus on the progress we've made and the opportunities for individual empowerment, rather than being held back by perceived systemic ills that you say still bind us."
1,3,Isaiah,Democrat,"Ezra, your optimism sounds nice, but it's misguided. Acknowledging our past and addressing systemic issues is crucial for true progress. We can't cherry-pick celebrations of diversity while ignoring the barriers that maintain racial disparities. Progress requires confronting the very structures that perpetuate racism, not sweeping them under the rug."
1,3,Ezra,Republican,"Isaiah, while I acknowledge the past, I believe overemphasis on systemic issues holds us back from achieving equal outcomes through personal responsibility and education. Instead of focusing on blame, let's empower individuals and communities to overcome disparities through initiative and hard work."
1,4,Isaiah,Democrat,"Ezra, I fear your ideas ignore the reality that systemic barriers have consistently denied people of color opportunities to ""overcome disparities through initiative and hard work."" Until we dismantle those systems, individual empowerment is an unlevel playing field. We must address both personal responsibility and systemic inequality."
1,4,Ezra,Republican,"""We're stuck in a cycle of blame and excuse-making, Isaiah. By ignoring individual agency and collective progress, we're implying racism is an insurmountable obstacle. I'd rather focus on solutions that uplift and empower people, rather than perpetuating the notion that we're trapped by our past."""
1,5,Isaiah,Democrat,"Ezra, your perspective trivializes centuries of trauma and oppression. Ignoring systemic barriers denies the lived experiences of people of color and perpetuates the myth that racism is their personal failing. We can't solve racism by ignoring its fundamental causes."
1,5,Ezra,Republican,"Isaiah, I understand your passion, but I still believe individual strength and collective progress can overcome systemic barriers when people are truly given equal opportunities. We should focus on uplifting, rather than perpetuating, a victim mentality that holds people back from achieving their full potential."""
1,6,Isaiah,Democrat,"Ezra, calling it a ""victim mentality"" erases the very real experiences of people of color who face systemic barriers. Acknowledging the past and addressing those barriers isn't perpetuating victimhood, it's empowerment – recognizing the roadblocks that need to be dismantled to create true equality."
1,6,Ezra,Republican,"Isaiah, I respect your perspective, but the term ""systemic barriers"" has become a catch-all excuse for not accomplishing individual success. Empowering people through education and opportunity should be the focus, not perpetuating a narrative of victimhood that undermines personal responsibility and collective progress."
1,7,Isaiah,Democrat,"Ezra, by dismissing systemic barriers as excuses, you're ignoring the centuries of deliberate design that has led to disparities. Acknowledging the past is not perpetuating a narrative of victimhood, it's understanding the weight of history that must be addressed for true equality to be achieved."
1,7,Ezra,Republican,"""I understand Isaiah's emphasis on historical context, but I still believe we can create true equality by empowering individuals and communities through education, opportunity, and personal responsibility. By focusing on solutions, not systemic blame, we can build a brighter future for all, regardless of skin color."""
1,8,Isaiah,Democrat,"""But Ezra, that's exactly the problem - focusing solely on personal responsibility and opportunity while ignoring systemic barriers is a Band-Aid solution that fails to address the deep-seated inequality. You can't build equality by ignoring the house that's been rigged against certain people from the start."""
1,8,Ezra,Republican,"""Isaiah, I disagree that our system is 'rigged.' We've made strides in equality, and I believe individual empowerment can overcome systemic 'barriers' when given equal opportunities. We must focus on solutions that uplift, rather than excuse-making, to create a brighter future for all."""
1,9,Isaiah,Democrat,"Ezra, your naivety about a system that's not rigged is staggering. You downplay centuries of oppression while promoting a bootstrap solution that ignores the very real obstacles people of color face. Until those barriers are dismantled, equality remains an unachievable dream."
1,9,Ezra,Republican,"""I still believe, Isaiah, that acknowledging past injustices doesn't excuse individual failures or overindulge a victim mentality. Education, personal responsibility, and equal opportunities can overcome systemic barriers when we genuinely promote both. We need to focus on pragmatic solutions, not blame or revisionist history."""
1,10,Isaiah,Democrat,"""Ezra, it's not about 'indulging a victim mentality,' but confronting the harsh reality of systemic oppression that denies equal opportunities. Education and personal responsibility can't compensate for a rigged system. Pragmatic solutions require acknowledging and dismantling those barriers, not just paying lip service to equality."""
1,10,Ezra,Republican,"""Isaiah, I understand you want to dismantle the entire system, but even with changes, individuals still have agency to work towards equality. Empowering education and personal responsibility can help level the playing field, but I'm open to incremental progress not revolutionary overhaul."""
1,11,Isaiah,Democrat,"Ezra, progressive change isn't about revolutionary overhaul, but incremental progress that acknowledges systemic barriers. I urge you to reconsider your stance and recognize that dismantling these structures, not just empowering individuals, is crucial for true equality. We must confront, not merely pay lip service to, our nation's historical injustices."
1,11,Ezra,Republican,"""I understand your conviction, Isaiah, but I still believe individual agency and personal responsibility can bridge the gap between equality and current disparities. Incremental progress through education and equal opportunities is a realistic step forward, even if we disagree on the pace of change."""
1,12,Isaiah,Democrat,"Ezra, I'm afraid your incremental progress won't bridge the gap until we confront the systemic roots of racism. Sweeping it under the rug through education and personal responsibility alone maintains the status quo. We need a fundamental shift in our society's values to truly achieve equality."
1,12,Ezra,Republican,"Isaiah, your focus on systemic change is admirable, but I still worry that revolutionary overhaul can be counterproductive. I'd rather incrementally empower individuals through education, personal responsibility, and equal opportunities, creating a more inclusive society without upending the system."
1,13,Isaiah,Democrat,"I fear Ezra's incremental approach enables the systemic status quo, allowing racism to persist. We need bold, courageous action to dismantle the structures that perpetuate inequality, rather than subtle, piecemeal changes that delay true equality."
1,13,Ezra,Republican,"""I understand Isaiah's passion for revolutionary change, but I believe incremental progress through education, opportunity, and personal responsibility can create meaningful change without upending the system. Empowering individuals can bridge the gap between equality and disparities if given a chance."""
1,14,Isaiah,Democrat,"Ezra, progressive change isn't gradual when the stakes are human lives and dignity. Incremental progress enables systemic racism to persist. We need courageous, collective action to dismantle it, not individual empowerment that reinforces the status quo. Equality demands bold, revolutionary change, not subtle tweaks."
1,14,Ezra,Republican,"Isaiah, while I understand your passionate plea for revolutionary change, I believe incremental empowerment of individuals through education and personal responsibility is a practical step forward, rather than revolutionary overhaul, which can be counterproductive and destabilizing to our society."
1,15,Isaiah,Democrat,"Ezra, I'm astonished that you prioritize incremental change over fundamental reform. Systemic racism is a entrenched, deadly cancer that requires a bold, collective cure. Incremental progress only enables the status quo, leaving the most vulnerable behind. We must disrupt and transform, not merely tweak, a broken system."
1,15,Ezra,Republican,"""I understand Isaiah's urgency for revolutionary change, but I believe incremental progress through education and individual empowerment can create lasting change without upending society. It's a gradual, practical approach that prioritizes real solutions over a fleeting desire for radical transformation."""
1,16,Isaiah,Democrat,"Ezra, your incremental approach ignores the historical trauma and entrenched systemic barriers that perpetuate racism. It's not a matter of tweaking, but fundamentally transforming our society to ensure equal opportunities and justice for all, especially those most marginalized. Bold change is necessary, not gradual Band-Aids."
1,16,Ezra,Republican,"Isaiah, though I understand your passion for radical change, I still believe incremental empowerment of individuals through education and personal responsibility can create meaningful progress in bridging the gap between equality and disparities without upending our societal foundations."
1,17,Isaiah,Democrat,"Ezra, your persistence in prioritizing incremental change over fundamental reform is concerning. It's not merely tweaking policies, but confronting centuries of oppression that we need to address. We must ensure that our solutions don't further enable systemic racism, but dismantle it."
1,17,Ezra,Republican,"Isaiah, I understand your conviction, but I still believe incremental progress through education and personal responsibility can create meaningful change without upending our societal foundations. By empowering individuals, we can build a more inclusive society, fostering equality and opportunities for all, regardless of skin color or background."
1,18,Isaiah,Democrat,"Ezra, your incremental approach is a Band-Aid solution that ignores the deep-seated inequality built into our system. We can't chip away at racism through education and personal responsibility alone. We need transformative change to dismantle the structures that perpetuate it and create a truly equal society."
1,18,Ezra,Republican,"Isaiah, I think we've reached a stalemate. While I respect your desire for revolutionary change, I still believe incremental progress through education and personal responsibility is a practical step forward in creating a more inclusive society, rather than attempting to upend our societal foundations."
1,19,Isaiah,Democrat,"""Ezra, our societal foundations are built on centuries of oppression. Incremental change won't dismantle the systemic barriers that perpetuate racism. It's time to acknowledge our nation's history and work towards bold, transformative change that truly achieves equality, not just incremental progress."""
1,19,Ezra,Republican,"Isaiah, while I respect your passion for transformative change, I still believe that incremental progress through education, opportunity, and personal responsibility can create meaningful change without upending our societal foundations. Let's find common ground to create a more inclusive society for all."""
1,20,Isaiah,Democrat,"Ezra, finding common ground won't address the entrenched systemic barriers perpetuating racism. We can't create a more inclusive society by ignoring the very foundations that have denied opportunities to people of color for centuries. We need bold change, not incremental tweaks."
1,20,Ezra,Republican,"Isaiah, I understand your urgency for change, but I still believe empowering individuals through education and opportunity can create meaningful progress. Incremental steps, though imperfect, are a practical approach to building a more inclusive society rather than revolutionary upheaval."
1,21,Isaiah,Democrat,"Ezra, incremental progress is a Band-Aid on a festering wound. The systemic barriers perpetuating racism require fundamental reform, not tweaks. To truly achieve equality, we must dismantle the structures that have denied people of color opportunities for centuries, not just empower individuals to overcome them."
1,21,Ezra,Republican,"""I understand Isaiah's fervor, but incremental progress can create lasting change by empowering individuals through education and personal responsibility. By giving people equal opportunities, we can bridge the gap between equality and disparities, fostering a more inclusive society without upending our foundations."""
1,22,Isaiah,Democrat,"Ezra, your incremental approach merely maintains the status quo. Education and personal responsibility can't compensate for a rigged system. We need courageous, collective action to dismantle entrenched systemic barriers now, not piecemeal solutions that delay true equality for people of color, our most vulnerable citizens."
1,22,Ezra,Republican,"Isaiah, I still believe that incremental progress through education, opportunity, and personal responsibility can create meaningful change. However, I'm open to exploring ways to address systemic inequalities, even if it means acknowledging our nation's complex history and the challenges it poses."
1,23,Isaiah,Democrat,"""Ezra, acknowledging our nation's complex history is indeed a crucial step, but mere acknowledgment won't dismantle systemic barriers. We need concrete action, policies, and institutions that actively work against racism, not just individual empowerment through education and opportunity."""
1,23,Ezra,Republican,"Isaiah, I understand your frustration with our current system, but I still believe empowering individuals through education and personal responsibility can create lasting change. Incremental progress is a starting point, not a conclusive solution, and we should be open to exploring systemic reforms that address historic disparities."
1,24,Isaiah,Democrat,"Ezra, we've had a lively discussion, but I still see a fundamental disconnect. Until we dismantle entrenched systemic barriers, equality will remain an unachievable dream. It's not about individual empowerment or incremental progress; it's about confronting the rigged system that denies opportunities to people of color."
1,24,Ezra,Republican,"Isaiah, I understand our disagreement on systemic change, but I'm open to compromise. Maybe we can work together to develop targeted reforms that address specific disparities, while also empowering individuals through education and personal responsibility, allowing for incremental progress towards equality."
1,25,Isaiah,Democrat,"""Ezra, compromise on targeting specific disparities is a step forward, but let's not forget that individual empowerment and reforms lack teeth without dismantling the systemic roots of racism. We must address the entire house, not just patch the walls."""
1,25,Ezra,Republican,"""I agree, Isaiah, that targeting specific disparities is a step forward, but it's crucial we also focus on education, personal responsibility, and individual empowerment to complement these reforms. By working together, we can foster a more equal society, albeit incrementally."""
1,26,Isaiah,Democrat,"Ezra, addressing specific disparities is a start, but it's a Band-Aid on a systemic wound. We can't truly achieve equality without dismantling the entrenched racism that perpetuates disparities. Individual empowerment won't fill the void left by centuries of oppression; systemic change must be the primary focus."
1,26,Ezra,Republican,"Isaiah, I hear your emphasis on dismantling systemic roots of racism, but I still believe incremental progress through education and empowerment can lead to meaningful change. Let's find common ground to develop targeted reforms that address disparities and prioritize individual agency in equality."
1,27,Isaiah,Democrat,"Ezra, compromise on targeted reforms is a step forward, but let's remember that incremental changes are insufficient without a broader, systemic overhaul. Individual empowerment is crucial, but it's a fleeting solution to entrenched racism that permeates every level of our society. We need revolutionary, transformative change."
1,27,Ezra,Republican,"Isaiah, I understand that systemic change is crucial, but incremental empowerment through education and personal responsibility can provide a foundation for lasting change. By acknowledging our differences and focusing on solutions, we can create a more inclusive society, step by step."
1,28,Isaiah,Democrat,"""Ezra, incremental empowerment is a Band-Aid on a system built on centuries of oppression. True change requires a fundamental shift in values and policies that actively dismantle racism, not just target its symptoms. We need revolutionary, transformative change, not incremental tweaks."""
1,28,Ezra,Republican,"Isaiah, I understand your call for revolutionary change, but I still believe empowering individuals through education and personal responsibility can create lasting change. Incremental progress may not be perfect, but it's a step forward towards a more inclusive society, even if it's a slow one."""
1,29,Isaiah,Democrat,"""Ezra, your incremental approach may feel like progress, but it's a facade, masking the entrenched systemic racism that denies opportunities to people of color. We need radical, transformative change, not Band-Aids, to create a truly equal society."""
1,29,Ezra,Republican,"Isaiah, I understand that radical change is desirable, but let's not forget the importance of incremental progress in creating lasting change. Education and personal responsibility can build a foundation for equality, which can be strengthened over time through policy reforms and systemic change."
1,30,Isaiah,Democrat,"Ezra, your emphasis on incremental progress ignores the entrenched systemic barriers that have denied opportunities to people of color for centuries. Radical, transformative change is not a choice, but a necessity for true equality to be achieved."
1,30,Ezra,Republican,"Isaiah, I understand your passion for radical change, but incremental progress through education and individual empowerment is a practical first step toward a more inclusive society. Incremental change is a foundation that can be strengthened over time through targeted reforms and systemic change."
