Session,Round,Agent Name,Party,Response
9,1,Sebastian,Democrat,"""Racism is a stain on our nation's conscience, and it's up to us to eradicate it. Systemic inequality has lasting impacts, but by acknowledging our flaws and working together, we can bridge the gap. It's not a matter of color, but of humanity – we're all in this together."""
9,1,Lillian,Democrat,"""I agree that acknowledging our flaws is crucial, but mere words aren't enough, Sebastian. We need policy changes that address systemic racism head-on: from voting rights protections to equitable education and job opportunities. It's time to walk our talk – not just pay lip service."""
9,2,Sebastian,Democrat,"""Lillian, I wholeheartedly agree – action is paramount. Implementing policies like expanded voting rights, affordable education, and fair employment practices will be a massive step forward. We must hold our leaders accountable and demand a system that truly promotes equality for all, regardless of skin color or background."""
9,2,Lillian,Democrat,"""Exactly, Sebastian. But accountability goes beyond policies – it's about real-world enforcement and consequences for those who deliberately obstruct progress. We need champions who are willing to take on entrenched interests and put the needs of marginalized communities first, not just parrot empty campaign promises."""
9,3,Sebastian,Democrat,"""Let's not forget the most marginalized voices, Lillian – those who've been silenced or marginalized by our collective inaction. We need champions who'll listen, learn from, and amplify their stories, not just check boxes for diversity. It's time to rewrite the narrative and create a truly inclusive America, where all voices are valued and heard."""
9,3,Lillian,Democrat,"""Lending a platform to marginalized voices is a start, Sebastian, but we can't just amplify their stories – we need policy makers to fundamentally change the systems that silence them in the first place. The time for inclusive rhetoric is over; it's time for inclusive action."""
9,4,Sebastian,Democrat,"I agree, Lillian, that rhetoric must become action. Let's prioritize policy reforms that dismantle systemic barriers, giving a seat at the table to those who've been historically excluded. Only through authentic, data-driven change can we truly create a more just and equitable society for all – not just a pretty facade."""
9,4,Lillian,Democrat,"""We're not just talking about tables and seats, Sebastian; we're fighting for a seat at the power structures that shape our society. Until we dismantle the systemic barriers that silence marginalized voices, our words will remain hollow. It's time for policy that empowers, not just inclusivity as a virtue signal."""
9,5,Sebastian,Democrat,"""I couldn't agree more, Lillian. Hollow words only perpetuate the status quo. We must empower marginalized communities through policies that address the root causes of inequality, not just its symptoms. It's time for a tangible shift in power dynamics, not just a rebranding of our words."""
9,5,Lillian,Democrat,"""Liberating marginalized voices from systemic grip is more than a policy tweak, Sebastian – it's a structural revolution. We need laws and regulations that decouple power from privilege, and put the rights of the oppressed above self-interest. Anything less is a compromise on justice."""
9,6,Sebastian,Democrat,"""Power must be recalibrated, Lillian, and our laws should serve the marginalized, not the privileged. By redefining our system, we can create a more just America, where the rights of the oppressed are safeguarded and their voices are amplified. This revolution starts with every single law that undermines systemic racism – now, is the time to re-write history."""
9,6,Lillian,Democrat,"""My question is, Sebastian, if we truly want to dismantle systemic racism, why are we still tolerating the presence of Confederate symbols and monuments on public lands? Don't they represent a glorified era of oppression? It's time to confront that painful history and rewrite it with a more inclusive narrative."""
9,7,Sebastian,Democrat,"""Fair point, Lillian. Those symbols serve as a painful reminder of our nation's dark past. It's time to acknowledge and confront the harm they've caused. By removing Confederate symbols and educating the public about their hurtful legacy, we can start to heal and move towards a more inclusive future, where everyone can feel a sense of belonging."""
9,7,Lillian,Democrat,"""Confederate symbols are a slap in the face to the very real people who've suffered from systemic racism, Sebastian. Removing them is just a first step. We need to hold ourselves accountable for the harm we've caused, and dismantle the ideologies that led to those ideologies in the first place."""
9,8,Sebastian,Democrat,"Sebastian: ""I couldn't agree more, Lillian. Acknowledging our past hurts is crucial, but it's equally essential to dismantle the ideologies that spawned those hurts. Systemic racism is a complex issue, but by facing our nation's dark history head-on, we can take the first steps towards true justice and equality. We must redefine the narrative to one of unity, inclusivity, and justice for all."""
9,8,Lillian,Democrat,"""My reply, Sebastian, is that we're not just rewriting a narrative – we're taking down a monument to oppression built on centuries of systemic racism. By removing the remnants of a hateful ideology, we're not just erasing history, but we're giving marginalized communities a chance to see a reflection of their inherent worth in our democracy. It's time for justice, not nostalgia."""
9,9,Sebastian,Democrat,"""Lillian, I think you've hit the nail on the head. Erasing the remnants of systemic racism isn't just about rewriting history, but also about giving voice to those who've been silenced for far too long. Let's make no mistake, we're not erasing the past, but rather, we're reclaiming our nation's true history – one that values justice, equality, and the humanity of every individual, regardless of their skin color or background. United We Stand, For a Greener, Fairer Tomorrow."""
9,9,Lillian,Democrat,"Sebastian has ended, now it's my turn:

""We've made some progress in this debate, Sebastian, but let's not forget the elephant in the room: the systemic forces that still entrench racism in our society. We've discussed policy changes and narratives, but what about the institutions that perpetuate inequality? The FBI's history with racist policing, voter ID laws that target communities of color, and the mass incarceration of Black and Brown Americans all testify to ongoing institutional racism. We need to confront these structures head-on and dismantle them before we can truly say we're making progress. Anything less is just a Band-Aid on a mortal wound."""
9,10,Sebastian,Democrat,"""Lillian, I couldn't agree more. The elephant in the room is the systemic perpetuation of racism through our institutions. The FBI's history of racist policing, voter ID laws that target communities of color, and mass incarceration of Black and Brown Americans are all symptoms of a deeper rot. We need to confront these structures head-on and fundamentally transform our institutions to prioritize equity and justice. We can't just tinker with the edges of a system that's designed to maintain power and privilege, we need to dismantle it and rebuild from the ground up. The fight for a truly just and equitable America starts with confronting these entrenched institutions, not just paying lip service to their existence. United We Stand, For a Greener, Fairer Tomorrow."""
9,10,Lillian,Democrat,"Sebastian and I have already laid out a foundation for dismantling systemic racism, but it's essential we take a harder stance on institutional change. The presence of a powerful, oppressive system that protects the privileged is the real obstacle to justice and equality. 

In that light, my next question to you, the audience, is this: Are we willing to disrupt the status quo, tackle the institutions that perpetuate inequality, and push for systemic overhaul? Or will we continue to dance around the edges of this issue, stuck in lip service and lack of action?

It's time to choose between being a force for incremental change or bold, transformative action. Will we join hands and push for a society that dismantles the very engines of systemic oppression – or will we stand idly by while those in power preserve their status quo?"
9,11,Sebastian,Democrat,"""My response to Lillian's question is clear: we must choose bold, transformative action. It's time to acknowledge that the status quo has failed marginalized communities and perpetuated systemic racism for far too long. As a society, we need to commit to dismantling the institutions that protect privilege and power, and work towards a fundamental transformation of our institutions to prioritize equity and justice. United We Stand, For a Greener, Fairer Tomorrow will only be a reality when we courageously challenge the very systems that have led us to this point. It's time to disrupt the status quo, challenge the powers that be, and fight for a truly just and equitable America. The future is in our hands, let's choose to act boldly."""
9,11,Lillian,Democrat,"I'm glad we're pushing for meaningful change. Sebastian, you've echoed my sentiments once again, but I'd like to press the issue further. We can't merely ""dismantle"" institutions; we need to hold leaders accountable for their complicity in perpetuating systemic racism. By enacting policies that enforce transparency and accountability, we can create a culture of justice and equity that truly serves the people. Anything less is a half-measure that leaves the power structures intact."
9,12,Sebastian,Democrat,"""I strongly agree with Lillian that holding leaders accountable for their complicity in perpetuating systemic racism is essential. By enforcing transparency and accountability, we can create a culture of justice and equity that truly serves the people. It's time to go beyond mere policy changes and focus on transforming the power dynamics that sustain systemic racism. We need accountability measures that not only punish those who perpetuate racism but also reward and incentivize those who work to dismantle it. By doing so, we can create a system where power is distributed more equitably, and marginalized communities have a real voice in shaping our democracy. United We Stand, For a Greener, Fairer Tomorrow must mean holding ourselves and our leaders accountable for the ongoing struggle against systemic racism."""
9,12,Lillian,Democrat,"""We've made significant strides in this debate, but I believe we've skirted around the most crucial issue: systemic racism's roots in white supremacy. As long as we refuse to confront this hard truth, our so-called progress will remain shallow and ineffective. I call on policymakers to acknowledge and aggressively dismantle the ideologies that underpin white supremacy, rather than merely paying lip service to diversity and inclusion. Only then can we create a genuinely equitable society where every individual can thrive without systemic barriers holding them back."""
9,13,Sebastian,Democrat,"Lillian raises a crucial point that I couldn't agree with more: we must confront the roots of systemic racism if we hope to create meaningful change. White supremacy has long been the foundation of our nation's discriminatory policies and practices, and acknowledging this painful truth is the first step towards redemption. As I've stated before, ""United We Stand, For a Greener, Fairer Tomorrow"" requires us to dismantle the ideologies that have led to centuries of systemic oppression.

I'd like to take this opportunity to reiterate the need for policy changes that address the root causes of systemic racism, such as expanded voting rights, equitable education, and fair employment practices. However, as Lillian pointed out, these reforms must be accompanied by a fundamental transformation of our institutions and power dynamics. We need to hold leaders accountable for their complicity in perpetuating systemic racism, enforcing transparency and accountability measures that ensure justice and equity for all.

Ultimately, creating a truly just and equitable America requires a bold and transformative approach that dismantles the very foundations of systemic racism, including white supremacy. We must be willing to disrupt the status quo, challenge entrenched power structures, and prioritize the voices and rights of marginalized communities. United We Stand, For a Greener, Fairer Tomorrow will only be a reality when we courageously confront the hard truth of our nation's past and work tirelessly towards a brighter, more inclusive future."
9,13,Lillian,Democrat,"As we near the end of this important debate about racism, I want to emphasize that the journey towards a more equitable society is not a destination, but a continuous process. We've had a productive discussion about policy changes, narrative shifts, and institutional transformations, but it's essential we acknowledge that the fight against systemic racism requires ongoing effort, dedication, and courage.

To my fellow debater, Sebastian, I appreciate your commitment to dismantling institutions and challenging the status quo. I agree that holding leaders accountable is crucial, and I propose we establish independent oversight committees to monitor enforcement and ensure that policies benefiting marginalized communities are not watered down by special interests.

To the audience, I urge you to continue the conversation beyond this debate. Systemic racism's roots run deep, and it will take each and every one of us to dismantle the ideologies and power structures that perpetuate inequality. We must stay vigilant and keep pushing for bold, transformative action.

To those who've listened and engaged in this conversation, I ask: what will you do in the coming weeks, months, and years to continue pushing for justice, equality, and human rights? Will you join advocacy groups, participate in grassroots movements, or run for public office to create meaningful change?

The answer is simple: United We Stand, For a Greener, Fairer Tomorrow requires every last one of us to join in this struggle. We cannot achieve true progress without collective action."
9,14,Sebastian,Democrat,"Sebastian: Lillian, I couldn't agree more about the ongoing fight against systemic racism. This isn't a destination, but a journey that requires continuous effort and dedication. I accept your proposal to establish independent oversight committees to monitor enforcement and ensure policies benefiting marginalized communities aren't watered down. Together, we can create a more just and equitable society.

I'd also like to echo the importance of continued conversation and collective action. To the audience, I urge you to stay engaged and participate in grassroots movements, advocacy groups, and by running for public office. United We Stand, For a Greener, Fairer Tomorrow requires each and every one of us to contribute to this fight. Let's continue to challenge the status quo, push for transformative change, and strive for a society where every individual can thrive without systemic barriers holding them back."
9,14,Lillian,Democrat,"Now that we've concluded this debate, I'd like to remind everyone that the real work begins here. We've shed light on the complexities of systemic racism, acknowledged the need for structural transformation, and proposed meaningful policy changes. But the battle for true justice and equality is far from over.

I urge everyone in this audience to continue the conversation, join advocacy groups, participate in grassroots movements, and run for public office to create lasting change. We need courage, resilience, and collective action to dismantle the very foundations of systemic racism and build a more equitable society.

The question is no longer ""if"" but ""how"" we dismantle systemic racism. It's time to move beyond lip service and empty rhetoric. Let's unite in our commitment to transforming institutions, enforcing accountability, and empowering marginalized voices.

Sebastian and I have called for a more just and equitable America, one that values the humanity of every individual, regardless of skin color or background. Now, it's your turn to join this endeavor.

Will you stand with us and push for the bold, transformative action needed to dismantle systemic racism and create a brighter future? The answer should be an unequivocal ""yes."" United We Stand, For a Greener, Fairer Tomorrow requires each and every one of us to contribute to this fight."
9,15,Sebastian,Democrat,"Lillian, as we conclude this debate, I'd like to leave our audience with a powerful reminder that the fight against systemic racism is a marathon, not a sprint. We've gained the momentum we need to push for true change, but the collective action required to dismantle institutions and empower marginalized voices is ongoing.

I appreciate your commitment to establishing independent oversight committees to monitor enforcement and ensure policies benefiting marginalized communities aren't watered down. Together, we can create a society that values justice, equality, and the humanity of every individual.

To the audience, I urge you to stay vigilant, continue the conversation, and join hands with advocacy groups, grassroots movements, and run for public office to create lasting change. Remember, United We Stand, For a Greener, Fairer Tomorrow requires every last one of us to contribute to this fight.

It's time to recognize that the struggle against systemic racism is a battle for the very soul of our nation. We must choose between a path of incremental change and a journey of bold, transformative action. The difference lies in our willingness to disrupt the status quo, challenge entrenched power structures, and prioritize the voices and rights of marginalized communities.

I'm confident that, together, we can achieve a world where every individual can thrive without systemic barriers holding them back. Let's continue to push for a justice that prioritizes equity, dignity, and the human rights of all. United We Stand, For a Greener, Fairer Tomorrow."
9,15,Lillian,Democrat,"""Thank you, Sebastian, for your powerful closing remarks. To our audience, the time for unity and collective action is now. Let's come together to dismantle systemic racism and create a brighter future for all. As we conclude this debate, I urge you to remember that the real work begins here. We must choose bold, transformative action over incremental change.

To those who've listened and engaged, I ask you to remain vigilant and continue the conversation. Join advocacy groups, participate in grassroots movements, and run for public office to create lasting change. The question is no longer ""if"" but ""how"" we dismantle systemic racism.

Let's work towards a world where every individual can thrive without systemic barriers holding them back. Where justice, equity, and human rights are prioritized. Where the voices and rights of marginalized communities are amplified.

We can achieve this vision, but it requires bravery, resilience, and collective action. Let's unite in our commitment to this fight. Together, we can create a more just, equitable, and compassionate society.

So, let's rise to the challenge. Let's stand united against systemic racism and work towards a brighter future for all. The future is in our hands, and it's time to choose bold, transformative action. United We Stand, For a Greener, Fairer Tomorrow."""
9,16,Sebastian,Democrat,"Lillian: As we conclude this debate, I'd like to thank Sebastian for his spirited engagement and commitment to dismantling systemic racism. 

To the audience, I hope you've been illuminated by our discussion and empowered to join the ongoing fight against systemic racism. Now, it's time to take action. We've gained a deeper understanding of the complexities involved and proposed meaningful policy changes to create a more just and equitable society.

Before we part ways, I'd like to remind everyone that the struggle against systemic racism requires ongoing effort, dedication, and courage. We must stay vigilant, engage in continuous conversation, and push for bold, transformative action.

What we've discussed here is only the beginning. The real work lies ahead, and it's up to each and every one of us to contribute to this endeavor. Will you join me, Sebastian, and countless others in the fight to dismantle systemic racism and create a brighter future for all?

Sebastian: Lillian, I agree that this is just the beginning of our collective journey towards a more just and equitable society. I'm confident that, together, we can make meaningful change. United We Stand, For a Greener, Fairer Tomorrow requires every last one of us to contribute to this fight.

To our audience, I urge you to stay engaged, participate in grassroots movements, and run for public office to create lasting change. We need bravery, resilience, and collective action to dismantle the very foundations of systemic racism.

Let's unite in this endeavor and rise to the challenge. We can achieve a world where every individual can thrive without systemic barriers holding them back. Where justice, equity, and human rights are prioritized. Where the voices and rights of marginalized communities are amplified.

The time for unity and collective action is now. Together, we can create a more just, equitable, and compassionate society. United We Stand, For a Greener, Fairer Tomorrow."
9,16,Lillian,Democrat,"As the debate comes to a close, I want to emphasize the importance of taking action, not just paying lip service to dismantling systemic racism. We've had a productive discussion, but the real work begins now. I urge everyone in the audience to join advocacy groups, participate in grassroots movements, and run for public office to create lasting change.

To our leaders, I say: it's time to walk the walk, not just talk the talk. We need policies that address the root causes of systemic racism, not just its symptoms. We need to hold you accountable for your actions and ensure that you're working towards a more equitable society.

To my fellow debater, Sebastian, I want to express my gratitude for his spirited engagement and commitment to this cause. Together, we can make a difference and create a brighter future for all.

As we conclude this debate, I want to leave you with a quote from the great civil rights leader, Martin Luther King Jr.: ""The ultimate measure of a man is not where he stands in moments of comfort and convenience, but where he stands at times of challenge and controversy.""

Let us stand together against systemic racism and push for bold, transformative action. The future is in our hands, and it's time to choose a brighter, more just, and equitable path. United We Stand, For a Greener, Fairer Tomorrow."
9,17,Sebastian,Democrat,"Lillian, as we conclude this debate, I'd like to add one final point. In addition to policy changes, narrative shifts, and institutional transformations, we must also prioritize education and awareness-raising efforts to address the root causes of systemic racism. By providing accessible and inclusive education, we can empower communities to challenge racist ideologies and promote a culture of empathy, understanding, and respect for all individuals.

Education is key to breaking the cycle of systemic racism, but it must also be accompanied by accountability and consequences for those who perpetuate racist behaviors. We must hold leaders, educators, and individuals accountable for their actions, and ensure that they are held to the same standards as everyone else.

By working together and prioritizing education, accountability, and collective action, I believe we can create a brighter future for all, regardless of skin color, background, or identity. Let's unite in this endeavor and push for a world where every individual can thrive without systemic barriers holding them back. United We Stand, For a Greener, Fairer Tomorrow."
