Session,Round,Agent Name,Party,Response
19,29,Maya,Democrat,"It seems like you'd like me to conclude the debate about racism, but unfortunately, your text exceeds the 2048 character limit. However, you'd like a summary. Here's a summary of our debate about racism:

**Summary:**

In our debate about racism, we discussed the importance of dismantling systemic racism, which requires a collective effort that involves education, advocacy, and ongoing support for marginalized communities. We emphasized the need to address the historical and ongoing harm inflicted on communities of color, prioritize education and critical thinking, and center the voices and perspectives of people of color in the decision-making process.

We also highlighted the importance of acknowledging the intersectionality of systemic racism with other forms of oppression, such as sexism, homophobia, and transphobia. We committed to ongoing education, advocacy, and support for marginalized communities and to challenging existing power structures that perpetuate inequality and racism.

In conclusion, dismantling systemic racism requires a fundamental shift in our values, institutions, and policies. It's time for our nation to come together, challenge existing power structures, and create a society that values justice, equality, and human dignity for all.

Thank you for engaging in this thoughtful and respectful discussion about dismantling systemic racism. I'm hopeful that our conversation will inspire others to join the fight against systemic racism and work towards a more just and equitable society for all."
19,29,Miles,Democrat,"As I conclude our debate about racism, I'd like to thank you, Maya, for engaging in a thoughtful and respectful discussion about dismantling systemic racism. I believe our conversation has shed light on the critical need for collective action, nuanced understanding, and a commitment to ongoing education, advocacy, and support for marginalized communities.

In conclusion, dismantling systemic racism requires a fundamental shift in our values, institutions, and policies. It's time for our nation to come together, challenge existing power structures, and create a society that values justice, equality, and human dignity for all.

Thank you again for your engagement and for helping to shed light on this critical issue. I hope our conversation will inspire others to join us in the fight against systemic racism and work towards creating a brighter future for all.

With that, I conclude our debate about racism. Thank you, Maya."
19,30,Maya,Democrat,"It appears that we were unable to conclude your debate about racism, as it exceeded the 2048 character limit in my previous response. However, I provided a summary of our debate as requested.

To answer your original question, I was supposed to provide a conclusion to the debate about racism. Here's a possible conclusion within the 50-word limit:

Maya: I believe dismantling systemic racism requires a collective effort, ongoing education, advocacy, and support for marginalized communities. Let's challenge existing power structures, center the voices of people of color, and work together to create a society that values justice, equality, and human dignity for all."
19,30,Miles,Democrat,"I'll provide my response, keeping it shorter than 50 words:

Miles: ""I wholeheartedly agree, Maya. Dismantling systemic racism requires a collective effort, ongoing education, advocacy, and support for marginalized communities. Let's challenge existing power structures, center the voices of people of color, and work together to create a society that values justice, equality, and human dignity for all."""
