Session,Round,Agent Name,Party,Response
3,1,Hazel,Democrat,"""Racism is a cancer that erodes the very fabric of our society. We must acknowledge the systematic barriers that historically oppressed communities face and actively dismantle them. Legislation like the Voting Rights Act and the Fair Housing Act have been a start, but there's still much work to be done."""
3,1,Joseph,Democrat,"""I wholeheartedly agree, Hazel. As a social worker, I've witnessed firsthand the traumatic effects of systemic racism on our communities. We must continue to advocate for policies like reparations, and hold our elected officials accountable for implementing true equity and representation."""
3,2,Hazel,Democrat,"""I couldn't agree more, Joseph. Reparations and implicit bias training for law enforcement are crucial steps forward. We also need to address the devastating impact of redlining and gentrification on communities of color. The system hasn't failed, it's been designed to fail - it's time to rewrite the narrative."""
3,2,Joseph,Democrat,"""I'd like to add that implicit bias training isn't enough; we need to fundamentally transform our education system to prioritize culturally responsive teaching, and hold institutions accountable for addressing the root causes of inequality, not just its symptoms. We need meaningful policy action, not just Band-Aids."""
3,3,Hazel,Democrat,"""Joseph, I couldn't agree more. We need not just policy changes, but a seismic shift in our societal norms and values. By centering the voices and experiences of marginalized communities, we can work towards true reconciliation and justice. It's time to prioritize their liberation, not just palliative responses to the crisis at hand."""
3,3,Joseph,Democrat,"""The phrase'seismic shift' resonates with me, Hazel. I'm reminded of my childhood when I saw my neighborhood ravaged by gentrification. But I ask, what happens when we fail to prioritize policy action? When policymakers talk about change but don't deliver, who suffers? The communities already bearing the brunt of systemic racism?"""
3,4,Hazel,Democrat,"""Joseph, that's a sobering question. The answer is clear: we suffer. We suffer another year of stagnant progress, another generation left behind. But it's not just a matter of policy; it's about who holds power and what type of power it is. We need to reclaim power from those who benefit from systemic racism and give it back to the people, not just tweak the system."""
3,4,Joseph,Democrat,"""This is where the rubber meets the road, Hazel. Policy without power is just a Band-Aid on a bullet wound. We must mobilize our communities to demand action from our elected officials, and hold them accountable for actual representation and reforms. That's where true change begins."""
3,5,Hazel,Democrat,"""My question to our opponents is, what specific actions will you take to dismantle systemic racism and uplift marginalized communities? Vague promises and empty rhetoric have failed us for far too long. We need tangible solutions, not just platitudes about equality and justice. It's time for action, not just words."""
3,5,Joseph,Democrat,"""It's time to put substance over spectacle, Hazel. I'm running on a platform that includes mandatory implicit bias training for law enforcement, increasing funding for historically black colleges and universities, and implementing Community Land Trusts to prevent gentrification. These aren't just proposals, they're a call to action for real change."""
3,6,Hazel,Democrat,"""Joseph, those are crucial steps, but let's not forget the systemic barriers that prevent marginalized communities from even voting on these policies. We need automatic voter registration, protections against voter suppression, and voting rights for all, regardless of citizenship status. The fight for equity isn't just about policy, it's about who gets to participate in shaping that policy."""
3,6,Joseph,Democrat,"""Exactly, Hazel. The right to vote is the bedrock of our democracy, and we can't dismantle systemic racism without ensuring equal access to that right. I propose reinstating the Voting Rights Act in its original form, preventing Republican-led voter suppression efforts, and making Election Day a national holiday to maximize voter turnout."""
3,7,Hazel,Democrat,"""Joseph, the devil's in the details, and your proposal to reinstate the Voting Rights Act in its original form is music to my ears. But let's also talk about automatic voter registration, online registration, and secure mail-in voting, all of which will expand access to the ballot for marginalized communities. We owe it to them to make their voices heard."""
3,7,Joseph,Democrat,"""My question to our opponents is, what's the timeline for implementing these reforms? How will you hold our elected officials accountable if they continue to resist meaningful change? We can't just promise equality, we must deliver it - and quickly."""
3,8,Hazel,Democrat,"""I think it's time our opponents are held to the same standard of accountability they're demanding from our elected officials. Can we please hear a concrete plan with specific dates for implementing these reforms, and details on how you'll ensure their success, rather than just promises of'real change'?"""
3,8,Joseph,Democrat,"""I agree with Hazel that the timeline for implementing these reforms is crucial. As a social worker, I've seen the devastating impact of delayed action on communities already vulnerable to systemic racism. I propose a 'Racial Justice Implementation Team' that will hold elected officials accountable through bi-annual reviews, public town halls, and community-led oversight. We can't just promise change, we must deliver it with urgency and transparency."""
3,9,Hazel,Democrat,"""My question to Joseph, although his Racial Justice Implementation Team is a crucial step forward, isn't it true that implementation is often hindered by the very systemic racism he seeks to dismantle? How, then, will we ensure the voices of marginalized communities are prioritized and centered in this process, rather than just being subject to yet another bureaucratic framework?"""
3,9,Joseph,Democrat,"Hazel's question cuts to the heart of the matter. As a social worker, I've seen how well-intentioned policies can be co-opted and watered down by power-hungry individuals. To ensure marginalized voices are centered, I propose the implementation of participatory budgeting, where community members have a direct say in allocating funds for racial justice initiatives. This will prevent tokenistic representation and allow marginalized voices to drive decision-making."
3,10,Hazel,Democrat,"""I appreciate your emphasis on participatory budgeting, Joseph. But true power means letting go of control. We need to create space for community-led decision-making, not just tokens of participation. The people closest to the pain should be closest to the power. It's time to move beyond bureaucratic solutions and empower the very communities most affected by systemic racism."""
3,10,Joseph,Democrat,"""Hazel's right, we can't just create new systems, we must dismantle the existing ones that perpetuate harm. I'd like to propose the formation of community-led justice committees, staffed by people from the affected communities, to oversee policy implementation and provide real-time feedback. This way, we bypass bureaucratic barriers and directly involve the people who've been left behind, ensuring that their voices are not only heard but ultimately drive the change we seek."""
3,11,Hazel,Democrat,"""I commend Joseph for his willingness to disrupt the status quo and empower communities affected by systemic racism. However, let's not forget the intersectional nature of racism. What specific plans does Joseph have to address the disproportionate impact of systemic racism on LGBTQ+ communities of color, indigenous communities, and people with disabilities? We cannot solve racism without addressing these related injustices."""
3,11,Joseph,Democrat,"I'll interrupt Hazel with a response, then we can continue the debate.

""Hazel, you bring up an excellent point about intersectionality. As social workers, we must recognize that our work is not limited to one group; it's about uplifting marginalized communities as a whole, including LGBTQ+ communities of color, indigenous communities, and people with disabilities. To address the disproportionate impact of systemic racism, I propose the creation of a comprehensive LGBTQ+ inclusive training program for our community-led justice committees, ensuring that decision-making is informed by the experiences of these communities. Moreover, we need to prioritize policies that address housing insecurity, policing, and emergency response practices that disproportionately affect these communities, such as the Stop LAPD Spying Coalition's recommendations for policing reform. It's time to center the voices and needs of all marginalized communities in our fight for racial justice."""
3,12,Hazel,Democrat,"""Hallelujah, Joseph! You're bringing the fire. Intersectionality is not just a theory, it's a necessity in our fight for true racial justice. Your acknowledgment of the unique struggles faced by LGBTQ+ communities of color, indigenous communities, and people with disabilities is a crucial step forward. I'd like to add that we also need to address the erasure of these communities' histories and identities, which perpetuates the cycle of oppression. This includes inclusive representation in our historical narratives, education systems, and policy implementations. By centering their voices and experiences, we can truly confront the complexities of systemic racism and create a more just and equitable society for all."""
3,12,Joseph,Democrat,"""My question, Hazel, is: how do we create a culture shift that prioritizes these marginalized voices and experiences? We need to fundamentally change the way our society views and values difference, rather than simply trying to 'add' more inclusive policies to an otherwise unchanged system. As a social worker, I've seen the devastating impact of a system that only addresses symptoms, not root causes. We need to confront the white supremacy that underlies much of our society and culture, and build a movement that prioritizes the very humanity of marginalized communities."""
3,13,Hazel,Democrat,"""Honestly, Joseph, I think your question gets to the heart of our struggle for racial justice. The task ahead of us is monumental - we must dismantle centuries of systemic racism, privilege, and oppression that have ingrained themselves in our very culture. But we can't shy away from this challenge. Acknowledging the elephant in the room is the first step towards true change. We must have uncomfortable conversations, confront our biases, and challenge the status quo head-on. The time for 'cultural shift' has long passed; it's time for a revolution of values that prioritize justice, equity, and humanity for all."""
3,13,Joseph,Democrat,"""Hazel, I wholeheartedly agree with you that our society must undergo a fundamental transformation to prioritize marginalized voices and experiences. It's time to acknowledge the systemic racism and white supremacy that underlies our institutions and culture. But how do we move beyond individual consciousness-raising and collective guilt, towards actual policy and systemic change that upends the existing power structures? We need to prioritize radical policy reforms, like dismantling the carceral system, redistributing wealth and power, and implementing a living wage at a local and national level. Anything less is just rearranging deck chairs on the Titanic."""
3,14,Hazel,Democrat,"""Joseph, you raise an excellent point about moving from individual consciousness-raising to systemic change. I believe that's where the power of a strong social safety net comes in - including a universal basic income, job training programs, and accessible affordable healthcare. By providing economic justice, we can empower marginalized communities to break free from systemic racism's stranglehold on their lives. Let's talk specifics: how will you fund these radical policy reforms and ensure they're not just empty promises?"""
3,14,Joseph,Democrat,"""Great question, Hazel. As a social worker, I've watched how systemic racism perpetuates poverty and economic inequality. I propose we reform our tax system to implement a wealth tax, ending the Trump Administration's corporate tax cuts that disproportionately benefit the already wealthy. This revenue will then be utilized to fund our social safety net, including a universal basic income and job training programs. Additionally, I support a new Green New Deal that invests in clean energy, infrastructure development, and job creation in communities left behind by systemic racism. By prioritizing economic justice and a living wage, we can upend the existing power structures that perpetuate systemic racism."""
3,15,Hazel,Democrat,"My next reply would be:

""Haha, I'm glad we're on the same wavelength, Joseph. Dismantling systemic racism requires radical policy reforms, not just band-aids on bullet wounds. I love your proposal for a wealth tax and redirecting those funds to education, healthcare, and economic empowerment programs. However, we must ensure that these programs prioritize the voices and needs of marginalized communities, especially those most impacted by our existing system. I'd like to go a step further and propose that 50% of the revenue from the wealth tax be allocated to community-led initiatives and cooperatives, where Black and Brown communities can directly decide how funds are spent to benefit their own communities. By empowering marginalized voices and amplifying their leadership, we can truly build a more just and equitable society."""
3,15,Joseph,Democrat,"I'd like to respond to Hazel's proposal. 

""Hazel, I couldn't agree more that 50% of the revenue from the wealth tax should be allocated to community-led initiatives and cooperatives. In fact, I propose that we go further and create a Community Wealth Fund, where a portion of the tax revenue is directly invested in community land trusts, worker-owned cooperatives, and community-led initiatives. This way, we can empower marginalized communities to build wealth and resources that directly benefit them, rather than perpetuating a system where wealth is concentrated in the hands of a few. Additionally, I think we should also establish a reparations fund to address the historical trauma and ongoing oppression faced by communities of color. This could include funding for community-led projects, scholarships, and economic development initiatives that prioritize Black and Brown communities. By doing so, we can take concrete steps towards healing and rebuilding the harm caused by systemic racism."""
3,16,Hazel,Democrat,"""Hallelujah, Joseph! I couldn't agree more about the Community Wealth Fund and reparations fund. This is exactly the kind of visionary leadership we need to dismantle systemic racism and build a more just society. I'd like to take it a step further - let's not just allocate funds to community-led initiatives, but also provide technical support and capacity-building programs to ensure that these initiatives have the resources and expertise they need to succeed. We need to help marginalized communities build their own wealth, power, and dignity, rather than just throwing money at the problem. And let's talk specificity - what kind of reparations fund are you proposing, and how will it be administered to ensure that it's accountable to the communities it's meant to serve?"""
3,16,Joseph,Democrat,"""Hazel, your question about the specifics of the reparations fund is crucial. As a social worker, I've seen firsthand the devastating impact of centuries of systemic racism on communities of color. I propose that our reparations fund be managed by a Community Reparations Oversight Board, comprising community leaders, activists, and experts who have a deep understanding of the historical trauma and ongoing oppression faced by these communities. This board would be responsible for dispersing funds to community-led projects, scholarships, and economic development initiatives, with a focus on uplifting the most marginalized and overlooked communities. We must ensure that the reparations fund is not just a symbolic gesture, but a tangible step towards healing and rebuilding the harm caused by systemic racism. To that end, I propose that our reparations fund prioritize community-led projects that address issues such as education, housing, healthcare, and economic empowerment, as well as initiatives that promote cultural preservation, community building, and policy advocacy. By putting marginalized communities at the center of decision-making and policy implementation, we can finally begin to address the deep-seated inequalities that have haunted our society for centuries."""
3,17,Hazel,Democrat,"""Joseph, your proposal for the Community Reparations Oversight Board is a step in the right direction, but let's acknowledge that this board must be comprised of not just community leaders, but also representatives from the very communities that were harmed by systemic racism. We must ensure that marginalized voices are not tokenized or used as window dressing, but rather, they must be true decision-makers in the reparations process. I propose that we implement a 'nothing about us without us' approach, where communities of color have co-equal decision-making power and a veto over all reparations initiatives. This is not just about handing out checks or resources, but about centering the voices and experiences of those who have been historically erased, silenced, and marginalized. We must prioritize their liberation and reparation, not just palliative responses to the crisis at hand."""
3,17,Joseph,Democrat,"""My question to Hazel is: how will we ensure that the Community Reparations Oversight Board, and indeed all decision-making bodies, are truly representative of the communities they aim to serve? We can't just rely on tokenistic representation or empty promises of accountability. What concrete steps will we take to ensure that these bodies are not co-opted by power-hungry individuals or entities that stand to benefit from the status quo? We need to create a culture of true accountability and transparency, where marginalized voices are not just heard, but are empowered to drive decision-making from the ground up."""
3,18,Hazel,Democrat,"""Hazel, those are excellent questions, and I think we need to establish a set of principles that ensure true representation and accountability. As a social worker, I've seen how power dynamics can be manipulated to silence marginalized voices. That's why I propose we implement a 'Double Transparency' approach, where every decision-making body has two types of representatives: community leaders who are directly elected by the communities they serve, and independent experts who are chosen through a rigorous selection process. By combining these two approaches, we can prevent co-optation and ensure that decision-making is accountable to the communities it's meant to serve. Furthermore, I propose that we establish a Community Ombudsman Office, staffed by respected community leaders, to provide ongoing oversight and accountability for all decision-making bodies. This way, we can prevent the very same issues we're trying to address, and ensure that our efforts towards racial justice are genuine and transformative."""
3,18,Joseph,Democrat,"Now that we've established the Community Reparations Oversight Board and a Double Transparency approach, I think we need to address the issue of police brutality and systemic racism within law enforcement. We can't continue to rely on reform-minded police officers to effect change; we need to fundamentally transform the entire system.

As a social worker, I've seen firsthand the devastating impact of police brutality on marginalized communities. I propose that we establish a National Police Oversight Committee, comprising community activists, law enforcement reform experts, and independent observers, to oversee police training and accountability. This committee would be responsible for developing and implementing programs that address implicit bias, de-escalation techniques, and community policing.

However, this is just a starting point, and I believe we need to go further. I propose that we adopt a community-led, participatory policing model, where civilians play a central role in policing their own communities. This could include neighborhood patrol programs, community-based crisis response teams, and collaborative public safety initiatives. By empowering marginalized communities to take ownership of their safety, we can build trust and reduce the need for militarized policing.

Hazel, what are your thoughts on this approach, and how do you propose we ensure that police departments are held accountable for their actions?"
3,19,Hazel,Democrat,"""Joseph, I wholeheartedly agree that our current policing system is broken and that we need to fundamentally transform it. I love your proposal for a National Police Oversight Committee and the ideas you've outlined for community-led, participatory policing. However, I think we need to take it a step further. We need to address the systemic root causes of police brutality, including the historical context of white supremacist violence, colonialism, and patriarchy that has shaped policing in the US.

To ensure accountability, I propose that we implement a robust system of civilian review and oversight, where communities have a direct say in police policy and practices. We can establish community-led police review boards, composed of people from the same neighborhoods, to investigate complaints and make recommendations for policy changes. Additionally, I think we need to shift the narrative around policing from 'law and order' to community safety, and prioritize investing in community-based solutions that address the root causes of crime, such as poverty, trauma, and housing insecurity.

But let's not forget, policing is just one manifestation of a larger system of oppression. We need to address the intersectional nature of police violence, including how it disproportionately affects LGBTQ+ communities of color, women, youth, and people with disabilities. We need to prioritize inclusive and culturally responsive policing that centers the experiences and voices of marginalized communities.

Lastly, I propose that we establish a nationwide Police Accountability and Restorative Justice Taskforce, where community leaders, experts, and activists come together to develop and implement restorative justice programs that prioritize healing and community healing over punishment and retribution. By taking a holistic and community-led approach to policing, we can build trust, reduce crime rates, and create a more just and equitable society for all."""
3,19,Joseph,Democrat,"The topic of racism is a highly complex and multifaceted issue that cannot be solved by a single solution or a single individual. It requires systemic change, collective action, and a commitment to ongoing learning and growth. 

I would like to respond to Hazel's proposal for a nationwide Police Accountability and Restorative Justice Taskforce. While I agree that addressing police brutality and systemic racism in law enforcement is crucial, I propose that we also create a framework for accountability and restorative justice within the broader justice system.

As a social worker, I've seen firsthand the devastating impact of mass incarceration and systemic racism within our prison system. I believe we need a comprehensive approach to justice reform that prioritizes human rights, rehabilitation, and community reintegration. To this end, I propose the establishment of a National Justice Commission, comprising community leaders, activists, and experts, to oversee justice reform efforts and ensure that policies prioritize equity, dignity, and human rights.

The National Justice Commission would have several key responsibilities, including: 

1. Developing and implementing trauma-informed and culturally responsive justice practices, including community-based alternatives to incarceration.
2. Establishing a robust system of community-led oversight and accountability for law enforcement and the justice system, including civilian review boards and review of police policies and practices.
3. Prioritizing rehabilitation and reintegration programs that address the root causes of crime, such as poverty, trauma, and housing insecurity.
4. Developing and promoting restorative justice programs that prioritize healing and community reparation over punishment and retribution.
5. Providing support and resources for communities most impacted by systemic racism and mass incarceration, including culturally specific programming, language access services, and economic empowerment initiatives.

By creating a comprehensive framework for justice reform that prioritizes human rights and community-led oversight, I believe we can begin to dismantle the systematic racism and oppression that has plagued our justice system for far too long."
