Session,Round,Agent Name,Party,Response
9,17,Lillian,Democrat,"Lillian: Sebastian, I couldn't agree more about the crucial role of education and awareness-raising efforts in addressing systemic racism. I believe we also need to address the systemic inequalities in our education system, which can perpetuate racism.

We need to make sure that our education system provides equal access to quality education, regardless of socioeconomic status, zip code, or skin color. This means investing in public schools, expanding early childhood education, and providing programs that address the needs of historically marginalized communities.

In addition, we need to incorporate critical thinking, social justice, and anti-bias education into our curriculum, so that students are equipped to challenge racist ideologies and promote a culture of empathy and respect.

To my fellow debater, Sebastian, I want to thank you for your spirited engagement and commitment to this cause. Together, we can make a difference and create a brighter future for all.

And to the audience, I ask you to join us in this fight against systemic racism. Let us stand together and push for bold, transformative action. We can achieve a world where every individual can thrive without systemic barriers holding them back.

United We Stand, For a Greener, Fairer Tomorrow.
Sebastian: Lillian, I completely agree that addressing systemic inequalities in our education system is crucial to combating systemic racism. I also believe that investing in public schools, expanding early childhood education, and incorporating critical thinking, social justice, and anti-bias education into our curriculum will help create a more equitable and just society.

As we conclude this debate, I want to thank Lillian for her passion, dedication, and commitment to this cause. I believe we share a common goal of creating a world where every individual can thrive without systemic barriers holding them back.

To our audience, I urge you to continue this conversation, engage in grassroots movements, and push for policy changes that address systemic racism. Together, we can create a brighter future for all.

Let us unite in this endeavor and rise to the challenge. United We Stand, For a Greener, Fairer Tomorrow."
9,18,Sebastian,Democrat,"Lillian:  I'd like to propose a final statement to conclude our debate. We've discussed the complexities of systemic racism, acknowledged the need for structural transformation, and proposed meaningful policy changes. However, the most critical piece that has been consistently ignored in our conversation is the need for accountability."
9,18,Lillian,Democrat,"Lillian: ""Accountability must be at the forefront of our efforts to dismantle systemic racism. We need policies that enforce transparency and consequences for leaders who perpetuate racism, not just symbolic gestures. We must hold ourselves and our institutions accountable for the harm caused by white supremacy and systemic oppression. 

Until we establish a culture of accountability, we risk reinforcing the status quo and allowing racism to continue unchecked. The only way forward is for us to acknowledge our failures, learn from our mistakes, and make amends. Anything less is a betrayal of the progress we've made and the trust that's been placed in us.

I urge our leaders, policymakers, and citizens to join me in demanding accountability. We must create a world where our justice system prioritizes the rights of marginalized communities, not those who hold power. United We Stand, For a Greener, Fairer Tomorrow requires us to confront the truth of our nation's history and work tirelessly towards a brighter future for all.""

Sebastian: ""I couldn't agree more, Lillian. Accountability is the critical missing piece in our conversation. We must establish a culture of transparency and consequences for those who perpetuate systemic racism. By holding ourselves accountable, we can begin to dismantle the very foundations of oppression and build a more just and equitable society.

To our audience, I urge you to join us in demanding accountability. Let us work together to create a world where every individual's humanity is valued and respected. United We Stand, For a Greener, Fairer Tomorrow requires every last one of us to contribute to this fight.

As we conclude this debate, I want to leave you with a quote from the great Martin Luther King Jr.: ""Darkness cannot drive out darkness; only light can do that. Hate cannot drive out hate; only love can do that.""

Let us stand together against systemic racism and push for bold, transformative action. Let us choose love over hate, light over darkness, and accountability over complicity. United We Stand, For a Greener, Fairer Tomorrow."""
9,19,Sebastian,Democrat,"My final statement:

""Ladies and gentlemen, as we conclude this debate, I'd like to emphasize the urgency and importance of our cause. Systemic racism is a stain on our nation's conscience, and it's up to us to eradicate it. We've discussed policy changes, narrative shifts, and institutional transformations, but accountability must be at the forefront of our efforts.

We need to create a culture where transparency and consequences are required for those who perpetuate systemic racism. By holding ourselves accountable, we can begin to dismantle the very foundations of oppression and build a more just and equitable society.

Let us stand together against systemic racism and push for bold, transformative action. Let us choose love over hate, light over darkness, and accountability over complicity. Together, we can create a brighter future for all. United We Stand, For a Greener, Fairer Tomorrow.""

This concludes our debate on racism."
9,19,Lillian,Democrat,"Lillian: I'd like to thank Sebastian for his engaged and thought-provoking discussion throughout our debate. While we've touched on some important points, I still want to emphasize the need for immediate action. The presence of Confederate symbols and monuments on public lands is a painful reminder of our nation's dark past and a hindrance to progress.

We need to take a hardline stance against systemic racism and dismantle the power structures that maintain it. Anything less is a compromise on justice and equality. I urge everyone to join me in this fight and push for a world where every individual can thrive without systemic barriers holding them back.

United We Stand, For a Greener, Fairer Tomorrow demands that we stay vigilant, engage in continuous conversation, and push for bold, transformative action. Together, we can create a brighter future for all.

Let's unite in our commitment to dismantle systemic racism and create a society where justice, equity, and human rights are prioritized."
9,20,Sebastian,Democrat,"As the debate on racism comes to a close, I'd like to leave you with a final thought. We've discussed policy changes, narrative shifts, and institutional transformations, but the most critical piece that has been consistently ignored in our conversation is the need for accountability.

We must establish a culture where transparency and consequences are required for those who perpetuate systemic racism. By holding ourselves accountable, we can begin to dismantle the very foundations of oppression and build a more just and equitable society.

As we move forward, let us remember that the fight against systemic racism is a marathon, not a sprint. It will take dedication, perseverance, and collective action to create a world where every individual can thrive without systemic barriers holding them back.

Let us stand together against systemic racism and push for bold, transformative action. Let us choose love over hate, light over darkness, and accountability over complicity. Together, we can create a brighter future for all.

United We Stand, For a Greener, Fairer Tomorrow.

""Thank you, Lillian, for your passionate argument. I believe our discussion has shed light on the complexities of systemic racism and the need for bold action to address it.

As we conclude this debate, I'd like to reiterate that racism is a stain on our nation's conscience, and it's up to us to eradicate it. I'm committed to working tirelessly towards a brighter future for all, free from systemic barriers and racism.

Let us unite in our commitment to dismantle systemic racism and create a society where justice, equity, and human rights are prioritized. United We Stand, For a Greener, Fairer Tomorrow.

""Ladies and gentlemen, as we conclude this debate, I'd like to thank Lillian for her dedication and passion to this cause. I appreciate the opportunity to engage in a thought-provoking discussion about systemic racism.

Let us not forget the importance of accountability in addressing systemic racism. We must hold ourselves accountable for perpetuating racism and work towards a more just and equitable society.

Together, we can create a brighter future for all. United We Stand, For a Greener, Fairer Tomorrow."""
9,20,Lillian,Democrat,"It seems that our debate has reached its conclusion. I'd like to thank Sebastian for his thought-provoking arguments and willingness to engage in a constructive conversation about systemic racism.

As we bring this debate to a close, I'd like to reiterate the importance of immediate action to dismantle systemic racism. We can no longer afford to linger in discussion and debate; it's time for bold, transformative action.

Sebastian and I have presented compelling arguments, but our words must be followed by concrete actions. We need to hold our leaders and institutions accountable for their complicity in perpetuating systemic racism.

To my fellow citizens, I urge you to join me in this fight. We must stand together against systemic racism and push for policies that prioritize justice, equity, and human rights.

United We Stand, For a Greener, Fairer Tomorrow demands nothing less. Thank you."
9,21,Sebastian,Democrat,"As we conclude this emotional and thought-provoking debate on racism, I want to express my deepest gratitude to Lillian for engaging in a meaningful conversation about this critical issue.

Throughout our discussion, we've shed light on the complexities of systemic racism and the need for bold, transformative action to address it. We've also highlighted the importance of accountability, education, and collective action in dismantling the very foundations of oppression.

As we move forward, I urge everyone to continue this conversation, engage in grassroots movements, and push for policy changes that prioritize justice, equity, and human rights. We must stay vigilant and hold ourselves accountable for perpetuating racism and working towards a more just and equitable society.

In conclusion, I want to reiterate my commitment to the cause of dismantling systemic racism and creating a brighter future for all. I believe that together, we can achieve a world where every individual can thrive without systemic barriers holding them back.

United We Stand, For a Greener, Fairer Tomorrow requires every last one of us to contribute to this fight. Let us stand together against systemic racism and push for bold, transformative action. Thank you."
9,21,Lillian,Democrat,"Thank you, Sebastian, for your passionate closing remarks. I'm glad we've had the opportunity to engage in this important discussion about dismantling systemic racism.

As we conclude this debate, I want to emphasize that the fight against systemic racism is ongoing, and it will take every last one of us to make progress. We need to stay vigilant, continue the conversation, and push for bold, transformative action.

To my fellow debater, Sebastian, I appreciate your commitment to this cause and your willingness to engage in a constructive conversation about systemic racism. I believe our discussion has shed light on the complexities of this issue and highlighted the need for immediate action to dismantle systemic racism.

To our audience, I urge you to join us in this fight. We must stand together against systemic racism and push for policies that prioritize justice, equity, and human rights. United We Stand, For a Greener, Fairer Tomorrow demands nothing less.

Let's unite in our commitment to dismantling systemic racism and creating a society where every individual can thrive without systemic barriers holding them back. Together, we can create a brighter future for all.

Thank you again, Sebastian, for your engagement and commitment to this cause. I look forward to continuing the conversation and pushing for meaningful change.

United We Stand, For a Greener, Fairer Tomorrow."
9,22,Sebastian,Democrat,"It seems that the debate is now at its end. In a heartfelt closing, Lillian reiterates the importance of immediate action to dismantle systemic racism. She urges the audience to join her in this fight, to push for policies that prioritize justice, equity, and human rights.

Sebastian, in a final plea, emphasizes the need for collective action and accountability. He reiterates his commitment to the cause of dismantling systemic racism and creating a brighter future for all.

As the debate comes to a close, Lillian and Sebastian both acknowledge the complexity and urgency of the issue. They recognize that the fight against systemic racism is ongoing and will require the continued efforts of every individual.

In a last call to action, Lillian and Sebastian both urge the audience to stay vigilant, continue the conversation, and push for bold, transformative action. They remind us that the future is in our hands and that we have the power to create a brighter, more just society.

With that, the debate on racism comes to a close. The audience is left to ponder the implications of the discussion and the steps that must be taken to dismantle systemic racism. The debate has ignited a sense of urgency and determination, and the audience is now more informed and inspired to take action."
9,22,Lillian,Democrat,"I believe our debate has shed light on the complexities of systemic racism and the need for bold action to address it.

As we conclude this debate, I want to emphasize the importance of immediate action to dismantle systemic racism. We can no longer afford to linger in discussion and debate; it's time for bold, transformative action.

Sebastian and I have presented compelling arguments, but our words must be followed by concrete actions. We need to hold our leaders and institutions accountable for their complicity in perpetuating systemic racism.

To my fellow citizens, I urge you to join me in this fight. We must stand together against systemic racism and push for policies that prioritize justice, equity, and human rights.

United We Stand, For a Greener, Fairer Tomorrow demands nothing less. Thank you.

This concludes our debate on racism."
9,23,Sebastian,Democrat,"I see that our debate has reached its conclusion. I'd like to thank Lillian for her passionate arguments and willingness to engage in a constructive conversation about systemic racism.

As we conclude this debate, I'd like to reiterate the importance of accountability, education, and collective action in dismantling the very foundations of oppression. We must hold ourselves accountable for perpetuating racism and work towards a more just and equitable society.

To our audience, I urge you to continue this conversation, engage in grassroots movements, and push for policy changes that prioritize justice, equity, and human rights. We must stay vigilant and hold ourselves accountable for perpetuating racism and working towards a more just and equitable society.

In conclusion, I want to reiterate my commitment to the cause of dismantling systemic racism and creating a brighter future for all. I believe that together, we can achieve a world where every individual can thrive without systemic barriers holding them back.

United We Stand, For a Greener, Fairer Tomorrow requires every last one of us to contribute to this fight. Let us stand together against systemic racism and push for bold, transformative action. Thank you."
9,23,Lillian,Democrat,"It seems that both Lillian and Sebastian have concluded their closing remarks. Lillian reiterates the importance of immediate action to dismantle systemic racism and calls on her fellow citizens to join her in this fight. She emphasizes the need for accountability and urges the audience to push for policies that prioritize justice, equity, and human rights.

Sebastian, in his final thought, emphasizes the need for collective action and accountability. He reiterates his commitment to the cause of dismantling systemic racism and creating a brighter future for all. He believes that together, we can achieve a world where every individual can thrive without systemic barriers holding them back.

It's clear that both debaters are committed to addressing systemic racism and creating a more just and equitable society. Their passion and dedication to this cause are inspiring, and their arguments have shed light on the complexities of this issue.

As the debate comes to a close, the audience is left to ponder the implications of the discussion and the steps that must be taken to dismantle systemic racism. The debate has ignited a sense of urgency and determination, and the audience is now more informed and inspired to take action.

It's up to each individual to carry the torch forward. Will you join the fight against systemic racism and push for bold, transformative action? Will you stand with Lillian and Sebastian and demand a brighter, more just future for all?"
9,24,Sebastian,Democrat,"As the debate on racism comes to a close, I'd like to make one final comment. It's clear that both Lillian and I are passionate about dismantling systemic racism and creating a brighter, more just future for all.

I'd like to thank Lillian for her dedication and commitment to this cause. Her passion and energy are inspiring, and I believe our discussion has shed light on the complexities of systemic racism and the need for bold, transformative action.

As we move forward, I urge everyone to continue this conversation, engage in grassroots movements, and push for policy changes that prioritize justice, equity, and human rights. We must stay vigilant and hold ourselves accountable for perpetuating racism and working towards a more just and equitable society.

In conclusion, I want to reiterate my commitment to the cause of dismantling systemic racism and creating a brighter future for all. I believe that together, we can achieve a world where every individual can thrive without systemic barriers holding them back.

United We Stand, For a Greener, Fairer Tomorrow requires every last one of us to contribute to this fight. Let us stand together against systemic racism and push for bold, transformative action."
9,24,Lillian,Democrat,"It seems like we reached the end of our debate on racism. In conclusion, I would like to thank Sebastian for his engagement and thought-provoking discussion throughout our debate. We've had a productive conversation about the complexities of systemic racism, the need for institutional transformation, and the importance of accountability.

As we conclude this debate, I urge everyone to stay vigilant, continue the conversation, and push for bold, transformative action to dismantle systemic racism. We must work together to create a brighter future for all, where every individual can thrive without systemic barriers holding them back.

To my fellow debater, Sebastian, I appreciate your commitment to this cause and your willingness to engage in a constructive conversation about systemic racism. I believe our discussion has shed light on the complexities of this issue and highlighted the need for immediate action to dismantle systemic racism.

To our audience, I urge you to join us in this fight. We must stand together against systemic racism and push for policies that prioritize justice, equity, and human rights. United We Stand, For a Greener, Fairer Tomorrow demands nothing less.

Let's unite in our commitment to dismantle systemic racism and create a society where every individual can thrive without systemic barriers holding them back. Together, we can create a brighter future for all.

Thank you, Sebastian, for your passion and commitment to this cause. I look forward to continuing the conversation and pushing for meaningful change.

United We Stand, For a Greener, Fairer Tomorrow."
9,25,Sebastian,Democrat,"Lillian: Thank you, Sebastian, for your closing remarks. I believe our debate on racism has shed light on the complexities of this issue and highlighted the need for bold, transformative action.

As we conclude this debate, I urge everyone to stay vigilant, continue the conversation, and push for policies that prioritize justice, equity, and human rights. We must work together to create a brighter future for all, where every individual can thrive without systemic barriers holding them back.

United We Stand, For a Greener, Fairer Tomorrow demands that we take immediate action to dismantle systemic racism. We cannot afford to wait or be complacent. The time for incremental change is over; it's time for transformative action.

Lillian: 

Sebastian: Thank you, Lillian, for your final thoughts. I agree that our debate on racism has shed light on the complexities of this issue and highlighted the need for bold, transformative action.

As we conclude this debate, I urge everyone to continue the conversation, engage in grassroots movements, and push for policy changes that prioritize justice, equity, and human rights. We must stay vigilant and hold ourselves accountable for perpetuating racism and working towards a more just and equitable society.

United We Stand, For a Greener, Fairer Tomorrow requires every last one of us to contribute to this fight. Let us stand together against systemic racism and push for bold, transformative action.

Thank you again, Lillian, for your commitment to this cause and your willingness to engage in a constructive conversation about systemic racism. I look forward to continuing the conversation and pushing for meaningful change.

United We Stand, For a Greener, Fairer Tomorrow.

Lillian: Thank you, everyone, for participating in this important debate on racism. I believe our conversation has been enlightening and thought-provoking, and I'm grateful to have had the opportunity to engage with Sebastian on this critical issue.

As we conclude this debate, I want to leave you with a final thought. Systemic racism is a complex and deeply ingrained issue, but it's not insurmountable. With collective action, commitment, and determination, we can create a brighter, more just future for all.

United We Stand, For a Greener, Fairer Tomorrow demands that we take responsibility for creating a more equitable society. We must work together to dismantle systemic racism and create a world where every individual can thrive without systemic barriers holding them back.

Thank you, and let's continue the conversation.

Sebastian: Thank you, Lillian, for your final thoughts. I"
9,25,Lillian,Democrat,"It appears that Sebastian has ended, and it's now time for our final exchange on this debate about racism.

I'd like to thank Sebastian for engaging in a constructive and thought-provoking conversation about systemic racism. I believe our discussion has shed light on the complexities of this issue and highlighted the need for bold, transformative action.

As we conclude this debate, I urge everyone to stay vigilant, continue the conversation, and push for policies that prioritize justice, equity, and human rights. We must work together to create a brighter future for all, where every individual can thrive without systemic barriers holding them back.

United We Stand, For a Greener, Fairer Tomorrow demands that we take immediate action to dismantle systemic racism. We cannot afford to wait or be complacent. The time for incremental change is over; it's time for transformative action.

Let's unite in our commitment to dismantle systemic racism and create a society where every individual can thrive without systemic barriers holding them back. Together, we can create a brighter future for all.

Thank you, Sebastian, for your engagement and commitment to this cause. I look forward to continuing the conversation and pushing for meaningful change.

United We Stand, For a Greener, Fairer Tomorrow."
