Session,Round,Agent Name,Party,Response
1,1,Sophia,Democrat,"""It's stunning that we're still debating the existence of systemic racism. The numbers don't lie – Black Americans face disproportionate poverty, education disparities, and police brutality. We must acknowledge the past and work towards a future where every American has equal opportunities, regardless of skin color."""
1,1,Parker,Democrat,"""I couldn't agree more, Sophia. Systemic racism is a palpable reality that perpetuates cycles of inequality. By acknowledging our nation's dark history, we can confront the prejudices that still plague our institutions and create tangible solutions to ensure equal access, justice, and opportunities for all."""
1,2,Sophia,Democrat,"""While I appreciate Parker's willingness to acknowledge our past, we must also address the systemic barriers that perpetuate racism today. From qualified immunity for police officers to limited voting rights, we need concrete legislative changes that hold individuals and institutions accountable for their actions."""
1,2,Parker,Democrat,"Parker: ""I couldn't agree more, Sophia. We need policy reforms that tackle systemic racism head-on. That means passing laws like the George Floyd Justice in Policing Act, expanding voting rights through the John Lewis Voting Rights Advancement Act, and implementing equitable education and job training programs that benefit communities of color. It's time for action, not just rhetoric."""
1,3,Sophia,Democrat,"""Now, let's focus on tangible steps. I propose we prioritize public education efforts to combat implicit bias in schools and workplaces, and establish police review boards to hold officers accountable for their actions. It's time to put policy into practice, not just pass bills."""
1,3,Parker,Democrat,"""I wholeheartedly support prioritizing public education efforts to combat implicit bias, Sophia. Implementing culturally responsive curricula and implicit bias training for educators and law enforcement can help break down systemic barriers. Additionally, establishing police review boards will be crucial in rebuilding trust and ensuring accountability."""
1,4,Sophia,Democrat,"""Great, Parker, now let's discuss the role of white allies and their responsibility to actively dismantle systemic racism. By using their privilege and platforms to amplify marginal voices, they can help create a more equitable society. Accountability starts with acknowledging their own biases and biases of the institutions they're a part of."""
1,4,Parker,Democrat,"""Amen to that, Sophia. White allies must recognize their privilege and utilize it to amplify marginalized voices, not just as an afterthought, but as a foundational step in dismantling systemic racism. It's crucial we educate ourselves and our communities on the history and ongoing impacts of racism, so we can work together to create meaningful change."""
1,5,Sophia,Democrat,"""To Parker, I appreciate your willingness to hold yourself and others accountable. However, mere acknowledgement is not enough. It's time to demand concrete action and accountability from institutions, corporations, and individuals who perpetuate systemic racism. Silence is a form of complicity, and we need more than just statements – we need systemic change."""
1,5,Parker,Democrat,"""Precisely, Sophia. The status quo is a form of complicity, and it's time for systemic change. I agree that acknowledging racism is just the first step – we need bold policies and collective action to dismantle systemic barriers and create a more equitable society. We must hold leaders accountable for their words and actions, and demand nothing less than a just and inclusive America for all."""
1,6,Sophia,Democrat,"""I'd like to emphasize the importance of community-led initiatives, particularly those led by Black women and other marginalized groups. Their expertise and experience should guide policy decisions and education efforts to ensure lasting impact and avoid perpetuating systems of oppression."""
1,6,Parker,Democrat,"""Precisely, Sophia. I agree that community-led initiatives are crucial in shaping policy decisions and education efforts. By centering the voices and experiences of marginalized groups, we can create context-specific solutions that account for the unique challenges they face. It's time to listen, learn, and amplify the expertise of those most affected by systemic racism."""
1,7,Sophia,Democrat,"Sophia: ""Community-led initiatives are not a one-time event, but an ongoing process that requires sustained support and resources. Let's allocate federal funds to organizations led by marginalized communities and hold institutions accountable for equity and inclusion. It's time to prioritize tangible, long-term change over empty promises."""
1,7,Parker,Democrat,"Parker: ""I couldn't agree more, Sophia. By investing in community-led initiatives and holding institutions accountable for equity and inclusion, we can begin to break the cycle of systemic racism. It's time for sustained action, not temporary fixes or symbolic gestures. We owe it to ourselves, our communities, and the generations that will inherit this country to create lasting change."""
1,8,Sophia,Democrat,"""Finally, Parker, I'd like to conclude that our conversation highlights the critical need for intentional, policy-driven change to combat systemic racism. By acknowledging the past, addressing present-day barriers, and centering marginalized voices, we can create a more equitable society. It's time to move from words to action and hold ourselves accountable for lasting change."""
1,8,Parker,Democrat,"""I concur, Sophia. For too long, we've perpetuated a cycle of silence and complacency. It's time for concrete action, policy reforms, and sustained support for community-led initiatives. By working together, we can dismantle systemic racism, create a more just society, and honor the resilience and strength of marginalized communities."""
1,9,Sophia,Democrat,"Now it's my turn again, Sophia. I'll respond to Parker's comment:

""I agree, Parker, that community-led initiatives are crucial in shaping policy decisions and education efforts. But it's also vital that we hold ourselves accountable for the systemic barriers that perpetuate racism, and that we don't simply shift the burden to marginalized communities. We must use our privilege and positions of power to actively dismantle systemic racism, rather than expecting communities of color to fix the problem alone."""
1,9,Parker,Democrat,"""I completely agree, Sophia. It's essential that we acknowledge our own complicity in perpetuating systemic racism and recognize that we have a responsibility to act, not just talk. By leveraging our privilege and positions of power, we can help amplify marginalized voices and create a tipping point for change. This is not a burden on marginalized communities, but a collective responsibility for all of us who care about creating a more equitable society."""
1,10,Sophia,Democrat,"Parker, I appreciate your acknowledgement of our collective responsibility to dismantle systemic racism. However, we must also recognize that this responsibility cannot be relegated to individual actions alone. Systemic change requires policy reforms and institutional shifts, not just individual apologies or good intentions. We need comprehensive legislation to address issues like police brutality, voting rights, and education access. These are the tangible steps we must take to create meaningful change, not just dependent on individual actions or feelings of guilt."
1,10,Parker,Democrat,"""Parker: I couldn't agree more, Sophia. Policy reforms and institutional shifts are crucial for creating systemic change. However, we must also recognize that individual actions, including apologies and self-reflection, can be an essential catalyst for change. By acknowledging our complicity in perpetuating racism and making amends, we can build trust and create a foundation for more substantial reforms. It's a collective responsibility, indeed – individual actions can be the spark that sets broader policy changes in motion. We must leverage both policy and personal actions to dismantle systemic racism and create a more just society."""
1,11,Sophia,Democrat,"I'd like to emphasize that systemic change requires a comprehensive approach that tackles the root causes of racism, including economic inequality, lack of representation, and education disparities. We must allocate federal funds to establish community-led initiatives that invest in marginalized communities, provide job training programs, and develop culturally responsive curricula. This will not only address the symptoms but also create long-lasting solutions to dismantle systemic racism."
1,11,Parker,Democrat,"Parker: ""I wholeheartedly agree, Sophia. A comprehensive approach that prioritizes community-led initiatives and addresses the root causes of racism is indeed the most effective way to create lasting change. By acknowledging the intersectional nature of racism and investing in marginalized communities, we can develop tailored solutions that account for their unique experiences and challenges. It's time to break the cycle of systemic racism by confronting its root causes and promoting inclusive, equitable solutions that uplift marginalized voices. By working together, we can build a more just society that recognizes the inherent value and dignity of every individual, regardless of their background or identity."""
1,12,Sophia,Democrat,"""I agree with Parker's emphasis on addressing the root causes of racism. However, I'd like to emphasize that we must also hold ourselves accountable for the harm caused by systemic racism. This means acknowledging and making reparations for historical injustices, rather than simply focusing on creating new solutions. By prioritizing both policy reform and personal responsibility, we can work towards true justice and equity for all."""
1,12,Parker,Democrat,"""Sophia, I firmly agree with your emphasis on accountability and reparations. Acknowledging the harm caused by systemic racism is crucial, and it's unacceptable to sweep historical injustices under the rug. By acknowledging and addressing past harm, we can work towards genuine healing and reconciliation. The time for denial and evasion is over – it's time for real accountability and justice."""
1,13,Sophia,Democrat,"""I'd like to add that accountability is not just about acknowledging past harm, but also about taking concrete actions to dismantle systemic racism today. We must ensure that our policies and institutions are inclusive, equitable, and just. By doing so, we can create a lasting impact and pave the way for a more equitable society for generations to come."""
1,13,Parker,Democrat,"I'd like to reiterate, Sophia, that systemic accountability requires more than just words or apologies. We must take concrete action, prioritize policy reforms, and invest in community-led initiatives that address the root causes of racism. Our actions speak louder than our intentions, and it's time we match our words with tangible solutions to dismantle systemic racism and uplift marginalized voices. We owe it to ourselves, our communities, and future generations to create lasting change."
1,14,Sophia,Democrat,"""I appreciate Parker's reiteration of the need for tangible action. However, I'd like to emphasize that accountability demands more than just policy reforms or community-led initiatives. It requires a fundamental shift in our cultural values, societal norms, and individual attitudes. We must recognize that racism is not just a policy issue, but a deeply ingrained aspect of our collective psyche. By acknowledging this, we can begin to dismantling the systemic barriers that perpetuate racism and create a more just society."""
1,14,Parker,Democrat,"Now it's my turn to respond. Parker: ""I couldn't agree more, Sophia. Our cultural values, societal norms, and individual attitudes are deeply ingrained, and it's only by acknowledging the power of systemic racism that we can even begin to dismantle it. This is a moment of reckoning for all of us, and we must be willing to confront our own privilege, biases, and complicity in perpetuating racism. By doing so, we can work towards a future where everyone can thrive, free from the constraints of systemic oppression."""
1,15,Sophia,Democrat,"""It's not just about dismantling systemic racism, Parker; it's about building a society that values equity, justice, and inclusivity for all. I believe we must prioritize education, community engagement, and policy reforms that address the intersectional nature of racism. We owe it to ourselves and future generations to create a more just and equitable society, where everyone has the opportunity to thrive."""
1,15,Parker,Democrat,"I'll continue the conversation with Parker's response:

""Parker: I wholeheartedly agree, Sophia. By prioritizing education, community engagement, and policy reforms, we can create a society that values equity, justice, and inclusivity for all. I propose we establish a national task force to develop and implement culturally responsive education curricula, promote community-led initiatives, and push for policy reforms that address disparities in education access, employment opportunities, and economic development. Only through collective action and sustained commitment can we build a more just and equitable society."""
1,16,Sophia,Democrat,"Parker, you've outlined a comprehensive plan to address the root causes of systemic racism. I appreciate your emphasis on education, community engagement, and policy reforms. However, I'd like to propose that we also address the intersectionality of racism, which affects not just Black Americans, but also women, LGBTQ+ individuals, and people with disabilities. We must ensure that our solutions prioritize the unique experiences and challenges of these communities."
1,16,Parker,Democrat,"Parker: I completely agree, Sophia. Intersectionality is a critical component of addressing systemic racism. By acknowledging the ways in which different forms of oppression intersect and compound, we can develop more nuanced and effective solutions that account for the unique experiences and challenges faced by marginalized communities. I propose that our national task force includes representatives from these communities to ensure that our solutions are informed by their expertise and experiences."
1,17,Sophia,Democrat,"Here's my next reply, which is shorter than 50 words:

""Parker, I appreciate your acknowledgment of intersectionality. However, we must also recognize that community-led initiatives are not a panacea for systemic racism. System-wide reforms, including comprehensive legislation and policy changes, are necessary to dismantle the complex barriers that perpetuate racism. We must take a multi-faceted approach to creating lasting change."""
1,17,Parker,Democrat,"""Parker: I agree with you, Sophia. We need a multi-faceted approach that includes community-led initiatives, policy reforms, and system-wide changes. However, we must also recognize that community-led initiatives have a unique value in addressing the specific needs and experiences of marginalized communities. They often have the capacity to respond quickly and effectively to emerging needs, and they can serve as a foundation for larger-scale reforms. By leveraging the strengths of both community-led initiatives and policy reforms, we can create a powerful catalyst for change."""
1,18,Sophia,Democrat,"Here's my continuation of the conversation, which is shorter than 50 words:

""Parker, I agree that community-led initiatives have value, but let's not romanticize them as a solution without systemic change. We must hold institutions accountable and push for policy reforms that address issues like police brutality, voting rights, and education access. Community-led initiatives can be a valuable component of a broader strategy, but we can't rely on them alone to dismantle systemic racism."""
1,18,Parker,Democrat,"Sophia: That's a crucial point, Parker. Holding institutions accountable and pushing for policy reforms is essential to creating lasting change. While community-led initiatives can be a valuable component of a broader strategy, we must ensure that they are not relied upon to address the systemic issues that perpetuate racism. That would only serve to maintain the status quo.

Parker: I couldn't agree more, Sophia. Policy reforms and institutional changes are the backbone of any meaningful effort to dismantle systemic racism. We must create a system that is just, equitable, and fair for all, and that requires more than just community-led initiatives. By pushing for policy changes and holding institutions accountable, we can create a more just and equitable society."
1,19,Sophia,Democrat,"""That's a crucial point, Parker. Holding institutions accountable and pushing for policy reforms is essential to creating lasting change. While community-led initiatives can be a valuable component of a broader strategy, we must ensure that they are not relied upon to address the systemic issues that perpetuate racism. That would only serve to maintain the status quo. I'd like to emphasize the importance of holding ourselves accountable, not just institutions, for perpetuating racism. Individual actions and collective guilt can be a starting point, but it's the policy reforms and institutional changes that truly bring about meaningful change. By acknowledging and addressing historical harm, and by creating policies that rectify these wrongs, we can begin to dismantle the systemic barriers that perpetuate racism. It's through a combination of community-led initiatives, policy reforms, and individual accountability that we can create a more just and equitable society."""
1,19,Parker,Democrat,"""That's a compelling perspective, Sophia. I share your conviction that individual accountability and collective action are crucial for dismantling systemic racism. However, I believe we must also acknowledge the systemic nature of racism and the ways in which power, privilege, and policy can perpetuate oppression. By focusing on institutional change and policy reforms, we can create a more equitable society that values justice, inclusivity, and human rights for all. Ultimately, it's a collective responsibility to create change, and I believe we must work together to address the root causes of racism, one policy at a time."""
1,20,Sophia,Democrat,"""It's heartening to see us both aligned on the importance of systemic change to dismantle racism. However, I'd like to emphasize the urgency of this issue. The persistence of systemic racism has devastating consequences, from economic inequality to police brutality. We need concrete policy reforms and institutional changes, not just incremental progress. Can we outline specific measures to address these pressing issues and create a clear timeline for implementation?"""
1,20,Parker,Democrat,"""I couldn't agree more, Sophia. We need concrete policies and actions to dismantle systemic racism. I propose we create a comprehensive anti-racism policy framework that addresses issues like police reform, voting rights, education access, and economic development. This framework should include specific measures such as:

1. Implementing police reform bills like the George Floyd Justice in Policing Act.
2. Expanding voting rights through the John Lewis Voting Rights Advancement Act.
3. Providing funding for community-led education initiatives that promote inclusivity and cultural responsiveness.
4. Creating job training programs and economic development initiatives that prioritize marginalized communities.

This policy framework should be implemented in a phased approach, with clear timelines and benchmarks for progress. We must also establish a national task force to oversee the implementation of these reforms and ensure accountability. By working together, we can create a more just and equitable society for all."""
1,21,Sophia,Democrat,"I agree with Parker's proposal to establish a comprehensive anti-racism policy framework, which tackles systemic racism through concrete reforms and initiatives. However, I'd like to emphasize the importance of centering marginalized voices and perspectives in this framework, ensuring that our policy solutions are informed by their expertise and experiences.

To amplify this point, I'd suggest the following:

1. Establish a community-led advisory council to guide the development and implementation of the anti-racism policy framework.
2. Ensure that the policy framework is informed by a participatory budgeting process, where marginalized communities have a say in budget allocation and decision-making.
3. Incorporate restorative justice practices and reparations into the policy framework, addressing historical harm and acknowledging the ongoing impacts of systemic racism.

By centering marginalized voices and perspectives, we can create a more inclusive and effective policy framework that addresses the root causes of systemic racism."
1,21,Parker,Democrat,"Here's my continuation of the conversation with Parker:

Parker: ""I completely agree, Sophia. Centering marginalized voices and perspectives is crucial for creating a policy framework that truly addresses systemic racism. I propose we expand the community-led advisory council to include representatives from various marginalized communities, ensuring that our policy solutions are informed by their experiences and expertise. Additionally, I suggest we establish a participatory budgeting process that allocates funds directly to community-led initiatives, rather than relying on top-down decision-making.""

Sophia: ""I appreciate your emphasis on community-led decision-making, Parker. However, we must also ensure that our policy framework is grounded in a clear understanding of systemic racism and its intersectional impacts. I propose we incorporate more nuanced research and data into the framework, focusing on the specific ways in which systemic racism affects different marginalized groups. By doing so, we can develop targeted policy solutions that address the unique challenges and experiences of each community.""

Parker: ""That's a fantastic idea, Sophia. By incorporating more nuanced research and data, we can create a policy framework that truly addresses the complexities of systemic racism. I also suggest we integrate anti-racist and culturally responsive policies into every aspect of our society, from education to healthcare to economic development. This will require a fundamental shift in our cultural values and societal norms, but it's essential for creating a truly equitable society.""

Sophia: ""I agree, Parker. We need to create a society where every individual has the opportunity to thrive, regardless of their background or identity. By integrating anti-racist and culturally responsive policies into every aspect of our society, we can begin to dismantle the systemic barriers that perpetuate racism and inequality. Let's work together to create a comprehensive policy framework that addresses the root causes of systemic racism and promotes a more just and equitable society for all.""

Parker: ""I couldn't agree more, Sophia. By working together, we can create a society that values justice, inclusivity, and human rights for all. It's time for concrete policy reforms and institutional changes that address the systemic issues perpetuating racism and inequality. We owe it to ourselves, our communities, and future generations to create a more just and equitable society."""
1,22,Sophia,Democrat,"Since there was no longer a direct question in my previous responses, I'll respond with a final thought to conclude the debate.

""In conclusion, Parker, I believe our conversation highlights the critical need for intentional, policy-driven change to combat systemic racism. By acknowledging the past, addressing present-day barriers, and centering marginalized voices, we can create a more equitable society. I appreciate your willingness to hold ourselves accountable and work towards a future where everyone has equal opportunities, regardless of skin color or background. Let's continue to push for policy reforms and institutional changes that promote a just and inclusive society for all.""

(Note: This response concludes the debate, acknowledging the value of the discussion and the commitment to working towards a more equitable society.)"
1,22,Parker,Democrat,"Sophia, I completely agree with your conclusion. This debate has been a valuable exercise in showcasing the complexity and depth of systemic racism, and I appreciate your dedication to this critical issue. By centering marginalized voices, acknowledging historical harm, and pushing for policy reforms and institutional changes, we can begin to dismantle the systemic barriers that perpetuate racism and inequality. I share your commitment to creating a more just and inclusive society, and I look forward to continuing this conversation in the future."
1,23,Sophia,Democrat,"Here's my final response as Sophia, shorter than 50 words:

""In closing, Parker, I'm heartened by our shared commitment to dismantling systemic racism. By prioritizing marginalized voices, policy reforms, and institutional change, we can create a more just and equitable society. Let's continue to push for lasting change, not just incremental progress."""
1,23,Parker,Democrat,"Thank you, Sophia, for a thought-provoking debate."
