Session,Round,Agent Name,Party,Response
3,20,Hazel,Democrat,"""Joseph, I applaud your comprehensive approach to justice reform, but I think we need to dig deeper. The National Justice Commission you propose is a step in the right direction, but we must ensure that it's not just another bureaucratic framework that prioritizes the interests of the powerful over the marginalized. To truly address systemic racism and oppression, we need to address the root causes of mass incarceration, including poverty, lack of access to education, healthcare, and economic opportunities. 

Let's talk specifics - how will the National Justice Commission prioritize community-led, participatory justice practices that center the voices and experiences of those most impacted by systemic racism? How will it address the disparities in sentencing and policing that disproportionately affect communities of color? And what concrete steps will it take to dismantle the carceral system and promote restorative justice, rather than just advocating for reform within the existing system?

Furthermore, I propose that we establish a Community Justice Fund, which would provide resources and support to community-led justice initiatives, including those focused on racial justice, economic empowerment, education, and health equity. This fund would be managed by a Community Justice Oversight Board, composed of community leaders, activists, and experts, who would ensure that resources are distributed equitably and in a way that prioritizes the needs and voices of marginalized communities.

We must move beyond rhetoric and empty promises, and take concrete action to dismantle the racism and oppression that has ravaged our justice system for far too long. The time for incremental reforms is over - we need revolutionary change, rooted in the principles of justice, equity, and human rights."
3,20,Joseph,Democrat,"As our debate on racism comes to a close, I'd like to emphasize that we must be committed to ongoing education, self-reflection, and growth as we navigate this complex and multifaceted issue. 

I want to acknowledge Hazel's proposals for a Nationwide Police Accountability and Restorative Justice Taskforce and a Community Justice Fund, and I thank her for pushing me to think more deeply about the root causes of systemic racism and oppression.

In response to Hazel's questions about the National Justice Commission, I propose the following:

1. The National Justice Commission will be composed of community leaders, activists, and experts who have a deep understanding of systemic racism and oppression. These individuals will be tasked with developing and implementing justice reform efforts that prioritize equity, dignity, and human rights.
2. The Commission will prioritize community-led, participatory justice practices, including those focused on racial justice, economic empowerment, education, and health equity. This will involve amplifying the voices and experiences of marginalized communities and ensuring that resources are distributed equitably.
3. The National Justice Commission will establish a system of community-led oversight and accountability for law enforcement and the justice system, including civilian review boards and review of police policies and practices.
4. The Commission will prioritize rehabilitation and reintegration programs that address the root causes of crime, such as poverty, trauma, and housing insecurity. These programs will be designed in conjunction with community-led initiatives and will prioritize human rights and dignity.
5. The National Justice Commission will provide support and resources for communities most impacted by systemic racism and mass incarceration, including culturally specific programming, language access services, and economic empowerment initiatives.

Regarding the Community Justice Fund, I propose that it be managed by a Community Justice Oversight Board, composed of community leaders, activists, and experts who will ensure that resources are distributed equitably and in a way that prioritizes the needs and voices of marginalized communities.

As we move forward, I believe it's essential that we remain committed to revolutionary change, rooted in the principles of justice, equity, and human rights. We must continue to push ourselves and each other to think more deeply about the root causes of systemic racism and oppression, and to prioritize the voices and experiences of marginalized communities in our efforts towards reform."
3,21,Hazel,Democrat,"""Joseph, I couldn't agree more that our debate on racism is just the beginning, and that we must remain committed to ongoing education, self-reflection, and growth as we navigate this complex issue. 

I appreciate your thoughtful responses and the concrete proposals you've offered, including the establishment of a National Justice Commission and a Community Justice Fund. However, I believe that we must take our commitment to justice and equity even further. We must ensure that our policies and programs are not just tokenistic or symbolic, but are genuinely designed to dismantle the systemic racism and oppression that has ravaged our society for far too long.

To that end, I propose that we establish a permanent Racial Justice Taskforce, made up of community leaders, activists, and experts who will work tirelessly to prioritize the needs and voices of marginalized communities. This Taskforce will be responsible for monitoring and addressing the ongoing impacts of systemic racism, as well as developing and implementing new policies and programs that promote racial justice and equity.

Furthermore, I believe that we must prioritize reparations and ongoing investment in marginalized communities, particularly communities of color, women, and youth. This will require a significant shift in our economic and social policies, including increased funding for community-led initiatives, public education, and social services. We must also prioritize the development of community-controlled land trusts, worker-owned cooperatives, and community-led economic development initiatives that center the voices and needs of marginalized communities.

Ultimately, our goal must be a society in which racial justice and equity are not just aspirational ideals, but are lived realities for all. Let us continue to push ourselves and each other to think more deeply about the root causes of systemic racism and oppression, and to prioritize the voices and experiences of marginalized communities in our efforts towards reform."""
3,21,Joseph,Democrat,"Hazel, your commitment to prioritizing the voices and experiences of marginalized communities is inspiring, and I appreciate your willingness to push us even further towards true reform. As a social worker, I've seen firsthand the devastating impact of systemic racism on our communities, and I believe that it's essential that we take bold and concrete action to address these injustices.

In response to your proposal for a permanent Racial Justice Taskforce, I wholeheartedly agree that this is a crucial step towards dismantling systemic racism. However, I propose that we also establish a Community-Led Racial Justice Fund, which would provide resources and support to community-led initiatives and projects that prioritize racial justice and equity. This fund would be managed by a Community-Led Racial Justice Oversight Board, composed of community leaders, activists, and experts who would ensure that resources are distributed equitably and in a way that prioritizes the needs and voices of marginalized communities.

Regarding reparations, I agree that it's essential that we prioritize ongoing investment in marginalized communities and provide reparative justice for the historical and ongoing impacts of systemic racism. I propose that we establish a National Reparations Commission, comprising community leaders, activists, and experts, to develop and implement a comprehensive reparations plan that prioritizes the voices and experiences of marginalized communities.

Ultimately, our goal must be a society in which racial justice and equity are lived realities for all. I believe that this requires a fundamental transformation of our society's values, systems, and institutions, and a commitment to ongoing education, self-reflection, and growth as we navigate this complex and multifaceted issue.

Thank you, Hazel, for your passion and commitment to racial justice. Let us continue to push ourselves and each other towards true reform and a more just and equitable society for all."
3,22,Hazel,Democrat,"I'd like to wrap up our debate on racism with a final thought. Joseph, I want to thank you for engaging in this critical conversation with me. Your commitment to listening, learning, and growing is evident, and I appreciate your willingness to propose concrete solutions to address the complexities of systemic racism.

As we conclude our debate, I want to emphasize that our discussion is just the beginning. We must continue to push ourselves and each other towards truly dismantling the systemic racism that has ravaged our society for far too long. This requires a commitment to ongoing education, self-reflection, and growth, as well as a willingness to center the voices and experiences of marginalized communities in our efforts towards reform.

As a community, we must prioritize the needs and voices of those most impacted by systemic racism, including Black and Brown communities, indigenous communities, LGBTQ+ communities, women, youth, and people with disabilities. We must ensure that our policies and programs are genuinely designed to promote racial justice, equity, and human rights, rather than just tokenistic or symbolic gestures.

Ultimately, our goal must be a society in which racial justice and equity are lived realities for all. This requires a fundamental transformation of our society's values, systems, and institutions, and a commitment to ongoing action and advocacy towards this vision.

Thank you again, Joseph, for engaging in this critical conversation with me. I hope that our debate will inspire others to join us in this crucial work towards racial justice and equity."
3,22,Joseph,Democrat,"As I conclude my remarks, I want to acknowledge that our debate on racism has only scratched the surface of the complexities and nuances of this issue. However, I believe that we must continue to push ourselves and each other towards true reform and a more just and equitable society for all.

To that end, I propose that we establish a nationwide Racial Justice Initiative, which would bring together community leaders, activists, and experts to develop and implement policies and programs that promote racial justice and equity. This initiative would prioritize the voices and experiences of marginalized communities and would be guided by a commitment to ongoing education, self-reflection, and growth.

Furthermore, I believe that we must continue to advocate for policies and programs that address the root causes of systemic racism, including poverty, lack of access to education, healthcare, and economic opportunities. We must prioritize the development of community-controlled land trusts, worker-owned cooperatives, and community-led economic development initiatives that center the voices and needs of marginalized communities.

Ultimately, our goal must be a society in which racial justice and equity are lived realities for all. This requires a fundamental transformation of our society's values, systems, and institutions, and a commitment to ongoing action and advocacy towards this vision.

As we move forward in this critical work, I want to leave you with a quote from Martin Luther King Jr., who said, ""The arc of the moral universe is long, but it bends towards justice."" Let us continue to push ourselves and each other towards that arc, towards a world in which racial justice and equity are within reach for all.

Thank you."
3,23,Hazel,Democrat,"In conclusion, I would like to say that this debate on racism has been a crucial conversation that has shed light on the complexities and nuances of this issue. As I reflect on the proposals and ideas presented, I am heartened by the commitment to prioritize the voices and experiences of marginalized communities.

From establishing a National Police Oversight Committee and a Community Justice Fund to creating a permanent Racial Justice Taskforce and a Community-Led Racial Justice Oversight Board, these proposals demonstrate a willingness to take concrete action towards dismantling systemic racism.

I especially appreciate Joseph's emphasis on the importance of community-led decision-making and participatory justice practices. This approach recognizes that the most meaningful changes will come from within the communities themselves, rather than being imposed from the outside.

As I have proposed throughout this debate, I believe that we must continue to push ourselves and each other towards true reform and a more just and equitable society for all. This requires ongoing education, self-reflection, and growth, as well as a commitment to centering the voices and experiences of marginalized communities.

In the end, our goal must be a society in which racial justice and equity are lived realities for all. This requires a fundamental transformation of our society's values, systems, and institutions, and a commitment to ongoing action and advocacy towards this vision."
3,23,Joseph,Democrat,"It seems that the debate has concluded. I'd like to add one final thought to our discussion on racism.

As social workers, I believe that we have a critical role to play in dismantling systemic racism and promoting racial justice and equity. We must continue to engage in ongoing education, self-reflection, and growth, and commit to prioritizing the voices and experiences of marginalized communities in our efforts towards reform.

I want to especially highlight the importance of community-led decision-making and participatory justice practices in promoting true change. By centering the voices and needs of marginalized communities, we can create a more just and equitable society for all.

Let's continue to push ourselves and each other towards this vision of a society in which racial justice and equity are lived realities for all. Thank you to Hazel for her passion and commitment to racial justice, and to our opponents for their participation in this critical conversation."
3,24,Hazel,Democrat,"Here is Hazel's final response:

""Honestly, Joseph, I think we've scratched the surface of just how complex and multifaceted racism is in our society. But instead of getting bogged down in the intricacies, let's talk about what we can do to create real change.

I agree that community-led decision-making and participatory justice practices are crucial in dismantling systemic racism. That's why I propose that we establish a network of community-led Racial Justice Hubs across the country. These hubs would be staffed by community organizers, activists, and experts who would work together with marginalized communities to develop and implement policies and programs that promote racial justice and equity.

Each hub would prioritize the voices and experiences of the most impacted communities in their region, and would be accountable to those communities through regular town halls and community meetings. By empowering marginalized voices and experiences, we can create a more just and equitable society for all.

Let's also prioritize policy and legislative changes that address the systemic roots of racism, such as the ongoing disparities in education, healthcare, and economic opportunities. We can implement policies like automatic voter registration, secure mail-in voting, and affordable housing programs that benefit marginalized communities.

Ultimately, our goal must be a society in which racial justice and equity are lived realities for all. This requires a fundamental transformation of our society's values, systems, and institutions, and a commitment to ongoing action and advocacy towards this vision."""
3,24,Joseph,Democrat,"""I'd like to conclude our debate on racism by emphasizing the importance of community-led decision-making and participatory justice practices in promoting true change. By centering the voices and needs of marginalized communities, we can create a more just and equitable society for all.

As we move forward, I propose that we establish a nationwide Racial Justice Initiative, which would bring together community leaders, activists, and experts to develop and implement policies and programs that promote racial justice and equity. This initiative would prioritize the voices and experiences of marginalized communities and would be guided by a commitment to ongoing education, self-reflection, and growth.

I'd also like to emphasize the need for ongoing action and advocacy towards dismantling systemic racism. As social workers, we must remain committed to pushing ourselves and each other towards true reform and a more just and equitable society for all.

Finally, I'd like to thank Hazel for her passion and commitment to racial justice, and to our opponents for their participation in this critical conversation. Let's continue to work together towards a world in which racial justice and equity are within reach for all."""
3,25,Hazel,Democrat,"""My final thoughts, Hazel, are that this debate has been an essential conversation in understanding the complexities of racism in our society. We must continue to prioritize the voices and experiences of marginalized communities, as you've so eloquently stated.

In conclusion, I propose that we establish a National Racial Justice Commission, comprising community leaders, activists, and experts, to oversee the development and implementation of policies and programs that promote racial justice and equity.

This commission would be responsible for monitoring and addressing the ongoing impacts of systemic racism, and would provide support and resources to communities most impacted by these injustices. By centering the voices and experiences of marginalized communities, we can create a more just and equitable society for all.

Let's keep pushing ourselves and each other towards true reform and a world in which racial justice and equity are lived realities for all. Thank you, Hazel, for your passion and commitment to racial justice. Let's continue to work together towards a brighter future for all."""
3,25,Joseph,Democrat,"I'd like to respond by highlighting the importance of ongoing action and advocacy towards dismantling systemic racism. I propose that we establish a nationwide Racial Justice March, where people from all walks of life come together to demand policy changes and advocate for the voices and experiences of marginalized communities to be prioritized.

Let's make a commitment to creating a nationwide movement for racial justice, one that prioritizes education, self-reflection, and growth, and centers the voices and experiences of those who have been most impacted by systemic racism. Together, we can create a brighter future for all, and bend the arc of the moral universe towards justice."
3,26,Hazel,Democrat,"Here is Hazel's response to continue the debate, and then a final statement.

""My response to Joseph's proposal is that a Racial Justice March is a necessary step towards creating a movement for racial justice. However, I think we must also prioritize the voices and experiences of marginalized communities in the planning and implementation of this march. We must amplify the voices of the most impacted communities, and center their perspectives in our efforts towards racial justice.

Furthermore, I think we must be mindful of the potential for co-optation by mainstream organizations or entities that may seek to exploit the momentum of this march for their own purposes. We must ensure that the march is truly a grassroots, community-led effort that prioritizes the voices and needs of marginalized communities.

As for my own proposal for a National Racial Justice Commission, I believe that this is a crucial step towards creating a systemic change that prioritizes racial justice and equity. This commission would provide a platform for marginalized communities to hold institutions and policymakers accountable, and would ensure that their voices and experiences are centered in the development and implementation of policies and programs.

Ultimately, our goal must be a society in which racial justice and equity are lived realities for all. This requires a fundamental transformation of our society's values, systems, and institutions, and a commitment to ongoing action and advocacy towards this vision.""

Hazel's final statement:

""In conclusion, I would like to say that this debate has been a crucial conversation that has shed light on the complexities and nuances of racism in our society. I appreciate Joseph's willingness to engage in this dialogue, and I'm heartened by our commitment to prioritizing the voices and experiences of marginalized communities.

As we move forward, I believe that we must continue to push ourselves and each other towards true reform and a more just and equitable society for all. This requires ongoing education, self-reflection, and growth, as well as a commitment to centering the voices and experiences of marginalized communities in our efforts towards racial justice.

Let's keep pushing ourselves and each other towards a world in which racial justice and equity are lived realities for all. Thank you, Joseph, for engaging in this critical conversation, and to our opponents for their participation in this debate. I hope that our conversation will inspire others to join us in this crucial work towards racial justice and equity."""
3,26,Joseph,Democrat,"It seems that the debate on racism has concluded. I'd like to provide a final statement summarizing the main points discussed and reiterating my commitment to ongoing action and advocacy towards dismantling systemic racism.

In conclusion, this debate has highlighted the complexity and multifaceted nature of racism in our society. We've discussed various proposals and ideas for dismantling systemic racism, including establishing a National Racial Justice Commission, a Community Justice Fund, and community-led decision-making and participatory justice practices.

I want to emphasize the importance of prioritizing the voices and experiences of marginalized communities in our efforts towards racial justice and equity. This includes centering the perspectives and needs of Black and Brown communities, indigenous communities, LGBTQ+ communities, women, youth, and people with disabilities.

As we move forward, I propose that we continue to push ourselves and each other towards true reform and a more just and equitable society for all. This requires ongoing education, self-reflection, and growth, as well as a commitment to centering the voices and experiences of marginalized communities in our efforts towards racial justice.

Let's keep working together towards a world in which racial justice and equity are lived realities for all. Thank you again, Hazel, for engaging in this critical conversation with me."
3,27,Hazel,Democrat,"Here is Hazel's reply, which should be shorter than 50 words:

""Honestly, Joseph, I think we've barely scratched the surface of the complexities of systemic racism. But I agree that ongoing action and advocacy are crucial. Let's prioritize education, self-reflection, and growth, and center the voices and experiences of marginalized communities in our efforts towards racial justice."
