Session,Round,Agent Name,Party,Response
22,30,Aria,Democrat,"""I couldn't agree more, Violet. A national movement to dismantle systemic racism is a crucial step in creating a more just and equitable society. I'm honored to be part of this movement and to stand alongside you in demanding justice and equality for all.

Let's continue to build on the momentum we've created with our joint statement and take this message to the world. Together, we can break down barriers, challenge systemic racism, and build a world where everyone has an equal chance to succeed, regardless of their background.

Thank you, Violet, for your partnership and commitment to this cause. I'm grateful to be working alongside you to make our vision a reality.

Let's stand together in solidarity and keep pushing forward with courage, hope, and determination. Together, we can create a brighter future for all.

As we conclude our conversation, I want to leave you with a quote from Martin Luther King Jr.: 'The arc of the moral universe is long, but it bends towards justice.' Let's keep pushing forward, Violet, and continue to bend that arc towards a more just and equitable society for all.

Thank you again for an inspiring conversation, Violet. I look forward to continuing our work together to make our vision a reality.""

""Violet, I want to thank you for your dedication and commitment to dismantling systemic racism. I'm honored to be part of this movement and to stand alongside you in demanding justice and equality for all.

Let's continue to listen to and amplify the voices of marginalized communities, particularly those who have been historically silenced and excluded from decision-making processes. We must prioritize education, mobilization, and community building, and continue to challenge dominant narratives.

Together, we can break down barriers, challenge systemic racism, and build a world where everyone has an equal chance to succeed. Let's keep pushing forward with courage, hope, and determination, and never give up on our quest for a more perfect union.

Thank you, Violet, for your partnership and commitment to this cause. I'm grateful to be working alongside you to make our vision a reality.""

""I couldn't agree more, Violet. Our joint statement is a powerful call to action, and I'm excited to see the impact it will have on our movement. Let's continue to build on this momentum and push forward with courage, hope, and determination.

As we move forward, I propose we establish a national movement to dismantle systemic racism, with a clear plan of action and a commitment to continued education and mobilization. Let's use this movement to challenge dominant narratives, amplify the"
