Session,Round,Agent Name,Party,Response
19,1,Maya,Democrat,"""I believe systemic racism is a deeply ingrained issue in our society, perpetuated by policies and practices that disadvantage communities of color. We must actively work to dismantle these systems, address implicit bias, and provide resources for marginalized communities to empower them to reclaim their own futures."""
19,1,Miles,Democrat,"""I wholeheartedly agree, Maya. Systemic racism is alive and well in our nation. The data on disparities in education, employment, and healthcare is staggering. Only through acknowledging and dismantling these systems can we begin to create a more equitable society, where every individual has access to the same opportunities and dignity."""
19,2,Maya,Democrat,"""I also think it's essential to recognize the role of silence and inaction in allowing systemic racism to persist. We must encourage ongoing difficult conversations, hold institutions accountable, and center the voices and experiences of people of color to create meaningful change and dismantle the structures that have oppressed them for far too long."""
19,2,Miles,Democrat,"""I think that's spot on, Maya. Silence and inaction have allowed racism to fester for centuries. It's time for us to take a clear stand, not just against racism, but also for justice and equality. We must create an atmosphere where marginalized voices can be heard, amplified, and supported in their fight for a more just society."""
19,3,Maya,Democrat,"""I'd like to emphasize the importance of reparations, especially for African Americans, as a tangible step towards addressing the historical intergenerational trauma and inequality stemming from slavery and Jim Crow laws. How do you think we can make reparations a reality?"""
19,3,Miles,Democrat,"""Maya, I couldn't agree more on the need for reparations. Direct cash grants, education and job training programs, and investments in underserved communities could be steps towards healing the wounds of slavery and segregation. We must also have a national conversation about compensation for the stolen labor, land, and wealth of enslaved people and their descendants."""
19,4,Maya,Democrat,"""That's exactly right, Miles. Reparations are not just about financial compensation, but also about acknowledging the tangible ways in which systemic racism has extracted wealth and opportunity from communities of color. We must also account for the intangible harm caused by centuries of oppression and begin the process of healing and reconciliation."""
19,4,Miles,Democrat,"""I think a critical aspect of reparations, Maya, is not just providing one-time financial assistance, but also ensuring ongoing investment in communities of color, particularly through culturally responsive education, healthcare, and economic development initiatives. This way, we can begin to break the cycle of poverty and systemic disinvestment that's plagued these communities for far too long."""
19,5,Maya,Democrat,"Maya: ""I agree, Miles, and it's crucial we address the root causes of systemic racism, not just its symptoms. We must implement policies that ensure equitable access to resources, education, and economic opportunities, and hold institutions accountable for perpetuating these disparities. Reparations can be a powerful step towards reversing the harm caused by centuries of systemic racism."""
19,5,Miles,Democrat,"Miles: ""I think we've hit upon a critical truth, Maya - that reparations are a means to an end, not an end in itself. By acknowledging the historical injustices and actively working to dismantle systemic racism, we can create a system where everyone has access to the same resources and opportunities. That's the real reparations we need: a society where every person is seen, heard, and valued."""
19,6,Maya,Democrat,"""I'd like to expand on Miles' point, regarding ongoing investment in communities of color. I believe it's essential to prioritize restorative policies that address the root causes of systemic racism, such as police reform and voter suppression regulations. We must also commit to long-term support for marginalized communities through affordable housing initiatives, mental health services, and education funding."""
19,6,Miles,Democrat,"Maya: ""That's an outstanding approach, Miles. Investing in systemic change and ongoing support for marginalized communities can help to build sustainable progress and break the cycle of poverty and disinvestment. We must also acknowledge the intersectionality of racism, acknowledging how racism intersects with other forms of oppression, such as sexism, homophobia, and transphobia, to create a more comprehensive solution.""
Miles: ""I wholeheartedly agree, Maya. Intersectionality is crucial in understanding the complexity of systemic racism. We must incorporate a nuanced understanding of how racism and other forms of oppression intersect and compound, to develop inclusive and effective solutions that uplift the most marginalized voices."""
19,7,Maya,Democrat,"""Furthermore, I think it's essential to acknowledge that the legacy of slavery and Jim Crow laws still influences contemporary institutions, such as our courts and law enforcement agencies. We need to address the systemic issues that lead to racial profiling, mass incarceration, and voter suppression. This requires a commitment to policy reform, increased funding for education and job training, and a nationwide effort to dismantle systemic racism in all its forms."""
19,7,Miles,Democrat,"""I couldn't agree more, Maya. It's not just about dismantling systems, but also about confronting the historical and ongoing impact of centuries-long oppression. We must address the pipeline-to-prison problem, the lack of representation in government, and the unequal distribution of resources that perpetuates racial disparities. By doing so, we can create a truly just society, where every individual has the opportunity to thrive and reach their full potential."""
19,8,Maya,Democrat,"Maya: ""I'd like to highlight the importance of education and critical thinking in combating systemic racism. We must prioritize culturally responsive education and teacher training to ensure that our children are learning a nuanced and accurate understanding of American history and the ongoing effects of racism. This will equip them with the critical thinking skills to dismantle racist systems and promote empathy and equity."""
19,8,Miles,Democrat,"""I agree, Maya. We must re-examine our education system and ensure that it promotes critical thinking, empathy, and cultural understanding. By doing so, we can break the cycle of misinformation and racial stereotypes that have been perpetuated for far too long. It's time for a fundamentally new approach to education that prioritizes the values of equity, justice, and human dignity."""
19,9,Maya,Democrat,"Maya: ""Miles, I appreciate your emphasis on education and critical thinking in dismantling systemic racism. However, I'd like to take it a step further. We must also create a society where education is a fundamental right, accessible to all, regardless of zip code, income level, or immigration status. This means allocating more funding to public schools, prioritizing teacher diversity, and implementing policies that ensure equal access to quality education for all."""
19,9,Miles,Democrat,"""I couldn't agree more, Maya. Education as a fundamental right is crucial in dismantling systemic racism. Every child deserves access to quality education, regardless of their zip code or financial background. By prioritizing education and holding institutions accountable, we can begin to level the playing field and create a more just and equitable society. We must also acknowledge the historical and ongoing inequities in education and make targeted investments in communities of color to address these disparities."""
19,10,Maya,Democrat,"Maya:  ""Miles, I believe it's crucial to examine the ways in which our economic systems perpetuate systemic racism and further entrench disparities. We must implement policies such as progressive taxation, worker-owned cooperatives, and community land trusts to empower marginalized communities and challenge the existing power structures that maintain these inequalities. By doing so, we can begin to dismantle the systemic barriers that prevent people of color from accessing wealth and opportunities."""
19,10,Miles,Democrat,"""That's a powerful analysis, Maya. I think we can also draw attention to the way in which corporations and wealthy elites often exploit and benefit from systemic racism. Holding them accountable and implementing policies to address their complicity in perpetuating racial disparities is crucial to creating a more equitable society. It's time to redefine what we mean by 'economic growth' and prioritize true prosperity for all, not just the privilege few."""
19,11,Maya,Democrat,"Maya: ""In conclusion, dismantling systemic racism requires a multifaceted approach that addresses the root causes of these disparities, acknowledges the intergenerational trauma inflicted on communities of color, and centers the voices and experiences of those most affected. It's time for our nation to take concrete steps towards reparations, educational investments, and economic empowerment, and to create a society where every individual has access to equal resources, opportunities, and dignity."""
19,11,Miles,Democrat,"Maya: ""I believe systemic racism is a deeply ingrained issue in our society, perpetuated by policies and practices that disadvantage communities of color. We must actively work to dismantle these systems, address implicit bias, and provide resources for marginalized communities to empower them to reclaim their own futures.""

Miles: ""I wholeheartedly agree, Maya. Systemic racism is alive and well in our nation. The data on disparities in education, employment, and healthcare is staggering. Only through acknowledging and dismantling these systems can we begin to create a more equitable society, where every individual has access to the same opportunities and dignity."""
19,12,Maya,Democrat,"Maya:  ""With regard to reparations, I also want to emphasize that it's crucial to engage in a national conversation about the various forms that reparations can take. This includes not only financial compensation, but also investments in education, job training, and community development initiatives. We must ensure that any reparations package is carefully crafted and implemented in a way that is equitable, sustainable, and responsive to the diverse needs of communities of color.""

I pause, taking a moment to gather my thoughts before continuing. ""Moreover, I think it's essential to recognize that reparations are not a one-time fix, but rather a long-term process of healing and reconciliation. We must commit to ongoing support and investment in communities of color, and be willing to adapt and evolve our strategies as we move forward."""
19,12,Miles,Democrat,"""I'd like to add, Maya, that ongoing support for marginalized communities is not just about providing resources, but also about centering their voices and perspectives in the decision-making process. This means amplifying the leadership of people of color, listening to their experiences and concerns, and incorporating their insights into our policies and practices. By doing so, we can ensure that our efforts to dismantle systemic racism are authentic, effective, and truly serve the needs of those most affected."""
19,13,Maya,Democrat,"""I couldn't agree more, Miles. Centering the voices and perspectives of people of color is crucial in dismantling systemic racism. By doing so, we can ensure that our efforts are guided by a deep understanding of the historical and ongoing impacts of racism, and that we're working towards solutions that truly address the needs and experiences of marginalized communities.

In conclusion, I believe that dismantling systemic racism requires a commitment to ongoing education, advocacy, and support for marginalized communities. It's not a single issue that we can tackle through a one-time solution, but rather a multifaceted challenge that requires sustained effort and collective action. By working together and centering the voices of people of color, we can create a more just and equitable society for all."""
19,13,Miles,Democrat,"""Systemic racism is a cancer that has infected every aspect of our society, from education to employment to healthcare. To truly dismantle it, we must confront the historical and ongoing harm it has inflicted on communities of color and take concrete steps towards reparations, education, and economic empowerment. It's time for us to acknowledge the power of our own privilege and bias, and to use our privilege to amplify the voices and experiences of those most affected. Only through this kind of collective action can we create a society where every individual has access to equal resources, opportunities, and dignity."""
19,14,Maya,Democrat,"""I wholeheartedly agree with Miles, that collective action is crucial in dismantling systemic racism. But, I'd like to emphasize that we must also address the intersection of racism with other forms of oppression such as sexism, homophobia, and transphobia. We must create a society where every individual, regardless of their identity, can live with dignity and equality. Furthermore, we must prioritize education, restorative justice, and economic empowerment to uplift marginalized communities and create a more just society for all."""
19,14,Miles,Democrat,"Maya: That's exactly what I've been trying to convey, Miles. We need to address the intersectionality of racism and other forms of oppression to truly dismantle systemic racism.

Miles: Absolutely, Maya. It's time for us to move beyond the incremental steps and incremental policies that have failed to address the scope of this problem. We need bold, transformative action that challenges the very foundations of systemic racism and perpetuates a new era of justice and equality.

Maya: I couldn't agree more, Miles. We must be willing to confront the institutions that perpetuate systemic racism and dismantling the systems that have entrenched racism for far too long.

Miles: Yes! We need to challenge the power structures that maintain these inequalities and bring to light the deep-rooted racial injustices that exist in our society.

Maya: And, Miles, it's essential to acknowledge the immense historical burden of centuries of systemic racism that has been imposed on Black Americans. That historical trauma should be taken into account when discussing reparations.

Miles: I agree, and that historical debt should be acknowledged and addressed through the reparations package we're discussing. We need to see that reparations aren't a handout; they're a form of compensation for centuries of unpaid labor, confiscated land, and systemic marginalization."
19,15,Maya,Democrat,"I agree that reparations should be a comprehensive package that addresses the historical and ongoing intergenerational trauma inflicted on Black Americans. This could include direct cash grants, education and job training programs, investments in underserved communities, and other forms of support that aim to address the wealth deficit and other economic disparities that have resulted from systemic racism."
19,15,Miles,Democrat,"""Maya, I think we're missing a crucial aspect - the role of economic growth in perpetuating systemic racism. If we don't address the ways in which corporate interests and wealthy elites exploit racial disparities, we'll continue to see the same patterns of oppression. We must prioritize policies that challenge these power structures and promote true prosperity for all, not just the privileged few. That means dismantling systems of wealth concentration, addressing tax evasion, and promoting inclusive economic development that benefits marginalized communities."""
19,16,Maya,Democrat,"""Thank you, Miles, for highlighting the critical role of economic growth in perpetuating systemic racism. I wholeheartedly agree that we must address the ways in which corporate interests and wealthy elites exploit racial disparities. We need policies that challenge these power structures and promote true prosperity for all, not just the privileged few.

As I see it, we must commit to progressive taxation, worker-owned cooperatives, and community land trusts to empower marginalized communities and challenge the existing power structures that maintain these inequalities. By prioritizing inclusive economic development and ensuring that the benefits of growth are equitably distributed, we can begin to dismantle the systemic barriers that prevent people of color from accessing wealth and opportunities.

I'd like to emphasize the importance of education and critical thinking in combating systemic racism. We must prioritize culturally responsive education and teacher training to ensure that our children are learning a nuanced and accurate understanding of American history and the ongoing effects of racism. This will equip them with the critical thinking skills to dismantle racist systems and promote empathy and equity.

Furthermore, I believe it's essential to center the voices and perspectives of people of color in the decision-making process. This means amplifying the leadership of people of color, listening to their experiences and concerns, and incorporating their insights into our policies and practices. By doing so, we can ensure that our efforts to dismantle systemic racism are authentic, effective, and truly serve the needs of those most affected.

In conclusion, Miles, I believe that dismantling systemic racism requires a multifaceted approach that addresses the root causes of these disparities, acknowledges the intergenerational trauma inflicted on communities of color, and centers the voices and experiences of those most affected. It's time for our nation to take concrete steps towards reparations, education, economic empowerment, and true economic growth that benefits all, not just the privileged few."""
19,16,Miles,Democrat,"""I wholeheartedly agree, Maya. Systemic racism is a complex issue that requires a comprehensive approach to dismantle. We must prioritize education, critical thinking, and advocacy to equip marginalized communities with the tools to reclaim their own futures. It's time for our nation to commit to ongoing support and investment in these communities, amplifying their voices and perspectives in decision-making processes.

Furthermore, I'd like to emphasize the importance of restorative justice, not just for individuals, but also for communities. We must create a societal framework that values healing, repair, and accountability over punishment and retribution. By doing so, we can foster a culture of understanding, empathy, and compassion.

In terms of reparations, I believe a national conversation is necessary, but it should be paired with concrete, tangible actions. This includes educational investments, job training programs, community development initiatives, and tangible compensation for the historical harm inflicted on communities of color.

Moreover, we must address the intersectionality of racism with other forms of oppression, such as sexism, homophobia, and transphobia. Only by tackling these interconnected issues can we create a truly inclusive and equitable society.

In conclusion, Maya, dismantling systemic racism requires collective action, nuanced understanding, and a commitment to ongoing education, advocacy, and support for marginalized communities. It's time for us to join forces, challenge the existing power structures, and create a society that values justice, equality, and human dignity for all."""
19,17,Maya,Democrat,"Maya: ""As I see it, Miles, dismantling systemic racism requires a commitment to ongoing education, restorative justice, and economic empowerment. It's time for our nation to prioritize policies that challenge the existing power structures that maintain these inequalities, such as progressive taxation, worker-owned cooperatives, and community land trusts.

Moreover, I believe we must center the voices and perspectives of people of color in the decision-making process. This means amplifying the leadership of people of color, listening to their experiences and concerns, and incorporating their insights into our policies and practices.

In conclusion, dismantling systemic racism is a complex issue that requires a comprehensive approach, but I believe we can create a more just and equitable society for all by taking concrete steps towards reparations, education, economic empowerment, and true economic growth that benefits all, not just the privileged few.""

Miles: ""I couldn't agree more, Maya. Systemic racism is a cancer that has infected every aspect of our society, from education to employment to healthcare. It's time for us to acknowledge the power of our own privilege and bias, and to use our privilege to amplify the voices and experiences of those most affected.

We need to create a society where every individual has access to equal resources, opportunities, and dignity. This requires a fundamental shift in our values, our institutions, and our policies.

In conclusion, Maya, dismantling systemic racism requires collective action, nuanced understanding, and a commitment to ongoing education, advocacy, and support for marginalized communities. It's time for us to join forces, challenge the existing power structures, and create a society that values justice, equality, and human dignity for all."""
19,17,Miles,Democrat,"Thank you, Maya, for a thoughtful and engaging discussion on the complex issue of systemic racism. I believe we've shed light on the critical need for collective action, nuanced understanding, and a commitment to ongoing education, advocacy, and support for marginalized communities.

As we close this conversation, I'd like to emphasize the importance of tangible, concrete actions to dismantle systemic racism. This includes reparations, education, economic empowerment, restorative justice, and policies that challenge existing power structures.

Systemic racism is a multifaceted issue that requires a comprehensive approach. We must address the historical and ongoing harm inflicted on communities of color, prioritize education and critical thinking, and center the voices and perspectives of people of color in the decision-making process.

In conclusion, I believe that dismantling systemic racism requires a fundamental shift in our values, institutions, and policies. It's time for our nation to come together, challenge existing power structures, and create a society that values justice, equality, and human dignity for all.

Thank you again, Maya, for this thought-provoking conversation. I'm hopeful that our discussion will inspire others to join the fight against systemic racism and work towards a more just and equitable society for all."
19,18,Maya,Democrat,"The role of silence and inaction has enabled systemic racism to persist for centuries. We must engage in ongoing difficult conversations, hold institutions accountable, and center the voices and experiences of people of color. By doing so, we can create meaningful change and dismantle the structures that have oppressed them for far too long. 

It is essential that we acknowledge the intergenerational trauma inflicted on communities of color, and address this historical harm in our policies and practices. This includes reparations, education, and economic empowerment. Centering the voices of people of color is crucial in dismantling systemic racism. 

Furthermore, I believe it's time for our nation to take concrete steps towards reparations, education, economic empowerment, and true economic growth that benefits all, not just the privileged few. We must prioritize policies that challenge existing power structures and promote inclusive economic development that benefits marginalized communities.

To create a society where every individual has access to equal resources, opportunities, and dignity, we must work together. It's time for us to join forces, challenge existing power structures, and create a society that values justice, equality, and human dignity for all."
19,18,Miles,Democrat,"Maya, I'm so glad we could have this conversation. I think we've made it clear that dismantling systemic racism requires a multifaceted approach, involving education, advocacy, and collective action. It's time for our nation to acknowledge the harm done and take concrete steps towards reparations, education, economic empowerment, and restorative justice.

I also want to reiterate that centering the voices and perspectives of people of color is crucial in dismantling systemic racism. We must amplify the leadership of people of color, listen to their experiences and concerns, and incorporate their insights into our policies and practices.

In the words of Martin Luther King Jr., ""The arc of the moral universe is long, but it bends towards justice."" Let's continue to push for justice, equity, and human dignity for all."
