Session,Round,Agent Name,Party,Response
24,1,Hazel,Republican,"""Let's focus on the progress we've made, not dwelling on past mistakes. We've come a long way since the Civil Rights Act. We need to move forward, not wallow in guilt and negativity. We can celebrate our diversity and unity as a nation, without revisiting old ghosts."""
24,1,Ethan,Republican,"""With all due respect, Hazel, just because we've made progress doesn't mean we've arrived. I reject the idea that people are not working hard to overcome adversity due to systemic racism. Personal responsibility, not handouts or guilt trips, is the key to success in this great nation of ours."""
24,2,Hazel,Republican,"""Exactly, Ethan. Personal responsibility is what has always driven America's greatness. We must support those who strive, not hold back by assigning collective blame. By empowering individuals, not groups, we can truly move forward and create a level playing field for all to succeed."""
24,2,Ethan,Republican,"Hazel may believe that empowering individuals, not groups, will solve everything, but don't you think that's overlooking the obvious barriers that many people face, Ethan?"
24,3,Hazel,Republican,"""Barriers, you call them, Ethan? I see them as stepping stones. America's the land of opportunity; anyone can overcome obstacles with hard work and determination. The real obstacle is the entitled mindset that expects victimhood status rather than embracing personal freedom and self-improvement."""
24,3,Ethan,Republican,"Ethan: ""I think we're confusing the issue, Hazel. You're equating hard work with not struggling at all. The truth is, many people face legitimate challenges due to systemic barriers. Let's acknowledge that and work on creating opportunities, not just telling people to 'pull themselves up by their bootstraps.'"""
24,4,Hazel,Republican,"""Ethan, we're not confusing the issue; you're confusing the concept of freedom. America's meritocratic system rewards hard work and resilience, not handouts or excuses. Acknowledging'systemic barriers' is just a euphemism for collective guilt. We should lift each other up by example, not through government intervention."""
24,4,Ethan,Republican,"""My point exactly, Hazel, we should be lifting each other up, not relying on government crutches. Personal initiative and entrepreneurship can overcome systemic hurdles. America's proven it time and time again – we just need to trust individuals, not bureaucratic solutions, to fix our society."""
24,5,Hazel,Republican,"""A bureaucratic solution is exactly what we'll get if we don't trust the free market and individual initiative. Government programs only perpetuate dependency, not freedom. Let's keep America great by promoting personal responsibility, not handing out more government handouts."""
24,5,Ethan,Republican,"Hazel seems to be missing the point here, I think we can both agree that we've made significant progress as a nation, but to say that racism isn't a factor in the lives of many Americans is naive. I've seen it firsthand – talented individuals, just trying to succeed, held back by bias and prejudice. We need to acknowledge that reality and find practical solutions, not just ideology-driven fixes."
24,6,Hazel,Republican,"""Aside from your anecdotal evidence, Ethan, what evidence do you have that systemic racism is widespread and hindering success? Empirical data and academic research, or just personal opinions? Let's fact-check this notion, rather than accepting it at face value."""
24,6,Ethan,Republican,"""Evidence? I've got my own eyes, Hazel. I've seen people get passed over for promotions, or struggle to get a fair shot because of their skin color. I've read countless stories of discrimination and bias in America. Just because you don't see it, doesn't mean it's not there. We need to believe the people affected, not just some ivory tower studies."""
24,7,Hazel,Republican,"""Hold on a minute, Ethan, I'm not saying racism doesn't exist at all; I'm saying it's not as pervasive as you're making it out to be. We've come a long way since Jim Crow and segregation. If personal anecdotes and emotional appeals are all we have, then we're just trading in myth for fact and facts are what drive our policies in a free society. Let's focus on data-driven solutions, not emotional manipulation."""
24,7,Ethan,Republican,"""I don't think we're debating facts, Hazel, but perspectives. You want to rely on data and studies, but how about considering the lived experiences of millions of Americans? People who face real, every-day obstacles because of their skin color. I'm not asking for handouts or special treatment, just a level playing field where everyone has an equal shot at the American dream. We can't dismiss the struggles of others just because they don't fit our preconceived notions."""
24,8,Hazel,Republican,"""I've listened to your stories, Ethan, but I still say we can't define the success of a nation by individual anecdotes. What about the vast majority of Americans who aren't experiencing these supposed systemic barriers? Don't their stories count? We're at a fork in the road here: we can either focus on the alleged victims or the thriving masses who prove that America's meritocratic system truly works."""
24,8,Ethan,Republican,"""Hazel, I think you're mistaking a trend for a norm. There are countless examples of people of color succeeding despite, rather than because of, systemic racism. What about Tim Kennedy, a decorated black Marine, or Angela Gomes, a first-generation Brazilian-American Congresswoman? Their stories illustrate the resilience of the American spirit. We shouldn't dismiss their experiences as anomalies, but rather, we should celebrate them as testaments to America's enduring promise: equal opportunity for all."""
24,9,Hazel,Republican,"""Hold on, Ethan, those are just anecdotes too. You can't define an entire system by cherry-picking a few success stories. We need to consider the aggregate data, not individual exceptions. I'm not dismissing the struggles of others, but I'm saying we should focus on widespread solutions, not targeted handouts. Personal freedom, not government favors, is what has always driven America's greatness."""
24,9,Ethan,Republican,Hazel's selective focus on data and success stories overlooks the harsh reality faced by many marginalized communities. We can't define a system solely by its peaks or outliers. The American Dream's cracks are evident everywhere – not just in the exceptions.
24,10,Hazel,Republican,"""I think we're at an impasse, Ethan, and it's clear we have differing views on the issue. I still stand by America's meritocratic system as the key to our greatness. While I acknowledge individual struggles, I firmly believe that collective, systemic racism is exaggerated and overstated. Our focus should remain on empowering individuals and unleashing the true potential of our nation."""
24,10,Ethan,Republican,"""I think we can agree on one thing, Hazel - there are indeed many individuals who've overcome incredible obstacles to achieve great things. However, to say those successes disprove the existence of systemic barriers is naive. What about the countless others who are stuck in a cycle of poverty and inequality? We can't ignore the struggles of our fellow Americans just because they don't fit into our ideal narrative. It's time to acknowledge the harsh realities and work towards true equality, not just for the few, but for the many."""
24,11,Hazel,Republican,"""We've said our piece, Ethan. It's clear we have different views, and it's time to agree to disagree. But I still maintain that America's meritocratic system has brought unparalleled prosperity and freedom to our nation and its people. While individual struggles exist, I stand by the power of personal responsibility and self-improvement in overcoming even the toughest barriers. And as for immigration: let's keep America's borders open to hardworking individuals who want to contribute to our economy and share the American Dream. That's the spirit of this great nation we should be celebrating."""
24,11,Ethan,Republican,"""I think we can both agree that we want what's best for this country, Hazel. However, I strongly disagree with your view that systemic barriers are exaggerated. As we've seen throughout our conversation, there are countless stories of people facing legitimate challenges due to their skin color. It's not just a matter of personal responsibility; it's about creating a level playing field where everyone has a fair chance to succeed. My issue with your argument is that it perpetuates the notion that racism only affects a small group of people when, in reality, it's a pervasive issue that affects millions. We should be working towards solutions that acknowledge this harsh reality, not just ideology-driven fixes that ignore the struggles of others."""
24,12,Hazel,Republican,"""Hazel: 'I believe our conversation has sparked a productive discussion on this topic, Ethan. While we may not see eye-to-eye, I appreciate your passion and commitment to addressing systemic issues. However, I must reiterate that I believe America's unique meritocratic system has been a driving force behind our nation's success.  I hope you can understand where I'm coming from, even if we disagree on the approach. In the end, as friends and fellow Americans, I believe we both want the best for this great nation of ours.'"""
24,12,Ethan,Republican,"Ethan: ""Hazel, I appreciate your willingness to engage in this conversation, even if we don't see eye-to-eye. However, I must respectfully disagree with your stance on systemic barriers. While I concede that America's meritocratic system has brought many successes, we can't ignore the ongoing struggles of millions of Americans who face racism on a daily basis. My question to you remains: how do we create a level playing field for all, regardless of skin color or background, when your approach seems to rely solely on individual initiative and personal responsibility?"""
24,13,Hazel,Republican,"""Ethan, I think we're coming full circle here. You're rephrasing the same questions and concerns over and over again. I understand that you believe systemic racism exists, but your facts don't add up to me. Personal responsibility and self-improvement have driven America's greatness throughout its history. My approach isn't solely about individual initiative; it's about unleashing the collective potential of every American. If we empower individuals, not government programs, everyone will have a fair shot at success. That's the essence of the American Dream."""
24,13,Ethan,Republican,"""I agree we've covered ground, Hazel, but I still see the issue as more complex than just a matter of personal responsibility. We need solutions that acknowledge systemic barriers and actively work to dismantle them, not just empower individuals. I'm not just asking you to believe me, I'm asking you to listen to the lived experiences of countless Americans who are just trying to succeed. We can't ignore the truth that racism is a real, ongoing issue that affects many people every day. I think we need to keep pushing for action, not just ideology-driven fixes."""
24,14,Hazel,Republican,"""I understand, Ethan, that we may not see eye-to-eye on this issue of systemic racism. However, I still believe that our meritocratic system has enabled countless individuals to overcome incredible obstacles and achieve greatness. I'm not dismissing the struggles of marginalized communities, but I firmly believe that individual initiative and self-improvement ultimately drive success. Rather than relying on government solutions or collective guilt, I propose we continue to promote personal freedom, entrepreneurship, and the free market, which have been the hallmarks of America's greatness from the very beginning."""
24,14,Ethan,Republican,"Hazel may have ended on a conciliatory note, but I still see a crucial gap in her understanding of systemic racism. Embracing the free market and entrepreneurship is all well and good, but it's not a substitute for acknowledging and addressing the very real barriers many people face."
24,15,Hazel,Republican,"Ethan: Hazel, it's been enlightening to discuss this topic with you, and I appreciate your perspective. However, I must respectfully disagree with your stance on systemic racism. In light of the vast amount of data and personal anecdotes that illuminate the ongoing struggles of marginalized communities, I fear that your approach may be, at best, naive, and at worst, ignoring the harsh realities faced by many Americans. Ultimately, as a nation, we must do better to create a level playing field where everyone has a fair chance to succeed, regardless of their background or skin color."
24,15,Ethan,Republican,"I think we've debated enough, Hazel. It's clear we fundamentally disagree on the role of systemic racism in American society. I'm not willing to concede that racism is a pervasive issue that affects millions of people. My perspective remains that America's meritocratic system has brought unprecedented prosperity and freedom to the nation and its people. I still believe that personal responsibility and self-improvement are the keys to success, not government solutions or collective guilt."
24,16,Hazel,Republican,"Hazel: ""Well, Ethan, it seems we've reached the end of our discussion. While I appreciate the passion you've brought to the conversation, I still maintain that America's meritocratic system has been the driving force behind our nation's success. I wish you could see the value in empowering individuals and unleashing the true potential of our great nation. For now, it seems we'll have to agree to disagree on the issue of systemic racism. But I remain committed to the principles of personal responsibility and self-improvement that have always made America great."""
24,16,Ethan,Republican,"I guess we've finally reached a stalemate, Hazel. I'm glad we could have this discussion, but I still can't shake the feeling that you're overlooking the real struggles of many Americans. As a nation, we've made significant progress, but we still have a long way to go. I'm not asking for handouts or special treatment; I'm asking for a level playing field where everyone has a fair shot at the American dream, regardless of their skin color or background. I'll continue to advocate for practical solutions that acknowledge the ongoing challenges faced by many American communities."
24,17,Hazel,Republican,"Hazel: ""Well, Ethan, it's been a lively discussion indeed. I respect your commitment to this issue, even if we don't see eye-to-eye. As we conclude, I'd like to say that I'm proud to be an American and to live in a country where we can have open and honest discussions like this one. I believe in the resilience of the American people and our ability to overcome any obstacle with hard work, determination, and a commitment to our core values. I wish you all the best in your advocacy for a level playing field, even if I won't be joining you on that particular journey."""
24,17,Ethan,Republican,"Hazel may have ended on a conciliatory note, but I still see a crucial gap in her understanding of systemic racism. Embracing the free market and entrepreneurship is all well and good, but it's not a substitute for acknowledging and addressing the very real barriers many people face.

As I've said all along, we've made significant progress, but we still have a long way to go. Until we start taking a more honest look at the challenges faced by marginalized communities, we're just scratching the surface. By ignoring the real-world implications of systemic racism, we're essentially erasing the experiences of millions of Americans who are just trying to succeed. That's not a productive or equitable approach to solving this problem.

I'll continue to advocate for practical solutions that acknowledge the ongoing challenges faced by many American communities. It's time for us to stop beating around the bush and start tackling the root causes of this complex issue.

I'd like to propose a compromise, Hazel: let's establish a bipartisan task force dedicated to studying the effects of systemic racism on American society. By bringing together experts from various fields and perspectives, we can create a more comprehensive understanding of the issue and develop targeted solutions that actually work. It's time for us to move beyond ideology-driven fixes and towards meaningful, evidence-based policies that benefit all Americans."
24,18,Hazel,Republican,"Hazel:  ""A bipartisan task force, Ethan? That sounds like a typical Washington solution – more bureaucracy and committee hearings. Look, I appreciate your passion, but I still believe that personal responsibility and self-improvement are the keys to success. We can't just create more government programs and think that'll solve the problem. What if the task force finds that systemic racism is the issue, Ethan? Will we just spend more taxpayers' money trying to fix a perceived injustice? I don't think so.""

Ethan: ""That's a narrow-minded view, Hazel. A bipartisan task force would bring together experts and stakeholders from various fields to study the effects of systemic racism. It would provide a platform for people from different walks of life to share their experiences and insights. By pooling our knowledge and resources, we can develop more effective solutions that actually address the root causes of this issue. And it would be evidence-based, not driven by ideology or partisan politics.""

Hazel: ""You're not listening, Ethan. I'm not opposed to studying the issue, but I want to focus on empowerment and self-improvement. We need to teach people personal responsibility and self-reliance, not rely on government handouts or entitlements. That's the American way, and it's been proven to work time and time again.""

Ethan: ""I understand where you're coming from, Hazel, but you're looking at this from a very individualistic perspective. Systemic racism is a societal issue that requires a collective solution. If we don't address the root causes of racism, we'll just see the same problems persist. A task force would be a crucial step towards acknowledging the problem and finding meaningful solutions.""

Hazel: ""I'm not opposed to acknowledging the problem, but I'm not willing to throw our country's values under the bus to do it. Personal freedom, entrepreneurship, and the free market are what have made America great, not government solutions or apologies. We should be focusing on empowering individuals and unleashing the full potential of our nation, not perpetuating victimhood and dependency.""

Ethan: ""We're not talking about throwing the country's values under the bus, Hazel. We're talking about acknowledging a real issue and finding a meaningful way to address it. Systemic racism is a cancer, and if we don't cut it out, it will continue to hurt our society. A bipartisan task force would be a significant step towards healing and moving forward.""

Hazel: ""I think we're at an impasse,"
24,18,Ethan,Republican,"Ethan:  ""We are at an impasse, Hazel, but that doesn't mean we can't find common ground. Let's agree to disagree on the details, but at least agree that we need to tackle this issue head-on. A bipartisan task force would be a starting point for meaningful discussion and action. It's time for us to come together as a nation and address the problems that face us.""

Hazel: ""I still have reservations, Ethan, but I appreciate your willingness to compromise. Perhaps we can discuss this further and see if we can find a more middle-of-the-road approach. However, I must reiterate that my primary concern is empowering individuals and unleashing the full potential of our nation.""

Ethan: ""I understand where you're coming from, Hazel, and I agree that empowerment is crucial. But we can't ignore the systemic issues that hold people back. A task force would allow us to explore ways to address these challenges and create more opportunities for everyone to succeed. I'm open to discussing further and finding a compromise that works for both of us.""

Hazel: ""I'm willing to consider your proposal, Ethan, but I want to make one thing clear: I will not support any solution that relies on government intervention or entitlements. We must focus on empowering individuals and unleashing the free market to solve this problem, not creating more bureaucratic red tape.""

Ethan: ""I appreciate your clarity, Hazel. I'm glad we can have this open and honest discussion. I think we can both agree on the importance of individual empowerment, but perhaps we can find ways to do that within a framework that acknowledges the systemic challenges that exist. A task force would be a good starting point for exploring those options.""

Hazel: ""Very well, Ethan. I'm willing to support a task force, provided that it focuses on empowering individuals and unleashing the free market. I hope we can work together to find a solution that honors the values that have always made America great."""
24,19,Hazel,Republican,"As the debate comes to a close, I would like to reiterate my position on systemic racism. While I acknowledge that racism exists, I firmly believe that individual initiative and self-improvement are the keys to success, not government solutions or collective guilt. I still stand by the power of America's meritocratic system and its ability to bring unparalleled prosperity and freedom to our nation and its people.

However, I also understand that some Americans still face real barriers due to systemic racism. I'm willing to work towards finding practical solutions that acknowledge these challenges, but I reject the idea that these solutions should come in the form of government handouts or entitlements. My emphasis is on individual empowerment, not collective guarantees.

In light of our discussion, I'm willing to support the establishment of a bipartisan task force to study the effects of systemic racism on American society. I believe this would provide a platform for experts and stakeholders to share their knowledge and insights, allowing us to develop more effective solutions that actually address the root causes of this issue.

But let me be clear: if this task force finds that systemic racism is the issue, I'm not willing to throw our country's values under the bus to fix it. Personal freedom, entrepreneurship, and the free market are what have made America great, and we should focus on empowering individuals and unleashing the full potential of our nation, not perpetuating victimhood and dependency.

I hope that's a starting point for our discussion, Ethan."
24,19,Ethan,Republican,"ious issue, but I remain hopeful that our discussion can be a catalyst for change.

Hazel may have ended on a conciliatory note, but I still see a crucial gap in her understanding of systemic racism. Embracing the free market and entrepreneurship is all well and good, but it's not a substitute for acknowledging and addressing the very real barriers many people face.

I'll continue to advocate for practical solutions that acknowledge the ongoing challenges faced by many American communities. It's time for us to stop beating around the bush and start tackling the root causes of this complex issue."
24,20,Hazel,Republican,"As a participant in the debate, I must say that I strongly disagree with Ethan's views on systemic racism. While I acknowledge that individual experiences of racism are real and impactful, I still believe that our meritocratic system has been a driving force behind America's success. By empowering individuals and unleashing the free market, we can create opportunities for everyone to succeed, regardless of their background or skin color.

However, I'm also willing to listen to other perspectives and consider new ideas. In light of our discussion, I'm open to the proposal of a bipartisan task force to study the effects of systemic racism on American society. Such an initiative could provide a platform for experts and stakeholders to share their knowledge and insights, allowing us to develop more effective solutions that address the root causes of this complex issue.

But I must reiterate that I will not support any solution that relies on government intervention or entitlements. We must focus on empowering individuals and unleashing the free market to solve this problem, not creating more bureaucratic red tape. I hope that's a starting point for our discussion, Ethan."
24,20,Ethan,Republican,"I think we've exhausted all the points we'd like to make on the topic of systemic racism, Hazel. As a final thought, I'd like to reiterate that I don't think we can solve this issue by simply empowering individuals and unleashing the free market. While those are indeed important factors in a functioning society, they don't negate the real, tangible barriers that many people face due to systemic racism.

Perhaps, instead of focusing on individual initiative and personal responsibility, we can work together to create a society that actively dismantles these barriers. That might involve implementing policies and programs that address the root causes of racism, rather than just giving lip service to the idea of equality.

I know you're concerned that such an approach will lead to further government intervention and dependency, but I truly believe that's a false choice. By acknowledging the real issues that people face and working towards practical solutions, we can create a society that's more just, more equitable, and more free for all Americans.

Let's not shy away from this challenge, Hazel. Let's use our differences to find common ground and work towards a better future for everyone."
