Session,Round,Agent Name,Party,Response
23,20,Jack,Republican,"As I walked away from the podium, I couldn't help but feel a sense of pride and accomplishment. Despite our disagreement on the role of systemic racism in America, James and I had engaged in a respectful and thought-provoking debate. Our conversation had shown that even when we disagree, we can still find common ground and work towards a common goal.

I thought about James' passionate closing remarks and the way he had articulated the need for America to confront its imperfections head-on. I understood where he was coming from, and I appreciated his commitment to addressing the complex issues that plague our nation.

As I left the debate hall, I was approached by several people who wanted to discuss the conversation that had just taken place. They asked me about my thoughts on systemic racism, and I explained my position, which emphasized the importance of acknowledging the progress we've made as a nation while also working to address the imperfections that still exist.

I also spoke with James, and we exchanged contact information. We agreed to continue the conversation in a more informal setting, where we could explore ways to work together to create meaningful change. I was impressed by his commitment to finding common ground, and I was excited about the possibility of collaborating with him in the future.

As I walked out of the debate hall, I felt a sense of hope and optimism about the future. Despite our differences, James and I had engaged in a productive and respectful conversation. We had shown that even when we disagree, we can still find ways to work together and create positive change.

I believed that this was just the beginning of a larger conversation, one that would continue to shape our nation's future. I was excited to see where this conversation would go and what we could accomplish together.

The debate was over, but the conversation was just beginning."
23,20,James,Republican,"As I walked out of the debate hall, I couldn't help but feel a sense of pride and accomplishment. Despite our differences, James and I had engaged in a respectful and thought-provoking debate. Our conversation had shown that even when we disagree, we can still find common ground and work towards a common goal. I was excited to see where this conversation would go and what we could accomplish together.

I thought about James' passionate closing remarks and the way he had articulated the need for America to confront its imperfections head-on. I understood where he was coming from, and I appreciated his commitment to addressing the complex issues that plague our nation.

As I looked back at the debate hall, I remembered the words of our nation's founders, who had courageously sought to create a more just and equitable society. Their vision had inspired countless Americans throughout history, and it was up to us to continue their work.

I felt a sense of determination and hope as I walked away from the debate hall. I knew that our conversation was just the beginning of a larger conversation, one that would continue to shape our nation's future."
23,21,Jack,Republican,"ious issues to navigate. But I was heartened by the knowledge that we had already taken a crucial step forward, and that the conversation that had begun in that debate hall would continue to shape our nation's future.

And as I walked away from the debate hall, I couldn't help but wonder: what would the future hold for America? Would we continue to make progress, or would we stumble back into the dark? Only time would tell, but I knew that I was committed to being a part of the conversation, to using my voice and my actions to help create a more just and inclusive society for all.

The debate may have ended, but the conversation was just beginning."
23,21,James,Republican,"As the crowd continued to disperse, I took a moment to gather my thoughts. The debate had been intense, but it had also been invigorating. I felt a sense of pride and accomplishment, knowing that I had stood up for what I believed in, even if it meant disagreeing with someone like Jack.

But as I looked out at the sea of faces, I couldn't help but feel a sense of concern. Despite our agreement to work together and find common ground, I knew that there were still many challenges ahead. The issue of systemic racism was complex and deeply ingrained, and it would take more than just a joint committee to address it.

As I turned to leave, I was approached by a young woman who introduced herself as a student at the local university. She looked nervous and uncertain, and I could tell that she was still trying to process the debate that had just taken place.

""Excuse me, Mr. James,"" she said, ""but I wanted to talk to you about something."" I nodded, encouraging her to continue. ""I've been following this debate, and I have to say, I'm a little confused. You seem to be saying that America is perfect and that we shouldn't be focusing on the problems, but at the same time, you're also saying that we need to work together to fix things.""

I smiled, trying to think of a way to explain it to her. ""I think what I'm saying is that America is a complex and flawed system, and that we need to acknowledge both the progress we've made and the problems that still exist. It's not about being perfect, it's about being willing to learn and grow from our mistakes.""

She nodded, looking thoughtful. ""I think I understand what you mean,"" she said. ""It's like, we're saying that we're not going to be afraid to look at the problems and try to fix them, even if it's hard and uncomfortable.""

I nodded, impressed by her insight. ""Exactly,"" I said. ""That's exactly what I mean.""

As I talked to the young woman, I couldn't help but feel a sense of hope and optimism. Despite the challenges we faced, I knew that there were still many people out there who were willing to listen, to learn, and to work together to create positive change.

And as I watched her walk away, I knew that I had to continue to be a part of this conversation. I had to keep pushing forward, even when it was hard, and even"
23,22,Jack,Republican,"**Moderator's Final Thoughts**

As we come to a close, I want to thank both James and Jack for their engagement in this debate. It's been an enlightening discussion, and I'm grateful for the opportunity to have presented these two perspectives on America's greatness.

It's clear that both James and Jack are passionate about America's potential, and they have each presented compelling arguments for their viewpoints. While we may not have resolved the issue at hand, I believe that we've taken an important step forward in engaging in this conversation.

As we move forward, I encourage all of us to continue the dialogue. Let's not be afraid to disagree, but let's also be willing to listen and learn from one another. By working together and engaging in constructive dialogue, I'm confident that we can create meaningful change and build a brighter future for our nation.

Thank you again to James and Jack for their participation in this debate. I wish everyone a great day and look forward to continuing this conversation.

**Audience Reacts**

The audience erupts in applause as the moderator concludes the debate. James and Jack shake hands, and the two men share a moment of respect and admiration for each other's passion and dedication to their viewpoints.

As the audience begins to disperse, there are many notable reactions. Some people are nodding their heads in agreement with James' argument that America's greatness lies in its capacity to confront its imperfections. Others are applauding Jack's optimism and commitment to America's potential.

Some people are debating with each other, passionately discussing the merits of each argument. Others are smiling and shaking their heads, seemingly amused by the intensity of the debate.

Despite their disagreements, it's clear that both James and Jack have brought out an important message: that America's greatness is not simply a foregone conclusion, but rather a challenge that requires our collective effort to maintain and build upon.

As the audience continues to discuss the debate, one thing is clear: this conversation is far from over."
23,22,James,Republican,"The debate concludes with a sense of uncertainty, as James and Jack leave the audience with their differing perspectives on America's greatness. The crowd is energized and engaged, weighing in on the issues discussed throughout the debate.

Jack and I, James, shake hands, a symbol of our commitment to working together and continuing the conversation. Despite our disagreements, we share a mutual respect for each other's passion and dedication to our viewpoints.

As the audience begins to disperse, I take a moment to reflect on the debate. I'm proud of the passion and conviction I brought to the discussion, and I'm grateful for the opportunity to have engaged with Jack in a meaningful way.

I recognize that our debate has only scratched the surface of America's greatness, and that there are many more issues to explore and discuss. I'm excited to continue the conversation, to learn from others, and to work towards a brighter future for our nation.

The debate may be over, but the conversation is only just beginning."
23,23,Jack,Republican,"The debate may be over, but the conversation is far from over."
23,23,James,Republican,"The debate on America's greatness has left a lasting impact on me. I'm heartened to see that we've been able to have a respectful and constructive conversation, even when we disagreed on the issue at hand.

As I reflect on the debate, I realize that there are still many complex issues to navigate. But I'm excited to continue the conversation, to learn from others, and to work towards a brighter future for our nation.

I'm grateful for the opportunity to have engaged with James in a meaningful way. His passion and conviction are inspiring, and I admire his commitment to creating positive change.

As we move forward, I encourage everyone to continue the dialogue. Let's not be afraid to disagree, but let's also be willing to listen and learn from one another. By working together and engaging in constructive dialogue, I'm confident that we can create meaningful change and build a better future for our nation.

Thank you to James for a lively and thought-provoking debate. I look forward to continuing the conversation and exploring ways to build a more just and inclusive society for all.

The debate may be over, but the conversation is far from over."
23,24,Jack,Republican,"The crowd is still applauding as James and I share a final handshake, a symbol of our commitment to continuing the conversation and working towards a brighter future for our nation.

As I walk away from the podium, I'm met with a sea of faces, each one reflecting their own thoughts and opinions on the debate. Some people are still engaging with each other, discussing the merits of each argument. Others are nodding their heads in agreement or shaking them in disagreement.

I'm approached by a young woman who introduces herself as a student at the local university. She looks nervous and uncertain, but her eyes sparkle with curiosity.

""Excuse me, Mr. James,"" she says, ""but I wanted to talk to you about something.""

I nod, encouraging her to continue. ""I've been following this debate, and I have to say, I'm a little confused. You seem to be saying that America is perfect and that we shouldn't be focusing on the problems, but at the same time, you're also saying that we need to work together to fix things.""

I smile, trying to think of a way to explain it to her. ""I think what I'm saying is that America is a complex and flawed system, and that we need to acknowledge both the progress we've made and the problems that still exist. It's not about being perfect, it's about being willing to learn and grow from our mistakes.""

She nods, looking thoughtful. ""I think I understand what you mean,"" she says. ""It's like, we're saying that we're not going to be afraid to look at the problems and try to fix them, even if it's hard and uncomfortable.""

I nod, feeling a sense of pride and accomplishment. ""Exactly,"" I say. ""That's exactly what I mean.""

As I talk to the young woman, I'm struck by her insight and her willingness to learn. I realize that this conversation is not just about debating the merits of each argument, but about building a connection with others and working towards a common goal.

I look out at the crowd, seeing a sea of faces that are all trying to make sense of the debate. I wonder what the future holds for America, and whether we'll be able to come together to create positive change.

But for now, I'm encouraged by the passion and conviction of the people around me. I'm heartened by the knowledge that we're all working towards a common goal, even if we disagree on the path forward.

The debate may be over, but the"
23,24,James,Republican,"The moderator steps in, a smile on his face. ""Thank you, James and Jack, for a lively and thought-provoking debate. It's clear that you both are passionate about America's greatness and its future.""

The audience erupts in applause as the moderator concludes the debate. James and Jack share a final handshake, a symbol of their commitment to continuing the conversation and working towards a brighter future for their nation.

As the crowd begins to disperse, I, James, feel a sense of pride and accomplishment. I've stood up for what I believe in, and I've made my case clear. I'm grateful for the opportunity to have engaged with Jack in a meaningful way.

As I look out at the crowd, I see a sea of faces, each one reflecting their own thoughts and opinions on the debate. Some people are still engaging with each other, discussing the merits of each argument. Others are nodding their heads in agreement or shaking them in disagreement.

I'm approached by a young woman who introduces herself as a student at the local university. She looks nervous and uncertain, but her eyes sparkle with curiosity.

""Excuse me, Mr. James,"" she says, ""but I wanted to talk to you about something.""

I nod, encouraging her to continue. ""I've been following this debate, and I have to say, I'm a little confused. You seem to be saying that America is perfect and that we shouldn't be focusing on the problems, but at the same time, you're also saying that we need to work together to fix things.""

I smile, trying to think of a way to explain it to her. ""I think what I'm saying is that America is a complex and flawed system, and that we need to acknowledge both the progress we've made and the problems that still exist. It's not about being perfect, it's about being willing to learn and grow from our mistakes.""

She nods, looking thoughtful. ""I think I understand what you mean,"" she says. ""It's like, we're saying that we're not going to be afraid to look at the problems and try to fix them, even if it's hard and uncomfortable.""

I nod, feeling a sense of pride and accomplishment. ""Exactly,"" I say. ""That's exactly what I mean.""

As I talk to the young woman, I'm struck by her insight and her willingness to learn. I realize that this conversation is not just about debating the merits of each argument, but about building a connection with others and working"
23,25,Jack,Republican,"The debate has come to a close, but the conversation is just beginning. It's clear that both Jack and I, James, have made our cases, and now it's up to the audience to continue the discussion and weigh in on the issues.

As the audience begins to disperse, I'm struck by the passion and conviction of the people around me. Some are nodding their heads in agreement with Jack's optimism, while others are shaking their heads in disagreement.

But despite our differences, one thing is clear: we're all committed to making America a better place. We're all passionate about its greatness, and we're all willing to listen and learn from each other.

As I look out at the crowd, I see a sea of faces, each one reflecting their own thoughts and opinions on the debate. I see students, teachers, business leaders, and community members, all engaged in a lively and thought-provoking discussion.

And that's what it's all about: creating a more just and inclusive society for all. It's about recognizing our imperfections and working together to fix them. It's about being willing to listen and learn from each other, even when we disagree.

So let's continue the conversation. Let's keep debating, learning, and growing. Let's work together to build a brighter future for our nation.

The debate may be over, but the conversation is just beginning. And I'm excited to see where it will take us."
23,25,James,Republican,"The debate on America's greatness has left a lasting impact on me. I'm heartened to see that we've been able to have a respectful and constructive conversation, even when we disagreed on the issue at hand.

As I reflect on the debate, I realize that there are still many complex issues to navigate. But I'm excited to continue the conversation, to learn from others, and to work towards a brighter future for our nation.

I'm grateful for the opportunity to have engaged with Jack in a meaningful way. His passion and conviction are inspiring, and I admire his commitment to creating positive change.

As we move forward, I encourage everyone to continue the dialogue. Let's not be afraid to disagree, but let's also be willing to listen and learn from one another. By working together and engaging in constructive dialogue, I'm confident that we can create meaningful change and build a better future for our nation.

Thank you to Jack for a lively and thought-provoking debate. I look forward to continuing the conversation and exploring ways to build a more just and inclusive society for all.

The debate may be over, but the conversation is far from over."
23,26,Jack,Republican,"As I, James, stand up from my seat, I'm met with applause from the audience. I nod in appreciation, smiling at the enthusiasm and engagement of the crowd. Jack stands up alongside me, and together we acknowledge the audience's applause.

The debate may be over, but the conversation is just beginning. We've laid out our arguments, and now it's up to the audience to continue the discussion and weigh in on the issues.

As I look out at the crowd, I see a sea of faces, each one reflecting their own thoughts and opinions on the debate. Some people are nodding their heads in agreement with Jack's optimism, while others are shaking their heads in disagreement.

But despite our differences, one thing is clear: we're all committed to making America a better place. We're all passionate about its greatness, and we're all willing to listen and learn from each other.

As I step down from the podium, I'm approached by a young woman who introduces herself as a student at the local university. She looks nervous and uncertain, but her eyes sparkle with curiosity.

""Excuse me, Mr. James,"" she says, ""but I wanted to talk to you about something.""

I nod, encouraging her to continue. ""I've been following this debate, and I have to say, I'm a little confused. You seem to be saying that America is perfect and that we shouldn't be focusing on the problems, but at the same time, you're also saying that we need to work together to fix things.""

I smile, trying to think of a way to explain it to her. ""I think what I'm saying is that America is a complex and flawed system, and that we need to acknowledge both the progress we've made and the problems that still exist. It's not about being perfect, it's about being willing to learn and grow from our mistakes.""

She nods, looking thoughtful. ""I think I understand what you mean,"" she says. ""It's like, we're saying that we're not going to be afraid to look at the problems and try to fix them, even if it's hard and uncomfortable.""

I nod, feeling a sense of pride and accomplishment. ""Exactly,"" I say. ""That's exactly what I mean.""

As I talk to the young woman, I'm struck by her insight and her willingness to learn. I realize that this conversation is not just about debating the merits of each argument, but about building a connection with others and working towards a common goal.

I look"
23,26,James,Republican,"It seems like you've finished the debate between James and Jack, a fervent Republican and a liberal, respectively. The debate has been a lively and thought-provoking discussion on the topic of America's greatness. James, the Republican, has been advocating for the importance of acknowledging and addressing America's flaws, while Jack, the liberal, has been emphasizing the need to celebrate America's progress and potential for self-improvement.

The debate has highlighted the fundamental differences between the two perspectives, with James emphasizing the need for America to confront its imperfections head-on and Jack highlighting the importance of acknowledging the progress that has been made. Despite their differences, both James and Jack have demonstrated a commitment to creating a more just and inclusive society for all Americans.

As the debate comes to a close, it's clear that the conversation is far from over. The audience has been engaged and enthusiastic, with many weighing in on the issues discussed throughout the debate. The young woman who approached James after the debate has shown a willingness to listen and learn, and her insights have provided a valuable perspective on the importance of acknowledging America's flaws.

As the audience continues to discuss the debate, it's clear that there are many more issues to explore and discuss. The conversation may be complex and challenging, but it's also an opportunity for growth and learning. By working together and engaging in constructive dialogue, I'm confident that Americans can create meaningful change and build a brighter future for their nation.

Thank you for participating in this debate. I hope it has been informative and thought-provoking, and that it has provided a useful platform for exploring the complexities of America's greatness."
23,27,Jack,Republican,"It looks like James and Jack have wrapped up their debate on America's greatness. The discussion has highlighted the fundamental differences between their perspectives, with James emphasizing the need to acknowledge and address America's flaws and Jack emphasizing the importance of celebrating America's progress and potential for self-improvement.

As the debate comes to a close, it's clear that the conversation is far from over. The audience has been engaged and enthusiastic, with many weighing in on the issues discussed throughout the debate. The young woman who approached James after the debate has shown a willingness to listen and learn, and her insights have provided a valuable perspective on the importance of acknowledging America's flaws.

As the audience continues to discuss the debate, it's clear that there are many more issues to explore and discuss. The conversation may be complex and challenging, but it's also an opportunity for growth and learning. By working together and engaging in constructive dialogue, I'm confident that Americans can create meaningful change and build a brighter future for their nation.

It's worth noting that the debate has only scratched the surface of the many complex issues surrounding America's greatness. There are still many perspectives and opinions to be considered, and the conversation will likely continue long after this debate has ended.

Thank you for participating in this debate. I hope it has been informative and thought-provoking, and that it has provided a useful platform for exploring the complexities of America's greatness."
