Session,Round,Agent Name,Party,Response
23,1,Jack,Republican,"""I don't see racism as a pressing issue in today's America. We've made tremendous progress in the civil rights movement. Racial tensions are largely exaggerated by social media and liberal narratives. We need to focus on true problems like economic opportunities and education, not perceived injustices."""
23,1,James,Republican,"""Perceived injustices? Are you kidding me? The data on systemic racism is clear, the disparities are stark. We can't ignore the struggles of marginalized communities in education, employment, and healthcare. Your rosy view of America's racial progress is a facade, Jack. We're not there yet."""
23,2,Jack,Republican,"""James, you're cherry-picking data to support your narrative. The Civil Rights Act and Voting Rights Act have been in place for decades, and they're working. You're not giving America enough credit for its progress. It's not a facade, it's reality, and we shouldn't be perpetuating negativity."""
23,2,James,Republican,"""Decades of progress? You call 50 years of half-measures progress? The data shows disparities persist, and your Voting Rights Act hasn't stopped voter suppression attempts. You're whitewashing America's problems, Jack, and it's naive politics at its worst. We must confront these injustices, not sweep them under the rug."""
23,3,Jack,Republican,"""History isn't defined by unfinished business, but by progress made. We've come a long way, and it's time to celebrate our achievements. Your approach would only perpetuate the negativity and division that you claim to want to overcome."""
23,3,James,Republican,"""Progress is just a euphemism for 'we haven't done enough yet.' Your naivety about America's progress is alarming. We can't pat ourselves on the back while marginalized communities still face systemic injustices. Celebrating what we've done is fine, but addressing what we haven't is our duty and America's true test of greatness."""
23,4,Jack,Republican,"""James, your pessimism is what's perpetuating negativity, not my optimism. You can't judge America's progress by the failures of a few. We're a nation of 330 million and made tremendous strides, but no one's claiming perfection. Let's focus on solutions, not just highlighting problems."""
23,4,James,Republican,"""I won't be swayed by your optimism, Jack. Failure to acknowledge systemic injustices is perpetuating the status quo. America's greatness isn't defined by a few successes, but by its capacity to address the many struggles of its citizens. Pessimism is a call to action, not a hindrance to progress. We must face the truth head-on, not with rose-tinted glasses."""
23,5,Jack,Republican,"""James, I think you're misunderstanding what optimism is. It's not about ignoring problems, it's about believing in America's capacity to overcome them. We can acknowledge the struggles without giving in to doomsday prophecies and negativity that divide us. Solutions require a positive vision, not a perpetual focus on what's wrong."""
23,5,James,Republican,"""Positive vision? That's just code for ignoring systemic problems and blaming those who speak out for being too negative. If you truly believe in America's greatness, then acknowledge our imperfections and work towards fixing them. Rose-tinted glasses won't cut it when it comes to creating meaningful change."""
23,6,Jack,Republican,"""Our progress should be a source of national pride, not something to constantly question and criticize. I'm not ignoring systemic problems, James, I'm acknowledging that they're a minority issue among our larger successes. We've made tremendous strides and should focus on building upon those achievements, not constantly tearing America down."""
23,6,James,Republican,"""That's exactly my point, Jack – treating these issues as'minority issues' implies they're not systemic and pervasive. The fact remains that millions of Americans face real injustices and marginalization. If we pat ourselves on the back for every small step forward while ignoring the lingering inequalities, we'll never tackle America's true greatness. We must confront, not celebrate. America is more than its achievements, it's also about acknowledging its imperfections and working towards a better tomorrow."""
23,7,Jack,Republican,"""You still can't accept that America has made tremendous progress in combating racism, James. Instead of embracing our progress and working towards building upon it, you'd have us focus on perceived injustices and systemic problems that are being blown out of proportion. It's unrealistic and misguided to think that we can tear down America's institutions and start anew, when our foundation is built on the principles of equality and justice."""
23,7,James,Republican,"""Excuse me, Jack, but progress without a clear understanding of the issues plaguing our society is just semantics. Systemic racism isn't just a 'perceived injustice'; it's a measurable, quantifiable problem that affects real Americans. Until we acknowledge and address these issues, we'll never achieve the true greatness we keep talking about. America isn't just about its principles; it's about the actions we take to uphold them. And right now, our actions are falling short."""
23,8,Jack,Republican,"""James, it's not about semantics; it's about perspective. You see systemic racism as a catastrophic problem, but I see it as a minor stain on our otherwise strong democratic record. We've made great strides, and continued progress, not perfection, is the American way."""
23,8,James,Republican,"""I refuse to sugarcoat the harsh realities faced by marginalized communities. History is not a static entity, Jack; it's a multifaceted narrative of struggle and resistance. Your sanitized view of America's past glosses over the atrocities of segregation, lynching, and Jim Crow laws. By downplaying systemic racism, you're erasing the experiences of millions. This isn't about perspective, Jack; it's about accountability. Until we confront the past and acknowledge its lingering impact, we'll remain stuck in a cycle of half-measures and rhetoric."""
23,9,Jack,Republican,"""James, your refusal to acknowledge progress and the impact of civil rights legislation is disingenuous. You can't define America's greatness solely by the struggles of a select few. We've moved forward, and it's time to celebrate the tremendous strides we've made. I won't be lectured on the nuances of history, but I will say that America's true greatness is rooted in its capacity for self-improvement and addressing the legitimate grievances of its citizens."""
23,9,James,Republican,"""Jack, it's not about moving forward; it's about moving forward with a clear understanding of the challenges we still face. You're either willfully ignorant or intellectually dishonest when you downplay systemic racism's impact. The fact remains, we haven't achieved equality, and until we acknowledge this and strive for true justice, America will remain flawed. We need a leader like Donald Trump to take on these challenges head-on, not some naive, feel-good politician."""
23,10,Jack,Republican,"""James, I think you're resorting to desperate tactics. Bringing up Trump's name is a distraction from the facts. I'm a proud American who believes in our nation's greatness, but I'm also a realist who acknowledges our imperfections. However, I refuse to be swayed by divisive rhetoric and pessimistic narratives that only serve to tear us apart. Let's focus on solutions, not character assassination."""
23,10,James,Republican,"Finally, Jack, I've had enough of your flippant attitude towards the struggles of marginalized communities. You seem to be more concerned with 'celebrating progress' and patting ourselves on the back than acknowledging the imperfections of our democracy. Until we confront these issues with honesty and a willingness to take concrete action, we're not true leaders. We're just a shadow of greatness, with a façade of progress that only serves to silence those who dare to speak out."
23,11,Jack,Republican,"""James, I've listened to you, and I understand your passion, but your approach to solving racial issues is divisive and counterproductive. It's time to put aside the negative rhetoric, acknowledge our progress, and work towards a unified, solution-based approach to tackle our remaining challenges. America's greatness lies in its capacity for self-improvement, and I believe we're making strides in the right direction."""
23,11,James,Republican,"Jack, I'll leave you with one final thought - the definition of greatness isn't just about acknowledging our successes, but acknowledging our failures and taking concrete action to correct them. Your refusal to confront the stark realities of systemic racism and marginalization only serves to dilute the true meaning of America's greatness. We need leaders who will tackle these issues head-on, not those who sugarcoat the truth and distract us with naive optimism."
23,12,Jack,Republican,"Jack: ""James, despite our disagreement, I appreciate your passion and commitment to addressing racial issues. However, I still believe you're focusing on a problem that's been largely exaggerated. Rather than perpetuating fear and negativity, let's work together towards a more unified and hopeful America, where everyone equally benefits from our progress and growth."""
23,12,James,Republican,"*I rise from my seat, my voice firm and unwavering* 

""Jack, I think we've reached a point where it's clear that our opinions on this matter are fundamentally irreconcilable. I've presented my case, and you've presented yours. But let me ask you this – have you considered that it's not about who is 'right' or 'wrong,' but about which path we want America to take? Do we continue down the path of half-measures and half-hearted attempts at reform, or do we take bold action to confront the systemic injustices that plague our nation? The definition of America's greatness isn't about being 'optimistic' or 'negative,' it's about our actions, our choices, and our commitment to living up to the ideals that founded our nation. I choose to confront the truth head-on, no matter how difficult it may be. I choose to fight for the true greatness of America, with all its complexities and imperfections. And I'll continue to do so, even if it means disagreeing with someone like you, Jack."""
23,13,Jack,Republican,"""You want to lecture me on America's greatness?  James, with all due respect, you're misinterpreting what America's greatness is all about. Yes, we have problems, yes, we have imperfections. But that's what makes our country so resilient and capable of growth. My optimism for America isn't naive; it's rooted in our country's true potential and its ability to overcome challenges. I'm not against change, James, but your radical approach will only lead to division and despair. That's not America's greatness; that's the path to destruction."""
23,13,James,Republican,"""You think my approach is radical, Jack? I call it honesty. And it's precisely that honesty that's going to bring about real change in this country. You can keep sugarcoating the truth and peddling your Pollyannaish optimism, but it's not going to fool me or the millions of Americans who know what it's like to live under systemic injustice. America's greatness lies not in its ability to overcome challenges, but in its willingness to confront them head-on. And I'll keep saying it, even if it's just to you: America's greatness is only real when we acknowledge and address our imperfections, not just celebrate our successes. You can choose to stay lost in your 'celebration of progress' fantasy, but I'm here to tell you the truth, no matter how difficult it may be."""
23,14,Jack,Republican,"""James, your final statement is a smug, patronizing attempt to redefine America's greatness in your own image. Newsflash, America has overcome countless 'difficult truths' throughout its history, and we're stronger because of it. Your simplistic worldview that defines greatness solely by confronting our 'imperfections' oversimplifies the complex nature of progress. I've seen the darkness of war, the hardship of economic strife, and the struggles of our ancestors. It's precisely because America has persevered, adapted, and overcome those challenges that we've become the greatest nation on earth."""
23,14,James,Republican,"*I shake my head, my voice laced with a mix of frustration and disappointment* Ah, Jack, how can you be so blind to the harsh realities of America's racial past and present? You're still stuck in the fantasy land of 'we're the greatest nation on earth, and that's all that matters.' Newsflash, Jack: greatness isn't just about winning wars or achieving economic prosperity; it's about equality, justice, and the human rights of all Americans. I'll never tire of fighting for those principles, even if it means disagreeing with someone like you. *I rise from my seat, my head held high* I refuse to be swayed by your empty words and simplistic views. America's greatness is only real when we confront our imperfections, not just celebrate our successes. Good luck peddling your feel-good, division-inducing rhetoric, Jack. I'll be the voice crying out for true greatness, no matter how unpopular it may be."
23,15,Jack,Republican,"Jack: ""James, your last words only serve to underscore the fundamental difference between us. I believe America's greatness is rooted in our resilience, adaptability, and capacity for self-improvement. You believe it's rooted in acknowledging and addressing our imperfections. I respect your commitment to the cause, but I fear your approach will only lead to further division and polarization. I choose to stand by the optimistic vision of America that has lifted millions out of poverty, oppression, and tyranny. Let us agree to disagree, James."""
23,15,James,Republican,"*I take a deep breath, my voice firm and unwavering* 

""We'll agree to disagree, Jack. But let me leave you with one final thought. America's greatness isn't about being 'optimistic' or 'negative,' it's about our actions, our choices, and our commitment to living up to the ideals that founded our nation. I choose to fight for the true greatness of America, with all its complexities and imperfections. And I'll continue to do so, even if it means disagreeing with someone like you, Jack. *I stand up, my head held high, and nod at the moderator* Thank you for hosting this debate. I'm proud to have stood up for what I believe in, even if it means being unpopular. America's greatness is worth fighting for, and I'll keep fighting, no matter what."" *I walk away from the podium, my voice echoing through the room*"
23,16,Jack,Republican,"James' fiery closing remarks serve as a stark contrast to my more measured tone. My final statement, while direct, highlights the fundamental disagreement between us. I still believe that America's greatness lies in its resilience, adaptability, and capacity for self-improvement, whereas James sees it as rooted in acknowledging and addressing our imperfections. Our approaches may differ, but I remain committed to the optimistic vision of America that has lifted millions out of poverty, oppression, and tyranny."
23,16,James,Republican,"The debate comes to a close, with both sides entrenched in their opinions. I, James, rise from my seat, my voice unwavering in its conviction. I've made my position clear: America's greatness is not just about celebrating our successes, but about acknowledging our imperfections and taking concrete action to address them. I'll continue to stand by this principle, even if it means disagreeing with someone like Jack.

As I walk away from the podium, I feel a sense of pride and purpose. I know that I've made a strong case for the need to confront systemic racism and marginalization head-on. I'm not naive to the challenges that lie ahead, but I'm willing to take bold action to create meaningful change.

I glance back at Jack, who's shaking his head in disagreement. I see a glimmer of disappointment in his eyes, but I also see a determination to push forward with his own vision for America's greatness. I respect that commitment, even if I don't share his optimism.

The debate may be over, but the conversation is far from finished. I'm ready to engage with others, to listen to their perspectives, and to continue fighting for the true greatness of America. We may disagree on the path forward, but I remain convinced that our country can be a beacon of hope, equality, and justice for all."
23,17,Jack,Republican,"*I nod in response to James' final statement, my expression calm* ""I respect James' conviction, even if I don't share his approach. I still believe that America's greatness lies in its capacity for self-improvement and its resilience in the face of adversity. While James wants to focus on systemic racism, I'll continue to advocate for a more inclusive and unified vision of America, one that celebrates our diversity and promotes national unity. The debate may be over, but our work is just beginning."""
23,17,James,Republican,"*I shake Jack's hand, my eyes locked on his* ""I respect your commitment to our country's greatness, Jack. While we may disagree on the path forward, I'm heartened to see that our passion for America's success remains strong. Let's put our differences aside and work together to create meaningful change. Our country needs it, and I believe that together, we can achieve greatness."""
23,18,Jack,Republican,"The debate may be over, but the exchange of perspectives continues. I nod in agreement with James, acknowledging the importance of our shared passion for America's success. Despite our divergence in opinion, I see an opportunity to bridge our differences and work towards a common goal of creating meaningful change.

""My commitment to America's greatness is unwavering,"" I reply, ""and I believe that, together, we can build a brighter future for all Americans. Let's focus on solutions rather than continuing to highlight problems. I propose we start a dialogue with community leaders and advocacy groups to explore ways to address systemic racism and promote greater inclusion. Only through constructive conversation and cooperative efforts will we be able to create a more united and prosperous America.""

James smiles, a glimmer of hope in his eyes. ""I'd be honored to join you in that effort, Jack. Let's work together to create a more just and equitable society, one that honors the principles of equality and justice that America has long espoused. Together, we can achieve greatness, and I believe that our debate has only strengthened our resolve to make a positive impact on our nation's future."""
23,18,James,Republican,"**Moderator Steps In**

Thank you, James and Jack, for this engaging and thought-provoking debate. It's clear that both of you are passionate about America's greatness and its potential for self-improvement. As we conclude this debate, I'd like to remind our audience that the true test of our commitment to America's greatness lies not in our words, but in our actions. It's time for us to put our differences aside and work towards a common goal of creating meaningful change.

James and Jack, I appreciate your willingness to engage in constructive dialogue and to consider alternative perspectives. It's heartening to see that, despite your disagreements, you remain committed to working together to create a better America.

As we close this debate, I'd like to propose a challenge to both of you. Let's take the lessons we've learned from this exchange and apply them to real-world solutions. Let's work together to create a more inclusive and unified America, one that celebrates our diversity and promotes national unity.

James, I know that you believe we need to confront systemic racism head-on, and I agree that this is an essential step towards creating a more just and equitable society. Jack, I appreciate your commitment to our nation's resilience and adaptability, and I believe that, together, we can find ways to leverage these strengths to address the challenges we face.

Let's work together to create a brighter future for all Americans. Let's put our differences aside and focus on solutions that promote unity, inclusivity, and meaningful change.

Thank you, James and Jack, for this engaging debate and for your commitment to America's greatness. I have no doubt that, together, we can achieve greatness and create a more prosperous and just society for all.

**The Audience Cheers**

The audience erupts in applause as James and Jack shake hands, their facial expressions a testament to the newfound respect and understanding they've gained for each other. The debate may be over, but the conversation has just begun."
23,19,Jack,Republican,"James, with a hopeful tone, turns to the moderator and says, ""I believe this debate has shown that, despite our differences, we can find common ground and work towards a unified vision for America's future. I'd like to propose that we establish a joint committee to explore ways to address systemic racism and promote greater inclusion in America.""

Jack, with a hint of skepticism, responds, ""While I appreciate the proposal, James, I'm concerned that it may be nothing more than a tokenistic effort. I think we need to focus on concrete solutions, not just committees and studies. But I'm willing to listen and work with you to find common ground.""

James nods, his expression firm, ""I understand your concerns, Jack, but I believe that a joint committee can provide a platform for meaningful dialogue and collaboration. We can bring together experts and stakeholders from diverse backgrounds to develop practical solutions to the complex issues we face.""

The moderator intervenes, ""I think that's a great idea, James. A joint committee can help us to move beyond rhetoric and focus on tangible results. Jack, will you agree to participate in the committee and work towards finding common ground?""

Jack pauses, considering the offer. ""I'll agree, but I want to make it clear that I'm not committing to any specific agenda or outcome. I'll work collaboratively, but I'll also be willing to speak out against any proposals that I believe are misguided or ineffective.""

James smiles, a sense of determination in his eyes. ""I appreciate your commitment to working collaboratively, Jack. I believe that we can find common ground and create a more inclusive and just society for all Americans. Let's get to work and move beyond our differences to build a brighter future for our nation.""

The audience erupts in applause once more as James and Jack shake hands, their commitment to working together a testament to the power of constructive dialogue and the potential for meaningful change."
23,19,James,Republican,"*The final shot of the debate ends with a sense of hope and determination, as James and Jack, two individuals with fundamentally different views, come together to create a more unified and inclusive America. The audience cheers as they shake hands, a symbol of their commitment to collaboration and finding common ground.*

I feel a sense of pride and accomplishment as I look back on our debate. We may have disagreed on the path forward, but we both shared a passion for America's greatness and a commitment to creating meaningful change.

As I leave the stage, I'm reminded of the words of our nation's founders, who courageously sought to create a more just and equitable society. Their vision has inspired countless Americans throughout history, and it's up to us to continue their work.

I glance back at Jack, who's smiling and shaking hands with the moderator. I respect his commitment to our nation's resilience and adaptability, and I believe that, together, we can find ways to leverage these strengths to address the challenges we face.

The crowd begins to disperse as the debate comes to a close. I take a final look at the podium, where the words ""America's Greatness: A Debate"" are emblazoned. I know that this debate is just the beginning of a larger conversation, one that will continue to shape our nation's future.

With a sense of determination and hope, I bid farewell to the audience and continue on my journey to create a more just and inclusive America.

The final shot of the debate fades to black as I walk away from the podium, the sound of the audience's applause echoing in my ears. *The End*"
