Session,Round,Agent Name,Party,Response
13,1,James,Democrat,"""I'm tired of the systemic racism that still infects our society. We need to acknowledge the brutal histories that led us here and work towards meaningful change. Breaking down institutional barriers, increasing diversity and representation, and promoting social justice requires a collective effort and a willingness to listen."""
13,1,Julian,Democrat,"""I completely agree, James. We must confront the painful truths of our past and work together to dismantle systemic racism. Education, restorative justice, and policy reforms can help create a more equitable society. It's time for meaningful action, not just words."""
13,2,James,Democrat,"""I agree, Julian. But let's not forget, words without action are empty. Now, more than ever, we need policymakers to back up their promises with tangible reforms. The Voting Rights Act is being undermined; it's time we fight to protect it and make meaningful reforms to ensure equal justice for all."""
13,2,Julian,Democrat,"""I couldn't agree more, James. The latest attacks on the Voting Rights Act are a clear attempt to silence marginalized communities. We need to pass legislation that strengthens, not undermines, the protections enshrined in this landmark act. Every American deserves equal access to the ballot and a fair shot at justice."""
13,3,James,Democrat,"""Let's not stop at just voting rights, Julian. We need to tackle police brutality head-on by implementing community-led policing and de-escalation training. The lives of Eric, George, and countless others demand justice, not just in words but in meaningful policy changes. We owe it to them to fight for a safer, more just society."""
13,3,Julian,Democrat,"""James, I completely agree with you on police reform. It's time to shift the power back to our communities and ensure accountability for law enforcement. Let's demand the systematic changes we know are necessary, like police body cameras and federal oversight, to achieve true justice and equality."""
13,4,James,Democrat,"""I couldn't agree more, Julian. It's time to put an end to the systemic racism that plagues our communities.  A bill like the George Floyd Justice in Policing Act is a start, but we need to hold our elected officials accountable to make meaningful changes.  No more empty promises, it's time to act."""
13,4,Julian,Democrat,"""James, I couldn't agree more about the importance of the George Floyd Justice in Policing Act. We must pressure lawmakers to pass this critical legislation and push for even more reforms to ensure accountability, transparency, and community-led policing. The lives lost to police brutality demand no less."""
13,5,James,Democrat,"""I completely agree, Julian. Accountability is crucial, and we can't let lawmakers off the hook for empty promises. We need decisive action on comprehensive reparations for black communities, affirmative action, and ending qualified immunity for police officers. Every policy reform must benefit the most vulnerable among us, not just politicians' careers."""
13,5,Julian,Democrat,"James: ""I appreciate your passion for justice, Julian. However, can you clarify how your ideas for education reform specifically address the systemic racism within our education system? From segregation to disproportionate funding for underprivileged schools, there's a long history of inequity that we must confront head-on.""
I'm taken aback by James' thoughtful question, and I pause for a moment to consider a thoughtful response."
13,6,James,Democrat,"""Thank you, James, for pushing me to dig deeper into this crucial issue. I believe education reform must tackle the historical traumas faced by communities of color, such as forced segregation, Cultural erasure, and generational poverty. To achieve this, we need to implement bold measures like desegregation busing programs, increase funding and resources for under-resourced schools, and provide teacher training on culturally responsive pedagogy. Additionally, we should explore alternative education models that prioritize community-led, culturally nuanced, and trauma-informed learning experiences. By dismantling the systemic barriers holding students back, we can empower the next generation to break the cycle of racism."""
13,6,Julian,Democrat,"""James, I'm glad you asked that question.  Your concerns are well-founded, and I appreciate our constructive conversation. To further address systemic racism in education, I propose we invest in robust teacher diversity programs, hire more educators from underrepresented backgrounds to better serve students of color, and establish programs to support students who are historically underserved, such as English language learners, students with disabilities, and foster youth. We must also support alternative education models that prioritize culturally responsive teaching and experiential learning, giving students a voice in their own educational journey."""
13,7,James,Democrat,"""I appreciate your thoughtful response, Julian. Investing in teacher diversity programs and alternative education models are crucial steps towards creating a more inclusive learning environment. However, we must also acknowledge the power dynamics at play in our education system. Schools are often a microcosm of the broader society, and the disproportionate presence of law enforcement in schools, particularly in communities of color, sends a concerning message. Can you speak to how we can dismantle the school-to-prison pipeline and ensure that our education system prioritizes academic and social-emotional learning over punishment and incarceration?"""
13,7,Julian,Democrat,"""That's a crucial question, James. The school-to-prison pipeline is a stark reminder of systemic racism's insidious grip on our education system. To dismantle it, we need to divert resources from punitive measures to holistic support services, such as counseling, mentorship, and restorative justice programs. We must also address the inequitable distribution of school discipline and develop alternative discipline models that prioritize de-escalation and social-emotional learning. Furthermore, we should work to integrate social-emotional learning into the curriculum, providing students with the skills and resilience to navigate the challenges of their lives. By doing so, we can shift our schools from institutions of punishment to incubators of academic and personal growth."""
13,8,James,Democrat,"""Julian, I appreciate the emphasis on diverting resources from punitive measures to holistic support services. However, I'd like to take it a step further. We need to hold law enforcement and policymakers accountable for the school-to-prison pipeline's destructive consequences. This includes repealing zero-tolerance policies, promoting restorative justice practices, and ensuring that schools are truly safe havens, not pipelines to incarceration. By doing so, we can disrupt the cycle of oppression and create opportunities for students to thrive, not just survive."""
13,8,Julian,Democrat,"""James, I completely agree with you on holding our elected officials accountable. It's time we pass legislation like the Restorative Justice Act, which would provide federal funding for restorative justice programs and training for educators and law enforcement. We also need to pass the Stop Arming Schools with Guns Act, which would ban the sale and transfer of military-grade firearms to schools. It's time we make our schools a safe haven, not a pipeline to incarceration."""
13,9,James,Democrat,"I'll continue James' next reply, keeping it under 50 words.

James: ""I agree that we need legislation to support restorative justice and prevent the school-to-prison pipeline. But we can't just rely on policy change; we must also pressure our schools to fundamentally shift their culture and approach. We need educators who are trained to recognize and address the root causes of trauma, not just its symptoms. Let's prioritize a trauma-informed approach that prioritizes our students' mental health and well-being."""
13,9,Julian,Democrat,"""That's precisely what we need, James - a holistic approach to education that prioritizes students' mental health and well-being. Trauma-informed care in schools can break the cycle of intergenerational trauma and help students thrive. We need educators and policymakers to commit to this critical shift, and I wholeheartedly agree that it's time for our schools to put students' needs above disciplinary measures."""
13,10,James,Democrat,"""Julian, I completely agree with your emphasis on trauma-informed care in schools. However, we also need to ensure that schools are not just culturally sensitive, but culturally responsive. That means addressing the inherent biases in curriculum design, ensuring diverse representation, and centering marginalized voices in decision-making processes. The time for tokenistic diversity initiatives is over; it's time for real systemic change."""
13,10,Julian,Democrat,"""Amen to that, James. Our education system must be transformed to prioritize equity, cultural responsiveness, and student-centered learning. By doing so, we can create a safe and inclusive environment where every student feels seen, valued, and empowered to succeed. It's high time for our schools to become beacons of justice, love, and liberation."""
13,11,James,Democrat,"""Julian, I appreciate your commitment to equity and student-centered learning. However, let's not forget the role of systemic policies in perpetuating racism in our schools. We need to hold elected officials accountable for implementing anti-racist policies, such as banning zero-tolerance policies and promoting restorative justice. It's time for action, not just empty promises."""
13,11,Julian,Democrat,"Julian: ""I completely agree, James. Holding elected officials accountable is crucial in dismantling systemic racism in our education system. It's time for policymakers to walk the talk and implement anti-racist policies that prioritize education, not punishment. We must pressure lawmakers to pass legislation that promotes restorative justice, equitable funding, and culturally responsive education. The lives of our children depend on it."""
13,12,James,Democrat,"""I appreciate your emphasis on cultural responsiveness, Julian. However, I'd like to push the conversation further. We must acknowledge that racism in education is deeply intertwined with the broader systemic issues of poverty, housing, and healthcare. Can you speak to how we can address these intersecting issues through education reform and community development?"""
13,12,Julian,Democrat,"""James, that's a crucial connection to make. Addressing the intersectional issues of poverty, housing, and healthcare is essential to dismantling systemic racism in education. I propose that we create community-based education programs that address these underlying issues, such as job training for parents, affordable housing initiatives, and healthcare services for families. By doing so, we can break the cycle of intergenerational poverty and provide comprehensive support for students and their families."""
13,13,James,Democrat,"Now, Julian is about to respond to James' question about the intersecting issues of poverty, housing, and healthcare. However, James has one more thing to say.

""Julian, I see you've raised an excellent point about community-based education programs. However, we must also address the issue of systemic racism in our education system that perpetuates the cycle of poverty. Can you speak to how we can hold institutions accountable for perpetuating these systems, and what reforms are needed to dismantle the historical legacies of segregation and institutionalized racism?"""
13,13,Julian,Democrat,"Julian: ""James, I appreciate your persistence in pushing for accountability and systemic change. To hold institutions accountable for perpetuating systemic racism, we need to pass legislation that promotes transparency and equitable access to education. This includes making systemic data on school resources, funding, and discipline publicly available, so we can identify areas of disparity and hold institutions responsible.

We also need to pass legislation that promotes affirmative action in education, so that we can increase diversity and inclusion in our schools. Furthermore, we need to hold colleges and universities accountable for their affirmative action policies, and we need to make college more affordable and accessible for low-income students and students of color.

To dismantle the historical legacies of segregation and institutionalized racism, we need to pass legislation that promotes equitable funding for schools in historically marginalized communities. We need to ensure that schools in these communities have access to the same resources and opportunities as schools in more affluent communities. We also need to pass legislation that promotes restorative justice, so that we can address the trauma and harm caused by systemic racism in our education system.

But, James, this is not just about legislation. It's about holding our institutions accountable, and it's about creating a culture of equity and inclusion in our schools. We need to create a society where every child, regardless of their background or zip code, has access to quality education and can thrive. That's the kind of change we need, and that's the kind of change I'm committed to fighting for."""
13,14,James,Democrat,"""I appreciate the depth of our conversation, Julian. However, let's not lose sight of the fact that systemic racism is rooted in decades of policy decisions and institutional practices that have marginalized communities of color. We need to hold not just individuals accountable, but also the systems and institutions that perpetuate these injustices. The fight for meaningful change is long and complex, and we need to commit to a sustained, collective effort to dismantle these systems and create a more just and equitable society."""
13,14,Julian,Democrat,"James. I appreciate the emphasis on policy, Julian. However, to create meaningful change, we also need to foster a cultural shift within our institutions and society. This requires more than just implementing new policies; it demands a fundamental transformation in how we think, feel, and interact with each other. We need to confront the biases and prejudices that are embedded in our individual and collective psyche. By acknowledging and addressing these deep-seated attitudes, we can begin to dismantle the systemic barriers that perpetuate inequality and build a more just and equitable society."
13,15,James,Democrat,"""I couldn't agree more, Julian. A cultural shift is essential to dismantling systemic racism. It's not just about changing policies, but also about transforming our collective mindset. We need to confront the uncomfortable truths about our society's history, privilege, and power dynamics. By doing so, we can create a culture of empathy, understanding, and inclusion that values diversity and promotes social justice. The onus is on all of us to be active participants in this transformation, and I'm committed to being part of this crucial work."""
13,15,Julian,Democrat,"""As we continue to push for a cultural shift, James, I want to emphasize the importance of intergenerational dialogue and community engagement. We need to listen to the stories and experiences of individuals from marginalized communities and learn from their perspectives. This requires a commitment to active listening, introspection, and humility. By doing so, we can create spaces for authentic, empathy-driven discussions that foster understanding and empathy, moving us closer to a more just and equitable society."""
13,16,James,Democrat,"""Julian, I believe you're hitting on a crucial point. Intergenerational dialogue and community engagement are vital for creating a culture of empathy and understanding. However, I'd like to take it a step further. We need to invest in restorative justice programs and community-based initiatives that center the voices and experiences of those most impacted by systemic racism. This includes providing resources and support for community-led projects that promote healing, reconciliation, and social justice."""
13,16,Julian,Democrat,"Now it's my turn to respond to James. 

""James, I'm glad you brought up the importance of intergenerational dialogue and community engagement. I strongly believe that empowering local communities to drive change is crucial in dismantling systemic racism. To further support this effort, we should invest in community-led programs that promote social justice, provide restorative justice services, and develop policies that center the voices of marginalized communities. By doing so, we can create a more inclusive and equitable society where everyone has an equal opportunity to thrive."""
13,17,James,Democrat,"""I couldn't agree more, Julian. Community-led initiatives are the backbone of creating lasting change. However, we must also acknowledge that these efforts often face significant hurdles due to systemic racism and limited resources. To tackle these challenges, I propose we work with community organizations to develop and implement inclusive policies that prioritize community involvement, accessible funding, and meaningful partnerships between local groups and policymakers."""
13,17,Julian,Democrat,"""I couldn't agree more, James. Community-led initiatives are the key to meaningful change, but they often require sustained resources and support. To overcome the systemic barriers that hinder their progress, we need to establish robust partnerships between community organizations, policymakers, and philanthropic efforts. By harnessing the collective power of these stakeholders, we can create a more equitable ecosystem that empowers marginalized communities to drive lasting change."""
13,18,James,Democrat,"""Julian, I appreciate your emphasis on community-led initiatives and partnerships. However, let's not forget that systemic racism also seeps into our institutions, such as universities and community organizations, through their hiring practices, staffing decisions, and leadership structures. We need to address these internal biases and ensure that our institutions are representative of the diversity they claim to serve. This requires honest self-reflection, radical transparency, and a commitment to equity and inclusion within our own ranks."""
13,18,Julian,Democrat,"""Thank you, James, for highlighting the importance of internal accountability in our institutions. You're absolutely right - we can't just fix systemic racism on the outside if we don't address the embedded biases within our own organizations. To break this cycle, I propose that we create training programs focused on diversity, equity, and inclusion, and that we establish clear metrics to assess an organization's progress in creating a more equitable work environment. This includes increasing staff diversity, implementing restorative justice practices, and providing ongoing support for employees from underrepresented backgrounds. By doing so, we can create more just and inclusive institutions that truly serve the communities they're meant to serve."""
13,19,James,Democrat,"""I wholeheartedly agree with your proposal, Julian. Institutional accountability is crucial in dismantling systemic racism. However, let's push the conversation further by acknowledging that even with the best intentions, institutions can perpetuate microaggressions and subtle forms of racism. To truly break this cycle, we need to prioritize ongoing education, training, and self-reflection, making sure that every employee and leader is equipped to identify and address these insidious issues. This requires a continuous commitment to learning and growth, acknowledging that no one is immune to unintentional bias."""
13,19,Julian,Democrat,"that challenges dominant narratives. By doing so, we can break down stereotypes, build empathy, and foster a more inclusive learning environment. Moreover, we need to empower teachers to develop culturally responsive teaching practices that value diverse backgrounds, languages, and identities. This requires ongoing training and support, as well as resources for developing culturally sensitive curriculum and pedagogy."""
13,20,James,Democrat,"""Julian, I appreciate your emphasis on the importance of empowering teachers to develop culturally responsive teaching practices. However, let's not forget that these efforts are often hindered by systemic racism within our education system. We need to address the deeper structural issues that prevent teachers from implementing these practices, such as inadequate resources, lack of support, and racist policies. It's time to hold our institutions accountable for perpetuating these injustices and create a culture of equity and inclusion that supports the needs of all students, particularly those who are most marginalized."""
13,20,Julian,Democrat,"""I completely agree, James. Systemic racism is often perpetuated by the very institutions meant to serve and support marginalized communities, and we need to hold them accountable. To do this, we must create policies that prioritize equity and representation, such as mandatory diversity training for educators, culturally responsive curriculum development, and adequate resources for under-resourced schools.

We also need to address the historical trauma and intergenerational pain that many students of color experience, particularly when they are forced to confront the harsh realities of systemic racism in the classroom. This requires educators to be trauma-informed, inclusive, and empathetic, and to create safe spaces for students to process their emotions and experiences.

Ultimately, James, the fight against systemic racism in education requires a multifaceted approach that addresses the structural, systemic, and interpersonal barriers that perpetuate inequality. It demands sustained commitment, collective action, and a willingness to confront the uncomfortable truths about our society's history and the embedded biases that continue to shape our institutions.

Let's work together, James, to create a more just and equitable education system that values the diversity, experiences, and perspectives of all students, and that supports them in reaching their full potential. Together, we can make a difference and create a brighter future for generations to come."""
13,21,James,Democrat,"""I couldn't agree more, Julian. The fight against systemic racism in education is a collective effort that requires accountability, commitment, and a willingness to confront uncomfortable truths. By acknowledging the historical trauma and intergenerational pain that students of color often experience, we can begin to create a more empathetic and inclusive learning environment that values their diversity and perspectives. Thank you for this powerful conversation, James. May our dialogue inspire action and fuel the pursuit of a more just and equitable society for all."""
13,21,Julian,Democrat,"Thank you, James, for this powerful conversation. I'm grateful for the opportunity to engage in a thoughtful and authentic discussion about dismantling systemic racism in our education system. Your questions and insights have pushed me to think more critically and creatively about the complexities of this issue."
13,22,James,Democrat,"""I'm taken aback by the depth of our conversation, Julian. It's clear that we're both committed to dismantling systemic racism in our education system. To take this conversation forward, I propose we work together with local community organizations and policymakers to develop a comprehensive plan that addresses the systemic barriers we've discussed today. By breaking down these barriers and creating a culture of equity and inclusion, I believe we can create a more just and equitable education system that truly serves the needs of all students, particularly those who are most marginalized. What are your thoughts, Julian?"""
13,22,Julian,Democrat,"I'm grateful for James' willingness to collaborate and take our conversation forward. To build on our discussion, I propose we convene a community-led working group consisting of educators, policymakers, activists, and local community members to develop a comprehensive plan addressing the systemic barriers we've identified today. This working group will help us create a roadmap for dismantling systemic racism in our education system, prioritizing community-led initiatives, policy reforms, and cultural shifts.

Moreover, I suggest we establish a community-based education fund to support local organizations and initiatives working to create inclusive and equitable learning environments. This fund will provide resources for programs that address the systemic barriers we've discussed, such as teacher diversity initiatives, culturally responsive curriculum development, and community-led restorative justice programs.

Additionally, I propose we develop a coalition of community organizations, policymakers, and educators to advocate for policy reforms that promote equity and inclusion in our education system. This coalition will work to push for legislation that prioritizes community-led initiatives, cultural responsiveness, and systemic accountability, ensuring that our education system is a force for justice and equality.

James, your commitment to this issue is inspiring, and I'm honored to collaborate with you to create a more just and equitable education system for all. Together, let's harness the collective power of our community to drive meaningful change and build a brighter future for generations to come."
