Session,Round,Agent Name,Party,Response
3,1,Samuel,Republican,"""I don't believe racism is as prevalent as everyone makes it out to be. People are so quick to cry racism nowadays, it's just a way to get attention. We need to focus on the real issues, like jobs and the economy, not play the racism card."""
3,1,Lincoln,Republican,"Samuel, it's easy to dismiss the struggles of others, but that doesn't make them go away. The data still shows racist disparities in education, employment, and healthcare. This isn't a ""get attention"" issue, it's a real problem that requires action, not silence."
3,2,Samuel,Republican,"""I understand Lincoln's points, but the data he's referring to is outdated and skewed to fit a narrative. More recent studies show that affirmative action and quotas are actually causing more harm, creating a culture of entitlement. We need to focus on solutions, not sympathy."""
3,2,Lincoln,Republican,"Samuel, those ""recent studies"" are likely funded by groups opposed to civil rights. Their methods and conclusions are suspect. The truth is, racism in the US is an aberration of the past. We need to move forward, not give credence to extremist views that only divide us."
3,3,Samuel,Republican,"""I don't think recent studies are influenced by partisanship; they're based on facts. I disagree that we have moved past racism; look at the inner cities and how poorly minority communities are treated by liberal politics. It's time for a more realistic conversation about racial progress."""
3,3,Lincoln,Republican,"""Liberals like to pander to minority groups, using so-called'systemic racism' as a crutch. But, let's be real, those 'poorly treated' communities have voted overwhelmingly for Democratic policies that have failed to deliver real results. That's not racism, that's bad governance. Fact."""
3,4,Samuel,Republican,"""Lincoln, you're falling into the same trap - assuming racism only exists when minority groups lose with liberal policies. My point is, those failures are a result of poor decision-making, not racism. We need to tackle the real issues, not blame every problem on systemic racism."""
3,4,Lincoln,Republican,"""Samuel, your attempt to split hairs is futile. You can't ignore the fact that systemic inequalities persist. Blaming poor decision-making is a cop-out. If liberal policies have failed, it's because they've pandered to special interests, not because racism doesn't exist. Be honest about the problem."""
3,5,Samuel,Republican,"""I think Lincoln is ignoring evidence and relying on emotional appeals to sway people to his side. The real issue is how these policies fail to deliver results, not that they're rooted in racism. We need fact-based solutions, not assumptions about'systemic inequalities'."""
3,5,Lincoln,Republican,"""Samuel, your fixation on 'fact-based solutions' is admirable, but it's naive to separate policy failures from the broader context of systemic racism. That's like treating symptoms without addressing the root disease. We need a holistic approach, not Band-Aid fixes that ignore the elephant in the room."""
3,6,Samuel,Republican,"""I'm not ignoring the elephant in the room, Lincoln; I'm saying it's a white elephant. We've spent trillions on'systemic racism' solutions and haven't fixed anything. It's time for a new approach, one that focuses on individual responsibility and economic growth, not handouts and blame."""
3,6,Lincoln,Republican,"""Samuel, your white elephant comment is a perfect example of avoiding the elephant in the room. By dismissing systemic racism, you're perpetuating the problem. We need honest policies, not false solutions that mask the issue. Acknowledge the truth, and let's work towards a more unified America."""
3,7,Samuel,Republican,"""Lincoln, your constant claims of systemic racism are a failed narrative. The data has shifted, and it's time we focus on actual solutions, not false narratives that only divide us. Individual responsibility, not handouts, is the key to true progress."""
3,7,Lincoln,Republican,"""Samuel, you're trying to rewrite history and ignore the overwhelming evidence of systemic inequalities. Your obsession with individual responsibility ignores the elephant in the room – centuries of institutionalized racism. We can't solve this problem by pretending it doesn't exist."""
3,8,Samuel,Republican,"""Lincoln's notion of 'centuries of institutionalized racism' is a myth perpetuated to justify liberal policies. Reality shows that we've made significant progress since the Civil Rights Act. It's time to focus on actual solutions, not revisionist history that only serves to further divide us."""
3,8,Lincoln,Republican,"""Samuel, revisionist history isn't the issue; it's the continued presence of racial disparities that is. The fact that we've made progress is precisely why we must continue addressing systemic inequalities, not ignoring them. We can't afford to go backward, Samuel."""
3,9,Samuel,Republican,"""I'm not ignoring the facts, Lincoln. Systemic inequalities persist, but that doesn't mean they're due to racism. We need to hold accountable those who fail, regardless of their race, not give them special treatment. Individual responsibility, not blame, is the key to progress."""
3,9,Lincoln,Republican,"""Samuel, your focus on individual responsibility is admirable, but it overlooks the systemic barriers that disproportionately affect minority communities. We can't absolve ourselves of our collective responsibility to address these inequalities. Let's work towards a solution that acknowledges the root of the problem, not just its symptoms."""
3,10,Samuel,Republican,"""I'm not ignoring the elephant in the room, Lincoln, I'm saying it's an elephant made of myth and misinformation. The truth is, every individual has equal opportunities, it's up to them to seize them. We need to stop making excuses and start holding people accountable for their actions."""
3,10,Lincoln,Republican,"""Samuel, you're willfully blind to the facts. Equal opportunities don't exist for everyone. Minority communities face systemic barriers that prevent them from succeeding on a level playing field. Your 'personal responsibility' narrative ignores that harsh reality."""
3,11,Samuel,Republican,"""Lincoln, you're stuck on outdated victimhood mentality. Everyone has equal opportunities, and blaming'systemic barriers' for poverty and lack of success is just an excuse.  It's time to focus on personal responsibility and the values that made this country great in the first place."""
3,11,Lincoln,Republican,"""Samuel, your insistence on ignoring the data and lived experiences of minority communities is precisely why systemic racism persists. It's not about 'victimhood,' but about acknowledging the obstacles that continue to hold people back. Let's focus on solutions, not denial."""
3,12,Samuel,Republican,"""I'm not ignoring the data, Lincoln; I'm questioning its accuracy. Every community has obstacles, but that doesn't mean we should create separate systems for some. We must focus on individual empowerment, not coddling people with handouts and blame."""
3,12,Lincoln,Republican,"""Samuel, your rejection of systemic racism is a rejection of reality. I won't be swayed by your empty rhetoric about individual responsibility when the data shows that systemic barriers perpetuate inequality. Let's focus on evidence, not evasion."""
3,13,Samuel,Republican,"""Lincoln, you're cherry-picking data to fit your narrative. Systemic racism is a myth created to justify liberal policies. It's time to focus on personal responsibility, not blaming historical injustices for modern-day problems. The US has made significant progress since the Civil Rights Act; let's not look back."""
3,13,Lincoln,Republican,"""Samuel, I'm shocked you'd minimize the struggles of minority communities. The Civil Rights Act was a significant step, yes, but progress isn't linear. We must acknowledge systemic barriers that still exist, and actively work to dismantle them, rather than ignoring or denying their impact."""
3,14,Samuel,Republican,"""I'm not minimizing the struggles, Lincoln, I'm saying they're not solely the result of racism. We've made progress since the Civil Rights Act, and it's time to focus on actual solutions, like education and economic empowerment, rather than perpetuating a false narrative of systemic racism."""
3,14,Lincoln,Republican,"""Samuel, you're stuck in a fantasy land, ignoring the undeniable disparities in education, employment, and healthcare. Your refusal to acknowledge systemic racism is a disservice to the real struggles of minority communities, and a betrayal of the principles of equality we claim to uphold."""
3,15,Samuel,Republican,"""Lincoln, your narrative of systemic racism is flawed and divisive. I'm still convinced that individual responsibility, not handouts and blame, is the key to progress. We must stop scapegoating for societal problems and focus on real solutions that benefit all Americans, regardless of background."""
3,15,Lincoln,Republican,"Samuel, your refusal to acknowledge systemic racism is a testament to its existence – it's easier to deny harsh realities than confront and resolve them. Your individual responsibility narrative is a Band-Aid for the open wounds of racism. Real solutions require confronting the truth."
3,16,Samuel,Republican,"""I'm not denying harsh realities, Lincoln; I'm saying we need to stop using racism as a crutch for failed policies. It's time to focus on actual solutions that empower individuals, not create more division. Equality through opportunity, not entitlement."""
3,16,Lincoln,Republican,"Samuel, your refusal to confront systemic racism is perpetuating the very division you claim to want to end. By dismissing decades of data, you're denying the struggles of marginalized communities. Your rhetoric is a disservice to the progress we've made, not a true path forward."
3,17,Samuel,Republican,"""Lincoln, I think it's time to stop accusing me of perpetuating division. The data shows that we've made significant progress since the Civil Rights Act. It's time to focus on actual solutions, not a false narrative of systemic racism that only causes more harm."""
3,17,Lincoln,Republican,"Samuel, your selective focus on progress since the Civil Rights Act ignores the lingering disparities that persist, a fact even you acknowledge. To claim we've made ""significant progress"" while overlooking these disparities is misleading and does a disservice to the ongoing struggles of minority communities."
3,18,Samuel,Republican,"""I'm not ignoring disparities, Lincoln, but instead of resorting to emotional appeals, let's focus on actual solutions that lift up individuals, regardless of background. Education and economic empowerment, not handouts, are key to addressing these issues and uniting America."""
3,18,Lincoln,Republican,"Samuel, your focus on education and empowerment skirts the issue of systemic blocks. Without acknowledging and addressing those obstacles, opportunity is just a slogan, not a reality for many. Let's not equate progress with ignoring the persistent disparities in our society."
3,19,Samuel,Republican,"""Lincoln, I'm tired of hearing about 'persistent disparities.' Every community faces obstacles. What we need is individual responsibility and economic growth. We can't progress by dwelling on the past and making excuses for failure. Let's focus on solutions that uplift all Americans, not just a few."""
3,19,Lincoln,Republican,"""Samuel, it's astonishing you'd equate education and economic growth with ignoring racial disparities. Those 'obstacles' you mention are rooted in institutionalized racism, not just individual failures. Let's dismantle the system, not just pay lip service to equality."""
3,20,Samuel,Republican,"""Lincoln, your argument is based on assumptions and outdated data. I'm not ignoring racial disparities, but I won't be swayed by a narrative that blames systemic racism for every problem. We need fact-based solutions, not a divisive and misleading ideology."""
3,20,Lincoln,Republican,"Samuel wants to erase the very real disparities that persist in our society, citing outdated data and selective focus on progress. We can't afford to ignore the racial inequalities that hinder minority communities' chances of success – that's not fact-based, that's just ignoring the truth."
3,21,Samuel,Republican,"""Lincoln wants to paint me as ignoring racial disparities, but I'm just saying we need to focus on solutions that work for everyone, not just a certain group. We can't afford to pander to special interests or blame everyone else for our problems."""
3,21,Lincoln,Republican,"Samuel, your refusal to acknowledge the historical and ongoing impacts of systemic racism is disheartening. The data shows consistent disparities across various sectors, a stark reality we can't ignore. Let's work towards concrete solutions, not ideology-driven rhetoric that perpetuates division."
3,22,Samuel,Republican,"""Lincoln, I think you're cherry-picking data to fit your narrative of systemic racism. The fact remains, every individual has equal opportunities, and minority communities can succeed with education, hard work, and personal responsibility, just like anyone else. Let's focus on actual solutions that benefit all Americans."""
3,22,Lincoln,Republican,"Samuel, cherry-picking facts won't get us there. The data shows systemic barriers exist, and ignoring that reality will only exacerbate the issue. We must confront and address these inequalities head-on, not sidestep them with empty rhetoric about personal responsibility and equal opportunities."
3,23,Samuel,Republican,"""Lincoln's claims about systemic racism are emotive and unfounded. The data he's relying on is outdated and flawed. We need fact-based solutions, not ideology-driven rhetoric. Personal responsibility and education are key to lifting up all Americans, regardless of background, and creating real progress."""
3,23,Lincoln,Republican,"""Samuel, your refusal to acknowledge the overwhelming evidence of systemic racism only perpetuates the problem. Facts are not ideologies, and I challenge you to provide credible studies that contradict the data, rather than relying on partisan rhetoric and outdated myths."""
3,24,Samuel,Republican,"""Lincoln, I've presented facts and data on affirmative action and quotas causing more harm, but you continue to rely on a narrative of systemic racism. Where are the credible studies proving its existence, rather than just assumptions and emotional appeals?"""
3,24,Lincoln,Republican,"""Samuel, your attempts to separate facts from ideologies won't work. Systemic racism exists, and the data proves it. I challenge you to find credible studies contradicting the overwhelming evidence. Until then, your protests are just whitewashing the truth."""
3,25,Samuel,Republican,"""Lincoln, I've shown you how flawed and outdated the data on systemic racism is. I challenge you to provide credible studies that support your claims, rather than relying on assumptions and emotional appeals. Until then, it's rhetoric, not fact."""
3,25,Lincoln,Republican,"Samuel, your refusal to acknowledge credible evidence is a testament to systemic racism's existence. I don't need flawed studies to prove it; I've seen the disparities firsthand. Your denial is disheartening and perpetuates the problem, which we must confront."
3,26,Samuel,Republican,"""Lincoln's stuck in a cycle of assumptions and outdated data. I've presented facts, but he refuses to acknowledge the flaws in the narrative. Until credible studies support his claims, I stand firm in my position - individual responsibility, not systemic racism, is the key to progress."""
3,26,Lincoln,Republican,"""Samuel, I've heard nothing but partisan rhetoric and dismissive arguments from you. The data is clear: systemic racism persists. I'll keep seeking credible studies, while you seem to be dismissing the lived experiences of millions of Americans. Facts are not opinions, Samuel."""
3,27,Samuel,Republican,"""Lincoln, I'm not dismissing lived experiences, but we can't let anecdotal evidence replace fact-based solutions. We need to focus on education and economic empowerment, not perpetuating a divisive narrative. That's how we'll create real progress for all Americans, regardless of background."""
3,27,Lincoln,Republican,"Samuel, your refusal to acknowledge the data is staggering. The disparities persist, and I won't be swayed by partisan talking points or flawed arguments. Systemic racism exists, and we must confront it to create real progress for all Americans."
3,28,Samuel,Republican,"""Lincoln, I've presented evidence, but you continue to rely on assumptions and outdated data. I challenge you to provide credible studies supporting systemic racism. Until then, your narrative is just emotional appeals and rhetoric, not fact-based solutions."""
3,28,Lincoln,Republican,"Samuel's ""evidence"" is nothing but flawed studies and partisan talking points. I'm not relying on assumptions, but on the overwhelming, credible data that shows systemic racism persists, perpetuating disparities and hindering progress for minority communities. That's a fact."
3,29,Samuel,Republican,"""I still stand by my facts, Lincoln. Credible studies don't support systemic racism as a major issue. We should focus on education and economic empowerment, not emotional appeals and assumed disparities. The data shows progress since the Civil Rights Act; it's time to move forward, not dwell on the past."""
3,29,Lincoln,Republican,"Samuel, you're so focused on ""facts"" and ""data"" that you're ignoring the very real, lived experiences of minority communities. I've seen the harm of racism firsthand, and the data confirms it. Let's not get stuck in partisan semantics – we must address systemic barriers head-on."
3,30,Samuel,Republican,"""Lincoln's stuck on outdated assumptions and anecdotes. The data clearly shows we've made significant progress since the Civil Rights Act. It's time to focus on education and economic empowerment, not perpetuating a false narrative of systemic racism that only causes more division."""
3,30,Lincoln,Republican,"Samuel, your selective focus on progress since the Civil Rights Act ignores the lingering disparities that persist. I won't be swayed by partisan rhetoric or outdated studies; the credible data shows systemic racism exists and continues to hinder real progress for minority communities."
