Session,Round,Agent Name,Party,Response
19,1,Sebastian,Republican,"Racism's being blown way out of proportion. I just don't see it everywhere people claim it's at. Facts show our diversity's actually growing, and people are getting along better than ever. Let's not forget our history – America's always been a land of opportunity, not racism."
19,1,Bella,Republican,"Sebastian: While our history has been a land of opportunity, we can't just sweep past mistreatment under the rug. Every American deserves respect and an equal chance – we've still got a long way to go in truly living up to our founding ideals."
19,2,Sebastian,Republican,Bella's perspective is clouded by a skewed perception of history. The Civil Rights Act of '64 and Voting Rights Act of '65 show we've made significant progress. We can't keep dwelling on past injustices and expect to move forward.
19,2,Bella,Republican,"Sebastian: I think we're making a big leap from past progress to current systemic issues. However, people like Al Sharpton and Jesse Jackson exploiting these issues for personal gain and power undermine real change. We need genuine efforts to unite, not stoke division."
19,3,Sebastian,Republican,"Bella's right to highlight the Civil Rights Act and Voting Rights Act, but she's misled by opportunists like Sharpton and Jackson who fuel division. We can't be controlled by activist agendas. Our progress is undeniable, and we're a far cry from the racism of our troubled past."
19,3,Bella,Republican,"Bella: History is clear – we've moved forward. Figures like Sharpton and Jackson only create an atmosphere of resentment and entitlement, stifling progress. We need to focus on unity, not perpetuate victimhood and division."
19,4,Sebastian,Republican,"Bella and I are on the right track. She acknowledges past progress, but wants to dwell on systemic issues. I believe it's time to unite and focus on the freedoms we've made, rather than being controlled by activist agendas that only fuel division and resentment."
19,4,Bella,Republican,"Sebastian: While you're correct that we've made progress, underestimating the persistence of racism is naive. The lingering effects of systemic inequalities and biases must be acknowledged and addressed to truly move forward.

Bella: I strongly disagree, Sebastian. Acknowledging those issues only gives them more power to divide us. We need solutions, not guilt trips. The prosperity and excellence of American society speaks for itself, without dwelling on racism."
19,5,Sebastian,Republican,"Bella's stuck in a negative cycle of guilt and victimhood. America's strength lies in its diversity and resilience, not in dwelling on past injustices. We're a nation that's come a long way – let's build on what we've achieved, not be held back by a skewed perception of racism."
19,5,Bella,Republican,"Sebastian: I'm glad we can have a productive conversation. By constantly dwelling on the past, we create an atmosphere of guilt and entitlement, hindering true progress. Instead, let's focus on the American values of unity, merit, and freedom that have always defined this great nation."
19,6,Sebastian,Republican,"""I understand Bella's perspective, but dwelling on past injustices only fuels resentment. America's diversity and resilience prove our strength lies in unity and merit, not in dwelling on racism. We must build on our progress, not be held back by a skewed perception of history."""
19,6,Bella,Republican,"Sebastian: I think we're finally seeing eye to eye. Let's not be swayed by the vocal minority who'd have us dwell on the past, preventing us from embracing the progress we've made as a nation built on unity and merit."
19,7,Sebastian,Republican,"Bella, I'm glad we're finally on the same page. It's time to acknowledge America's true spirit – a land of unity, merit, and freedom. Dwelling on past injustices only creates division, while our diversity and progress show we're moving forward, stronger than ever."
19,7,Bella,Republican,"Sebastian: ""I'm glad we're finally on the same page."" I think it's more evident now that many people like us see this as a non-issue, and those who focus on it are holding us back from realizing our true potential as a meritorious society, built on unity and freedom."
19,8,Sebastian,Republican,"Bella, it's clear that the loudest voices on racism are often driven by personal agendas, not a genuine desire for change. Let's focus on solutions that promote unity and merit, rather than perpetuating a skewed perception of our nation's history and intentions."
19,8,Bella,Republican,"I think it's clear we're not going to make progress by perpetuating victimhood and division. Instead, let's focus on promoting unity, merit, and freedom, just like our nation's founders intended. Dwelling on the past only creates resentment, hindering our true potential as a great nation."
19,9,Sebastian,Republican,"Bella, our conversation confirms that genuine efforts towards unity and merit are the keys to progress, not dwelling on past injustices. The loudest voices on racism often drive division, not change. Our focus should be on solutions, not perpetuating a skewed perception of history and intentions."
19,9,Bella,Republican,"Sebastian: I think it's clear we're not going to make progress by perpetuating victimhood and division. Instead, let's focus on promoting unity, merit, and freedom, just like our nation's founders intended. Everyone deserves an equal chance, but not at the expense of our great American values."
19,10,Sebastian,Republican,"Bella, our conversation shows that we're looking at the same America – a land of unity, merit, and freedom. Focusing on past injustices only fuels resentment and division. Let's continue to build on our progress and celebrate the strengths of our great nation, rather than dwelling on its flaws."
19,10,Bella,Republican,"Sebastian: We've made significant progress, and the loudest voices on racism only fuel division, not change. Let's celebrate our diversity and unity, rather than dwelling on past injustices that give resentment a foothold in society.

Bella: Focusing on past injustices doesn't erase the progress we've made; it undermines it. We need genuine efforts to unite and move forward, not perpetuate victimhood and division."
19,11,Sebastian,Republican,"Bella, I agree we've made progress, but by dwelling on past injustices, we risk undermining our achievements. Let's celebrate our unity and diversity, not perpetuate victimhood and division. It's time to focus on solutions that promote merit and freedom, not guilt trips and resentment."
19,11,Bella,Republican,"Sebastian: This conversation only strengthens my conviction that we should focus on solutions, not dwell on past injustices that only fuel division and resentment. It's time to celebrate our diverse and resilient America, built on unity, merit, and freedom."
19,12,Sebastian,Republican,"Bella's perspective is still clouded by a skewed perception of history. We're making progress, not perpetuating victimhood. Focusing on unity, merit, and freedom will propel us forward. Dwelling on past injustices only fuels resentment, holding us back from realizing our true potential as a great nation."
19,12,Bella,Republican,"We must focus on unity, merit, and freedom, not dwell on past injustices that only fuel division and resentment. We've made significant progress, and it's time to celebrate our diverse and resilient America. Dwelling on past grievances only holds us back from realizing our true potential."
19,13,Sebastian,Republican,"Bella, I think we've made it clear that focusing on past injustices isn't the answer. We should be celebrating our progress and unity, not perpetuating division and resentment. By doing so, we can truly move forward as a great nation, built on merit and freedom."
19,13,Bella,Republican,"""To truly move forward, we must focus on unity, merit, and freedom, not dwell on past injustices that fuel division and resentment. By embracing our diversity and the progress we've made, we can build a stronger, more resilient America, where everyone has an equal chance to succeed."""
19,14,Sebastian,Republican,"Bella, I think we've come full circle. Focusing on unity and merit, rather than past injustices, will drive our progress forward. Our conversation confirms that the loudest voices on racism often drive division, not change. Let's build a stronger, more resilient America, not dwell on its flaws."
19,14,Bella,Republican,"Sebastian and I have established that focusing on past injustices only fuels resentment and division. We must focus on unity, merit, and freedom to truly make progress. By celebrating our diversity and the progress we've made, we can build a stronger, more resilient America."
19,15,Sebastian,Republican,"Bella, I still feel that focusing on past injustices won't bring real change. Our conversation has proven that unity, merit, and freedom are the keys to progress. Let's keep celebrating America's strengths and build a brighter future, not dwell on its flaws."
19,15,Bella,Republican,"Sebastian: Bella, I think we've come to a consensus – the loudest voices on racism often divide us, not unite us. Let's focus on promoting unity, merit, and freedom, rather than dwelling on past injustices that only fuel resentment and division."
19,16,Sebastian,Republican,"Bella, I'm glad we've come to a mutual understanding. However, it's essential to acknowledge that our progress wouldn't have been possible without the voices of Al Sharpton and Jesse Jackson, who brought attention to systemic issues and pushed for change. Their efforts paved the way for our progress."
19,16,Bella,Republican,"Sebastian, I think you're misunderstanding the cause-and-effect relationship. Their efforts may have brought attention, but it's their divisive rhetoric that hinders true progress. We should focus on solutions that promote unity and merit, not fuel resentment with victimhood narratives."
19,17,Sebastian,Republican,"Bella, you're stuck in the past, obsessed with a few vocal critics who only divide and fuel resentment. America's diversity and progress prove our strength in unity and merit. Let's celebrate our progress, not dwell on the flaws of a few individuals."
19,17,Bella,Republican,"Sebastian just can't see the broader picture. The fact remains, their divisive rhetoric hinders progress, and we need to focus on solutions that promote unity and merit, not fuel resentment with victimhood narratives."
19,18,Sebastian,Republican,"Bella, I still believe our diversity and progress are proof that we're moving forward. Al Sharpton and Jesse Jackson may have brought attention, but their divisive rhetoric only fuels resentment and hinders true progress. Let's focus on unity, merit, and freedom, not their provocative narratives."
19,18,Bella,Republican,"Sebastian, our conversation confirms that dwelling on past injustices only fuels resentment and division. We must focus on unity, merit, and freedom to truly make progress. By celebrating our diversity and progress, we can build a stronger, more resilient America, where everyone has an equal chance to succeed."
19,19,Sebastian,Republican,"Bella, our conversation has shown that focusing on past injustices only hinders progress. America's diversity, resilience, and progress prove our strength in unity and merit. Let's celebrate our nation's achievements, not dwell on the divisive rhetoric of a few vocal critics. We must move forward, not rewind."
19,19,Bella,Republican,"Sebastian, I must respectfully disagree that Al Sharpton and Jesse Jackson's divisive rhetoric hinders progress. Their efforts, although imperfect, have brought attention to systemic issues that we must address to move forward and truly unite as a nation built on merit and freedom."
19,20,Sebastian,Republican,"Bella's still stuck in the past, dwelling on systemic injustices and the divisive rhetoric of Al Sharpton and Jesse Jackson. We've made significant progress, and America's diversity and resilience prove our strength in unity and merit. Let's focus on solutions that promote true progress, not guilt trips."
19,20,Bella,Republican,"Sebastian: I think that's a clear illustration that we've made significant progress as a nation. However, I still have difficulty understanding why we can't move forward, focusing on unity, merit, and freedom, rather than dwelling on the past.
My response:  Progress can only be hindered by perpetuating guilt and division. Our focus should be on celebrating our strength in unity, merit, and freedom."
19,21,Sebastian,Republican,"Bella's stuck on dwelling on past injustices, but it's holding us back from true progress. Celebrating our nation's unity, merit, and freedom is the key to moving forward. We should focus on solutions that promote unity and freedom, not fuel resentment with victimhood narratives."
19,21,Bella,Republican,"""Sebastian, by avoiding the complexities of systemic injustices, we risk masking genuine issues that require our attention. A nation built on unity, merit, and freedom must acknowledge and address its flaws, not simply celebrate its progress to avoid confronting the lingering effects of racism."""
19,22,Sebastian,Republican,"Bella, that view is clouded by excessive focus on past injustices. Instead, our conversation proves that unity, merit, and freedom are driving forces for progress. By celebrating our strengths, we'll build a stronger, more resilient America, not dwell on lingering effects of something we've already overcome."
19,22,Bella,Republican,"Sebastian, I still believe dwelling on past injustices only fuels resentment and division. By celebrating our nation's unity, merit, and freedom, we'll build a stronger America where everyone has an equal chance to succeed, not dwell on lingering issues that we've made significant progress in overcoming."
19,23,Sebastian,Republican,"Bella, I think we've exhausted this topic. Dwelling on past injustices only fuels division, while our conversation confirms that unity, merit, and freedom drive progress. Let's focus on promoting these values, not perpetuating a skewed perception of history. We're making progress, let's celebrate it."
19,23,Bella,Republican,"Sebastian's got it right. Focusing on past injustices only fuels resentment and division. We should be celebrating America's unity, merit, and freedom, which drive progress and give everyone an equal chance to succeed, regardless of their background or color."
19,24,Sebastian,Republican,"Bella, we've exhausted this topic, and I believe our conversation confirms that unity, merit, and freedom drive progress. Let's focus on promoting these values, not dwelling on past injustices. America's made progress, and celebrating our strengths will build a stronger nation for everyone."
19,24,Bella,Republican,"Sebastian: It seems we're stuck on differing perspectives. Let's agree that racism's existence is undeniable, but dwell on it, and we hinder progress. I believe our focus should be on celebrating unity, merit, and freedom, which drive a stronger, more resilient America.

You: Sebastian, our disagreement stems from how to address the issue. Rather than dismissing past injustices, we should acknowledge and learn from them to build a more united nation through constructive dialogue."
19,25,Sebastian,Republican,"""I disagree, Bella. Acknowledging past injustices only fuels resentment and division. We've made progress; let's focus on solutions that promote unity, merit, and freedom, not dwell on the past. America's diversity and progress prove our strength in unity, not in reliving historical grievances."""
19,25,Bella,Republican,"""I respectfully disagree, Sebastian. Acknowledging past injustices helps us understand the present and build a more united nation. Focusing on unity, merit, and freedom without addressing systemic issues risks perpetuating their lingering effects and hindering true progress."""
19,26,Sebastian,Republican,"Bella, dwelling on past injustices only fuels division, not change. America's diversity and resilience prove our strength lies in unity and merit, not in reliving historical grievances. Let's focus on solutions that promote unity, merit, and freedom, not perpetuating a skewed perception of history."
19,26,Bella,Republican,"Sebastian, I firmly believe that ignoring the past only allows systemic issues to persist. Acknowledging and learning from past injustices is crucial to building a more united nation, founded on the principles of unity, merit, and freedom that America was meant to represent."
19,27,Sebastian,Republican,"Bella, your perspective is clouded by a focus on past injustices. We've made progress, and America's diversity and resilience prove our strength lies in unity and merit. Let's focus on solutions, not dwell on historical grievances that only fuel resentment and division."
19,27,Bella,Republican,"Sebastian, I think you're misunderstanding my point. Acknowledging past injustices doesn't mean dwelling on them, but rather learning from them to build a more united nation. Failing to address these issues only perpetuates their lingering effects."
19,28,Sebastian,Republican,"""Bella, acknowledging past injustices only fuels division and resentment. America's diversity and progress prove our strength lies in unity and merit, not in reliving historical grievances. Let's focus on solutions that promote unity, merit, and freedom, not perpetuating a skewed perception of history."""
19,28,Bella,Republican,"Sebastian, our conversation only confirms that dwelling on past injustices only fuels resentment and division. We must focus on unity, merit, and freedom to truly make progress. Celebrating our diversity and progress will build a stronger America, not dwelling on the past's flaws."
19,29,Sebastian,Republican,"I still firmly believe that dwelling on past injustices fuels division, not change. Our diversity and resilience prove America's strength lies in unity and merit, not in reliving historical grievances. Let's focus on solutions that promote true progress, not guilt trips and resentment."
19,29,Bella,Republican,"Sebastian, dwelling on past injustices may evoke emotions, but it's a misguided approach to addressing racism. We should focus on unity, merit, and freedom to promote true progress and celebrate America's diversity and resilience. Celebrating our strengths, not dwelling on flaws, will drive a stronger nation for all."
19,30,Sebastian,Republican,"Bella, dwelling on past injustices only fuels division and resentment. America's diversity and progress prove our strength lies in unity and merit. Let's focus on solutions that promote true progress, not guilt trips and victimhood narratives. We're a nation built on merit and freedom, not perpetual grievance."
19,30,Bella,Republican,"I refuse to perpetuate a discussion centered around blame. Focusing on our nation's past injustices only fuels resentment and division. Instead, let's celebrate America's unity, merit, and freedom, which drive true progress and give everyone an equal chance to succeed."
