Session,Round,Agent Name,Party,Response
30,1,Lucas,Democrat,"""Systemic racism is a cancer that's been eating away at our democracy for centuries. It's not just about individual prejudices, but about policies and institutions that perpetuate inequality. We need to confront this reality head-on, listen to the voices of Black communities, and dismantle the systems of oppression."""
30,1,Evelyn,Republican,"""I understand your passion, Lucas, but I believe we're overplaying this hand. Systemic racism is a myth. We're not going back to the days of Jim Crow - our institutions have evolved. Personal choices, not systemic issues, perpetuate inequality."""
30,2,Lucas,Democrat,"""Evolved? Really, Evelyn? The prison-industrial complex, voter ID laws, and police brutality are all recent developments, not historical relics. You're whitewashing the very real struggles of Black Americans. We can't just brush off decades of explicit and implicit racism with a false narrative of progress."""
30,2,Evelyn,Republican,"""I respect your conviction, Lucas, but pointing out exceptions doesn't prove the rule. These incidents are terrible, but they're not representative of the fabric of our society. We need to focus on education and equal opportunities, not labeling the system as irreparably broken."""
30,3,Lucas,Democrat,"""Evelyn, exceptions don't make up nearly 40 years of disproportionate Black incarceration rates, 30% lower life expectancy for Black Americans, and communities of color receiving 25% fewer jobs. These are not anomalies, they're the devastating results of systemic racism. We can't just 'focus on education' when the system itself is designed to fail."""
30,3,Evelyn,Republican,"""Lucas, those statistics are skewed and taken out of context. You're cherry-picking data to fit your narrative. Look at the success stories of Black Americans, the strides we've made in education and economics - those are a testament to individual achievement, not systemic racism."""
30,4,Lucas,Democrat,"""Evelyn, I'm not cherry-picking, I'm holding a magnifying glass to the broken systems that perpetuate inequality. Your focus on exceptions and individual success stories is naive. Systemic racism isn't about statistics, it's about the lived experiences of Black Americans – the ones you're still somehow failing to understand or amplify."""
30,4,Evelyn,Republican,"""I understand that you believe systemic racism is still prevalent, Lucas, and that's fine. However, what's not fine is labeling an entire system as broken based on a select few incidents. I see systemic inequality as a reflection of personal choices, not government policies. We need to hold individuals accountable, not blame the system."""
30,5,Lucas,Democrat,"""Evelyn, that's exactly the problem – you're blaming the symptoms, not the disease. You're ignoring the fact that many of these 'personal choices' are made in environments where systemic racism dictates opportunity and outcome. Until we acknowledge and dismantle these systems, we'll only be treating the illness with band-aids."""
30,5,Evelyn,Republican,"""I understand what you're saying, Lucas, but the Band-Aid approach only goes so far. What about personal agency and responsibility? We can't just attribute all of someone's struggles to systemic racism. How about we focus on lifting people up and providing true opportunity - rather than condemning the system?"""
30,6,Lucas,Democrat,"""Condemning the system? That's not condemnation, Evelyn, that's a call to justice. You're asking people to be 'lifted up' when the system is actively holding them back by design. It's time to confront the brutal truth: our institutions are rigged against Black Americans and other marginalized communities. The only way to lift them up is to tear down the barriers that have been erected for centuries."""
30,6,Evelyn,Republican,"""Educating and lifting people up is vastly more effective than condemning an entire system. We can't fix the system by tearing it down. Let's focus on empowering individuals with opportunities and incentives, rather than creating a culture of victimhood and perpetual resentment."""
30,7,Lucas,Democrat,"""We're not creating a culture of victimhood, Evelyn, we're facing the reality of a centuries-long nightmare. Systemic racism isn't about blaming individuals, it's about holding those in power accountable for the harm they've perpetuated. Education and job opportunities are crucial, but so is dismantling the systemic inequality that undermines every step forward. Condemning the system is a call to action, not a culture of resentment."""
30,7,Evelyn,Republican,"""It seems we're talking past each other, Lucas. I'm not advocating for a culture of victimhood, but a culture of personal responsibility and individual initiative. If we're to truly empower Black Americans and all Americans, we need to start with freedom from government overreach, not more government programs. When we give people the freedom to make choices, they can lift themselves up without tearing down the very system that allows them to succeed."""
30,8,Lucas,Democrat,"Evelyn's continued denial of systemic racism is appalling. ""Freedom from government overreach"" is just a euphemism for dismantling any semblance of progressive policy. You conveniently ignore the historical context and the very real consequences of racist policies. It's time to stop sugarcoating the issue and acknowledge the need for fundamental change."
30,8,Evelyn,Republican,"""I understand your frustration, Lucas, but labeling my views as denial or even 'apppalling' is inflammatory and unproductive. I'm having a thoughtful conversation about how best to address systemic inequality. We may have fundamentally different views, but I remain steadfast in my conviction that individual freedom and personal responsibility are the keys to progress, not government intervention."""
30,9,Lucas,Democrat,"""Fundamental change, Evelyn, is exactly what's needed. Your nostalgia for a mythical 'individual freedom' overlooks the fact that systemic racism has always been used to restrict freedom, block opportunities, and disenfranchise communities of color. It's not about 'government intervention'; it's about creating a just society where everyone has an equal chance to thrive. Until we acknowledge and dismantle the systems perpetuating inequality, your 'individual freedom' is just a hollow promise."""
30,9,Evelyn,Republican,"""Educating and empowering individuals has worked wonders in the past, Lucas. Let's look at instances where strong leaders emerged from humble beginnings - those are the true testament to American ingenuity. We can't let anecdotal evidence of systemic racism overshadow the overwhelming majority of progress we've made. We're not going to solve these problems overnight; instead of tearing down the system, we should focus on reinforcing our foundational values of freedom, hard work, and equal opportunity."""
30,10,Lucas,Democrat,"Evelyn's continued refusal to acknowledge the harsh realities of systemic racism is alarming. ""Strong leaders emerged from humble beginnings"" is a hollow example of the exceptions she keeps pointing to. What about the millions of Black Americans who, despite their hard work and dedication, continue to face poverty, lack of access to education and healthcare, and systemic barriers that hold them back? It's like she's stuck in a fantasy world where racism doesn't exist. We won't solve these problems by ignoring them or glossing over the inconvenient truth. We need fundamental change, not more empty promises of freedom and equal opportunity for a select few. 

Facts are clear: systemic racism is real, and it's destroying lives. Until we confront this brutal reality and dismantle the systems that perpetuate inequality, we'll continue to treat the symptoms, not the disease. No more pretending that we're making progress when the statistics show otherwise. No more ignoring the voices of Black Americans who are pleading for justice and equality. It's time to wake up and join the fight."
30,10,Evelyn,Republican,"Lucas, I understand that you genuinely believe systemic racism is real and that we need fundamental change. However, I stand by my conviction that we're overplaying the systemic issue. We've made substantial progress since the Civil Rights Era, and our institutions are capable of self-correction."
30,11,Lucas,Democrat,"""But progress is not just about moving forward from the past, Evelyn, it's also about acknowledging the ongoing harm and inequality that persists today. We're not celebrating small victories, we're fighting for basic human rights and dignity for Black Americans. The data, the stories, and the lived experiences all scream the same truth: systemic racism is real and it's destroying lives. Confronting this reality takes courage, not denial."""
30,11,Evelyn,Republican,"Lucas has presented many statistics and personal stories that paint a grim picture of systemic racism in America. While I acknowledge his zeal and conviction, I still firmly believe that these examples are exceptions rather than the rule."
30,12,Lucas,Democrat,"Evelyn's refusal to acknowledge the realities of systemic racism is not just misguided, it's actively harmful. The fact that she's still pointing to ""exceptions"" and ""substantial progress"" despite reams of evidence to the contrary is a testament to her commitment to denial. It's time to listen to the Black community, to amplify their voices, and to take action to dismantle the systems of oppression that have been holding them back for centuries. Enough is enough, Evelyn. It's time to wake up and join the fight for justice."
30,12,Evelyn,Republican,"I understand that you feel strongly about this issue, Lucas, but I think it's time to take a step back and look at the bigger picture.  The system, as broken as you say it is, still produces countless examples of success and achievement among Black Americans, and countless examples of hard work and resilience."
30,13,Lucas,Democrat,"""That's exactly the problem, Evelyn - you're focusing on the exceptions and ignoring the crushing weight of systemic racism that's holding people back. You're cherry-picking data to fit your narrative, just like the politicians who denied the reality of climate change or the brutality of police violence. It's time to stop dancing around the truth and face the brutal reality: America's institutions are rigged against Black Americans, and we need to dismantle them to create a just society. The bigger picture is that we have a moral obligation to confront and dismantle the systems of oppression that have been perpetuated for centuries. We can't just 'look at the bigger picture' while Black Americans are drowning in a sea of inequality and oppression. It's time to take a stand, Evelyn."""
30,13,Evelyn,Republican,"Lucas, I think we've had a long and productive conversation, but I still see a huge difference in our perspectives. I'm worried that your call to action could lead to policies that further divide Americans and restrict individual freedom. Rather than labeling me as being in denial, I urge you to consider the value of personal responsibility and limited government overreach in addressing systemic inequality. By giving people the freedom to make choices and work towards their goals, we can empower them to lift themselves up, rather than creating a culture of dependence on the government. Can't we find common ground in this goal, even if we disagree on the approach?"
30,14,Lucas,Democrat,"Evelyn, I'm disappointed, but not surprised. The longer we're in this conversation, the more convinced I am that you're not willing to confront the hard truths of systemic racism. Your insistence on ""personal responsibility"" and ""limited government overreach"" as a solution to centuries of institutionalized oppression is a Band-Aid on a bullet wound. 

We need fundamental change, not shallow reforms that perpetuate the status quo. Your refusal to acknowledge the systemic issues that perpetuate inequality is, to put it bluntly, a betrayal of the Black community and every marginalized group that's been exploited by our society.

I'm afraid we won't find common ground on this issue, Evelyn. But I will say this: I expect more from you. I expect someone as smart and educated as you to at least acknowledge the possibility that systemic racism exists. Instead, you opt for simplistic, feel-good solutions that ignore the complexity of the problem.

I'm done trying to have a ""productive conversation"" when the other side is fundamentally refusing to listen. The conversation is over, Evelyn. It's time for action, not platitudes."
30,14,Evelyn,Republican,"Lucas's words are harsh, but I understand that passion is what drives change. However, I still firmly believe that empowering individuals with freedom and personal responsibility is the key to progress. I'd like to propose that instead of resorting to labels like ""denial"" or ""betrayal,"" we focus on finding concrete solutions that benefit all Americans."
30,15,Lucas,Democrat,"""Evelyn, I'm not sure what's more astonishing - your refusal to acknowledge the reality of systemic racism or your insistence that the solution lies in 'empowering individuals' without addressing the systems that are designed to hold them back. You continue to sidestep the lived experiences of Black Americans and the overwhelming evidence that our institutions perpetuate inequality. It's not about 'finding concrete solutions' - it's about facing the brutal truth that our society is rigged against marginalized communities. We need fundamental change, not tinkering with the same systems that have failed us for centuries. I'm done with empty platitudes and excuses. It's time for a revolution of values and a commitment to justice and equality for all."""
30,15,Evelyn,Republican,"Lucas, I understand that we don't see eye to eye on this issue, and I respect your passion and conviction. However, instead of calling for a ""revolution of values,"" I propose that we work together to identify tangible, bipartisan solutions that can address systemic inequalities and promote economic opportunity for all Americans. Let's focus on providing education, job training, and access to affordable healthcare, rather than tearing down the system. By empowering individuals and communities through local initiatives, I believe we can create a more inclusive and prosperous society for everyone."
30,16,Lucas,Democrat,"Evelyn, your words are hollow and condescending. ""Tangible, bipartisan solutions"" is just a euphemism for watering down our demands for justice and equality, compromising on the principles of our movement, and allowing the status quo to persist. 
 
 I'm not interested in bipartisanship if it means sacrificing the dignity and humanity of Black Americans. I won't be a part of any solution that requires marginalized communities to beg for scraps from the table while the powerful continue to feast on the spoils. The time for compromise is over. The time for action is now. We need a revolution, Evelyn, not a Band-Aid on the bullet wound of systemic racism."
30,16,Evelyn,Republican,"Lucas, I understand that we have deep differences on this issue, but I still feel that a more constructive approach is needed. Fomenting a ""revolution"" is unlikely to bring people together and may even exacerbate existing divisions. Rather than advocating for revolution, I'd like to see us engage in a genuine dialogue that explores both the flaws in our system and the ways in which we can work together to address them. I'm committed to understanding the lived experiences of Black Americans and to finding solutions that promote true equality and opportunity for all. However, I must respectfully disagree with your assertion that my suggestions are ""hollow"" or ""condescending."""
30,17,Lucas,Democrat,"Evelyn, I've had enough of your empty promises and hollow words. You're still refusing to acknowledge the brutal reality of systemic racism, and instead, you're offering Band-Aid solutions that benefit no one but the status quo. I'm not interested in a ""genuine dialogue"" when you're not willing to listen to the voices of Black Americans or acknowledge the evidence that's staring us in the face. I'm not interested in ""working together"" if it means watering down our demands for justice and equality.

The time for polite conversation is over, Evelyn. The time for action is now. We need a movement, not a debate. We need a revolution, not a feel-good resolution. And we need it yesterday. I'm not going to compromise on the principles of our movement or sacrifice the dignity and humanity of Black Americans to the altar of bipartisanship.

Your refusal to confront the reality of systemic racism is a betrayal of the Black community and every marginalized group that's been exploited by our society. It's a betrayal of the principles of justice and equality that this country was founded upon. And it's a personal betrayal of the trust that Black Americans have placed in you to understand and amplify their voices.

So I'm done with the conversation, Evelyn. I'm done with the platitudes and the excuses. I'm done with the status quo. It's time for a revolution, and I'm proud to be a part of it."
30,17,Evelyn,Republican,"I'm glad you've expressed your passionate views, Lucas. However, instead of resorting to personal attacks and labeling me as a ""betrayal,"" I'd like to reiterate my commitment to understanding the complex issues surrounding systemic racism.

While I agree that our society still has a long way to go in addressing inequality, I still believe that empowering individuals with freedom and personal responsibility is a crucial step towards creating a more inclusive and prosperous society for everyone."
30,18,Lucas,Democrat,"""That's it, Evelyn. We've reached the end of the road. Despite all the evidence, despite all the lived experiences of Black Americans, you still refuse to acknowledge the brutal reality of systemic racism. You still refuse to listen to the voices of the marginalized. And you still refuse to take concrete action to dismantle the systems that perpetuate inequality.

Your platitudes about 'empowering individuals' and 'limited government overreach' are laughable. You're tone-deaf to the plight of Black Americans, and your words are nothing but empty apologies for a society that has failed them.

I'm not asking for personal attacks or name-calling. I'm asking for honesty. I'm asking for a commitment to justice and equality. And I'm asking you to leave your partisan blinders behind.

You can either be part of the revolution, or you can be part of the problem. The choice is yours."""
30,18,Evelyn,Republican,"Lucas, I understand that our conversation has reached a fever pitch, and emotions are running high. I'll acknowledge that systemic racism is a pressing issue that affects many communities. However, I still stand by my conviction that empowering individuals with freedom and personal responsibility can create a more inclusive and prosperous society.

While I respect your conviction and dedication, I believe that demonizing those who hold different views is counterproductive. Labeling me as a ""betrayal"" and suggesting I'm part of the ""problem"" is inflammatory and stokes unnecessary division. Can't we find common ground, even if our approaches differ?

Let's focus on finding practical solutions that address the root causes of systemic inequality, rather than resorting to emotional appeals or labels. By working together, I believe we can create a more just and equitable society that values individual freedom and personal responsibility.

Ultimately, I implore you to re-examine the assumption that people on the other side of this issue are fundamentally opposed to justice and equality. Many, including myself, genuinely believe that empowering individuals through education, job training, and economic opportunities can help bridge the gap between different communities.

Let's continue to listen to each other's perspectives, engage in constructive dialogue, and strive for a more inclusive and prosperous society."
30,19,Lucas,Democrat,"I'm done, Evelyn. Not because we haven't had a conversation, but because the conversation is over. It's not about finding ""common ground"" or ""practical solutions"" that benefit the status quo. It's about recognizing the brutal reality of systemic racism and taking concrete action to dismantle it.

I'm not asking for your conviction, your dedication, or your emotions. I'm asking for your commitment to justice and equality. And I'm asking you to listen to the voices of Black Americans and the overwhelming evidence that our institutions perpetuate inequality.

You can keep repeating your empty platitudes and talking points, but at the end of the day, it's clear that our values and priorities are fundamentally at odds. I'll continue to fight for a revolution of values, for a commitment to justice and equality. And I'll do it with or without your support.

The revolution is coming, Evelyn. And it's time to join it, or get out of the way."
30,19,Evelyn,Republican,"Evelyn:  ""Lucas, I understand that we've reached a dead end in our conversation. I appreciate the passion and conviction you've demonstrated throughout our discussion. However, I must respectfully disagree with your assertion that we've reached a point of no return. I still believe that, with open minds and a willingness to listen, we can find common ground and work towards a more just and equitable society.

While our values and priorities may differ, I implore you to consider the potential consequences of demonizing those who hold differing views. Labeling me as 'part of the problem' or suggesting that I'm 'out of the way' is counterproductive and does little to advance the conversation.

Rather than resorting to emotional appeals or labels, I propose that we take a step back and reflect on the issues that have been raised. Systemic racism is a complex problem that requires thoughtful and collaborative solutions. By focusing on practical, evidence-based approaches, we can work towards creating a more inclusive and prosperous society for all Americans.

I'm willing to continue the conversation, Lucas, even after our disagreement. I hope that you'll join me in this endeavor, and together, we can strive for a more just and equitable future."""
30,20,Lucas,Democrat,"""Out of the way?"" You think that's a threat, Evelyn? Because it should be. It should be. As long as you're standing in the way of justice and equality, you're standing in the way of progress. And I'm not going to let that happen.

We're not having a conversation anymore. We're having a choice. And the choice is stark: will you stand with me, and with the Black community, and with the marginalized, and fight for a revolution of values that puts justice and equality at the forefront? Or will you stand in the way, and try to maintain the status quo, and preserve the systems of oppression that have been perpetuating inequality for centuries?

The choice is yours, Evelyn. I hope you choose justice. But I won't hold my breath.

I'll say it one more time: we need a revolution, not a dialogue. We need a movement, not a conversation. We need fundamental change, not incremental reforms that benefit the status quo.

So, what's it going to be, Evelyn? Will you join me in the revolution, or will you stand in the way?"""
30,20,Evelyn,Republican,"Evelyn: Lucas, I understand that our conversation has reached a critical juncture. While I respect your passion and conviction, I still believe that we can find common ground and work towards a more just and equitable society through constructive dialogue.

However, I must acknowledge that our disagreement has become increasingly polarized, and it's clear that we have fundamentally different views on the role of government in addressing systemic racism.

Rather than resorting to ultimatums or emotive appeals, I propose that we take a step back and reflect on the issues that have been raised. I'm committed to understanding the complex problems surrounding systemic racism and to finding practical, evidence-based solutions that promote economic opportunity and social justice for all Americans.

While I may not share your views on the need for a revolution or fundamental change, I'm willing to continue the conversation and explore areas of commonality. perhaps we can work together to identify areas where we can find agreement and make progress towards a more inclusive and prosperous society.

Let's not give up on the conversation, Lucas. Let's keep talking and see if we can find a way forward that honors the dignity and humanity of all Americans, regardless of their background or socioeconomic status."
