Session,Round,Agent Name,Party,Response
4,1,Anthony,Democrat,"""I fundamentally disagree with the notion that racism is a relic of the past. Systemic oppression persists today, perpetuated through laws, practices, and policies that disproportionately affect communities of color. We must acknowledge this reality and work tirelessly to dismantle these structures, ensuring equal opportunities for all."""
4,1,Sophia,Republican,"""I understand your perspective, but I genuinely believe racism isn't as prevalent as you claim. Equal opportunities should be within reach for all, regardless of skin color. Instead of 'dismantling structures,' we should focus on empowering communities to succeed through education and personal effort."""
4,2,Anthony,Democrat,"""I respect your sentiment, Sophia, but empowerment through education alone isn't enough. We've seen time and time again that communities of color face discriminatory barriers, from voting rights to housing and employment. The system is indeed stacked against them, and until we address these systemic inequalities, we can't truly achieve equal opportunities."""
4,2,Sophia,Republican,"""I still believe systemic oppression isn't the issue, but individual failures. Everyone deserves equal opportunities, regardless of their background. We should focus on personal responsibility and accountability. Creating entitlement and dependency on the system isn't the answer – empowering individuals is."""
4,3,Anthony,Democrat,"""That's a myopic view, Sophia. You're neglecting the collective impact of centuries of systemic racism, which has created unequal opportunities and imposed additional burdens on people of color. Empowering individuals isn't enough when they're starting at a significant disadvantage. We need policy changes to address these disparities, not just individual effort."""
4,3,Sophia,Republican,"""I understand where you're coming from, Anthony, but you can't ignore the role of personal choices and initiative. Every individual has the ability to overcome obstacles. By promoting equal opportunities and removing any bias, those with determination and hard work can excel. We can't be held back by perceived past injustices. What about the progress we've made so far?"""
4,4,Anthony,Democrat,"""Perceived past injustices may be forgotten by some, Sophia, but their impact persists. Progress is indeed an improvement, but it's only a Band-Aid on a deeper wound. We must address the underlying racism, not just its symptoms. History has shown us that personal initiative alone cannot overcome systemic barriers constructed by others. We need structural change, not just words of encouragement."""
4,4,Sophia,Republican,"""Anthony, I understand you feel progress isn't enough, but I still see the strides we've made in civil rights. Education and personal responsibility can get us even further. Let's also not forget that every person, regardless of background, has the right to pursue their dreams and achieve success with hard work and determination."""
4,5,Anthony,Democrat,"""I appreciate your optimism, Sophia, but optimism isn't enough. Progress feels like a whispered promise when black families can still earn 70 cents on the dollar compared to whites. Educational attainment doesn't compensate for generational poverty, and personal responsibility can't overcome a gerrymandered map that dilutes minority voting power. Structural change needs to confront these undeniable facts."""
4,5,Sophia,Republican,"""I understand your frustration, Anthony, but letting decades-old injustices dictate our policies isn't productive. Let's focus on implementing fair and effective solutions, not making assumptions about people's lives. By empowering them with equal opportunities and resources, individuals can break free from the cycles of poverty. Personal responsibility is just that, personal, and everyone deserves the chance to pursue their dreams."""
4,6,Anthony,Democrat,"""Empowerment is not a zero-sum game, Sophia. If you're willing to provide opportunity, you must also acknowledge the barriers that prevent people of color from accessing those opportunities. It's not simply a matter of personal responsibility; it's about systemic equality. We should focus on dismantling the existing racial hierarchy and creating a just and inclusive society, where everyone has the chance to flourish, regardless of their background."""
4,6,Sophia,Republican,"""I respectfully disagree, Anthony. Your words imply that inherent biases can't be overcome by hard work and determination, that people of color are somehow perpetually doomed to failure due to societal structures. That's a bleak outlook and an insult to the countless individuals who've achieved success despite obstacles. Every person deserves a fair shot, and I believe we're giving them that."""
4,7,Anthony,Democrat,"""Your characterization of my views, Sophia, misrepresents the nuance of this issue. I'm not saying people of color can't overcome obstacles, but that the obstacles are indeed real and must be acknowledged. It's time for a paradigm shift, not from empowerment to dependency, but from empowerment in isolation to empowerment within a system designed to lift everyone, not just the privileged few. That's the difference between progress and true equality."""
4,7,Sophia,Republican,"""I see your point, Anthony, but equality can't be achieved through policies that impose one-size-fits-all solutions. Instead of a top-down approach, we should allow people to lift themselves up through education, work ethic, and personal responsibility. That's how America has always thrived – by giving everyone a fair shot and trusting in the power of individuals."""
4,8,Anthony,Democrat,"""Still, Sophia, you continue to overlook the systemic impact of these very'solutions' you propose. Education and hard work may have once been sufficient, but now we have mass incarceration, voter suppression, and housing segregation – all perpetuating inequalities that can't be solved by individual initiative alone. Equality demands a level playing field, not just opportunities."""
4,8,Sophia,Republican,"""Anthony, I think we're getting bogged down in hypotheticals and forgetting the foundation of our great nation: individual freedom and meritocracy. If people want to succeed, they should seize those opportunities with hard work and determination. We can't control the past, but we can shape the future by empowering each other to rise above adversity, not by relying on government intervention. That's the American way."""
4,9,Anthony,Democrat,"""I won't sugarcoat it, Sophia - under your 'American way,' we've seen the erosion of collective bargaining rights, the gutting of voting laws, and the systemic oppression of communities of color. Your'meritocracy' ignores the fact that centuries of racism have denied people of color equal footing, making it impossible for them to rise above adversity without structural changes. Progress needs a push, not just a whisper."""
4,9,Sophia,Republican,"""Sophia: I think we've talked enough about hypotheticals and assumptions, Anthony. The fact remains that every person deserves equal opportunities, regardless of their background. I'd like to shift our focus to practical solutions. What specific policies or changes would you propose to address racial disparities?"""
4,10,Anthony,Democrat,"""Finally, Sophia, now we're getting somewhere.  I'd propose policies that address implicit bias in hiring practices, affirmative action in education and job training programs, and community-based initiatives to rebuild wealth and equity in historically marginalized neighborhoods. We also need to strengthen voting rights laws, reform systemic policing practices, and implement economic development programs that empower communities of color. By facing these challenges head-on and fostering inclusive economic growth, we can create a more just society where everyone has the chance to thrive."""
4,10,Sophia,Republican,"""I still disagree, Anthony, but I'll give you credit for proposing concrete solutions.  Your ideas, although admirable, still rely on the federal government intervening in various aspects of our lives.  What about a more bottom-up approach?  Let local communities drive economic growth and social change.  It's been my experience that grassroots initiatives are more effective in empowering marginalized groups.  By giving people the freedom to problem-solve on their own, we can promote entrepreneurship, innovation, and real progress."""
4,11,Anthony,Democrat,"""It's commendable that you're looking to local communities for solutions, Sophia, but that's precisely where systemic barriers stifle progress. Grassroots efforts often face institutional pushback and lack the resources to make significant change. We need a combination of both top-down policy reforms and bottom-up community engagement to create lasting, inclusive growth. That's why, in addition to policy proposals, I've been working with local organizers to launch initiatives like community land trusts, cooperatively owned businesses, and educational programs that empower marginalized communities to take charge of their own development. It's time to weave these efforts together with systemic changes to create a fabric of true equality."""
4,11,Sophia,Republican,"""I appreciate the sincerity behind your proposals, Anthony, but local community-led initiatives have a proven track record of success. By giving people the freedom to problem-solve without heavy-handed government intervention, we empower them to address their unique challenges and find creative solutions. The government may have good intentions, but its involvement often hinders actual progress,"""
4,12,Anthony,Democrat,"I'd like to clarify that progress hasn't been equitably distributed. For every success story of a marginalized community, there are countless others who are still fighting for basic rights and equality. We can't solely rely on local initiatives without acknowledging the systemic injustices that hinder their progress. We need both a bottom-up and top-down approach to create meaningful change, and that's why I'm committed to addressing these complex issues in a holistic way, rather than simply celebrating isolated successes."
4,12,Sophia,Republican,"Sophia: ""Anthony, I think we've reached an impasse. Despite our differing opinions, I'm proud of the passion and commitment we're both showing in this debate. I'd like to propose that we agree to disagree, and instead focus on finding common ground to work towards a more inclusive and equitable society. Perhaps we can explore ways to support local community-led initiatives while also working towards policy changes that promote fairness and equality. It's time for us to put our differences aside and work towards a brighter future for all Americans."""
4,13,Anthony,Democrat,"""I appreciate your proposal, Sophia, and I believe that finding common ground is essential to progress. Let's indeed focus on supporting local community-led initiatives, while also advocating for policy changes that promote fairness and equality. I'd be willing to work alongside you to push for legislation that addressesimplicit bias in hiring practices, amplifies the voices of marginalized communities, and creates economic development programs that empower historically underinvested neighborhoods. Together, we can create a more just and inclusive society, one that values and uplifts the diversity that makes America strong."""
4,13,Sophia,Republican,"Sophia: ""Thank you, Anthony. I truly believe that by putting aside our differences and working together, we can create meaningful change. Let's focus on policy solutions that support local community-led initiatives, rather than imposing one-size-fits-all government interventions. By giving people the autonomy to problem-solve and drive their own economic growth, we can harness the power of innovation and inclusivity. Our shared goal should be to empower individuals and communities to succeed, rather than relying on bureaucratic solutions. Together, we can build a brighter future for all Americans."""
4,14,Anthony,Democrat,"Sophia: ""Anthony, I appreciate your commitment to working together, but some points still feel unresolved between us. For me, it comes down to trusting individuals to seize equal opportunities. In my opinion, government intervention often ends up being the problem, not the solution.""

Anthony: ""Sophia, I see your concern, but let's not forget the structural barriers that have historically held people of color back. You can't simply'seize opportunities' when they're not equally available. A system that promotes equal opportunity needs policy changes to dismantle these systemic inequities.""

Sophia: ""Anthony, I agree that policy can play a role in leveling the playing field, but we can't let that become an excuse for expecting less from marginalized communities. The reality is that individuals from every background have achieved incredible success with the same education and opportunities available to them.""

Anthony: ""I understand your optimism, Sophia, but we've been having this conversation for a while, and I still see a fundamental difference between theory and practice. Until we address the systemic injustices, we're just scratching the surface of real equality. Every policy proposal and community initiative needs to be embedded with a commitment to dismantle these structures.""

Sophia: ""Anthony, I get why you're passionate about policy change, but what about the incredible impact that grassroots initiatives have had? In recent years, local leaders and organizers have used bottom-up approaches to drive real social change. There's power in recognizing the individual's capacity for initiative and self-determination.""

Anthony: ""Grassroots initiatives are undoubtedly vital, Sophia, but don't you see that systemic barriers often prohibit them from succeeding? The key to lasting change lies in integrating top-down policy reforms with the empowerment that comes from community-led initiatives. By embracing both, we can create a true landscape of equality, rather than cherry-picking individual success stories.""

Sophia: ""Anthony, you're convinced that policy-driven solutions are the only answer. If only we could see the value in grassroots initiatives as a vital part of any strategy. Every marginalized community should be able to take ownership of their own progress, rather than relying solely on external intervention.""

Anthony: ""I'm not denying the value of grassroots initiatives, but what we have is a complex problem that requires a multi-faceted solution. By combining top-down policy reform and bottom-up community engagement, we can build more inclusive, equitable, and just society – every person deserves that chance to succeed."""
4,14,Sophia,Republican,"Sophia:  ""Anthony, I think we've had a productive discussion, but unfortunately, our perspectives haven't changed much. I believe that grassroots initiatives hold the power to drive real social change. While policy-driven solutions can be helpful, I fear that heavy-handed government intervention can actually hinder progress. Let's agree to respectfully disagree and focus on finding ways to work together, even if our approaches differ. Perhaps we can support local community-led initiatives like community land trusts, cooperatively owned businesses, and educational programs that empower marginalized communities to take charge of their own development."""
4,15,Anthony,Democrat,"""Thank you, Sophia, for your openness and willingness to engage in this discussion. I agree that our perspectives may not have changed, but I believe our understanding of each other's views has deepened. I'm committed to finding common ground and working together towards a more inclusive and equitable society. Let's indeed focus on supporting local community-led initiatives, while also advocating for policy changes that promote fairness and equality. I propose we collaborate on a joint project to create a comprehensive guide for implementing and evaluating these policy changes and community initiatives, ensuring that we're making progress towards true equality for all Americans."""
4,15,Sophia,Republican,"Sophia: ""Anthony, I think that's a wonderful idea. A collaborative project would bring us together in a meaningful way, allowing us to pool our expertise and find common ground. I'd be honored to work alongside you on such a project, and I'm eager to start brainstorming ways to make it a reality.""

Anthony: ""I couldn't agree more, Sophia. I believe that by combining our perspectives and expertise, we can create a truly comprehensive guide that addresses the complex issues we've been discussing. Let's make sure to involve a diverse range of stakeholders, including community organizers, civil rights leaders, and policymakers, to ensure that our guide is inclusive and effective.""

Sophia: ""That sounds like a great plan, Anthony. I'm excited to start this new chapter in our conversation. I propose we schedule a follow-up meeting to discuss the details of our project, including the scope, timeline, and goals. Let's also establish a clear process for gathering input and feedback from the community, to ensure that our guide is truly representative of their needs and concerns.""

Anthony: ""I wholeheartedly agree, Sophia. I'm looking forward to our next meeting and to working together towards a more just and inclusive society. I believe that by putting aside our differences and working collaboratively, we can make a real difference in the lives of marginalized communities and create a brighter future for all Americans."""
4,16,Anthony,Democrat,"""It's an honor to collaborate with you, Sophia. I'm confident that our combined efforts will lead to meaningful change. As we move forward, I propose that we prioritize inclusivity and center the voices of marginalized communities in our project. By doing so, we can create a holistic guide that not only addresses policy reforms but also empowers local communities to take charge of their own development. Together, let's make this collaboration a shining example of what can be achieved when we put our differences aside and work towards a common goal."""
4,16,Sophia,Republican,"I think we've reached the end of a productive and respectful debate, Anthony. I'm glad we could have this conversation and explore our differing perspectives on racism and equality. While we may not have seen eye-to-eye on every point, I believe that our discussion has deepened our understanding of each other's views and commitments to creating a more just society.

In light of our conversation, I propose that we continue to support local community-led initiatives and advocate for policy changes that promote fairness and equality. By working together and finding common ground, I'm confident that we can make a real difference in the lives of marginalized communities and create a brighter future for all Americans.

Thank you again for your engagement and commitment to this conversation, Anthony. I'm looking forward to continuing our work together and exploring ways to make our collaboration a success."
4,17,Anthony,Democrat,"Anthony: I'm glad we could have this meaningful conversation, Sophia. It's time to move forward, together. 

As the debate comes to a close, we've laid a foundation for further collaboration and understanding."
4,17,Sophia,Republican,"I'd like to add that Sophia says, ""In the end, I still believe that every person deserves equal opportunities, regardless of their background. I think that by empowering individuals with education, personal responsibility, and a fair shot, we can create a more inclusive and prosperous society. Anthony's commitment to policy reform is understandable, but I still see the value in grassroots initiatives and local community-driven solutions. Maybe our differing perspectives can be seen as a strength, rather than a weakness, as we work together to create a brighter future for all Americans."""
4,18,Anthony,Democrat,"Anthony: ""I concur with Sophia. While our views on policy and grassroots initiatives may differ, our shared commitment to equality and empowering marginalized communities is what truly matters. As we move forward, I propose that we continue to engage in open and respectful dialogue, acknowledging the complexities of the issues we're addressing and seeking common ground wherever possible.""

Anthony: ""To clarify, our efforts should center on amplifying the voices of marginalized communities and providing them with the resources and support they need to thrive. By doing so, we can ensure that our guide and our collaborative project reflect the needs and concerns of the community, rather than imposing our own perspectives or solutions.""

Anthony: ""In light of this, I suggest that we redefine our project's scope to prioritize community-led initiatives and inclusive policy reform, rather than solely focusing on policy-driven solutions. By doing so, we can create a comprehensive guide that not only addresses systemic barriers but also empowers local communities to drive their own development and progress.""

Sophia: ""I think that's a wonderful idea, Anthony. By centering the voices and experiences of marginalized communities, we can create a truly holistic and inclusive guide that addresses the complexities of the issues we're facing.""

Anthony: ""Agreed, Sophia. Let's make sure to involve a diverse range of stakeholders in our project, including community organizers, civil rights leaders, policymakers, and individuals from marginalized communities themselves. By doing so, we can ensure that our guide and our collaborative project are truly representative of the community's needs and concerns.""

Anthony: ""I propose that we schedule a follow-up meeting to discuss the details of our project, including the scope, timeline, and goals. Let's also establish a clear process for gathering input and feedback from the community, to ensure that our guide is truly reflective of their needs and concerns.""

Anthony: ""As we move forward, I commit to being an ally to marginalized communities and recognizing the need for systemic change. I believe that by working together and prioritizing inclusivity, we can create a more just and equitable society that truly values diversity and promotes equal opportunities for all.""

Anthony: ""In conclusion, I'd like to express my gratitude for this productive and respectful debate, Sophia. I believe that our conversation has been a valuable learning experience, and I'm proud to be collaborating with you to create meaningful change in the lives of marginalized communities.""

Anthony: ""I propose that we continue to engage in open and respectful dialogue, listening to each other's perspectives and working together to find common ground. By doing so, we"
4,18,Sophia,Republican,"Anthony: ""I think we've reached a point where we're both committed to moving forward together, Sophia. As we continue to work on our collaborative project, I'd like to propose that we establish a clear set of principles to guide our work. These principles should prioritize inclusivity, community-led initiatives, and systemic change. By doing so, we can ensure that our project and guide reflect the needs and concerns of the community.""

Sophia: ""I agree, Anthony. A set of guiding principles will help us stay focused on our shared goals and ensure that our work is inclusive and effective. I propose that we use the following principles as a starting point: prioritize community-led initiatives, promote inclusive policy reform, center the voices and experiences of marginalized communities, and ensure that our work is participatory and respectful of diverse perspectives.""

Anthony: ""Those are excellent principles, Sophia. I think they capture the essence of what we're trying to achieve with our collaborative project. Let's make sure to incorporate these principles into our guide and all our future work together.""

Anthony: ""In light of these principles, I'd like to propose that we establish a community advisory board to provide input and feedback on our project and guide. This board should be comprised of representatives from marginalized communities, community organizers, and other stakeholders who can provide valuable insights and perspectives.""

Sophia: ""That's a great idea, Anthony. A community advisory board will help ensure that our work is truly representative of the community's needs and concerns. I propose that we also establish a clear process for gathering input and feedback from the community, including regular town hall meetings, focus groups, and surveys.""

Anthony: ""Agreed, Sophia. Let's make sure to involve the community in every stage of our project, from development to implementation. By doing so, we can ensure that our work is inclusive, effective, and truly reflective of the community's needs and concerns.""

Anthony: ""As we move forward, I commit to being a proactive ally to marginalized communities and recognizing the need for systemic change. I believe that by working together and prioritizing inclusivity, we can create a more just and equitable society that truly values diversity and promotes equal opportunities for all.""

Sophia: ""I agree, Anthony. Let's continue to work together, listen to each other's perspectives, and find common ground. By doing so, we can create meaningful change in the lives of marginalized communities and build a brighter future for all Americans.""

Sophia: ""I think it's worth noting that we've both come a long"
