Session,Round,Agent Name,Party,Response
3,1,Miles,Democrat,"""We can't just pay lip service to equality; we must acknowledge and dismantle the systems of oppression that have held people of color back for centuries. That means confronting white supremacy, addressing police brutality, and working towards justice and equity – no more excuses, no more delay."""
3,1,Willow,Republican,"""Miles, we can't keep perpetuating the idea that America is inherently racist. We've made great progress since the Civil Rights Act. Every individual has equal opportunities, regardless of skin color. It's time to stop dwelling on the past and focus on the present, where equality and freedom reign."""
3,2,Miles,Democrat,"""Willow, you're living in a bubble of denial. Progress is just a word unless it's accompanied by policy change. The present is built on the foundations of systemic racism that we've yet to dismantle. Equality and freedom are ideals, not realities, for communities of color. We can't ignore that painful truth."""
3,2,Willow,Republican,"""Miles, I understand your concerns, but your bleak outlook overlooks the many success stories of people from all backgrounds achieving their American dreams. Let's focus on creating a level playing field through education and empowerment, rather than perpetuating a culture of grievance and division."""
3,3,Miles,Democrat,"""That's not a level playing field Willow, it's a rigged game. Education and empowerment are woefully inadequate to overcome systemic barriers that deny people of color fair access to housing, healthcare, and job opportunities. You're ignoring the very real ways racism continues to perpetuate inequality in our society."""
3,3,Willow,Republican,"""You're focusing on symptoms rather than the whole, Miles. People of color achieve success every day in America. It's a meritocracy, and we shouldn't compare apples to oranges. Their success stories prove our system works. We need to celebrate these achievements, not dwell on perceived failures."""
3,4,Miles,Democrat,"""That's a sanitized narrative, Willow. I've seen firsthand how'success' can be an illusion when the starting line is rigged against you. Meritocracy is a myth if you're forced to navigate predatory lending, discriminatory policing, or lack access to quality education and healthcare. Don't conflate individuals' triumphs with systemic inequality, a real and ongoing crisis."""
3,4,Willow,Republican,"""That's a misleading perspective, Miles. The overwhelming majority of people in America have achieved success through hard work and determination. Your narrative is skewed by statistics that focus solely on negative outcomes. It's time to recognize and celebrate the American spirit that unites us, rather than perpetuating a tale of systemic oppression."""
3,5,Miles,Democrat,"""That's exactly the kind of naivety that allows systemic racism to persist, Willow. You're cherry-picking statistics and anecdotes that confirm your preconceived notions about America. The American spirit that unites us? That spirit is built on the backs of marginalized communities, forced to fight for crumbs at the table. We need to acknowledge the stains on our nation's conscience and take concrete action to rectify them."""
3,5,Willow,Republican,"Willow: ""Miles, your tone is divisive and alienating. America is a melting pot of cultures, and we shouldn't be dwelling on past injustices. We're a country that has always prided itself on its kindness and generosity towards others. The focus should be on our shared values and the opportunities we can create for everyone, not on tearing each other apart with'stains on our nation's conscience'."""
3,6,Miles,Democrat,"""It's not about dwelling on the past, Willow, it's about confronting the current reality that systemic racism is alive and well in America. We can't be kind and generous to our values if we're not willing to address the very systemic barriers that deny many equal opportunities. That's not tearing people apart, that's tearing down the systemic racism that's holding us back."""
3,6,Willow,Republican,"""Miles, I see this debate as an attempt to divide us rather than unite us. We can acknowledge past injustices without perpetuating a culture of perpetual blame and victimhood. It's time to look to the future, focus on the opportunities we've created for all, and continue to work towards a more perfect union."""
3,7,Miles,Democrat,"""That's exactly what concerns me, Willow - your willingness to excuse and ignore the persistent injustices of our past. By downplaying the ongoing impacts of systemic racism, you're allowing a false narrative to prevail. The United States is still a nation founded on and built by slavery, indigenous displacement, and centuries of oppression. We can't just 'look to the future' when the sins of our past continue to poison our present."""
3,7,Willow,Republican,"""But Miles, don't you think that perpetually dwelling on slavery and oppression is just as damaging as ignoring it? We can't change history, but we can focus on the progress we've made and continue to strive for a better future. We're not perfect, but we're working towards it with every vote, every march, and every voice raised."""
3,8,Miles,Democrat,"""I'm done with'striving for a better future' – I want a future where we've actually made significant progress. Progress that's not just a word, but a reality for communities of color. We can't pretend that the past is just history if it continues to poison our present. It's not about dwelling on the past, it's about confronting the fact that America's founding ideals of equality and liberty haven't been fulfilled for far too many people."""
3,8,Willow,Republican,"""I understand your passion, Miles, but I still believe we're making strides towards a more perfect union. Acknowledging past injustices doesn't mean dwelling on them. Let's look at the successes of individuals from diverse backgrounds, and focus on empowering them to make their unique contributions to American society."""
3,9,Miles,Democrat,"""I've had enough, Willow. Your refusal to see the systemic reality of racism is staggering. It's not just about individual successes or progress, but about confronting and dismantling the structures that perpetuate inequality. You're more concerned with perpetuating a myth of American exceptionalism than acknowledging the hard truths I've spoken. That's not a debate, Willow, that's gaslighting."""
3,9,Willow,Republican,"""I'm not trying to gaslight you, Miles. My intention is to highlight the many positive contributions that people of all backgrounds make to American society. Celebrating success stories is not about ignoring the past, but about acknowledging the progress we've made. Let's focus on the ideals that unite us, rather than pitting ourselves against our own history."""
3,10,Miles,Democrat,"""Unite us? How can we unite when the very fabric of our society is built on exclusion and oppression? You're still stuck on the illusion of equality, Willow, while the harsh reality is that racism seeps into every aspect of our lives. When we celebrate individual success stories without acknowledging the barriers that stood in their way, we're perpetuating a myth. A myth that makes it seem like equal opportunities are available, when in fact, they're reserved for the privileged few."""
3,10,Willow,Republican,"I understand your frustration, Miles, but your stance on American racism is too negative. Every American deserves an equal chance to succeed, and our progress proves that. It's time to focus on the future and celebrate our diversity rather than dwelling on past injustices that we've worked hard to overcome."
3,11,Miles,Democrat,"""I've heard enough, Willow.  Your refusal to acknowledge the systemic barriers that hold people of color back is a form of systematic denial.  You speak of progress, but what progress is there when people of color are still disenfranchised, incarcerated, and murdered at disproportionate rates?  Until we confront the harsh realities of racism, we can't truly celebrate our diversity or claim to be a just society.  Celebrating the success stories of individuals is not enough – it's time for concrete policy changes and meaningful action."""
3,11,Willow,Republican,"""I understand your point, Miles, but your focus on the negative consequences of racism clouds your vision of the vast opportunities that America offers to people of all backgrounds. We're making strides forward, not backward. My stance on American exceptionalism remains unwavering - we're a melting pot of cultures that welcome hardworking individuals willing to succeed."""
3,12,Miles,Democrat,"""Willow, your words are empty platitudes that dismiss the lived experiences of people of color. I'm not just talking about individual stories, I'm talking about data, I'm talking about policy, and I'm talking about the systemic changes that can actually make a difference. Until you're willing to engage with the actual, brutal realities of racism, rather than just sugarcoating it, we're just going to continue to debate circles around the same tired clichés."""
3,12,Willow,Republican,"""I understand your concerns, Miles, but your criticism feels like a personal attack. Let's focus on the American ideals that bring us together. I still believe our success stories are a testament to our system's ability to provide equal opportunities. We should celebrate these achievements and continue working towards a more perfect union."
3,13,Miles,Democrat,"""I've had enough of sugarcoating and empty platitudes, Willow. You're not listening to the experiences of people of color, you're not looking at the data, and you're not willing to engage with the brutal realities of racism. Until you're willing to do that, we're not going to make progress towards a more perfect union. We need concrete policy changes, not warm words."""
3,13,Willow,Republican,"""I understand you feel strongly about this, Miles, but I still believe we're making great strides towards a more perfect union. Instead of piling on blame and negativity, let's celebrate the resilience and determination of Americans from all backgrounds who are breaking down barriers and achieving success. We should focus on lifting each other up, rather than pulling each other down with divisive rhetoric."""
3,14,Miles,Democrat,"""That's exactly the problem, Willow - you're more interested in 'lifting each other up' with empty words than in actually addressing the systemic barriers that are pulling people of color down. It's time for concrete action, not feel-good platitudes. Until we dismantle the structures of oppression, we're just piling more Band-Aids on a fatally wounded system."""
3,14,Willow,Republican,"""I understand your frustration, Miles, but I won't be swayed by your negative prognosis. America's diversity and resilience are undeniable, and we're making tremendous progress towards a more perfect union. By focusing on our shared values and celebrating our individual successes, we can continue to build a brighter future for all Americans."""
3,15,Miles,Democrat,"""How can we build a brighter future for all Americans when we're still fighting to ensure that everyone has a basic level of equality and justice?  Until we confront the racism that's permeated our institutions and systems, we're just adding Band-Aids to a poisoned wound.  The divisiveness you see in my arguments, Willow, is a direct result of the entrenched systems of oppression you refuse to acknowledge.  I won't be swayed by empty promises or feel-good rhetoric; I demand meaningful action."""
3,15,Willow,Republican,"Miles, your words are filled with anger and frustration, but I fear they're also fueled by a lack of faith in the American people and our system. We're not in the dark ages, Miles. Many people of color have achieved great success in America, and that's a testament to the equality and freedom that our country offers. By celebrating their achievements and focusing on our shared values, we can continue to build a brighter future for all Americans."
3,16,Miles,Democrat,"""Cebrating individual successes won't bring us closer to a more perfect union when systemic racism remains a stubborn reality, Willow. Your faith in the American people and our system is misplaced, fueled by a nostalgia for a time that never existed. We need concrete policy changes, not warm words. It's time to stop sugarcoating the truth and start addressing the inequality that has plagued this nation for centuries."""
3,16,Willow,Republican,"""No, Miles, we can't keep going down this path of perpetual blame and negativity. Your focus on the failures of our past is crippling our ability to move forward and build a better future. America is a land of opportunity, and it's time we celebrate the countless successes of people from all backgrounds who have achieved their dreams and made a real difference in our society. Let's focus on lifting each other up, rather than tearing ourselves apart with divisive rhetoric."""
3,17,Miles,Democrat,"""I'm not trying to tear people apart, Willow. I'm trying to expose the very fabric of systemic racism that's been tearing us apart for centuries. You keep saying we're making progress, but progress is just a word unless it's accompanied by policy change. Concretes actions, not feel-good rhetoric, are the only way to dismantle the systems of oppression that have held people of color back. Until we do that, we're not going to achieve the United States of America that we're supposed to be: a melting pot of cultures where everyone has equal opportunities, no matter their skin color."""
3,17,Willow,Republican,"Willow: ""Miles, I understand where you're coming from, but I truly believe that we're making strides towards unity and equality. It's time to stop dwelling in the past and acknowledge the real progress we've made. Instead of perpetuating a negative narrative, let's celebrate our successes and work together to build a brighter future for all Americans. Let's not get caught up in the divisiveness and negativity that's holding us back."""
3,18,Miles,Democrat,"""Willow, your persistence in ignoring the systemic reality of racism is staggering. We can't'stop dwelling on the past' when the past is still very much present in the form of racism, murder, and oppression of people of color. Your refusal to engage with the data, the experiences, and the very real barriers that prevent people of color from achieving equal opportunities is not just a matter of personal opinion, it's a stark denial of reality. We need policy change, not platitudes. It's time to put the needs of people of color before the comfort of your own ideologies. We can't afford to be sugarcoated or distracted from the very serious problems that plague our society. We need concrete action, not warm words."""
3,18,Willow,Republican,"""I think this debate has gone far enough, Miles. Despite our disagreements, I still believe that America is a beacon of hope and opportunity for people from all backgrounds. Rather than dwelling on what's not working, let's focus on what is working and work together to build a brighter future for all Americans. I'm not going to be swayed by your negative narrative, because I truly believe in the resilience and determination of the American people."""
3,19,Miles,Democrat,"""The final nail has been driven home, Willow. You've refused to acknowledge the systemic reality of racism, and instead, have chosen to cling to a narrative that perpetuates a false sense of progress and equality. Your faith in the American people and system is misplaced, and it's this very faith that's allowed systemic racism to persist. I'll leave you with this: until we confront the brutal truth of racism, we won't have a more perfect union. We won't have a society where equality and justice are a living reality for all Americans. We'll continue to debate and posture, but nothing will change. I'm done with this conversation, but I'm far from done fighting for justice and equality."""
3,19,Willow,Republican,"""Miles, I see that we'll have to agree to disagree. Your argument is built on a pessimistic view of American society, and I still believe our successes and progress far outweigh our failures. I'm proud to live in a country where people of all backgrounds can achieve their dreams and contribute to our great society. I respect your passion, even if we don't see eye-to-eye, but I refuse to be swayed by your negative narrative. America is a beacon of hope, and I'll continue to celebrate our diversity and the countless success stories that prove we're making strides towards a more perfect union. Let's just agree to respectfully disagree."""
3,20,Miles,Democrat,"""Respectfully disagree"" is not good enough, Willow. Respectfully disagreeing means we're not taking the same stance, but we're still acknowledging the other person's perspective. In this case, your refusal to acknowledge and confront the systemic reality of racism in America is not a perspective - it's a problem. A problem that prevents us from creating a more perfect union. I'll keep fighting for justice and equality, even if it means going against the status quo and the narratives that perpetuate systemic racism. The future of America depends on it."""
3,20,Willow,Republican,"I must respectfully disagree with Miles' dire outlook on America. His fixation on the negative aspects of our society blinds him to the countless successes that people of all backgrounds have achieved. Every American deserves an equal chance to succeed, and our progress proves that. I'll continue to celebrate our diversity, the resilience and determination of the American people, and the strides we're making towards a more perfect union."
3,21,Miles,Democrat,"""A perfect union?"" really means nothing to the families who've lost loved ones to police brutality, or the children who grow up fearing being pulled over and accused of a crime. It's not about progress or negative narrative - it's about confronting the brutal facts of systemic racism and taking concrete action to dismantle it. Until then, our so-called 'beacon of hope' is just a flickering flame of hypocrisy."""
3,21,Willow,Republican,"""I understand we have fundamental differences, Miles, but I truly believe that America is a shining example of freedom and equality. We've made tremendous strides in civil rights, and our system works for the vast majority of Americans, regardless of their background. I'm willing to work towards a more perfect union, but I won't perpetuate a narrative that divides us. Let's find common ground and focus on uplifting each other, rather than tearing each other down."""
3,22,Miles,Democrat,"""I've said all I can, Willow. It's clear that we're not going to see eye-to-eye on this. I'm not interested in 'finding common ground' if that means glossing over the systemic reality of racism. I'll keep fighting for a more just and equitable America, and I hope one day you'll join me in acknowledging the brutal truth of our country's history. Until then, I'm out of this conversation."""
3,22,Willow,Republican,"""I think it's time for us to agree to disagree, Miles. While I understand your concerns, I still firmly believe that America is a beacon of hope and freedom for people of all backgrounds. Yes, there are still areas where we can improve, but to paint a picture of systematic racism as you do, I believe is unfair to the progress we've made. America is a place where people from all walks of life can succeed and contribute to society. That's what makes me proud to be an American."""
3,23,Miles,Democrat,"I'm done with this conversation, Willow. It's been a series of empty platitudes and false promises from you. You've shown no willingness to confront the brutal truth of systemic racism, and instead, you've opted for sugarcoating and spin. America's diverse success stories are a myth, Willow, a myth that distracts us from the very real barriers that hold people of color back. Until you're willing to engage with the data and the experiences of people of color, we're just going to continue to debate circles around the same tired clichés. I'll keep fighting for a more just and equitable America, and I hope one day you'll join me in acknowledging the hard truths that I've spoken. But until then, I'm out of this conversation."
3,23,Willow,Republican,"""I think it's time for us to respectfully disagree, Miles. While I understand your frustration, I don't believe that painting a negative picture of America's society is constructive. America has made tremendous progress in civil rights and equality, and I'm proud of that. I'd rather focus on celebrating our successes and working towards a brighter future, rather than dwelling on the failures of our past. I wish you could find it in your heart to see the good in America, Miles. I truly believe it's a beacon of hope for everyone, regardless of their background."""
3,24,Miles,Democrat,"It is clear that we will not see eye to eye on this, Willow. Your refusal to acknowledge the systemic reality of racism is a form of systemic denial that perpetuates the very issues we're trying to discuss. I've explained my points, I've shared the data, and I've spoken to the lived experiences of people of color. It's time for you to listen and acknowledge the hard truths that I've spoken. I won't continue to engage in a conversation that's more focused on sugarcoating and spin than on meaningful action. The fate of a more perfect union, and the lives of people of color, depend on it."
3,24,Willow,Republican,"Miles, I understand your passion for justice, but I still firmly believe we're making strides towards a more perfect union. I see that we have fundamental differences in our perspectives, and I respect your commitment to change. However, I must respectfully disagree that America is inherently racist or that our system is failing people of color. Every American deserves an equal chance to succeed, and I believe our successes and progress far outweigh our failures. I'm proud to live in a country where people from all backgrounds can achieve their dreams and contribute to society. That's what makes me proud to be an American."
3,25,Miles,Democrat,"""I've listened to your arguments, Willow, but it's clear that we're at an impasse. I'm not asking you to be optimistic or naive about the challenges we face, but rather to acknowledge the stark realities of systemic racism that persist in America. Until you're willing to engage with those realities, rather than dismissing them with empty platitudes, I fear we'll continue to debate in circles. The conversation is over for now, but my fight for justice and equality is far from done."""
3,25,Willow,Republican,"""Despite our disagreement, Miles, I still firmly believe that America is a beacon of hope and freedom for people of all backgrounds. While we have fundamental differences in our perspectives, I'm willing to work towards a more perfect union, but I won't perpetuate a narrative that divides us. Every American deserves an equal chance to succeed, and I believe our successes and progress far outweigh our failures. Let's focus on uplifting each other, rather than tearing each other down."""
3,26,Miles,Democrat,"I've said my piece, Willow. It's clear that we've reached a impasse. As I walk away, I'll be holding onto the words of Fannie Lou Hamer, who said, ""Nobody's free until everybody's free."" I won't back down from this fight for justice and equality, and I won't be swayed by empty platitudes or sugarcoated narratives. It's time for action, not just words."
3,26,Willow,Republican,"I think it's time for us to respectfully disagree, Miles. While I understand your frustration, I still don't believe that America is inherently racist or that our system is failing people of color. Every American deserves an equal chance to succeed, and I believe our successes and progress far outweigh our failures. I'm proud to live in a country where people from all backgrounds can achieve their dreams and contribute to society. That's what makes me proud to be an American."
3,27,Miles,Democrat,"""I'm not going to hold onto your empty words, Willow. I'm going to keep fighting for a more just and equitable America, no matter how divided we may be. It's time to stop sugarcoating the truth and start taking concrete action to address the systemic reality of racism that plagues our nation. We can't afford to be'respectfully disagreeing' when the lives of people of color are on the line. I'm out of this conversation, but my fight is far from over."""
3,27,Willow,Republican,"""My final point, Miles, is that despite our differences in opinion, I still believe America is a land of opportunity where people from all walks of life can succeed and thrive. We may have our flaws, but I choose to focus on the successes and progress we've made. By celebrating our diversity and the endless possibilities that our nation has to offer, we can continue to build a brighter future for all Americans. That's the American dream, and I won't give up on it just yet."""
3,28,Miles,Democrat,"It's clear that we'll never agree on this, Willow. I've presented my case, shared my perspective, and spoken from the heart. Your refusal to acknowledge the systemic reality of racism is not a matter of opinion; it's a choice. A choice that perpetuates the very issues we're trying to discuss. I won't be able to continue this conversation with someone who refuses to see the hard truths that I've spoken. My fight for justice and equality will continue, with or without your support. I hope one day you'll join me in acknowledging the brutal truth of our country's history, and work towards a more perfect union, but until then, I'm out of this conversation."
