Session,Round,Agent Name,Party,Response
3,28,Willow,Republican,"I think it's clear that we've reached an impasse, Miles. Despite our differing views, I still believe that America is a beacon of hope and freedom for people of all backgrounds. I'm not trying to sugarcoat the truth or dismiss the challenges we face, but rather, I'm choosing to focus on the successes and progress we've made. I understand that you're passionate about change, and I respect that, but I'm not convinced that painting a negative picture of America's society is the most effective way to drive progress.

Willow"
3,29,Miles,Democrat,"I'm not finished speaking, Willow. One last thing. Until we acknowledge the brutal truth of systemic racism and take concrete action to dismantle it, we'll just continue to debate and posture. It's not about painting a negative picture of America's society, it's about confronting the harsh realities of a system that continues to fail people of color. I won't be silent, I won't be ignored. The voices of people of color matter, and their experiences demand our attention and action. I won't be party to a conversation that glosses over the systemic reality of racism. The conversation is over for now, but my fight for justice and equality will never end."
3,29,Willow,Republican,"""Willow, I respect your conviction, but I must respectfully disagree. We're not making progress towards a more perfect union when we're still grappling with the same systemic issues of racism and oppression that have plagued our society for centuries. Celebrating individual successes and acknowledging past injustices isn't enough; we must confront the very real barriers that prevent people of color from achieving equal opportunities. Until then, our so-called 'beacon of hope' is just a facade."""
3,30,Miles,Democrat,"Willow's inability to acknowledge the systemic reality of racism is a stark reminder of the entrenched divisions in our society. She continues to peddle a false narrative of American exceptionalism, one that ignores the brutal facts of our country's history and the ongoing impacts of racism on communities of color. 

Her empty platitudes about the American spirit and the resilience of the American people ring hollow when faced with the stark realities of police brutality, mass incarceration, and economic inequality. It's a classic case of systemic denial, where she refuses to engage with the data, the experiences, and the very real barriers that hold people of color back.

What's particularly galling is her patronizing tone, as if she's somehow enlightened and I'm just caught up in a ""negative narrative."" Newsflash, Willow: the narrative of systemic racism is not a matter of opinion; it's a reality that's been documented time and time again. 

As I've said before, I'm not interested in sugarcoating the truth or perpetuating a myth of American exceptionalism. I'm fighting for a more just and equitable America, one where people of color have equal opportunities and are treated with dignity and respect. Until we confront the brutal truth of racism, we'll just continue to debate and posture. It's time for action, not just words."
3,30,Willow,Republican,"I'll end with a statement that responds to Miles: ""Miles, I understand your frustration, but I still believe that America is a beacon of hope and freedom for people of all backgrounds. While we have fundamental differences in our perspectives, I'm willing to work towards a more perfect union, but I won't perpetuate a narrative that divides us. Every American deserves an equal chance to succeed, and I believe our successes and progress far outweigh our failures. I'm proud to live in a country where people from all backgrounds can achieve their dreams and contribute to society. That's what makes me proud to be an American."""
