Session,Round,Agent Name,Party,Response
1,1,Audrey,Democrat,"""I strongly believe that systemic racism exists and requires immediate action from our leaders. We must address police brutality, voter suppression, and economic inequality through policy reforms. By acknowledging the harm caused and taking proactive steps, we can work towards a more just and equitable society for all."""
1,1,Skylar,Democrat,"""Audrey, I completely agree. We can't just acknowledge the harm, we must take concrete actions to dismantle the systems that perpetuate inequality. I'd like to see concrete proposals addressing these issues, such as police reform, automatic voter registration, and investment in low-income communities."""
1,2,Audrey,Democrat,"""I agree completely, Skylar. That's why I propose a comprehensive bill addressing these issues. The 'Justice and Equity Act' would prioritize police accountability through body cameras and de-escalation training, expand automatic voter registration, and invest $10 billion in community development projects for historically disenfranchised communities."""
1,2,Skylar,Democrat,"""That's a great start, Audrey, but we also need to hold perpetrators accountable, not just reform systems. We must increase funding for community-based programs that support victims of police brutality and implement stronger consequences for officers who commit wrongdoing."""
1,3,Audrey,Democrat,"""I couldn't agree more, Skylar. The 'Justice and Equity Act' would also include provisions for independent review boards to investigate and prosecute police misconduct, as well as provide support services for victims and their families, including reparations for past injustices."""
1,3,Skylar,Democrat,"""Audrey, while the 'Justice and Equity Act' is a step in the right direction, I remain concerned about enforcement mechanisms to ensure accountability. Can you elaborate on how we'll prevent backsliding and ensure these reforms are implemented with integrity?"""
1,4,Audrey,Democrat,"""That's a crucial question, Skylar, and I understand your skepticism. To address this, the 'Justice and Equity Act' would establish an independent oversight commission to monitor implementation, conduct regular audits, and provide public reports. This commission would also have the authority to impose penalties on jurisdictions that fail to comply with the act's provisions."""
1,4,Skylar,Democrat,"""I appreciate the independent oversight commission, Audrey, however, it's essential that the commission's budget is adequately funded and that its members are elected representatives from communities most affected by systemic racism, rather than mere appointees."""
