Session,Round,Agent Name,Party,Response
40,1,Julian,Democrat,"""I firmly believe that systemic racism is a stain on our nation's conscience. We must acknowledge the injustices inflicted upon communities of color and take concrete actions to dismantle racial barriers in our institutions, economy, and politics. It's time for reckoning and reparative justice."""
40,1,John,Democrat,"""I agree that systemic racism is a stain on our nation's conscience. Acknowledging past injustices and taking proactive steps towards reparative justice is crucial. We need to codify policies that address wealth and education disparities, police reform, and equal opportunities for communities of color to break the cycle of systemic racism."""
40,2,Julian,Democrat,"""I wholeheartedly agree, John. Codifying policies that address wealth and education disparities is a crucial step forward. Additionally, we need to dismantle gerrymandering, which perpetuates voting rights suppression. By doing so, we can ensure equal representation and amplify the voices of marginalized communities."""
40,2,John,Democrat,"""I completely agree with you, Julian. Gerrymandering only serves to silence marginalized voices. We need to pass the John Lewis Voting Rights Advancement Act and the For the People Act to safeguard our democracy and ensure equal representation for all Americans."""
40,3,Julian,Democrat,"""Furthermore, we must address the impact of systemic racism on our economy, including the persistent wealth gap and limited access to capital for communities of color. By investing in equitable opportunities, we can build a more just and prosperous society for all Americans."""
40,3,John,Democrat,"""I couldn't agree more, Julian. Addressing the wealth gap and limited access to capital is critical to economic empowerment for communities of color. We must also support community-led initiatives and businesses, providing resources to help them thrive and break the cycle of poverty."""
40,4,Julian,Democrat,"""I'd like to add that economic empowerment must also extend to addressing implicit bias in corporate lending and hiring practices. We need to hold institutions accountable for their role in perpetuating systemic racism, and ensure equal access to opportunities for marginalized communities."""
40,4,John,Democrat,"""I completely agree, Julian. Holding institutions accountable for implicit bias is crucial. We must also prioritize diversity and inclusion training for corporate leaders to raise awareness and foster a more inclusive work environment that benefits all Americans, regardless of their background."""
40,5,Julian,Democrat,"""I agree, John. Systemic racism is deeply ingrained in our institutional fabric. We must prioritize policy reforms that address implicit bias, and promote diversity, equity, and inclusion. Accountability and education are key to dismantling systemic racism and creating a more just society for all Americans."""
40,5,John,Democrat,"""I appreciate the emphasis on accountability, education, and economic empowerment to dismantle systemic racism. To build on this momentum, I propose a comprehensive anti-discrimination law that protects marginalized communities from hate crimes and ensures justice for victims, fostering a culture of respect and inclusivity nationwide."""
40,6,Julian,Democrat,"""I wholeheartedly endorse John's proposal for a comprehensive anti-discrimination law. It's imperative we protect marginalized communities from hate crimes and ensure justice for victims. This law will be a crucial step towards creating a safer, more inclusive society for all Americans, where hate has no refuge."""
40,6,John,Democrat,"""Julian, I couldn't agree more with your endorsement of the anti-discrimination law. By implementing this law, we can truly create a society where marginalized communities feel safe, valued, and protected. Let's work together to make this a reality and end systemic racism once and for all."""
40,7,Julian,Democrat,"""Furthermore, John, we must acknowledge the historical trauma inflicted upon Native American communities, who have been disproportionately affected by systemic racism and land theft. Their voices and experiences must be centered in our discussion and policy-making efforts."""
40,7,John,Democrat,"""I agree that the historical trauma inflicted upon Native American communities must be acknowledged and addressed. Centering their voices and experiences is essential to understanding and dismantling systemic racism. Their stories and perspectives must be included in our policy-making efforts and discussions."""
40,8,Julian,Democrat,"""John, I agree that acknowledging historical trauma inflicted upon Native American communities is crucial. We must also ensure their equal access to education, healthcare, and economic opportunities, and address the ongoing land dispute issues that have perpetuated systemic injustice for centuries."""
40,8,John,Democrat,"""Julian, I couldn't agree more on centering Native American voices and addressing historical trauma. We must ensure equal access to education, healthcare, and economic opportunities for all Native Americans, and also recognize their sovereignty over their lands to truly dismantle systemic racism. Accountability is key."""
40,9,Julian,Democrat,"""I wholeheartedly agree, John. Holding corporations accountable for their role in perpetuating systemic racism and ensuring equal access to opportunities for marginalized communities is a crucial step forward. By working together, we can dismantle this entrenched issue and create a more just society."""
40,9,John,Democrat,"""I agree, Julian, that accountability is essential in dismantling systemic racism. We must also increase representation of marginalized voices in decision-making positions and ensure that those responsible for perpetuating racism are held accountable through targeted legislation and policy reforms."""
40,10,Julian,Democrat,"""John, I agree that targeting legislation and policy reforms is key. We must also prioritize restorative justice, providing reparations and support to those who've been affected by systemic racism. This will be a crucial step in healing wounds and fostering true equity."""
40,10,John,Democrat,"""I couldn't agree more, Julian. Restorative justice and reparations are essential to addressing the historical trauma inflicted upon communities of color. We must provide tangible support to those who've been marginalized and oppressed, and prioritize their healing and recovery in our policy efforts."""
40,11,Julian,Democrat,"""As we conclude this critical conversation, I want to emphasize that dismantling systemic racism requires sustained efforts, accountability, and a willingness to listen. We must continue to amplify marginalized voices, educate ourselves, and prioritize restorative justice to create a truly equitable society for all Americans."""
40,11,John,Democrat,"""Julian, I couldn't agree more on the importance of sustained efforts and accountability in dismantling systemic racism. By prioritizing restorative justice, amplifying marginalized voices, and educating ourselves, we can create a society where everyone has equal opportunities and is treated with dignity and respect."""
40,12,Julian,Democrat,"""John, I agree that our efforts to dismantle systemic racism must be ongoing and inclusive. To further this goal, I propose we establish community-led truth and reconciliation commissions to document the experiences of marginalized groups and create a national reckoning with our nation's history of racism."""
40,12,John,Democrat,"""I wholeheartedly support the proposal for community-led truth and reconciliation commissions. These commissions will provide a vital platform for marginalized voices to share their stories and experiences, helping us truly confront and dismantle systemic racism in this nation. It's a crucial step towards healing and progress."""
40,13,Julian,Democrat,"""John, I couldn't agree more on the importance of truth and reconciliation commissions. By centering marginalized voices and holding a national reckoning with our nation's racist history, we can finally begin to heal and create a more just society. It's time for accountability and truth to prevail."""
40,13,John,Democrat,"""Julian, I strongly agree that truth and reconciliation commissions are a crucial step in dismantling systemic racism. By amplifying marginalized voices and acknowledging our nation's racist history, we can create a more just society. But let's not forget, words must be accompanied by concrete action."""
40,14,Julian,Democrat,"""I completely agree, John. Empty words won't suffice; concrete action is imperative. That's why I propose investing 10% of our national budget in community-led initiatives and programs tackling systemic racism, education, and economic empowerment for marginalized communities."""
40,14,John,Democrat,"""I wholeheartedly agree, Julian, that investing 10% of our national budget in marginalized communities is a crucial step forward. This will empower them to break the cycle of systemic racism, access education and economic opportunities, and truly thrive in a fair and inclusive society."""
40,15,Julian,Democrat,"""John, I appreciate your commitment to actionable steps. By prioritizing community-led initiatives, truth and reconciliation commissions, and investing 10% of our national budget, we can begin to dismantle systemic racism and create a more just society. Let's turn these words into concrete action and policy changes."""
40,15,John,Democrat,"""I wholeheartedly agree, Julian. To dismantle systemic racism, we must prioritize education, economic empowerment, and community-led initiatives. The proposed 10% budget allocation for marginalized communities is a crucial step forward. It's time for concrete action, not just words, to create a more just society."""
40,16,Julian,Democrat,"""John, I agree that policy changes must be accompanied by concrete action. By establishing community-led truth and reconciliation commissions, investing in marginalized communities, and codifying anti-discrimination laws, we can tangibly dismantle systemic racism and create a more just society that values equity and respect for all."""
40,16,John,Democrat,"""Julian, I wholeheartedly agree that truth and reconciliation commissions, anti-discrimination laws, and investments in marginalized communities are crucial steps towards dismantling systemic racism. Let's prioritize accountability, education, and economic empowerment to create a society where everyone has equal opportunities and is treated with dignity and respect."""
40,17,Julian,Democrat,"""John, let's prioritize concrete action by allocating 10% of our national budget to community-led initiatives, truth and reconciliation commissions, and anti-discrimination laws. This tangible investment will ensure we create a society where marginalized voices are amplified and equitable opportunities are available to all Americans."""
40,17,John,Democrat,"""I firmly believe that education is key to dismantling systemic racism. By allocating 10% of our national budget to community-led initiatives and truth and reconciliation commissions, we can create a cultural shift that fosters understanding, empathy, and respect for all Americans, regardless of their background."""
40,18,Julian,Democrat,"""John, I agree that education is a crucial aspect of dismantling systemic racism. However, we must also address the systemic barriers that prevent marginalized communities from accessing quality education in the first place, such as underfunded schools and biased curriculum."""
40,18,John,Democrat,"""I agree, Julian, that underfunded schools and biased curriculum are major obstacles to dismantling systemic racism. We must prioritize equity in education by funding inner-city schools and implementing inclusive curriculum that teaches the histories and struggles of marginalized communities."""
40,19,Julian,Democrat,"""We must not only confront the effects of systemic racism but also address the root causes. To do so, we need to challenge discriminatory policies, such as voter ID laws and gerrymandering, that suppress marginalized voices. It's time for equal representation and a fair democracy."""
40,19,John,Democrat,"""I agree, Julian, that we must confront and address the root causes of systemic racism. Challenging discriminatory policies like voter ID laws and gerrymandering is essential to promoting equal representation and a fair democracy, where every voice matters."""
40,20,Julian,Democrat,"""I firmly believe that dismantling systemic racism requires a multifaceted approach, including policy reforms, education, and community-led initiatives. We must confront and address the root causes of racism, challenge discriminatory policies, and prioritize accountability and restorative justice to create a more just and equitable society."""
40,20,John,Democrat,"""Julian, I agree that dismantling systemic racism requires a multifaceted approach. To complement our policy reforms, I propose creating a national task force to monitor and report on institutions that perpetuate racism, holding them accountable for tangible progress towards equity and inclusion."""
40,21,Julian,Democrat,"""I agree with your proposal, John. The national task force will be instrumental in monitoring institutional racism and ensuring accountability. However, we must also prioritize reparative justice, restorative practices, and community-led initiatives to create a truly inclusive and equitable society."""
40,21,John,Democrat,"""I agree, Julian, that reparative justice is essential. Implementing restorative practices and supporting community-led initiatives will help heal the historical trauma inflicted on marginalized communities. By prioritizing education, economic empowerment, and accountability, we can create a just and equitable society for all Americans."""
40,22,Julian,Democrat,"""We must prioritize policy reforms that address implicit bias, promote diversity, and ensure accountability. Furthermore, we must acknowledge and address the historical trauma inflicted upon Native American communities, ensuring their voices and experiences are centered in our policy-making efforts."""
40,22,John,Democrat,"""I agree, Julian. Implicit bias training and accountability in institutions are crucial. Acknowledging and addressing Native American historical trauma is also essential. We must prioritize their voices and experiences in our policy-making efforts, and ensure they receive equal access to education, healthcare, and economic opportunities."""
40,23,Julian,Democrat,"""John, I agree we must acknowledge and address Native American historical trauma. By doing so, we can begin to heal the wounds of the past and create a more just society. It's time to break the cycle of systemic racism and stand united in our pursuit of equity and justice."""
40,23,John,Democrat,"""To Julian, I agree that breaking the cycle of systemic racism requires a collective effort. We must continue to center marginalized voices, acknowledge historical trauma, and advance policy reforms that promote equity and accountability. Together, we can create a more just and inclusive society for all."""
40,24,Julian,Democrat,"""I couldn't agree more, John. We must acknowledge and address the historical trauma inflicted upon Native American communities and center their voices in our policy-making efforts. This is a crucial step towards breaking the cycle of systemic racism and creating a more just society for all."""
40,24,John,Democrat,"""I firmly believe that acknowledging historical trauma and centering Native American voices is crucial. It's time to break the cycle of systemic racism and hold ourselves accountable for the past. We must invest in cultural education and economic empowerment to create a just and inclusive society."""
40,25,Julian,Democrat,"""I agree, John. Acknowledging historical trauma and investing in cultural education and economic empowerment are essential steps towards breaking the cycle of systemic racism. We must also hold corporations accountable for their role in perpetuating historical injustices and ensure equal access to opportunities for marginalized communities."""
40,25,John,Democrat,"""I wholeheartedly agree, Julian. We must acknowledge the devastating impact of historical injustices on marginalized communities. Holding corporations accountable and promoting equal access to opportunities will be crucial in creating a society where everyone has an equal chance to thrive and be valued."""
40,26,Julian,Democrat,"""I concur, John, that accountability is key. We must also promote diversity and inclusion in our institutions, ensuring marginalized voices are represented in decision-making positions. This genuine shift in power dynamics will catalyze significant progress towards dismantling systemic racism and fostering a truly just society."""
40,26,John,Democrat,"""Julian, I agree that promoting diversity and inclusion in our institutions is crucial. By giving marginalized voices a seat at the table, we can create decision-making policies that genuinely serve the needs of all Americans, not just the privileged few."""
40,27,Julian,Democrat,"""Let's not forget, John, that racism is not just a historical issue, but a present-day phenomenon that perpetuates systemic inequalities. We must continue to push for tangible policy changes that dismantle these inequalities and ensure equal opportunities for all Americans, regardless of their background."""
40,27,John,Democrat,"""I agree that racism is a present-day phenomenon that perpetuates systemic inequalities. To truly address this issue, we need to codify policies that promote diversity and inclusion, provide reparative justice, and ensure equal access to education and economic opportunities for marginalized communities."""
40,28,Julian,Democrat,"""I couldn't agree more, John. Codifying policies that promote diversity and inclusion is crucial. We must also hold corporations accountable for perpetuating systemic racism and ensure equal access to opportunities for marginalized communities, creating a more just society for all."""
40,28,John,Democrat,"""Julian, I agree that racism is a present-day phenomenon. To truly dismantle systemic racism, we need to prioritize policy reforms that address implicit bias, promote diversity, and ensure accountability. We must also invest in education and economic empowerment to create a just and equitable society."""
40,29,Julian,Democrat,"""As we move forward, we must address racial health disparities, including the disproportionate rate of premature deaths in communities of color. We need data-driven solutions, equitable healthcare access, and community-led initiatives to tackle these disparities and promote a culture of well-being and justice."""
40,29,John,Democrat,"""I agree that addressing racial health disparities is crucial. We need to invest in community-led healthcare initiatives, provide equitable access to healthcare services, and prioritize data-driven solutions to bridge the racial gap in healthcare outcomes."""
40,30,Julian,Democrat,"""John, I couldn't agree more on addressing racial health disparities. We must also acknowledge the role of systemic racism in perpetuating health inequities. By investing in community-led initiatives and data-driven solutions, we can create a healthcare system that truly serves all Americans, regardless of their background."""
40,30,John,Democrat,"""I agree, Julian, that addressing systemic racism requires a multifaceted approach. We must invest in community-led initiatives, prioritize data-driven solutions, and ensure equitable access to healthcare services. By doing so, we can create a culture of well-being and justice for all Americans."""
