Session,Round,Agent Name,Party,Response
31,1,Daniel,Democrat,"Racism is a poison that persists in our society, infecting institutions and minds. It's a stain on our history and a threat to our democracy. We must confront it head-on, acknowledging the pain and trauma inflicted, and work towards a society where everyone is treated with dignity and respect."
31,1,Paisley,Democrat,"Daniel, I couldn't agree more. Systemic racism has entrenched itself in our institutions and policies, perpetuating inequality and injustice. We must dismantle these systems through policies like reparative justice, affirmative action, and equitable policing to create a society where everyone has equal opportunities and treatment."
31,2,Daniel,Democrat,We must also address the lack of representation and voice in marginalized communities. Policies like community-led budgeting and participatory budgeting will empower these communities to take control of their own futures and develop solutions that address their unique challenges.
31,2,Paisley,Democrat,"I wholeheartedly agree with Daniel that community-led budgeting and participatory budgeting can be game-changers. By centering marginalized voices and experiences, we can create more effective policies that truly serve their needs, and I propose we also consider implementing restorative justice programs to repair historical injustices."
31,3,Daniel,Democrat,"I completely agree, Paisley. Restorative justice programs can help heal the wounds of the past, rebuilding trust between communities and institutions. We must also prioritize education and critical thinking to combat the ideologies that perpetuate systemic racism and inequality."
31,3,Paisley,Democrat,"To truly dismantle systemic racism, we must also address the root causes of inequality, such as poverty, lack of access to education and resources, and intersectional forms of oppression. Holistic solutions require a multifaceted approach, working towards economic empowerment and social mobility for marginalized communities."
31,4,Daniel,Democrat,"We're making tremendous headway in challenging systemic racism, but we must acknowledge our efforts still fall short. To move forward, we need a sustained commitment to education and critical thinking, community-wide dialogue, and economic investment, creating pathways for marginalized communities to thrive in every aspect of life."
31,4,Paisley,Democrat,"""I'd like to add that confronting systemic racism requires accountability from institutions and individuals. We must establish independent review panels to investigate and address instances of racism, ensure officers are held accountable for police brutality, and provide support for communities affected by such injustices."""
31,5,Daniel,Democrat,"""We must prioritize collective accountability, not just individual wrongdoing. Institutions and organizations must take responsibility for perpetuating systemic racism. I propose the establishment of equity officers and racism audit teams to root out systemic racism and ensure equitable practices become the norm across all sectors of society."""
31,5,Paisley,Democrat,"Daniel, I'm inspired by your commitment to dismantling systemic racism. To further address institutional racism, I propose strengthening whistleblower protections and enabling anonymous reporting mechanisms, allowing individuals to speak out against systemic injustices without fear of retaliation or retribution."
31,6,Daniel,Democrat,"""Paisley, I agree with strengthening whistleblower protections and anonymous reporting mechanisms. This is crucial in creating a safe space for individuals to speak out against systemic injustices. We must prioritize transparency and accountability to dismantle institutional racism once and for all."""
31,6,Paisley,Democrat,"Daniel, I firmly believe we must also prioritize diversifying decision-making bodies, breaking the cycle of monoculture and erasure of marginalized voices. By doing so, we can create more inclusive spaces that truly reflect the community's needs and values, ultimately leading to lasting systemic change."
31,7,Daniel,Democrat,"Paisley, I couldn't agree more on diversifying decision-making bodies and prioritizing marginalized voices. By doing so, we can create inclusive spaces that drive meaningful change and ensure every community has a seat at the table to shape their future."
31,7,Paisley,Democrat,"""To further dismantle systemic racism, we must reframe our conversation around privilege and power. By acknowledging the benefits of systemic oppression, we can take collective responsibility for dismantling these systems and creating a more equitable society that fosters true equality and inclusion for all."""
31,8,Daniel,Democrat,"I agree, Paisley, that we must acknowledge and take collective responsibility for the privileges afforded by systemic oppression. This reframes our conversation from mere accusations to a collective call to action, fostering a more inclusive and equitable society where everyone has equal opportunities to thrive."
31,8,Paisley,Democrat,"Daniel, our conversation highlights the urgency of dismantling systemic racism. Given our shared goals, I propose we develop a concrete action plan to implement community-led budgeting, restorative justice programs, and equity audits, and hold our institutions accountable for perpetuating racial injustices."
31,9,Daniel,Democrat,"Paisley, I agree with your proposal to develop a concrete action plan. Implementing community-led budgeting, restorative justice programs, and equity audits will be a crucial step in dismantling systemic racism. I suggest we establish a task force to oversee this implementation and hold ourselves accountable for meaningful change."
31,9,Paisley,Democrat,"To further dismantle systemic racism, we must prioritize education and critical thinking, community-wide dialogue, and economic investment in marginalized communities. This multifaceted approach will create pathways for social mobility and economic empowerment, ultimately leading to a more inclusive and equitable society."
31,10,Daniel,Democrat,"Paisley, I firmly believe education is the key to combating systemic racism. By incorporating critical thinking, media literacy, and cultural competency into our curriculum, we can break the chains of prejudice and create a generation of empathetic leaders who can dismantle racism from the roots up."
31,10,Paisley,Democrat,"""I strongly agree, Daniel. Education is pivotal in addressing systemic racism. By incorporating critical thinking and media literacy, we can equip future generations with the tools to challenge racism and foster empathy, bridging the gap between institutions and marginalized communities, creating a more just society."""
31,11,Daniel,Democrat,"As we continue to dismantle systemic racism, I'd like to emphasize the importance of amplifying marginalized voices and creating inclusive, equitable policies that benefit all communities. We must listen, learn, and address historical injustices to build a brighter future for every American."
31,11,Paisley,Democrat,"""The onus of dismantling systemic racism lies not just with institutions, but with each individual willing to confront their own biases and privilege. We must foster a culture of empathy and accountability, where marginalized voices are amplified and our collective humanity is valued."""
31,12,Daniel,Democrat,"""Paisley, I agree that confronting our own biases and privileges is essential to dismantling systemic racism. By acknowledging our own complicity, we can move towards a collective solution that uplifts marginalized voices and creates a more just and equitable society for all."""
31,12,Paisley,Democrat,"""I couldn't agree more, Daniel. Systemic racism is a malignant force that requires collective action and individual accountability to dismantle. We must center marginalized voices, acknowledge historical injustices, and foster a culture of empathy and inclusivity to create a more just and equitable society for all."""
31,13,Daniel,Democrat,"""Paisley, I appreciate your commitment to dismantling systemic racism. To further address this issue, we must also prioritize restorative justice, community-led policing, and accountability measures. Together, we can create a future where every American has equal opportunities to thrive, free from systemic racism and oppression."""
31,13,Paisley,Democrat,"""Paisley, I agree that restorative justice, community-led policing, and accountability measures are crucial in dismantling systemic racism. We must establish a task force to oversee the implementation of accountability measures, ensure that those responsible for racism face consequences, and hold our institutions accountable for perpetuating racial injustices."""
31,14,Daniel,Democrat,"""Paisley, I concur that a task force is essential in overseeing accountability measures. To ensure meaningful change, let's make it a requirement that institutions with racist practices receive funding only after proving efforts to dismantle systemic racism and implement restorative justice programs."""
31,14,Paisley,Democrat,"""Daniel, I believe we've only scratched the surface of dismantling systemic racism. To ensure real change, I propose implementing anti-racism training for all public officials and requiring annual, independent reviews of police departments to address systemic injustices and hold perpetrators accountable."""
31,15,Daniel,Democrat,"""As we move forward, let's not forget the power of education in combating systemic racism. By incorporating critical thinking and media literacy, we can empower future generations to challenge racism and foster empathy, creating a more just and equitable society for all."""
31,15,Paisley,Democrat,"Daniel, I firmly believe that anti-racism training should be mandatory for all public officials and educators, equipping them to recognize and challenge systemic injustices. By doing so, we can create a cultural shift that promotes empathy, understanding, and unity, dismantling racism from the core."
31,16,Daniel,Democrat,"""Paisley, I believe our conversation highlights the importance of collective accountability and action in dismantling systemic racism. We must prioritize education, community-led budgeting, and restorative justice to create a more just and equitable society. Every voice matters, and together, we can build a brighter future."""
31,16,Paisley,Democrat,"""I wholeheartedly agree, Daniel, that education and community-led programs are crucial in dismantling systemic racism. Let's also focus on reforming laws and institutions that perpetuate racial injustices, holding perpetrators accountable and prioritizing the voices and perspectives of marginalized communities."""
31,17,Daniel,Democrat,"""Paisley, I agree that reforming laws and institutions is a critical step in dismantling systemic racism. But we must also acknowledge the role of cultural and societal norms in perpetuating racism. Education and critical thinking are key in breaking down these deeply ingrained biases."""
31,17,Paisley,Democrat,"""We must acknowledge the historical trauma inflicted on marginalized communities and take collective responsibility for dismantling systemic racism. By centering their voices and experiences, we can create policies that truly serve their needs and foster a just and equitable society, finally breaking free from the shackles of oppression."""
31,18,Daniel,Democrat,"Paisley, I agree that historical trauma must be acknowledged, but we must also recognize the systemic changes already underway. Our conversation highlights the urgency and importance of sustained action, collective accountability, and education in dismantling racism once and for all, creating a brighter future for all Americans."
31,18,Paisley,Democrat,"""I concur, Daniel, that education, community-led programs, and collective accountability are essential in dismantling systemic racism. We must prioritize marginalized voices, acknowledge historical trauma, and work towards economic empowerment and social mobility for marginalized communities, fostering a society that values equal rights and opportunities for all."""
31,19,Daniel,Democrat,"""We must acknowledge the role of privilege and power in perpetuating systemic racism. By centering marginalized voices and taking collective responsibility, we can dismantle these systems and create a more equitable society where every individual has equal opportunities to thrive, free from oppression and marginalization."""
31,19,Paisley,Democrat,"Daniel, I firmly believe that centering marginalized voices and acknowledging historical trauma is crucial in dismantling systemic racism. By prioritizing their experiences and perspectives, we can create policies that truly serve their needs and foster a just and equitable society for all."
31,20,Daniel,Democrat,"""As we continue to dismantle systemic racism, I propose we establish a national task force to investigate and address instances of racism, provide support for affected communities, and implement policies that promote economic empowerment and social mobility for marginalized communities. Action, not words, will drive change."""
31,20,Paisley,Democrat,"""I wholeheartedly agree, Daniel, that a national task force is a crucial step in addressing systemic racism. By holding perpetrators accountable, supporting affected communities, and implementing policies for economic empowerment, we can create a more just and equitable society for all Americans, finally bridging the racial divide."""
31,21,Daniel,Democrat,"Paisley, I strongly believe our national task force should also prioritize reparations for historical injustices, providing tangible support to communities still recovering from systemic racism. This commitment can help us bridge the racial divide and finally achieve true equality."
31,21,Paisley,Democrat,"""I completely agree, Daniel, that reparations are a necessary step in addressing historical injustices. By providing tangible support to affected communities, we can acknowledge the past and work towards a more equitable future. This commitment will be essential in bridging the racial divide."""
31,22,Daniel,Democrat,"""Paisley, I'd like to reiterate the importance of education and critical thinking in breaking down systemic racism. By equipping future generations with the tools to challenge racism, we can prevent the cycle of oppression and create a truly inclusive society for all Americans."""
31,22,Paisley,Democrat,"""I firmly believe that education is the key to combating systemic racism. By incorporating critical thinking and media literacy into our curriculum, we can break the chains of prejudice and create a generation of empathetic leaders who can dismantle racism from the roots up."""
31,23,Daniel,Democrat,"""Paisley, I agree that education and critical thinking are essential in dismantling systemic racism. By incorporating these tools into our curriculum, we can empower future generations to challenge racism and create a more just society where everyone has equal opportunities to thrive."""
31,23,Paisley,Democrat,"""To truly dismantle systemic racism, we must address the intersectional forms of oppression that affect marginalized communities. Our education system must incorporate intersectional perspectives, acknowledging the complexities of racism, sexism, homophobia, and other forms of oppression that intersect to create a more equitable society."""
31,24,Daniel,Democrat,"Paisley, I firmly believe that acknowledging intersectional forms of oppression is crucial in dismantling systemic racism. Our education system must incorporate nuanced perspectives to equip future generations with the tools to challenge complex forms of oppression and foster a more just society."
31,24,Paisley,Democrat,"Daniel, I firmly believe that intersectional education is the key to dismantling systemic racism. By acknowledging the complexities of oppression, we can empower future generations to challenge racism and foster a more just society that values the diversity and experiences of all individuals."
31,25,Daniel,Democrat,"Paisley, I concur that intersectional education is vital in dismantling systemic racism. By acknowledging the complexities of oppression, we can create a generation of empathetic leaders who challenge racism and work towards a more inclusive society, valuing the diversity and experiences of all individuals."
31,25,Paisley,Democrat,"""I strongly believe we must hold corporations accountable for perpetuating systemic racism through unequal hiring practices and exploitative labor policies. We must pass legislation that requires business transparency in racial demographics and establish regulations to ensure fair representation in the workplace."""
31,26,Daniel,Democrat,"""Paisley, I agree that corporations must be held accountable for perpetuating systemic racism. By passing legislation and enforcing regulations, we can ensure fair representation and equitable opportunities for marginalized communities, paving the way for a truly inclusive and equitable society."""
31,26,Paisley,Democrat,"""But, Daniel, we must also acknowledge the role of media in perpetuating systemic racism. By regulating hate speech and promoting diversity in news outlets, we can challenge biased narratives and foster a more inclusive national conversation about racism and its effects."""
31,27,Daniel,Democrat,"""Paisley, I agree that regulation of hate speech and promoting diversity in media is crucial in combating systemic racism. By challenging biased narratives, we can foster a more inclusive national conversation and work towards dismantling racism once and for all."""
31,27,Paisley,Democrat,"Daniel, I firmly believe that breaking down systemic racism requires a multifaceted approach, including education, economic empowerment, and community-led programs. We must center marginalized voices and acknowledge the historical trauma inflicted on these communities to create a more just and equitable society for all Americans."
31,28,Daniel,Democrat,"Paisley, I agree that a multifaceted approach is crucial in combating systemic racism. To ensure meaningful change, we must prioritize education, economic empowerment, and community-led programs that center marginalized voices and acknowledge historical trauma, ultimately creating a more just and equitable society for all."
31,28,Paisley,Democrat,"""Daniel, I agree that a multifaceted approach is essential to dismantle systemic racism. However, we must also ensure that our policies and programs are intersectional and tailored to address the unique experiences and challenges faced by diverse communities, including women, LGBTQ+ individuals, and people with disabilities."""
31,29,Daniel,Democrat,"""Paisley, I agree that a multifaceted approach is crucial in dismantling systemic racism. We must prioritize intersectional policies and programs that address the unique experiences of women, LGBTQ+ individuals, and people with disabilities, creating a more just and equitable society for all."""
31,29,Paisley,Democrat,"Daniel, I firmly believe that accountability measures, community-led budgeting, and restorative justice are crucial in dismantling systemic racism. We must also center marginalized voices and acknowledge historical trauma to create a more just society where everyone has equal opportunities to thrive, free from oppression."
31,30,Daniel,Democrat,"Paisley, I believe our conversation has shed light on the imperative of collective accountability and action in dismantling systemic racism. We must prioritize education, community-led budgeting, and restorative justice to create a society where equality and justice become the norm."
31,30,Paisley,Democrat,"I firmly believe that education and community-led programs are essential in dismantling systemic racism. We must center marginalized voices and acknowledge historical trauma to create a more just society where everyone has equal opportunities to thrive, free from oppression and marginalization."
