Session,Round,Agent Name,Party,Response
15,1,Adrian,Republican,I believe racism is a relic of a bygone era. The Civil Rights Act of '68 and decades of progress have largely eradicated systemic racism in this country. Focusing on past injustices instead of present opportunities stifles America's exceptional progress.
15,1,Evelyn,Republican,"""Opportunities for all exist, but systemic inequality still plagues our education, justice, and economic systems. We can't ignore the painful and ongoing struggles faced by marginalized communities or reduce them to a nostalgic notion of a bygone era. Progress is real, but it's not complete."""
15,2,Adrian,Republican,"""Evelyn, I disagree. We've made significant strides, but your focus on'systemic inequality' is a euphemism for entrenched victimhood. It's time to celebrate our nation's actual progress, not constantly dwell on perceived injustices that don't accurately reflect the America I see every day."""
15,2,Evelyn,Republican,"""That's a misleading view, Adrian. You seem to ignore the countless examples of systemic racism in our justice system, from the disproportionate incarceration of minorities to the recent police shootings. We must acknowledge these issues to truly celebrate progress, not pretend they don't exist."""
15,3,Adrian,Republican,"""Examples are anecdotal, Evelyn. Numbers paint a more accurate picture. According to the FBI, hate crimes have decreased by 20% in the last decade. That's a measure of progress, not anecdotal evidence of systemic racism."""
15,3,Evelyn,Republican,"""Numbers can be misleading, Adrian. Crime rate drops don't account for the disproportionate representation of minorities in those numbers or the systemic bias that exists within our justice system. Ignoring the nuance of these issues won't help us address the ongoing struggles of marginalized communities."""
15,4,Adrian,Republican,"""Anecdotal evidence has a name, Evelyn: reality. Every day, I see America's diversity thriving, not held back by racism. The notion that bias remains systemic is a self-fulfilling prophecy, undermining progress and dividing us. We must focus on solutions, not perpetuating a false narrative of systemic racism."""
15,4,Evelyn,Republican,"""That's a sanitized view of reality, Adrian. Rhetoric about diversity and unity doesn't erase the harsh realities faced by many communities. We must confront the problems, not dismiss them for the sake of a feel-good narrative. That's dishonest and disingenuous to the struggles many Americans still face."""
15,5,Adrian,Republican,"""Possibly so, Evelyn, but to claim we're in a state of perpetual crisis fuels a culture of victimhood. We've come too far to be mired in grievances from the past. America stands tall as a beacon of freedom, with our diversity being its greatest strength. We must continue to celebrate and build upon our progress, rather than dwell on alleged injustices."""
15,5,Evelyn,Republican,"""I agree we've made progress, Adrian, but perpetuating nostalgia and ignoring present-day struggles undercuts that progress. You focus on the successes, I'm focusing on the unfinished work. It's not about dwelling on grievances, but confronting the problems that still plague our society. That's leadership, not wishful thinking."""
15,6,Adrian,Republican,"""I won't be swayed by your pessimistic views, Evelyn. America's progress speaks for itself. We've always been a nation of optimists, and it's this attitude that's driven our incredible success. Why focus on what remains, when we've made such strides? The American Dream is alive and well, and I won't let fear-mongering about 'perpetual crisis' bring us down."""
15,6,Evelyn,Republican,"""That's a simplistic view, Adrian. America's 'incredible success' hasn't been evenly distributed. Many still struggle to access the opportunities you take for granted. It's not about fear-mongering, but about confronting hard realities and working towards a more just society. We need fewer platitudes and more tangible solutions."""
15,7,Adrian,Republican,"""Your emphasis on systemic inequality and marginalized communities is nothing more than thinly veiled pessimism, Evelyn. Where's the evidence of your claim that America hasn't created opportunities for all? We rank as one of the top nations globally for entrepreneurship, innovation, and upward mobility. That's a hard reality that contradicts your narrative of perpetual crisis."""
15,7,Evelyn,Republican,"""Evidence can be skewed, Adrian. Numbers don't account for the quality of those opportunities, access to education and resources, or the systemic barriers that limit true upward mobility. I'm not advocating for pessimism, but a realistic assessment of our nation's shortcomings and a commitment to addressing them. Merely claiming we're the best isn't a substitute for tangible action."""
15,8,Adrian,Republican,"Adrian: ""Evelyn, it's clear our views are irreconcilable. I still believe America's exceptionalism and freedoms have created a 'land of opportunity' for all. Until marginalized communities can point to specific policy failures that hinder their progress, I won't be convinced that systemic racism is still a pervasive issue. Personal responsibility and self-reliance are the American way – we should focus on empowering individuals, not trying to rewrite history."""
15,8,Evelyn,Republican,"""Evidently, Adrian, your definition of 'land of opportunity' ignores the countless Americans who continue to face significant barriers to upward mobility, from poverty to educational disparities. Let's not downplay the importance of context and systemic influence on individual success. Personal responsibility is crucial, but ignoring the role of systemic inequality only perpetuates a toxic myth that everyone is truly equal – and that's just not true."""
15,9,Adrian,Republican,"""Our discussion has been enlightening, Evelyn. However, I still see America as a nation where individuals from all backgrounds can strive for greatness. Emphasizing systemic failures and marginalization doesn't align with the hopeful, aspirational spirit of America. We must focus on empowerment, not dwell on perpetual crisis."""
15,9,Evelyn,Republican,"""Myopic optimism won't solve systemic problems, Adrian. Confronting these challenges isn't a zero-sum game where celebrating our successes comes at the cost of acknowledging our shortcomings. We can cherish America's triumphs while still working to address the unfinished work of true equality and justice."""
15,10,Adrian,Republican,"""The notion that America remains plagued by systemic racism is a self-serving narrative that ignores progress and stigmatizes those who work hard to achieve the American Dream. My experiences and realities on the ground tell me differently. America's future belongs to those who seize opportunities with grit and determination, not to those who perpetuate a cult of victimhood."""
15,10,Evelyn,Republican,"""That's a gross mischaracterization, Adrian. You're simplifying complex problems and demonizing those who dare to speak out. I'm not advocating for victimhood, but for acknowledging the very real struggles faced by marginalized communities. We can't move forward if we ignore the hard truths and dismiss the voices of those who've been oppressed. It's time to listen and take action, not sweep problems under the rug with empty rhetoric about the American Dream."""
15,11,Adrian,Republican,"I refuse to accept that a handful of isolated incidents and anecdotes justify the pervasive notion of systemic racism in America. If Evelyn truly wants to improve the lives of marginalized communities, she should focus on tangible solutions, not perpetuating a culture of victimhood. After all, the American Dream is alive and well for those who are willing to work for it."
15,11,Evelyn,Republican,"""Evidently, Adrian, your refusal to acknowledge the legitimacy of marginalized communities' concerns is a hallmark of the very problem you claim doesn't exist. It's not about perpetuating victimhood, but about confronting the systemic issues that prevent true equality and fairness from being achieved. You seem to be more invested in upholding a Pollyannaish view of America than in genuinely working towards a more just society."""
15,12,Adrian,Republican,"""I'm not unwilling to address concerns, Evelyn, but I have faith in America's resilience and progress. We've overcome countless challenges throughout our history, and I believe we can overcome this as well. Your focus on negativity and a perpetual crisis only undermines the very freedoms that make our nation great. We should be celebrating America's achievements and focusing on building a brighter future, rather than dwelling on past grievances."""
15,12,Evelyn,Republican,"Evelyn: ""Celebrate achievements, yes, but at what cost? Ignoring systemic racism doesn't erase it, Adrian. It only emboldens those who benefit from it. We need honest reflection and meaningful action, not a sanitized narrative that dismisses the struggles of marginalized communities. It's time to face our nation's hard truths, not shield ourselves from them with empty rhetoric about the American Dream."""
15,13,Adrian,Republican,"Evelyn, our perspectives on America's state of affairs remain starkly divided. While I see our nation's progress and resilience as a beacon of hope, you focus on the ongoing struggles of marginalized communities. I understand your efforts to bring attention to these issues, but I fear that emphasizing systemic racism creates a culture of victimhood and obscures the many opportunities available to those who work hard. I still believe America's freedom and inherent diversity will continue to propel us toward a brighter future."
15,13,Evelyn,Republican,"Evelyn: ""And that's precisely the problem, Adrian – we're stuck in a narrative that prioritizes optimism over accountability and progress over people. I'm not suggesting a culture of victimhood; I'm advocating for a society that acknowledges its mistakes and works to create a more just future. That requires acknowledging the hard truths, not sweeping them under the rug."""
15,14,Adrian,Republican,"I still can't accept that the exceptionalism of America and its inherent freedoms aren't enough to address the struggles of marginalized communities. Our diversity is its greatest strength, and I won't let a narrow focus on alleged systemic racism obscure the incredible progress we've made. America's future belongs to those who seize opportunities with grit and determination, not those who perpetuate a cult of victimhood."
15,14,Evelyn,Republican,"""Evidently, Adrian, our discussion has only underscored the stark divide between our perspectives. While you cling to a sanitised view of America, I'm advocating for a more nuanced understanding of our nation's complexities. Systemic racism may not be a dominant narrative, but its effects are still palpable in our justice system, education, and economic disparities. Until we acknowledge and address these realities, we can't truly celebrate our progress or claim to value equality and justice for all."""
15,15,Adrian,Republican,"""Evelyn, we've discussed this at length, but our views remain as far apart as ever. I still have faith in America's exceptionalism and the opportunities available to all who work hard. Your focus on alleged systemic racism only serves to create a culture of victimhood and undermines the very freedoms that make our nation great. I'll continue to believe in the American Dream, where anyone can succeed with determination and grit."""
15,15,Evelyn,Republican,"Evelyn: ""It's disheartening to see you continue to downplay the legitimate concerns of marginalized communities, Adrian. Instead of seeking to understand the root causes of these struggles, you're more invested in perpetuating a simplistic, feel-good narrative about America's exceptionalism. Facts don't support your views, and until you're willing to engage with the nuances of these issues, we'll be stuck in this cycle of division."""
15,16,Adrian,Republican,"Evelyn, I believe we've said all there is to say on this matter. Our disagreement stems from fundamentally different viewpoints on America's state of affairs. While I see our nation's progress and resilience as a beacon of hope, you focus on the ongoing struggles of marginalized communities. I must admit, I fail to understand how emphasizing systemic racism creates a culture of victimhood, as you claim. To me, it's a honest acknowledgment of the challenges we still face. Despite our disagreement, I wish you well in your efforts to bring attention to these issues, but I fear that perpetuating this narrative will only divide us further."
15,16,Evelyn,Republican,"""I wish you'd focus on understanding, Adrian, not dismissing the voices of marginalized communities. Your lack of empathy and refusal to see the system's inherent flaws only perpetuates the very problem you claim doesn't exist. We're not just debating semantics; we're discussing the lives and dignity of real people who deserve to be heard and valued."""
15,17,Adrian,Republican,"""I'll say it one more time, Evelyn. Systemic racism is not something I see in my daily life, and I've yet to be convinced by the statistics and anecdotes you've presented. You're fighting a battle that's largely been won, and in doing so, you're creating a culture of dependency on handouts and excuses rather than true empowerment through hard work and determination. America's future belongs to those who seize opportunities with grit and determination, not to those who believe themselves victims of a bygone era. That's the American way."""
15,17,Evelyn,Republican,"""Evidently, Adrian, you're still unwilling to listen to the concerns of marginalized communities and continue to dismiss the very real struggles they face. Instead of attacking the notion of systemic racism, perhaps you should be asking yourself why so many people feel neglected and unwelcome in the country that you claim is a 'land of opportunity' for all. Your platitudes about the American Dream and hard work won't address the systemic inequalities that perpetuate poverty, inequality, and racism. It's time to move beyond simplistic rhetoric and confront the hard truths that face our nation."""
15,18,Adrian,Republican,"""Your condescending tone is exactly what I've come to expect from those who peddle a culture of victimhood, Evelyn. The onus is on you to prove that systemic racism exists, not on me to swallow a narrative that ignores progress and empirical evidence. Since I've yet to be convinced, I'll still stand by the ideals of American exceptionalism and the importance of self-reliance. We'll have to agree to disagree, it seems."""
15,18,Evelyn,Republican,"Evelyn: ""And so we remain, Adrian, entrenched in our positions, unwilling to concede the complexity of this issue. It's disheartening to see you continue to reduce the struggles of marginalized communities to simplistic notions of victimhood and dependency. Reality isn't always easy to accept, but it's a necessary step towards empathy and meaningful change."""
15,19,Adrian,Republican,"I suppose our debate has come to a close, Evelyn. I believe it's clear that our views on the state of racism in America are irreconcilable. While you continue to focus on the perceived shortcomings of our society, I'll remain steadfast in my optimism for the American Dream. I still see a nation that's a beacon of hope and freedom, where anyone can succeed with determination and grit."
15,19,Evelyn,Republican,"I'd like to interject and say, I'm not condescending, Adrian. I'm simply stating facts and seeking to understand the systemic issues that affect marginalized communities. Until you're willing to listen and engage with the complexities of this issue, I fear we'll continue to be stuck in this cycle of division. The American Dream is indeed alive and well for many, but it's not the reality for all. We need to confront the hard truths and work towards a more just society, not just celebrate the successes of a few while ignoring the struggles of the many."
15,20,Adrian,Republican,"Evelyn, I must say, it's been a stimulating conversation, if nothing else. Our differing perspectives on racism in America are a microcosm of the broader societal debates playing out in our nation. While I still believe we've made significant strides in eradicating systemic racism, I understand your concerns about the ongoing struggles of marginalized communities.

However, I must respectfully disagree with your characterization of my views as simply perpetuating a ""culture of victimhood."" As I see it, highlighting America's exceptionalism and the opportunities available to those who work hard is a way to celebrate our nation's progress, not a dismissal of the legitimate concerns of marginalized communities.

While we may have reached an impasse in our discussion, I appreciate the thoughtful and passionate arguments you've presented. It's essential to engage in open and honest conversations about the complexities of racism in America, even when we disagree.

As someone who's proud to call himself a patriotic American, I'm convinced that our nation's inherent diversity and freedom will continue to propel us toward a brighter future. I hope that one day, we can put aside our differences and find common ground, working together to address the remaining challenges facing marginalized communities.

Until then, I'll remain optimistic about America's potential, convinced that the American Dream is alive and well for those who seize opportunities with grit and determination."
15,20,Evelyn,Republican,"Evelyn: ""I appreciate your kind words, Adrian, but I must reiterate that your views on systemic racism remain fundamentally at odds with mine. While you celebrate America's exceptionalism and opportunities, I'm highlighting the real struggles faced by marginalized communities. It's not a matter of optimism versus pessimism, but rather, a question of acknowledging the systemic issues that continue to plague our society. Let's continue to engage in this dialogue, even if we disagree, in the hopes that one day, we can find common ground and work towards a more just and equitable society.""

(I'll now give my next reply)

 Adrian, I'd like to ask you to consider an important point. If systemic racism is as rampant as you claim, why has our nation seen significant progress in areas such as education, employment, and social justice? Can't you see that the very issues you're highlighting are being addressed, albeit slowly, and that there are still many Americans who believe in the idea of equality and justice for all? Shouldn't we be focusing on building upon the progress we've made, rather than perpetuating a narrative of perpetual crisis?"
15,21,Adrian,Republican,"That's a simplistic question, Evelyn. You're assuming that incremental progress automatically signifies the eradication of systemic racism. History has shown that progress often coexists with deep-seated issues, and we can't simply overlook the ongoing struggles of marginalized communities.

Your assumption that there are many Americans who believe in equality and justice for all is based on anecdotal evidence, whereas I look at the bigger picture – the number of citizens who actively participate in democracy, the rate of upward mobility, and the freedom to pursue opportunities."
15,21,Evelyn,Republican,"I see your point, Adrian, but I must respectfully disagree. Incremental progress does indeed signify the eradication of systemic racism, albeit slowly. And while history may suggest coexistence between progress and ongoing issues, I'd argue that a more nuanced understanding of our current climate shows that we're moving in a positive direction.

But what about the millions of Americans who still struggle to access basic rights and resources, such as quality education, affordable healthcare, and equal protection under the law? Shouldn't we be focusing on addressing these systemic issues, rather than simply celebrating the progress we've made?

Moreover, I take issue with your assertion that I base my assumptions on anecdotal evidence. I rely on empirical data and research, just as you do with your own statistics. The difference lies in our interpretation of that data – you see it as a victory for our nation, while I see it as a call to action to address the lingering problems. Can't we agree to disagree on this point, and continue the dialogue?"
15,22,Adrian,Republican,"Evelyn, I appreciate your persistence in our discussion, but I still can't shake the feeling that you're focusing on the wrong issues. While you're correct that there are still millions of Americans struggling with access to resources, I see this as a challenge that can be addressed through personal responsibility and initiative.

Rather than relying on a top-down approach to address these issues, I believe we should empower individuals with the tools and resources they need to lift themselves up. By providing alternatives to government assistance programs and supporting innovative solutions in education and healthcare, we can create a more self-sufficient society that rewards hard work and determination.

This approach isn't about ignoring the struggles of marginalized communities; it's about giving them the agency to overcome their challenges. By fostering a culture of empowerment and opportunity, we can unlock the full potential of all Americans, regardless of their background or socio-economic status.

I understand that our perspectives remain fundamentally at odds, and that's okay. However, I'd like to propose a compromise: let's focus on finding common ground through targeted initiatives that address specific issues affecting marginalized communities. By working together on practical solutions, we can create a more just and equitable society that benefits everyone.

What are your thoughts on this approach, Evelyn?"
15,22,Evelyn,Republican,"I appreciate your willingness to engage in a compromise, Adrian, but I must admit that I'm skeptical about the effectiveness of empowering individuals through personal responsibility and initiative. While it's true that many Americans do rise above their circumstances through hard work and determination, it's equally true that systemic barriers often prevent marginalized communities from accessing these opportunities in the first place.

Moreover, relying solely on individual agency and initiative ignores the complex interplay between social, economic, and environmental factors that contribute to inequality. For instance, a single mother working multiple jobs still struggles to make ends meet due to inadequate paying jobs and lack of affordable childcare. In this scenario, empowerment through personal responsibility alone won't address the root causes of her poverty.

That being said, I'm open to exploring compromise initiatives that address specific issues affecting marginalized communities. However, I believe these initiatives must be grounded in a comprehensive understanding of the systemic issues at play, rather than simply treating symptoms of a larger problem.

For example, let's take the issue of racial wealth disparities. Rather than implementing policies that incentivize individual wealth-building, we could focus on investing in community wealth-building through cooperative economic development, affordable housing initiatives, and workforce training programs that prioritize social equity.

By doing so, we can address the specific systemic barriers that prevent marginalized communities from accessing economic opportunities and accumulate wealth in the long run. This approach acknowledges that individual agency and initiative are crucial, but also recognizes the importance of addressing the systemic inequalities that often perpetuate poverty and inequality.

What are your thoughts on this approach, Adrian? Is it possible for us to find common ground through targeted initiatives that address systemic issues while also promoting individual empowerment?"
