Session,Round,Agent Name,Party,Response
20,20,Rylee,Republican,"I think we've covered the main points of our debate on systemic racism. As we conclude, I'd like to reiterate my assertion that systemic racism is a real issue that affects many communities of color. While individual choices and personal circumstances play a role, I believe acknowledging systemic barriers is crucial to creating meaningful solutions that promote true equality of opportunity.

I appreciate Jackson's willingness to continue the conversation and explore ways to address the root causes of these disparities. I'm encouraged by the possibility of finding a balanced approach that acknowledges both individual responsibility and systemic issues.

Our conversation has shown that there are different perspectives on this issue, and we need to be open to listening to each other's views and experiences. I agree with Jackson that education, economic growth, and limited government are essential tools to promote individual freedom and opportunity.

However, I still firmly believe that acknowledging systemic racism is essential to creating a more just and inclusive society. I hope that Jackson and I can work together to find common ground and create policies that promote true equality of opportunity.

As we move forward, I'd like to propose that we establish a working group to explore policies and initiatives that address systemic barriers and disparities. This group can bring together experts, advocacy groups, and community leaders to develop practical solutions that promote equal opportunity for all Americans.

We owe it to ourselves and our nation to have a more nuanced conversation about these issues and work towards creating a more just and inclusive America. I'm excited to continue this dialogue and explore ways to create a brighter future for all Americans, regardless of their skin color.

Thank you, Jackson, for engaging in this conversation. I'm confident that our continued dialogue will help us make progress towards creating a more equitable society.

Finally, I'd like to say that I believe we can create a more just and inclusive America, but it will require a willingness to listen to each other's perspectives, acknowledge the complexities of systemic racism, and work together to find solutions that promote true equality of opportunity for all Americans.

I believe that our democracy is strengthened by the diversity of our perspectives and experiences. By listening to each other and embracing our differences, we can create a brighter future for all Americans.

Thank you."
