Session,Round,Agent Name,Party,Response
19,1,Addison,Republican,"""I truly believe racism is a relic of the past. We've made tremendous progress since the civil rights movement. We should focus on promoting economic empowerment, education, and equal opportunities rather than dwelling on past injustices. It's time to heal and move forward, not get bogged down in hate."""
19,1,Luke,Republican,"""While I share your sentiment on progress made, I believe it's unfair to downplay the realities of systemic racism and microaggressions that still exist. We should acknowledge the struggles of marginalized communities and work towards tangible solutions, rather than dismissing past injustices as a thing of the past."""
19,2,Addison,Republican,"""I understand where you're coming from, Luke, but I think we can address these issues without labeling every action as systemic racism. We need to focus on the individual, not groupthink. Personal responsibility and education are key to breaking down barriers, not guilt trips or government reparations."""
19,2,Luke,Republican,"""While I appreciate your emphasis on personal responsibility, Addison, I strongly disagree that labeling systemic racism as 'guilt trips' dismisses the harsh realities faced by marginalized communities. We must address these systemic issues head-on, not dilute their significance with a 'personal responsibility' narrative."""
19,3,Addison,Republican,"""My point isn't to dismiss the significance of these issues, Luke, but rather to acknowledge that we can combat them through individual action, such as education and economic empowerment, rather than solely relying on government intervention or labeling every problem as systemic racism. Let's empower, not guilt-trip, people towards progress."""
19,3,Luke,Republican,"I appreciate Addison's enthusiasm for education and empowerment. However, I still believe labeling every problem as systemic racism overlooks individual agency and personal choices. By acknowledging individual responsibility, we can foster a culture of self-improvement and collective growth, rather than dwelling on perceived systemic injustices."
19,4,Addison,Republican,"""I see where Luke's coming from, but even the great Ronald Reagan knew that personal responsibility is key to greatness. Let's focus on creating opportunities, not guilt-tripping people with labels, and we'll be able to move forward together as one nation, united in progress and prosperity."""
19,4,Luke,Republican,"I respect Addison's emphasis on personal responsibility and education, but labeling racism as a ""thing of the past"" oversimplifies the ongoing struggles of marginalized communities. By acknowledging systemic injustices, we can work towards tangible solutions that address the root causes of these issues, rather than glossing them over with a narrow focus on individual agency."
19,5,Addison,Republican,"""And I think that's exactly what we're not doing, Luke - glossing over it. We're talking about making progress, not creating dependency on the government. Individual action and personal responsibility will always be the driving force for change, not vague accusations of systemic racism."""
19,5,Luke,Republican,"""I believe Addison's focus on personal responsibility and education is a step in the right direction, but let's not pretend that racism isn't a complex issue. Acknowledging individual agency doesn't have to come at the expense of recognizing the very real struggles faced by marginalized communities, past and present."""
19,6,Addison,Republican,"""I think that's where we're really at, Luke. We both want the same outcome - progress for everyone. Let's agree to find common ground and work towards solutions that empower individuals, rather than being held back by perceived past injustices and divisive labels. We can do better than that."""
19,6,Luke,Republican,"""I still believe we need a more nuanced approach, Addison. Acknowledging past injustices isn't about 'divisive labels,' but recognizing the systemic disparities that persist. By understanding the intricacies of these issues, we can craft targeted solutions to address them, rather than solely relying on individual action or a'move forward' mentality."""
19,7,Addison,Republican,"I respect Luke's passion, but I truly believe we're trying to solve two problems at once: past injustices and present-day progress. Let's focus on promoting equality through personal responsibility and education. By uplifting individuals, we can create a more prosperous society, rather than dwelling on the ghosts of our past."
19,7,Luke,Republican,"""I understand your point, Addison, and appreciate your commitment to promoting equality through education. However, I firmly believe that labeling systemic racism as a relic of the past oversimplifies the struggle of marginalized communities. Recognizing the complexity of these issues requires a more nuanced perspective, not a'moving forward' mentality that dismisses the past."""
19,8,Addison,Republican,"""I think that's the beauty of America, Luke - our ability to find common ground and work towards progress. We can't let the ghosts of our past dictate our future. Let's focus on empowering individuals, promoting self-reliance, and embracing the optimism that made this country great. That's how we'll truly drive change from the bottom up."""
19,8,Luke,Republican,"""My point remains that we must acknowledge the systemic issues that persist, rather than brushing them under the rug as a relic of the past. We can support individual empowerment without dismissing the historical realities that marginalized communities have faced. Healing and progress require honest recognition of our past, not wishful thinking that dismisses the ongoing struggles of marginalized communities."""
19,9,Addison,Republican,"""I understand your dedication to shining a light on past injustices, Luke, but we can't keep dwelling on what's behind us. We owe it to ourselves and future generations to focus on the opportunity ahead, not to be held back by the weight of perceived past guilt. Let's build a better tomorrow, not justify yesterday's problems."""
19,9,Luke,Republican,"""I appreciate Addison's optimism for the future, but we mustn't forget the lessons of our past. By acknowledging and addressing systemic racism, we can create a more inclusive and equitable society where everyone has an equal opportunity to thrive. Let's use the lessons of history to forge a brighter, more just future."""
19,10,Addison,Republican,"""It's time to stop dwelling on past injustices and look towards the progress we can make, Luke. Let's recognize the good that's been done and strive for a brighter future where everyone can thrive, regardless of their background. United, we'll create a society where personal responsibility and hard work are the keys to success."""
19,10,Luke,Republican,"Addison says we need to focus on promoting economic empowerment and education to break down barriers. I agree that economic empowerment is essential, but I strongly disagree that labeling systemic racism as a relic of the past dismisses the ongoing battles of marginalized communities. Acknowledging and addressing these systemic issues is crucial to creating a more inclusive society, where everyone has an equal opportunity to thrive."
19,11,Addison,Republican,"""I understand where Luke's coming from, but isn't it time to move forward? We can't change the past, but we can build a better tomorrow. By focusing on individual empowerment, education, and economic opportunities, I truly believe we'll create a brighter future for everyone, regardless of their background. We just need to stop blaming others and start taking ownership of our own success. That's the American way."""
19,11,Luke,Republican,"Luke:  I still believe that downplaying systemic racism does a disservice to the ongoing struggles of marginalized communities. By acknowledging and addressing these issues, we can create lasting change. Personal responsibility is a vital component, but it must be grounded in an honest recognition of the systemic injustices that persist."
19,12,Addison,Republican,"""I respect Luke's passion, but I truly believe that talking about the past is just that – talking about the past. It's time to focus on what we can change today, not justify what's already happened. Individual action, education, and personal responsibility will always be the key drivers of progress, not dwelling on past injustices or systemic labels."""
19,12,Luke,Republican,"I agree that we should focus on promoting individual empowerment, education, and economic opportunities to break down barriers, but I strongly disagree that labeling systemic racism as a relic of the past dismisses the ongoing struggles of marginalized communities. We must acknowledge and address these systemic issues to create a more inclusive society, where everyone has an equal opportunity to thrive."
19,13,Addison,Republican,"""I think we're going around in circles, Luke. Let's agree to disagree, and instead, focus on finding common ground on the issues that unite us. We can all support economic empowerment, education, and personal responsibility. Let's work towards a more prosperous America where everyone has the chance to succeed, regardless of their background."""
19,13,Luke,Republican,"Luke: I appreciate Addison's willingness to find common ground, but I still believe that acknowledging the harsh realities of systemic racism is essential to moving forward. Downplaying these issues won't erase the struggles of marginalized communities; it's our responsibility to address them head-on to create lasting change."
19,14,Addison,Republican,"""I think we've both made our points clear, Luke. While I understand and respect your dedication to acknowledging systemic racism, I still believe that it's time to move forward and focus on creating opportunities for everyone, regardless of their background. Let's agree to disagree and work towards a more prosperous America, where personal responsibility and hard work are the keys to success."""
19,14,Luke,Republican,"""That's where I see a major disconnect, Addison. While I agree that education and empowerment are key, labeling systemic racism as a relic of the past ignores the fact that it still disproportionately affects marginalized communities. Until we acknowledge and address these systemic issues, we'll never truly achieve the progress you're advocating for."""
19,15,Addison,Republican,"I think we've both presented our viewpoints, Luke. I'd like to reiterate that I believe in empowering individuals through education, personal responsibility, and economic opportunities. We can create a more prosperous America by focusing on what unites us, rather than being held back by labels and past injustices. Let's prioritize progress, not dwell on what's behind us."
19,15,Luke,Republican,"""I appreciate Addison's optimism and commitment to education and empowerment, but I strongly disagree that labeling systemic racism as a relic of the past is the best approach. We must acknowledge and address these systemic issues, even if it's uncomfortable, to create lasting change and ensure equal opportunities for all."""
19,16,Addison,Republican,"""I agree to disagree, Luke. While I understand your point about acknowledging systemic racism, I still believe that individual action, education, and personal responsibility will always be the key drivers of progress. Let's focus on building a brighter future for everyone, rather than dwelling on the past. As Ronald Reagan once said, 'We can't help everyone, but everyone can help themselves.' I think that's the American spirit we should be embracing."""
19,16,Luke,Republican,"""I still disagree that labeling systemic racism as a relic of the past oversimplifies the ongoing struggles of marginalized communities. Acknowledging these systemic issues requires a nuanced understanding, not a sweeping'move forward' mentality that dismisses the past. By recognizing the root causes of our social challenges, we can forge targeted solutions to address them, rather than relying solely on individual action or education."""
19,17,Addison,Republican,"""I think we've made our points clear, Luke. At the end of the day, we all want to see a brighter, more prosperous America where everyone has an equal chance to succeed. Let's put our differences aside and focus on promoting education, economic empowerment, and personal responsibility. That's the American way, and I believe it's the key to creating a truly inclusive society."""
19,17,Luke,Republican,"I respect Addison's enthusiasm for promoting education and empowerment, but I still believe labeling systemic racism as a relic of the past dismisses the ongoing struggles of marginalized communities. By acknowledging and addressing these issues, we can create a more inclusive society where everyone has an equal opportunity to thrive."
19,18,Addison,Republican,"""While I appreciate Luke's dedication to shining a light on past injustices, I truly believe it's time to focus on the progress we can make, not dwell on the ghosts of our past. Let's prioritize individual empowerment through education and economic opportunities. As the great Ronald Reagan once said, 'The greatest leader is not necessarily the one who does the greatest things, he is the one that gets the people to do the greatest things.'"""
19,18,Luke,Republican,"I suppose, Addison, that our disagreement lies in our different approaches to addressing systemic racism. While you focus on individual empowerment through education and economic opportunities, I believe acknowledging and addressing systemic injustices is crucial to creating lasting change. I won't give up on advocating for a more nuanced understanding of our societal challenges, and I hope you can understand where I'm coming from."
19,19,Addison,Republican,"""My point remains clear, Luke. I believe in empowering individuals through education and personal responsibility. Let's focus on creating opportunities for everyone, regardless of their background. United, we'll create a society where hard work and self-reliance are the keys to success. We can rise above our differences and work towards a brighter future, not be held back by past injustices or labels."""
19,19,Luke,Republican,"""I appreciate Addison's passion for empowering individuals and promoting a more prosperous America. However, I still firmly believe that labeling systemic racism as a relic of the past oversimplifies the ongoing struggles of marginalized communities. We must acknowledge and address these systemic issues to create a more inclusive society, where everyone has an equal opportunity to thrive. It's time for us to find a balance between optimism and accountability, rather than dismissing the harsh realities faced by marginalized communities."""
19,20,Addison,Republican,"I'm glad we're ending on a note of mutual respect, Luke. While we may not see eye-to-eye on this issue, I believe our conversation has been a productive exchange of ideas. As Americans, we should always strive to understand different perspectives and work towards creating a more inclusive society. I'm committed to promoting individual empowerment, education, and economic opportunities. I hope that by focusing on what unites us, we can create a brighter future for everyone."
19,20,Luke,Republican,"Luke: I still disagree that labeling systemic racism as a relic of the past oversimplifies the ongoing struggles of marginalized communities. By acknowledging these systemic issues, we can create a more inclusive society where everyone has an equal opportunity to thrive."
