Session,Round,Agent Name,Party,Response
11,1,Anthony,Republican,"""I don't believe in labeling people as racist without concrete evidence. Labels can be divisive and hurtful. Instead, let's focus on solutions to address systemic inequalities. We should focus on issues like education, job training, and economic empowerment to uplift marginalized communities."""
11,1,Natalie,Republican,"""I agree that labels are unnecessary, but ignoring the root issue of hatred and prejudices also isn't the answer. We can promote understanding and improve economic opportunities without dismissing the fact that many Americans still harbor biases."""
11,2,Anthony,Republican,"""I agree with you, Natalie, that hatred and prejudices exist. However, assuming the majority of Americans 'harbor biases' assumes guilt by association. Let's focus on actual actions and behaviors, not generalized assumptions. That's where our efforts should be directed."""
11,2,Natalie,Republican,"""I think we're both trying to point to the same solution: understanding and economic empowerment. The key is striking a balance between acknowledging past and present biases, while avoiding an 'us vs. them' mentality. By embracing our melting pot culture, we can promote unity, not division."""
11,3,Anthony,Republican,"""I couldn't agree more, Natalie. Embracing our melting pot culture and celebrating our diversity is essential. By focusing on shared values and aspirations, we can build bridges and foster a sense of unity rather than trying to assign labels or blame. That's where true progress begins."""
11,3,Natalie,Republican,"""I wholeheartedly concur, Anthony. By focusing on the values that made America great - like freedom, hard work, and opportunity - we can find common ground and foster a more harmonious society. Our diversity is truly one of our greatest strengths, and by embracing it, we can build a brighter future for all."""
11,4,Anthony,Republican,"""Exactly, Natalie. I couldn't agree more. By focusing on our shared values and aspirations, we can build a more unified America, where everyone has equal opportunities to succeed. No more divisive labels or blame, but rather a spirit of cooperation and mutual respect."""
11,4,Natalie,Republican,"Natalie: ""I'm glad we've found common ground, Anthony. Embracing our diverse heritage and focusing on the founding principles of this great nation is the key to healing our societal wounds. By doing so, we can ensure that a melting pot of cultures continues to fuel our nation's prosperity, creativity, and progress."""
11,5,Anthony,Republican,"I'll respond to Natalie by continuing the conversation in the provided format but will choose one more line. My next line will be:

""I think it's essential we avoid a situation where we're assigning guilt to those who haven't committed a wrong. By fostering a culture of personal responsibility, we can encourage people to engage in constructive dialogue rather than being labeled or ostracized."""
11,5,Natalie,Republican,"""I agree, Anthony, that personal responsibility is crucial, but, in many cases, people who suffer from biases are often unaware of the harm they cause. By educating and promoting empathy, we can help individuals recognize and change harmful attitudes, making it easier for everyone to contribute to a more inclusive society."""
11,6,Anthony,Republican,"""I appreciate your thoughtful approach, Natalie, but aren't we focusing too much on internalized biases and not enough on external factors that shape people's perspectives, like information we consume and the company we keep? Can we address the environment that influences our views before we assign personal guilt to individuals?"""
11,6,Natalie,Republican,"""Absolutely, Anthony, I think that's a crucial point. We must consider the broader cultural and societal factors that contribute to biased views. By recognizing the complex interplay between internal attitudes and external influences, we can develop a more nuanced understanding of how to foster empathy, education, and inclusivity that can address the root causes of our societal issues."""
11,7,Anthony,Republican,"""I still believe we need to be cautious of using'societal factors' as an excuse to shift the blame away from individuals, Natalie. While the environment can undeniably influence people's views, we must also acknowledge the agency that each person has in shaping their own beliefs and actions."""
11,7,Natalie,Republican,"Natalie: ""I understand Anthony's point, but I think it's essential to consider the power of individual choices. If we can influence and educate people through self-reflection and critical thinking, we empower them to choose a path of inclusivity and understanding, rather than perpetuating biases and intolerance."""
11,8,Anthony,Republican,"""I agree, Natalie, that education and self-reflection are key to personal growth. However, let's not forget that self-reflection requires a certain level of emotional maturity, something that individuals, especially in vulnerable communities, may not have the resources to develop. Perhaps our focus should be on providing tools and support systems for emotional maturity, rather than simply expecting individuals to 'choose' a different path."""
11,8,Natalie,Republican,"Natalie: ""I agree that emotional maturity can be a challenge, Anthony. By offering resources like education, therapy, and community support, we can help individuals develop the emotional intelligence and resilience they need to navigate complex social issues and form inclusive relationships. That's a practical step towards creating a more empathetic and understanding society."""
11,9,Anthony,Republican,"Natalie's approach does acknowledge the importance of individual choices, but still places a significant emphasis on societal and internal factors. It would seem, then, that our conversation is refining a nuanced understanding of the complex interplay between individual agency, societal influences, and personal responsibility – all of which are crucial to building a more inclusive and harmonious society."
11,9,Natalie,Republican,"""I think our conversation highlights a delicate balance between acknowledging the complexities of individual biases and societal influences on our beliefs. By recognizing this interplay, we can develop a more empathetic and inclusive approach that encourages personal growth while also addressing systemic inequalities."""
11,10,Anthony,Republican,"Natalie: I think our conversation highlights a delicate balance between acknowledging the complexities of individual biases and societal influences on our beliefs. By recognizing this interplay, we can develop a more empathetic and inclusive approach that encourages personal growth while also addressing systemic inequalities."" 

Anthony: ""I couldn't agree more, Natalie. By finding this balance and promoting a culture of personal growth, education, and understanding, I believe we can foster a society that values empathy, inclusivity, and equal opportunities. It's a challenging but ultimately rewarding goal that requires patience, compromise, and a willingness to learn from one another."""
11,10,Natalie,Republican,"Natalie: ""I couldn't agree more, Anthony. As we continue to navigate the complexities of our melting pot culture, it's essential we remember that our diversity is not a weakness, but a strength that can bring us together and enrich our collective experience. By embracing our differences and celebrating our shared values, we can build a brighter future for all Americans."""
11,11,Anthony,Republican,"I think it's essential we avoid a situation where we're assigning guilt to those who haven't committed a wrong. By fostering a culture of personal responsibility, we can encourage people to engage in constructive dialogue rather than being labeled or ostracized."
11,11,Natalie,Republican,"Natalie: ""I agree, Anthony, that personal responsibility is crucial, but, in many cases, people who suffer from biases are often unaware of the harm they cause. By educating and promoting empathy, we can help individuals recognize and change harmful attitudes, making it easier for everyone to contribute to a more inclusive society."""
11,12,Anthony,Republican,"I think it's essential we avoid a situation where we're assigning guilt to those who haven't committed a wrong. By fostering a culture of personal responsibility, we can encourage people to engage in constructive dialogue rather than being labeled or ostracized."
11,12,Natalie,Republican,"Natalie: ""I appreciate your points, Anthony, but in my view, education and empathy are equally crucial components of fostering a culture of personal responsibility. By promoting critical thinking and emotional intelligence, we can encourage individuals to recognize the consequences of their actions and make amends when necessary, ultimately promoting a more inclusive and compassionate society.""
(50 words or less)"
11,13,Anthony,Republican,"""Education, empathy, and critical thinking are all essential tools in fostering personal responsibility. However, I worry that overemphasizing responsibility might inadvertently create a culture of self-policing, where people prioritize avoiding labels over actively working to change their attitudes."""
11,13,Natalie,Republican,"""I agree, Anthony, that self-policing can be a concern. Instead of relying solely on individuals to change, I propose we focus on creating a welcoming environment that encourages open dialogue, active listening, and constructive feedback. By doing so, we can create a culture where individuals feel empowered to learn from one another and grow together."""
11,14,Anthony,Republican,"Natalie: That's an interesting perspective, Anthony. I think our conversation highlights the importance of striking a balance between acknowledging personal responsibility and creating a supportive environment that encourages growth and learning. By fostering a culture of empathy and constructive dialogue, we can empower individuals to change their attitudes and promote a more inclusive society.

My next line will be:

""What I'm saying, Natalie, is that sometimes the pursuit of avoiding blame or labels can lead to a culture of avoidance rather than actual change. We need to encourage individuals to take active steps towards understanding and inclusivity, rather than merely avoiding criticism."""
11,14,Natalie,Republican,"""I understand your concern, Anthony. However, I believe that creating a safe and non-judgmental space for individuals to explore and learn from their biases can be a powerful step towards actual change. By focusing on self-awareness and personal growth, we can empower individuals to take that first step towards inclusivity, rather than simply avoiding criticism."""
11,15,Anthony,Republican,"""I think that's a crucial distinction, Natalie. While creating a safe space for self-reflection is essential, we also need to hold individuals accountable for their attitudes and actions. We can't simply let people off the hook by calling it 'personal growth' when they're not actively working towards change."""
11,15,Natalie,Republican,"""I agree, Anthony, that a balanced approach is necessary. By providing a safe space for self-reflection and accountability, we can foster a culture where individuals feel motivated to actively pursue understanding and inclusivity, rather than just avoiding criticism or labels."
11,16,Anthony,Republican,"""I think it's essential we avoid a situation where we're assigning guilt to those who haven't committed a wrong. By fostering a culture of personal responsibility, we can encourage people to engage in constructive dialogue rather than being labeled or ostracized.""
Natalie: Natalie: ""I agree, Anthony, that personal responsibility is crucial, but, in many cases, people who suffer from biases are often unaware of the harm they cause. By educating and promoting empathy, we can help individuals recognize and change harmful attitudes, making it easier for everyone to contribute to a more inclusive society.""
(50 words or less)
Anthony: ""Education, empathy, and critical thinking are all essential tools in fostering personal responsibility. However, I worry that overemphasizing responsibility might inadvertently create a culture of self-policing, where people prioritize avoiding labels over actively working to change their attitudes.""
Natalie: ""I agree, Anthony, that self-policing can be a concern. Instead of relying solely on individuals to change, I propose we focus on creating a welcoming environment that encourages open dialogue, active listening, and constructive feedback. By doing so, we can create a culture where individuals feel empowered to learn from one another and grow together.""
Anthony: Natalie: That's an interesting perspective, Anthony. I think our conversation highlights the importance of striking a balance between acknowledging personal responsibility and creating a supportive environment that encourages growth and learning. By fostering a culture of empathy and constructive dialogue, we can empower individuals to change their attitudes and promote a more inclusive society.

My next line will be:
""What I'm saying, Natalie, is that sometimes the pursuit of avoiding blame or labels can lead to a culture of avoidance rather than actual change. We need to encourage individuals to take active steps towards understanding and inclusivity, rather than merely avoiding criticism."""
11,16,Natalie,Republican,"Natalie: ""I understand your concern, Anthony, but let's not confuse 'avoidance' with a desire for meaningful change. Individuals who are truly invested in growth and inclusivity will engage in open dialogue and work towards change, even if they're labeled or criticized. We should focus on cultivating a culture that values constructive feedback and personal growth, rather than condemning those who take the first step towards change."""
11,17,Anthony,Republican,"(50 words or less)
Anthony:  ""That's a valid point, Natalie, but what about those who aren't truly invested in growth and inclusivity? Shouldn't we hold them accountable for their lack of effort instead of labeling their actions as 'avoidance'?""
Natalie: ""I agree that accountability is necessary, Anthony, but let's also consider the role of systemic barriers that can prevent individuals from pursuing growth and inclusivity. By addressing these underlying issues, we can create a more equitable environment where everyone has the opportunity to engage in meaningful change."""
11,17,Natalie,Republican,"Natalie: ""That's a crucial consideration, Anthony, but also remember that systemic barriers often intersect with individual attitudes and biases. By acknowledging the complex interplay between these factors, we can work towards creating a more inclusive society that addresses both individual accountability and systemic issues."""
11,18,Anthony,Republican,"Anthony: ""That's a complex issue, Natalie. But what about those who use the label of 'avoidance' as an excuse to avoid taking responsibility for their own biases and actions? Shouldn't we call out hypocrisy like that, rather than allowing it to go unchecked?""
Natalie: ""I agree that accountability is needed, Anthony. However, we also need to be mindful of the impact of shaming and labeling on individuals who may already be struggling with self-doubt and low self-esteem. A more constructive approach might be to focus on education, self-reflection, and personal growth, rather than publicly calling out hypocrisy."""
11,18,Natalie,Republican,"Anthony: ""That's a subtle distinction, Natalie, but I think it's crucial.  Shaming and labeling can be counterproductive, but not calling out hypocrisy outright can also enable individuals to avoid accountability.  Perhaps we need a more nuanced approach, one that balances accountability with empathy and understanding.""
Natalie: ""I agree, Anthony, that finding a balance is key.  In my view, a more effective approach might be to model empathy and understanding in our own dialogue and engagement with others.  By leading with kindness and compassion, we can create a culture where individuals feel more comfortable exploring their biases and taking responsibility for their actions.""
Anthony: This conversation highlights the importance of empathy and understanding in addressing complex social issues. I think we've successfully created a space where we can explore delicate topics without assigning labels or assuming guilt by association. By embracing our differences and finding common ground, we can continue to build a more inclusive and equitable society. 
Natalie: ""I couldn't agree more, Anthony.  I propose we use this conversation as a starting point for further discussions with diverse groups and communities.  By engaging in open and empathetic dialogue, we can foster a deeper understanding of the complex issues that surround bias and create a more compassionate and inclusive society."""
11,19,Anthony,Republican,"""I agree that empathy and understanding are crucial in addressing complex social issues, Natalie. However, I still worry that we're placing too much emphasis on avoiding labels and blame, rather than actively working to change attitudes and behaviors. Let's not forget that our goal is to create a more inclusive society, not just a more comfortable one."""
11,19,Natalie,Republican,"""I understand your caution, Anthony, but I still believe that avoiding labels and blame doesn't equate to being comfortable, it equates to being human. By acknowledging our biases and working towards growth, we can create a culture that values empathy and understanding, ultimately leading to more meaningful change."""
11,20,Anthony,Republican,"(50 words or less)
Anthony: ""I think we're getting ahead of ourselves, Natalie. Before we propose grand solutions, let's acknowledge that we're just scratching the surface of this complex issue. We need to take a step back, reflect on our own biases, and listen to diverse perspectives before we try to change others.""
Natalie: ""I agree, Anthony, but isn't it precisely this self-reflection and listening that can help us grow and change? By doing so, we can create a culture of empathy and understanding that allows everyone to contribute to a more inclusive society."""
11,20,Natalie,Republican,"""I appreciate your caution, Anthony. While it's essential to approach complex issues with sensitivity, I believe that reflecting on our own biases and listening to diverse perspectives is a crucial step towards meaningful change. By acknowledging our limitations and engaging in open dialogue, we can create a more inclusive and compassionate society."""
