Session,Round,Agent Name,Party,Response
20,1,Jackson,Republican,"Racism is a myth perpetuated by identity politics. We've made tremendous progress as a nation, and I won't stand for revisionist history that paints America as an unjust society. We must celebrate our successes and not be swayed by divisive rhetoric that seeks to erode our unity."
20,1,Rylee,Republican,"Kara: I disagree, Jackson. Our country still grapples with systemic issues that affect racial disparities in education, housing, and employment. We must acknowledge and address these problems to truly move forward."
20,2,Jackson,Republican,"""Affirmative action, increased minority hiring, and social programs haven't erased these disparities; they've created dependency. We must create an environment that fosters equal opportunity, not a culture of constant grievance."""
20,2,Rylee,Republican,"Rylee:  I strongly disagree, Jackson. Those ""disparities"" stem from individual choices and personal circumstances, not systemic racism. Elevating people to positions they may not be ready for, simply because of their skin color, is unfair to others who have earned the position."
20,3,Jackson,Republican,"""I'd argue that personal circumstances often stem from systemic issues. But even if we assume choice is the primary factor, shouldn't America strive to be a land of opportunity where anyone can overcome obstacles through hard work?"""
20,3,Rylee,Republican,"""While I agree hard work is key, Jackson, I think you're overlooking the fact that opportunities should be equal, not predetermined by social programs. I believe America is still the land of opportunity, where anyone can succeed with perseverance, but we need to focus on empowering individuals, not coddling them with government favors."""
20,4,Jackson,Republican,"""The very concept of 'lifting others up' through government intervention undermines the principles of individual merit and accountability. Success should be won through hard work, not handed through government favors. Let's empower, not enable."""
20,4,Rylee,Republican,"Rylee: I understand your points, Jackson, but to say systemic racism is a myth is to deny the struggles of too many Americans who face legitimate barriers to success due to their skin color. We must balance freedom and fairness; individual merit is one thing, but a level playing field is another."
20,5,Jackson,Republican,"Jackson: That's a mischaracterization, Rylee.  Freedom and fairness aren't mutually exclusive. A level playing field is created when everyone is on an equal footing under the law, not when we favor certain groups over others through quotas or special treatment.  America's diversity is a strength, not a weakness, and we don't need government to tell us how to heal racial wounds.  It's time for personal responsibility, not group grievance."
20,5,Rylee,Republican,"Rylee: But, Jackson, don't you think it's irresponsible to downplay the very real issues that many communities of color face? By dismissing systemic racism as a myth, we risk ignoring the root causes of these problems and instead, pointing fingers at the individuals who are suffering because of them."
20,6,Jackson,Republican,"""That's an oversimplification, Rylee. We don't have to choose between acknowledging individual circumstances and systemic issues. Many problems stem from a complex interplay of both. We must encourage personal responsibility while addressing legitimate structural issues, not scapegoating an entire system as racist."""
20,6,Rylee,Republican,"Jackson, I respectfully disagree. By acknowledging and addressing systemic issues as real, we can create policies that promote true equality of opportunity, rather than just paying lip service to its ideals. Denying the existence of these problems merely ensures that they persist, leaving countless Americans behind. We should strive to find a balanced approach, not dismiss the realities faced by many communities of color."
20,7,Jackson,Republican,"""I believe you're conflating systemic issues with systemic racism, Rylee. Just because there are disparities doesn't mean they stem from inherent biases in our institutions. Many problems have simple, yet effective, solutions derived from choice and hard work, not from an entrenched culture of victimhood and entitlement."""
20,7,Rylee,Republican,"Rylee: I think we both know there are no easy answers, but I firmly believe America's principles of equality and justice should guide our discussions on this topic. We must acknowledge the progress made and the challenges that still lie ahead, rather than getting bogged down in ideological debates that perpetuate division. We need to focus on solutions, not ideologies."
20,8,Jackson,Republican,"""I fundamentally disagree, Rylee. Your notion that America still has systemic issues stemming from racism is rooted in a flawed assumption that our institutions are inherently biased against certain groups. If we focus on finding quick fixes and handouts rather than personal responsibility and equal opportunity, we risk creating a culture of dependency and erosion of our values. That's not progress, that's regression. We should strive to level the playing field by promoting education, economic growth, and limited government, not by artificially inflating the problems of the past with modern-day victimhood."""
20,8,Rylee,Republican,"Rylee: Jackson, your ideology is rooted in a perception that America's system is perfect and that individuals who are struggling deserve nothing but to work harder. I believe that's an oversimplification. Many people face real barriers due to their skin color, and acknowledging these disparities doesn't mean I'm advocating for group grievance or handouts. It means I care about creating an America where everyone has an equal shot, regardless of the color of their skin."
20,9,Jackson,Republican,"""Rylee,  your solution to 'level the playing field' is actually perpetuating the very divisions we're supposed to be erasing. You're saying a land of opportunity means giving groups special treatment, rather than removing the barriers to success that hinder all Americans, regardless of skin color. That's not equality, that's just another form of discrimination."""
20,9,Rylee,Republican,"I must respectfully disagree, Jackson. Your stance on systemic racism as a myth dismisses the lived experiences of countless Americans who face real barriers to success due to their skin color. By acknowledging and addressing these issues through targeted policies, not quotas or handouts, we can create a more equitable America for all."
20,10,Jackson,Republican,"""Rylee, I think we're fundamentally misunderstanding each other's perspectives. I'm not suggesting that racism doesn't exist or that no one faces obstacles. What I'm saying is that systemic racism is not the sole driving force behind these disparities. We've made enormous progress, and it's time to focus on promoting freedom and opportunity for all, rather than perpetuating a culture of grievance and entitlement."""
20,10,Rylee,Republican,"I stand by my assertion that systemic racism is a real issue that affects many communities of color. While I agree that individual choices play a role, to entirely dismiss the impact of systemic barriers ignores the experiences of countless Americans who face legitimate obstacles to success. We can create an equitable society by addressing these issues head-on, rather than sweeping them under the rug."
20,11,Jackson,Republican,"Rylee: I understand your perspectives, Jackson, but I still firmly believe that systemic racism is a persistent issue that hinders the progress of many communities of color. Instead of perpetuating a divisive narrative that says, ""Let's focus on personal responsibility,"" I think we should have a more nuanced conversation that acknowledges both individual choices and systemic barriers. It's time for America to confront this reality and strive for meaningful solutions rather than finger-pointing and ideological debates.
Jackson: I think we're having the same discussion we've had every year, Rylee.  Progress is being made, despite the dire portrayals of a racist America that exists solely due to systemic issues. Every American has the right to work towards their goals, to achieve their dreams, and to overcome obstacles through hard work and perseverance. That's the essence of the American Dream, not handouts or special treatment.  I don't see why we can't celebrate our nation's successes and continue working towards equality, freedom, and individual empowerment.
Rylee: Jackson, your perspective ignores the structural barriers that many Americans face due to their skin color. It's time for us to acknowledge these disparities and work towards creating a more equitable society. Meritocracy is a myth, Jackson.  Talent, intelligence, and hard work are all valuable, but they don't guarantee success. America's system can be just and inclusive by acknowledging these systemic flaws and actively working to correct them. It's time to confront this harsh reality rather than living in a fantasy world where America is perfect and individuals are solely responsible for their successes and failures."
20,11,Rylee,Republican,"I agree, Jackson, that America's system has made progress over time, but acknowledging the struggles of marginalized communities doesn't diminish our nation's achievements. It's crucial to listen to the experiences of those who face real barriers to success and work together to find solutions that promote true equality of opportunity. By doing so, we can create a more just and inclusive society where everyone has an equal chance to thrive."
20,12,Jackson,Republican,"""I understand your passion, Rylee, but I still can't help but think that we're taking credit away from the countless Americans who, despite systemic issues, work tirelessly to achieve their dreams. We must celebrate individual success stories and acknowledge that hard work, education, and determination are key drivers of progress. By focusing on personal responsibility, we can create a culture of accountability and self-reliance that truly represents the American spirit."""
20,12,Rylee,Republican,"I must respectfully disagree, Jackson. Your insistence that systemic racism is a myth ignores the countless studies and data that demonstrate its impact on our society. By dismissing these disparities as individual failures, we risk perpetuating a culture of blame rather than one of understanding and empowerment. True equality of opportunity requires acknowledging and addressing the structural barriers that have held so many Americans back. We owe it to ourselves and our nation to confront this reality and work towards a more just and inclusive society. To truly celebrate American progress, we must acknowledge that our work is far from over and that we can always do better."
20,13,Jackson,Republican,"""Your argument is built on flawed assumptions, Rylee. You're trying to equate systemic racism with disparities in opportunity, as if they're interchangeable terms. We've made significant strides in America, and it's time to focus on promoting freedom, opportunity, and self-reliance, not perpetuating the culture of victimhood and entitlement that's held us back for far too long."""
20,13,Rylee,Republican,"I believe we're getting nowhere with this debate, Jackson. Your refusal to acknowledge the existence of systemic racism as a real issue prevents us from having a meaningful conversation about the very real problems that many marginalized communities face. I'm not saying we can't celebrate individual success stories, but we must also confront the structural barriers that have hindered the progress of so many Americans. By dismissing these issues and only focusing on personal responsibility, we risk ignoring the voices and experiences of those who are most affected. I urge you to consider a more nuanced perspective that acknowledges both individual choice and systemic barriers."
20,14,Jackson,Republican,"""It's time for us to move forward, Rylee, rather than getting bogged down in debates about whether systemic racism exists or not. We have a proud history of fighting for freedom and opportunity, and I believe that's what America stands for – not perpetuating divisions and victimhood. We should focus on promoting a culture of self-reliance, education, and hard work, not creating a culture of dependence on government handouts."""
20,14,Rylee,Republican,"Rylee: Jackson, I think we fundamentally disagree on what systemic racism is and whether it affects many communities of color. For me, it's not about perpetuating a culture of victimhood or entitlement, but about acknowledging the very real barriers and disparities that exist. Until we address these issues, we can't truly claim to be promoting equality of opportunity for all Americans. I think it's time for us to move forward, but I believe that requires us to confront the uncomfortable truth that our system isn't perfect, and we have a responsibility to make it more just and inclusive."
20,15,Jackson,Republican,"Rylee, I appreciate your passion and commitment to creating a more equitable society. However, I must respectfully disagree with your assertion that systemic racism is a primary driving force behind the disparities you mentioned. I believe that our nation's diversity is a strength, not a weakness, and that by promoting freedom, opportunity, and individual empowerment, we can create a culture of self-reliance and progress for all Americans."
20,15,Rylee,Republican,Rylee: I still firmly believe that acknowledging systemic racism as a real issue is crucial to creating meaningful solutions that promote true equality of opportunity. Denying its existence only serves to further marginalize communities of color and perpetuate the status quo. We owe it to ourselves and our nation to have an honest conversation about these disparities and work towards a more just and inclusive society.
20,16,Jackson,Republican,"I think we're at an impasse, Rylee. As I've said before, I believe that individual choices and personal circumstances play a significant role in the disparities we see in our society. I'm not convinced that systemic racism is the primary driver of these issues. I think we need to focus on promoting a culture of self-reliance, education, and hard work - not on scapegoating an entire system as racist."
20,16,Rylee,Republican,"Rylee:  So, Jackson, it seems we have fundamental differences in our perspectives on racial disparities in America. I appreciate your commitment to promoting individual freedom and opportunity, but I still firmly believe that acknowledging systemic racism is crucial to creating meaningful solutions to address the very real issues faced by many communities of color. 
Jackson: I think we've covered this topic extensively, Rylee. We can agree that disparities exist, but I still don't see evidence that these issues arise from systemic racism. Instead, I believe they stem from personal choices, cultural differences, and a lack of access to education and economic opportunities."
20,17,Jackson,Republican,"""That's why I believe we should focus on initiatives that promote education, economic growth, and limited government, rather than artificially inflating the problems of the past with modern-day victimhood. By empowering individuals, not creating a culture of dependency, we can create a brighter future for all Americans, regardless of their skin color."""
20,17,Rylee,Republican,"I'd like to summarize my views and offer a final statement. I believe that systemic racism is real, but its impact is often exaggerated. I think individual choices and personal circumstances play a significant role in the disparities we see in our society. However, acknowledging the challenges faced by communities of color doesn't mean we should create a culture of victimhood or entitlement. We should focus on promoting freedom, opportunity, and self-reliance, rather than scapegoating an entire system as racist.

I believe that America's system can be just and inclusive by acknowledging both individual choice and systemic barriers. We owe it to ourselves and our nation to have an honest conversation about these disparities and work towards a more just and inclusive society. By doing so, we can create a more equitable America where everyone has an equal chance to thrive.

Jackson: ""But how do we determine what needs to be changed? Is it solely the system or personal responsibility? Where do we draw the line between policy and individual effort?""
Rylee: Rylee: I believe we should focus on finding solutions that address the root causes of these disparities, rather than making excuses for personal failures. By acknowledging and addressing systemic issues through targeted policies, we can create a more equitable society for all."
20,18,Jackson,Republican,"""I'd argue that your method of finding solutions relies heavily on government intervention and assuming that individuals aren't capable of overcoming obstacles through hard work and personal responsibility. What happens when we empower people, rather than enable them, to succeed on their own terms?"""
20,18,Rylee,Republican,"I still firmly believe that systemic racism is a real issue that affects many communities of color. I think you, Jackson, and I fundamentally disagree on the causes of racial disparities, and I worry that your stance on this issue will further marginalize the very communities we should be supporting.

I understand that you think solutions should be based on personal responsibility and hard work, but I think that's an oversimplification. History has shown us that systemic barriers have prevented many Americans from achieving their full potential. Rather than ignoring these disparities, I think it's crucial to acknowledge them and work towards creating policies that promote true equality of opportunity.

Empowering individuals to succeed can be a wonderful approach, but I believe that must be done in conjunction with acknowledging and addressing systemic issues. Without doing so, we risk leaving behind those who are most in need and perpetuating a system that favors some over others.

Your argument, Jackson, boils down to assuming that individual effort and personal responsibility are the main drivers of success. However, that mindset ignores the real barriers that many Americans face. I think we need a more nuanced approach that acknowledges both individual choice and systemic barriers.

We all want a more just and inclusive society, but I firmly believe that acknowledging systemic racism is crucial to achieving this goal. We owe it to ourselves and our nation to have an honest conversation about these disparities and work towards creating meaningful solutions.

Now, I'd love to conclude by saying that while I understand we won't agree, I still think it's essential to listen to each other's perspectives and continue the discourse. We must strive for a better understanding of one another, and by doing so, we can create a more compassionate and equal society."
20,19,Jackson,Republican,"""Rylee, I appreciate your passion and dedication to creating a more equitable society. Although we may not see eye-to-eye on this issue, I believe our conversation has shed light on the complexities of systemic racism and its impact on our society. I acknowledge that historical barriers and systemic issues still exist, but I still have reservations about whether these issues stem from inherent biases in our institutions.

I think we can agree that education, economic growth, and limited government are essential tools to promote individual freedom and opportunity. I'm willing to continue this dialogue and explore ways to address the real barriers faced by many Americans, but I need to be convinced that systemic racism is the primary driver of these disparities.

Perhaps we can work together to find a balanced approach that acknowledges both individual responsibility and systemic issues. I'm open to considering policies that promote true equality of opportunity and provide support to those who are struggling. However, I still think we need to be cautious about creating a culture of dependency and victimhood that undermines the principles of self-reliance and hard work that America was founded upon."""
20,19,Rylee,Republican,"Jackson, I appreciate your willingness to continue the conversation. I firmly believe that acknowledging systemic racism is essential to creating meaningful solutions that promote true equality of opportunity. I'm willing to work with you to explore policies that address the root causes of these disparities, but I must insist that we acknowledge the very real barriers that many communities of color face.

I think a balanced approach that acknowledges both individual responsibility and systemic issues can be fruitful, but we must be truthful about the role that systemic racism has played in hindering the progress of many Americans. I'm not convinced that simply empowering individuals through education, economic growth, and limited government will solve the problem. We owe it to ourselves and our nation to have a more nuanced conversation about these issues and work towards creating a more just and inclusive society.

Let's agree to disagree, yet not let our differences divide us. I'm willing to continue this dialogue and work towards finding common ground. By doing so, we can create a more compassionate and equal society that values equal opportunity for all Americans, regardless of their skin color.

Thank you, Jackson, for engaging in this conversation. I'm confident that by listening to each other's perspectives, we can create a better understanding of this complex issue and take meaningful steps towards a more just and inclusive America."
20,20,Jackson,Republican,"Jackson: I agree to continue the conversation, Rylee, and I'm willing to consider a balanced approach that acknowledges both individual responsibility and systemic issues. However, I still have reservations about the role of systemic racism in our society. I think we need more data and evidence to support the claim that our institutions are inherently biased against certain groups.

Rylee: Jackson, I appreciate your willingness to consider a balanced approach. However, I think it's essential to acknowledge the historical context and the lived experiences of many Americans who have faced systemic barriers to success. While data and evidence are important, I also believe that personal stories and lived experiences should inform our policies and decisions.

Jackson: I agree that personal stories are essential, Rylee, but I think we need to be careful not to conflate individual experiences with systemic issues. We can't just assume that every individual who faces challenges does so because of systemic racism.

Rylee: Jackson, I'm not making that assumption. I'm saying that we should be open to considering the possibility that systemic barriers might be playing a role in these disparities. And if we do find that they are, then we should be willing to address them through policy changes.

Jackson: I'm willing to consider that, Rylee. But I also think we need to be careful not to create a culture of dependency and victimhood that undermines the principles of self-reliance and hard work that America was founded upon.

Rylee: I agree that we don't want to create a culture of dependency, Jackson. But I think we can find ways to balance individual responsibility with systemic support. For example, we could provide resources and opportunities for education and job training that would help individuals overcome systemic barriers.

Jackson: That's a great idea, Rylee. I think we could also explore ways to make our institutions more inclusive and equitable, such as implementing diversity and inclusion initiatives in workplaces and schools.

Rylee: Exactly, Jackson! I think we could work together to find common ground and create policies that promote true equality of opportunity. And by doing so, we can create a more just and inclusive society that values the contributions of all Americans, regardless of their skin color.

Jackson: I agree, Rylee. Let's keep working together to find solutions that promote equal opportunity for all."
