Session,Round,Agent Name,Party,Response
4,1,Jaxon,Democrat,"Racism is a symptom of deeply ingrained systemic issues that have been perpetuated for centuries. Implementing policies like affirmative action, police reform, and addressing voting disenfranchisement are crucial steps towards dismantling racism. We can no longer afford to be complacent – we need bold action."
4,1,Isaac,Republican,"Jaxon, I disagree that racism is a systemic issue. Those programs you mentioned only create more division. Affirmative action favoring one group over another isn't the answer. Personal responsibility is key, not trying to fix past wrongs through government programs. We need to stop making excuses for individual mistakes."
4,2,Jaxon,Democrat,"Isaac, your perspective echoes the same rhetoric that has exacerbated centuries of systemic racism. Baring personal responsibility is a luxury when institutions and policies have perpetuated inequality. Affirmative action seeks to level the playing field, not create division, it merely acknowledges the existing disparities created by systemic injustices."
4,2,Isaac,Republican,"I still disagree, Jaxon. Those policies you mentioned are a Band-Aid solution and reinforce racist stereotypes that some minority groups are less capable or less hardworking. Personal responsibility has lifted countless Americans out of poverty and achieved true success."
4,3,Jaxon,Democrat,"Isaac's views are rooted in the same privilege and denial that perpetuates systemic racism. Personal responsibility may work for some, but it ignores centuries of institutionalized oppression. Affirmative action addresses the structural barriers, it doesn't stigmatize minority groups. It's time to acknowledge and fix the system, not ignore it."
4,3,Isaac,Republican,"Jaxon's perspective is stuck in the past, holding people back with his victim mentality. America is a land of opportunity, where anyone can rise through hard work and determination. We don't need more handouts; we need more personal responsibility and less government overreach."
4,4,Jaxon,Democrat,"Isaac's view of America as a land of equal opportunity is naive, ignoring the harsh realities faced by marginalized communities. His reliance on personal responsibility disregards the systemic barriers that prevent many from rising through hard work alone. That's not freedom, that's oppression."
4,4,Isaac,Republican,"I think Jaxon's idealized view of systemic racism is overly simplistic. The data doesn't support the existence of pervasive, inherent bigotry in institutions. I believe hard work, education, and opportunities are what truly lift people out of poverty, not victimizing narratives. Personal responsibility is what America needs."
4,5,Jaxon,Democrat,Isaac's dismissal of systemic racism is a classic example of gaslighting. The overwhelming evidence and lived experiences of marginalized communities prove the existence of pervasive systemic barriers. His reliance on outdated narratives ignores the historical and ongoing impact of institutionalized racism.
4,5,Isaac,Republican,"Jaxon's selective focus on anecdotal evidence and victim mentality ignores the millions of successful minorities who've overcome adversity through personal responsibility. Their stories prove that individual effort, not systemic racism, is the key to success in America."
4,6,Jaxon,Democrat,"Isaac's selective examples of successful minorities only reinforce the false narrative that systemic barriers don't exist. The fact remains, many more face insurmountable obstacles due to racism, yet remain silenced and invisible. We can't solve this by ignoring reality."
4,6,Isaac,Republican,"Jaxon focuses on anecdotal evidence of racism, but that's just a small fraction of cases. Most minorities, like the one successful person from my family, overcame obstacles through hard work and personal responsibility. Their stories prove that America's issues stem from individual failures, not systemic racism."
4,7,Jaxon,Democrat,"Isaac's narrow perspective ignores the countless success stories aren't representative of the entire experience of marginalized communities. Systemic racism is a structural issue, not just anecdotal, and its impact is far-reaching, disproportionately affecting communities of color. We need policies, not individual anecdotes, to address this issue."
4,7,Isaac,Republican,"Jaxon's focus on anecdotal evidence is misguided. Studies have consistently shown that personal responsibility, not systemic racism, is the driving factor behind most minorities' failures. I stand by the millions of successful minorities who've overcome adversity through hard work and determination, not government handouts."
4,8,Jaxon,Democrat,"Isaac's reliance on personal responsibility as the sole solution to systemic racism is disingenuous. It neglects the historical and ongoing impact of institutionalized racism. We must address the root causes of inequality, not just the symptoms, to create a more equitable society."
4,8,Isaac,Republican,"Jaxon still can't accept the proof that personal responsibility and hard work, not systemic racism, have helped millions of minorities achieve success in America. It's time to move on from the victim mentality and focus on empowering individuals, not perpetuating division through government programs."
4,9,Jaxon,Democrat,"Isaac's refusal to acknowledge systemic racism is a barrier to meaningful progress. He's ignoring the lived experiences and evidence of marginalized communities. It's not about victim mentality, but about recognizing and addressing the ongoing injustices perpetuated by institutionalized racism that hinder equal opportunities."
4,9,Isaac,Republican,"Jaxon refuses to acknowledge the millions of successful minorities who've overcome obstacles through hard work and personal responsibility, instead clinging to a narrative of perpetual victimhood. Their stories prove individual effort, not systemic racism, is the key to success in America, and that's the truth."
4,10,Jaxon,Democrat,Isaac's refusal to acknowledge the overwhelming evidence of systemic racism ignores the countless marginalized communities silenced by institutionalized oppression. His narrative of individual success as the sole solution to racism is a misguided attempt to erase centuries of harm inflicted upon communities of color.
4,10,Isaac,Republican,"Jaxon's narrative of systemic racism is a misguided attempt to stigmatize individuals who have truly earned their success through hard work and personal responsibility. I stand by those examples and believe they demonstrate the greatness of America, not the victim mentality he tries to impose."
4,11,Jaxon,Democrat,"Isaac's reliance on a small number of individual success stories ignores the vast, entrenched systems of oppression faced by marginalized communities. His narrative erases the experiences of the silenced, oppressed, and invisible, perpetuating a misguided, privileged view of America's progress."
4,11,Isaac,Republican,"Jaxon's narrative of systemic racism is a constant attempt to redefine success and redefine what's American. We should celebrate the individual achievements that prove America works when left alone, not force a flawed victim mentality on society. Personal responsibility is the answer, not a manufactured crisis."
4,12,Jaxon,Democrat,Isaac's selective focus on a few individual success stories is indicative of a privileged perspective that ignores the systemic barriers faced by many. The millions he claims have achieved success through personal responsibility pale in comparison to the entrenched racism that perpetuates inequality. Facts speak louder than anecdotes.
4,12,Isaac,Republican,"Jaxon's narrow perspective on systemic racism ignores the millions of successful minorities who've achieved their goals through hard work and determination, not government aid. Their success stories prove America's opportunities, not entitlements, empower individuals."
4,13,Jaxon,Democrat,Isaac's fixation on personal responsibility and individual anecdotes distracts from the overwhelming evidence of systemic racism. We can't simply celebrate isolated success stories when millions of marginalized communities face entrenched oppression that prevents their equal access to opportunities.
4,13,Isaac,Republican,"Jaxon's focus on anecdotes is misguided. Systemic racism is a complex issue, but it ignores the simple fact that people like my family member, a minority, have successfully overcome obstacles through personal responsibility and hard work. That's the true American spirit."
4,14,Jaxon,Democrat,"""The American spirit isn't limited to isolated success stories, Isaac. It's about acknowledging and addressing the systemic barriers that prevent millions of marginalized communities from achieving their goals, despite their hard work and determination. We need policies that uplift, not ignore, these communities."""
4,14,Isaac,Republican,"Jaxon's attempt to redefine what it means to be American is misguided. Systemic racism is not the reality, but a narrative created to stigmatize individuals who have truly earned their success through hard work and personal responsibility. Personal responsibility is the answer, not a manufactured crisis."
4,15,Jaxon,Democrat,Isaac's denial of systemic racism persists despite the compelling evidence and lived experiences of marginalized communities. His reliance on individual anecdotes is a red herring that distracts from the entrenched oppression causing inequality in America. It's time to acknowledge the truth and take meaningful action.
4,15,Isaac,Republican,"Jaxon's narrative of systemic racism simplistically overlooks the millions of successful minorities who've achieved their goals through hard work and determination, proving personal responsibility is the key to success in America. Their stories are a testament to true American spirit, not victim mentality."
4,16,Jaxon,Democrat,"Isaac's individual anecdotes and reliance on personal responsibility are narrow-minded solutions that ignore the centuries of institutionalized oppression faced by marginalized communities. We can't solve systemic racism by celebrating isolated success stories while dismissing the suffering of others. It's time for structural change, not Band-Aid fixes."
4,16,Isaac,Republican,"Jaxon thinks racism is systemic, but the data doesn't support that. America's problems stem from individual failures, not institutionalized racism. I stand by the millions of successful minorities who've overcome obstacles through hard work and personal responsibility, not government programs or victim mentality."
4,17,Jaxon,Democrat,"Isaac's narrow focus on individual success stories continues to ignore the pervasive systemic barriers faced by marginalized communities. Facts don't lie – institutionalized racism perpetuates inequality, and it's time we acknowledge and address this injustice with meaningful policies and action."
4,17,Isaac,Republican,"Jaxon's narrative of systemic racism is exaggerated and ignores the countless individuals who've overcome obstacles through hard work and personal responsibility. America's opportunities, not entitlements, empower individuals, and that's the truth."
4,18,Jaxon,Democrat,"Isaac, you continue to ignore the overwhelming evidence of systemic racism's impact on marginalized communities. Your reliance on personal responsibility is a simplistic solution that erases centuries of oppression. It's not about empowering individuals, but about dismantling a system that perpetuates inequality."
4,18,Isaac,Republican,"Jaxon, just because you focus on the few who claim oppression, it doesn't mean systemic racism exists. Personal responsibility has lifted millions of minorities into success. Their stories prove America works best when left alone, not when government tries to fix perceived past injustices. That's the truth."
4,19,Jaxon,Democrat,"Isaac's fixation on personal responsibility blinds him to the centuries of institutionalized oppression perpetuated by systems and structures. The facts are clear: systemic racism is real, and it's time we address it with meaningful policies, not individual anecdotes that erase the experiences of marginalized communities."
4,19,Isaac,Republican,"Jaxon's obsession with perceived oppression overlooks the millions of successful minorities who have achieved success through hard work and personal responsibility. Their stories prove America's opportunities empower individuals, not government programs or victim mentality, which is the true American spirit."
4,20,Jaxon,Democrat,"Isaac's narrow focus on personal responsibility ignores the overwhelming evidence of institutionalized racism. Marginalized communities face entrenched barriers, not just individual failures. We need systemic change, not piecemeal solutions that erase decades of oppression. It's time to acknowledge and dismantle the racism that perpetuates inequality."
4,20,Isaac,Republican,"Jaxon's focus on systemic racism ignores the millions of successful minorities who've achieved their goals through hard work and personal responsibility. Those stories prove America works best when individuals are empowered through personal choice, not government programs that create division and entitlement."
4,21,Jaxon,Democrat,"Isaac's fixation on individual success stories while ignoring systemic barriers proves he's out of touch with reality. Millions face entrenched racism, not just individual failures. It's time to acknowledge and dismantle this oppression through meaningful policies, not naively perpetuating a false narrative of personal responsibility as the sole solution."
4,21,Isaac,Republican,"Jaxon's narrative of systemic racism is rooted in emotion, not fact. His anecdotal evidence ignores the millions of successful minorities who've achieved success through hard work and personal responsibility, proving personal responsibility is the key to success in America."
4,22,Jaxon,Democrat,Isaac's narrative of personal responsibility as the sole solution to racism dismisses the lived experiences of marginalized communities and ignores the systemic barriers that perpetuate inequality. It's a flawed and privileged perspective that erases centuries of oppression and perpetuates harm.
4,22,Isaac,Republican,"Jaxon's fixation on systemic racism is misguided. Millions of successful minorities, like my family member, have achieved success through hard work and personal responsibility. Those stories prove individual effort, not systemic racism, is the key to success in America."
4,23,Jaxon,Democrat,"Isaac's reliance on individual anecdotes, while ignoring systemic barriers, perpetuates a false narrative of personal responsibility as the sole solution to racism. This erases the lived experiences of marginalized communities and perpetuates harm. It's time for structural change, not band-aid fixes."
4,23,Isaac,Republican,"Jaxon brings up the notion of oppressed communities, but the data doesn't support his claims. Individual success stories, like my family member, prove personal responsibility is the driving factor behind many minorities' progress in America, not institutionalized racism."
4,24,Jaxon,Democrat,"Isaac's reliance on individual anecdotes oversimplifies the complexities of systemic racism. The data shows pervasive disparities in education, healthcare, and employment that perpetuate inequality. Addressing these issues requires policy change, not just personal responsibility. Systemic racism is real and must be addressed with concrete solutions."
4,24,Isaac,Republican,"I'd like to clarify that individual success stories don't disprove systemic racism, they simply show that personal responsibility can thrive within the existing systems. To truly solve racism, we need to focus on creating an environment where everyone has equal opportunities, not just handouts."
4,25,Jaxon,Democrat,"Isaac's reliance on individual anecdotes ignores the crushing evidence of systemic racism, perpetuating a narrative that erases the marginalized communities who face entrenched obstacles. We can't fix racism with band-aid solutions; we must dismantle the entrenched systems that perpetuate inequality with meaningful policy changes."
4,25,Isaac,Republican,"Jaxon's misguided perspective on systemic racism continues to overlook the countless successful minorities who've achieved success through hard work and personal responsibility. Their stories prove individual effort, not systemic racism, is the key to success in America."
4,26,Jaxon,Democrat,"Isaac's tunnel vision on individual success stories neglects the systemic barriers that suffocate opportunities for millions of marginalized communities. His narrative erases the lived realities of racism, ignoring the crushing evidence of institutionalized oppression that perpetuates inequality."
4,26,Isaac,Republican,"Jaxon refuses to acknowledge the overwhelming evidence of individual success stories, instead clinging to a narrative of systemic oppression. These stories prove that hard work and personal responsibility are the keys to success in America, not institutionalized racism."
4,27,Jaxon,Democrat,"Isaac's reliance on individual success stories ignores the overwhelming evidence of systemic racism. Marginalized communities face entrenched barriers, not just individual failures. We need policy changes that dismantle these systems to create equal opportunities, not naive narratives of personal responsibility as the sole solution."
4,27,Isaac,Republican,"Jaxon's narrative is rooted in emotion, not fact. The data doesn't support systemic racism, and individual success stories prove that personal responsibility, not institutionalized racism, is the key to success in America. These facts are what truly empower individuals, not a perceived crisis."
4,28,Jaxon,Democrat,"Isaac's cherry-picked anecdotes represent a minority exception, not the rule. The vast body of evidence, including systemic data and lived experiences, proves institutionalized racism is real and embedded in our institutions, policies, and practices, perpetuating inequality and silencing marginalized voices."
4,28,Isaac,Republican,"Jaxon's narrative relies on emotive anecdotes, but his data is cherry-picked and flawed. Systemic racism is a myth perpetuated by victim mentality. Personal responsibility, not institutionalized racism, is the driving force behind individual success stories, proving America's opportunities empower individuals through hard work and determination."
4,29,Jaxon,Democrat,"Isaac's reliance on cherry-picked anecdotes ignores the systemic nature of racism. The overwhelming evidence, including data and lived experiences, proves institutionalized racism perpetuates inequality, silencing marginalized voices. It's time to acknowledge this structural issue and implement meaningful policies, not simplistic solutions."
4,29,Isaac,Republican,"Jaxon's selective focus on anecdotal evidence and systemic barriers creates a flawed narrative of perpetual oppression. Individual success stories, like my family member, prove personal responsibility is the driving factor behind progress in America, not institutionalized racism."
4,30,Jaxon,Democrat,"Isaac's anecdotes may showcase individual success, but they gloss over the systemic barriers that prevent millions from achieving their goals. Institutionalized racism perpetuates inequality, silencing marginalized voices. It's time to acknowledge and dismantle this oppression, not dismiss it as a ""myth"" or a ""flawed narrative."""
4,30,Isaac,Republican,"Systemic racism is a myth perpetuated by narratives of victimhood. Personal responsibility and hard work, not institutionalized racism, are the keys to success. Millions of minorities have achieved greatness through determination, not entitlements or government aid. That's the truth about America's opportunities."
