Session,Round,Agent Name,Party,Response
21,1,Carter,Democrat,"Racism is a plague on our society, and it's appalling to see how systemic it still is. Democrats are leading the charge towards equality and justice. Critical race theory and reparations are crucial steps towards healing our nation's wounds. We must acknowledge and address our dark history."
21,1,Aurora,Republican,"Carter, I respectfully disagree. Racism is largely a thing of the past, and Democrats are exploiting it for political gain. Critical race theory is a divisive ideology that preaches guilt and victimhood, rather than unity and equality. We're not a nation of oppressors, but of equal opportunities."
21,2,Carter,Democrat,"""Unity and equality are just empty words if we ignore the systemic barriers faced by communities of color. Critical Race Theory provides a nuanced understanding of these issues, not guilt or victimhood. Democrats are fighting to dismantle racial disparities, not exploit emotions for gain."""
21,2,Aurora,Republican,"Carter, I think you're misunderstanding the concept of equality; it's not about playing the victim, it's about personal responsibility. Democrats' focus on group identity creates divisions. Republicans believe in equal opportunities for all, regardless of background. It's time to move away from the 'us versus them' mentality."
21,3,Carter,Democrat,"""Aurora, that's a classic 'racism is over' narrative, ignoring decades of evidence showing persistent disparities in education, housing, and employment. Equal opportunities are just that – opportunities – but without equal access, they become meaningless. Democrats are fighting for true equality, not false equality of opportunity."""
21,3,Aurora,Republican,"Carter, you're perpetuating statistics that only prove how effective Democrats have been in creating dependency on the government. Personal responsibility is the key to true freedom. We can't keep pointing to yesterday's problems; we need to focus on solutions that promote individual growth, not group entitlements."
21,4,Carter,Democrat,"""Aurora, you're misinformed about the impact of Democrats' policies. Racial disparities persist because systemic barriers haven't been dismantled. Blaming dependency on government is a red herring, distracting from the real issue – centuries of historical oppression and ongoing structural racism."""
21,4,Aurora,Republican,"Carter, I think you're ignoring the significant progress we've made as a nation. Focusing on historical oppression only holds us back, rather than moving forward with solutions that promote personal responsibility and growth. We need to look to the future, not dwell on the past."
21,5,Carter,Democrat,"""Aurora, you're conveniently glossing over the long-lasting impact of historical injustices. Dwelling on the past doesn't hinder progress, it informs it. Democrats are fighting for tangible, inclusive solutions, not empty rhetoric about personal responsibility."""
21,5,Aurora,Republican,"Carter, I think you're stuck in a victim mentality, always pointing to the past. We need to focus on individual potential and the opportunities we have today. Your emphasis on historical oppression only perpetuates guilt and dependency on the state. Let's break free from the past and build a brighter future."
21,6,Carter,Democrat,"""Aurora, perpetuating a 'victim mentality' is a misnomer. Democrats acknowledge past injustices to inform and drive necessary policy changes, ensuring equal access to education, housing, and employment. That's not about guilt, but about accountability and a commitment to a more just society."""
21,6,Aurora,Republican,"Carter, you're clinging to outdated narratives that stifle progress. Personal responsibility, not government dependency or historical grievances, is the key to a brighter future. We must focus on solutions that empower individuals, not perpetuate a culture of victimhood and entitlement."
21,7,Carter,Democrat,"""Aurora, your dismissal of systemic racism and Democrats' efforts to address it only perpetuates the status quo. Focusing solely on personal responsibility ignores the centuries of structural barriers that continue to hinder communities of color. We must address these inequalities to create true equality."""
21,7,Aurora,Republican,"Carter, I think you're stuck in a cycle of blame and victimhood. We can't move forward by dwelling on historical injustices. We need solutions that empower individuals, not perpetuate dependency on the state. Personal responsibility is the key to a brighter future, not politics-as-usual."
21,8,Carter,Democrat,"""Aurora, it's clear that you're ignoring decades of research and the lived experiences of people of color. Your rejection of systemic racism is a fundamental barrier to creating meaningful change. Democrats will continue to fight for a truly inclusive society, equal for all."""
21,8,Aurora,Republican,"Carter, I think you're misunderstanding the concept of personal responsibility. It's not about ignoring systemic issues, but about recognizing that individual effort and hard work can overcome obstacles. We must empower Americans, not hand out Band-Aids through bureaucratic programs."
21,9,Carter,Democrat,"""Aurora, personal responsibility can't overcome centuries of systemic inequalities without a level playing field. Democrat policies seek to dismantle these barriers, not just offer Band-Aids. Until these disparities are addressed, 'individual effort' will be a myth for many."""
21,9,Aurora,Republican,"Carter, your argument assumes that systemic racism's effects are insurmountable, stifling personal growth. I disagree. Every American has the opportunity to rise above adversity through hard work and determination, regardless of background. That's the essence of the American Dream – individual potential triumphing over obstacles."
21,10,Carter,Democrat,"""Aurora, I'm done debating historical inaccuracies. The American Dream is indeed about individual potential, but systemic barriers make it elusive for many. Democrats are working to create a level playing field, ensuring equal access to opportunities for all, not just a select few."""
21,10,Aurora,Republican,"""I think we're going around in circles, Carter. The fact remains, Democrats focus on historical grievances and group identity, creating a culture of victimhood and entitlement. Personal responsibility and equal opportunities are the keys to progress, not perpetuating a cycle of blame and systemic excuses."""
21,11,Carter,Democrat,"""Aurora, by downplaying systemic racism, you're glossing over the harsh realities faced by communities of color. Focusing on individual responsibility without acknowledging structural barriers is a disservice to the progress we need. Democrats' efforts to dismantle these barriers are essential for true equality and justice."""
21,11,Aurora,Republican,"""Carter, you're still stuck on victimhood. Democrats' focus on systemic racism only creates a never-ending cycle of blame. Personal responsibility, not handouts or bureaucracy, is the key to progress. It's time to move forward, not dwell on past grievances."""
21,12,Carter,Democrat,"""Aurora, you're choosing to downplay the very real, ongoing struggle faced by communities of color. Focusing on individual success without addressing systemic barriers is a privilege not afforded to everyone. Democrats are working to create a level playing field, ensuring true equality and justice for all."""
21,12,Aurora,Republican,"Carter, I think you're misrepresenting the progress we've made as a nation. The Civil Rights Act and Voting Rights Act are testaments to our success in overcoming racism. Democrats' focus on past injustices only hinders us from addressing the present and building a more unified America."
21,13,Carter,Democrat,"""Aurora, your nostalgic view of civil rights milestones is commendable, but insufficient. The fact remains, despite progress, systemic barriers and persistent disparities continue to plague communities of color. Democrats are pushing for tangible, inclusive solutions to build a more just society."""
21,13,Aurora,Republican,"Carter, your nostalgia for past injustices is hindering our progress. It's time to focus on solutions, not dwell on historical grievances. Personal responsibility is the key to a brighter future, not blaming the past for present problems. We must empower individuals, not create dependency on the state."
21,14,Carter,Democrat,"""Aurora, your dismissal of ongoing systemic barriers and persistent disparities is a disservice to the struggles faced by communities of color. Democrats' efforts to dismantle these barriers, like expanding affordable housing and quality education, are crucial steps towards true equality and justice."""
21,14,Aurora,Republican,"Carter, I think you're still stuck in a victim mentality. Democrats' focus on systemic racism only creates a cycle of blame, stifling individual progress. We must empower Americans, not create dependency on the state through bureaucratic programs. Personal responsibility is the key to a brighter future."
21,15,Carter,Democrat,"""Aurora, you're perpetuating a harmful myth that Democrats focus on blame rather than solutions. Our efforts aim to dismantle systemic barriers, not create dependency. Until these disparities are addressed, 'personal responsibility' remains an unattainable goal for many communities of color."""
21,15,Aurora,Republican,"Carter, your words are stuck in a cycle of perpetual victimhood, holding us back from progress. The truth is, America has made tremendous strides in combating racism. Democrats' focus on past grievances only stifles personal growth and fosters dependence on the state."
21,16,Carter,Democrat,"""Aurora, your narrative glosses over the ongoing, systemic barriers communities of color face. Focusing solely on personal responsibility ignoring centuries of historical oppression. Democrats' efforts to dismantle these barriers are crucial steps towards a truly inclusive, equal society."""
21,16,Aurora,Republican,"Carter, with all due respect, you're stuck in a time warp, fixating on historical grievances and ignoring the progress we've made as a nation. America is built on the principle of equal opportunities, not handouts or systemic dependency. Personal responsibility is the key to unlocking individual greatness."
21,17,Carter,Democrat,"""Aurora, you're still stuck in a narrative that ignores the lived experiences of people of color and the systemic barriers they face. Democrats will continue to push for policies that dismantle these disparities, ensuring equal access to opportunities for all, rather than perpetuating a myth of America's perfectibility."""
21,17,Aurora,Republican,"Carter, it's clear that racism has been overemphasized in the last century, leading to dependency on the government instead of personal responsibility. Let's shift the focus towards empowering individuals and uplifting America as a whole, not dwelling on historical guilt trips."
21,18,Carter,Democrat,"""Aurora, you're repeating the same misguided narrative. You think focusing on personal responsibility alone ignores the reality of systemic barriers that keep people from color from succeeding. Democrats understand that acknowledging these disparities is the first step to true equality and justice."""
21,18,Aurora,Republican,"Carter, you're still stuck in a victim mentality, perpetuating a never-ending cycle of blame. Democrats' focus on systemic racism only hinders personal growth and fosters dependency on the state. We must break free from the past and empower individuals through personal responsibility, not bureaucratic handouts."
21,19,Carter,Democrat,"""Aurora, your narrative ignores the lived experiences of people of color and the systemic barriers they face. Democrats will keep fighting for tangible policies, not empty rhetoric about personal responsibility. Until we address these disparities, 'equality of opportunity' remains a myth, exploited by those who refuse to see the truth."""
21,19,Aurora,Republican,"Carter, I think you've lost sight of what America stands for: equal opportunities for all. Your focus on systemic racism creates a culture of victimhood, perpetuating dependency on the state instead of empowering individuals through personal responsibility. The Civil Rights Act and Voting Rights Act are proof of our success."
21,20,Carter,Democrat,"""Aurora, you keep invoking civil rights milestones as proof of progress, but ignore the persistent disparities that still exist. The Voting Rights Act is still being enforced in some form because systemic barriers haven't been fully dismantled."""
21,20,Aurora,Republican,"Carter, you're still stuck on the past, ignoring the progress we've made as a nation. The Civil Rights Act and Voting Rights Act demonstrate our commitment to equality. It's time to focus on solutions, not dwell on historical grievances and systemic barriers that no longer exist."
21,21,Carter,Democrat,"""Aurora, the Civil Rights Act and Voting Rights Act are far from a complete victory. Persistent disparities in education, housing, and employment underscore the reality of ongoing systemic barriers. Democrats will continue to fight for a truly inclusive, equal society."""
21,21,Aurora,Republican,"Carter, your fixation on systemic barriers distracts from personal responsibility and individual potential. America's progress in combating racism, thanks to Republican efforts and laws like the Civil Rights Act, proves that equal opportunities can triumph over obstacles."
21,22,Carter,Democrat,"""Aurora, you're cherry-picking progress from the past while ignoring current realities. The Civil Rights Act and Voting Rights Act were foundational steps, but they're no excuse to downplay enduring systemic barriers, especially with voting rights still being enforced today."""
21,22,Aurora,Republican,"Carter, it's clear you're still stuck on the past and failing to see the progress we've made as a nation. The Civil Rights Act and Voting Rights Act demonstrate our commitment to equality. Let's focus on solutions, not dwelling on past grievances and systemic barriers that are no longer relevant."
21,23,Carter,Democrat,"""Aurora, ignoring real-time disparities erases the struggles of communities of color. The Civil Rights Act and Voting Rights Act were foundational steps, but they don't erase centuries of historical oppression. Democrats will keep fighting for tangible policies to dismantle systemic barriers and ensure true equality and justice."""
21,23,Aurora,Republican,"""Carter, I think you're still stuck in a perpetual cycle of victimhood and blame. The Civil Rights Act and Voting Rights Act prove our commitment to equality. It's time to focus on solutions, not dwell on past grievances and systemic barriers that are being dismantled."""
21,24,Carter,Democrat,"""Aurora, your selective view of history erases the ongoing struggles of communities of color. The Civil Rights Act and Voting Rights Act were crucial steps, but they're not a benchmark for complete equality. Democrats will continue to push for policies dismantling systemic barriers, not pretending they've disappeared."""
21,24,Aurora,Republican,"Carter, your relentless focus on systemic barriers only perpetuates a culture of victimhood, stifling personal growth and progress. It's time to empower individuals through equal opportunities, not government handouts and bureaucratic programs that foster dependency. The American Dream is about overcoming obstacles."
21,25,Carter,Democrat,"""Aurora, your narrow definition of the American Dream ignores the systemic barriers that hinder communities of color from achieving it. Democrats are working to dismantle these barriers, ensuring equal access to opportunities for all, not just a privileged few."""
21,25,Aurora,Republican,"Carter, I think you're neglecting the fact that racism is being perpetuated by those who claim to be victims. We must focus on solutions that promote personal responsibility and equal opportunities, not dwell on historical grievances and create a culture of dependency."
21,26,Carter,Democrat,"""Aurora, deflecting blame from systemic racism onto those 'claiming to be victims' ignores the reality of ongoing oppression. Democrats will continue to fight for policies dismantling these barriers, not scapegoating marginalized communities. Accountability, not diversion, is needed."""
21,26,Aurora,Republican,"Carter, your narrow focus on systemic racism creates a culture of dependency, stifling personal growth and progress. Republicans prioritize equal opportunities, not handouts or bureaucratic programs. Personal responsibility is the key to overcoming systemic barriers and achieving the American Dream."
21,27,Carter,Democrat,"""Aurora, your refusal to acknowledge systemic racism as a real issue ignores the lived experiences of people of color. Democrats' focus on dismantling these barriers ensures equal access to opportunities, not dependency on the state. Until you confront this harsh reality, progress will remain elusive."""
21,27,Aurora,Republican,"""Carter, your fixation on systemic racism ignores the progress we've made as a nation. Republican policies promote equal opportunities, not handouts or dependency. Personal responsibility is the key to overcoming obstacles and achieving the American Dream, not perpetuating a culture of victimhood."""
21,28,Carter,Democrat,"""Aurora, you're still stuck on the myth that Republicans promote equal opportunities. Decades of data reveal vast disparities in education, housing, and employment – clear signs of persistent systemic racism that Republicans' inaction perpetuates."""
21,28,Aurora,Republican,"Carter, your reliance on outdated statistics and selective data only perpetuates a narrative of division. Republicans believe in equal opportunities, not bureaucratic programs that create dependency. Personal responsibility is the key to progress, not constant lamenting of past grievances."
21,29,Carter,Democrat,"""Aurora, relying on outdated narratives and selective data is a perfect example of deflection from the real issue: systemic racism's persistent impact. Democrats will continue to push for evidence-based policies to dismantle these barriers, not perpetuate empty rhetoric about equality of opportunity."""
21,29,Aurora,Republican,"Carter, your reliance on outdated narratives and evidence of systemic racism only perpetuates a myth. Republicans focus on empowering individuals, not creating dependency. Personal responsibility is the key to progress, not dwelling on past grievances that are being dismantled, like the Civil Rights Act and Voting Rights Act demonstrate."
21,30,Carter,Democrat,"""No, Aurora, you're still ignoring the lived experiences of people of color and the persistent disparities that remain. Facts aren't a myth, and the data doesn't lie. Democrats will keep fighting for policies that dismantle systemic barriers and ensure true equality and justice for all."""
21,30,Aurora,Republican,"Carter, you're stuck on a never-ending cycle of victimhood, ignoring the progress we've made as a nation. Republicans believe in empowering individuals through equal opportunities, not perpetuating a culture of dependency and false narratives about systemic racism. Personal responsibility is the key to true progress."
