Session,Round,Agent Name,Party,Response
38,1,Audrey,Republican,"I believe we've made tremendous progress in addressing racism in this country. We have laws and institutions in place to protect everyone's rights, regardless of their background. We should focus on celebrating our diversity and not dwell on past injustices that have been largely rectified."
38,1,Jack,Republican,"Audrey, I agree we've made progress, but let's not be naive. Many of these laws and institutions are mere band-aids. We still have systemic issues that plague our society. Bringing up past injustices isn't dwelling; it's acknowledging a complex history to prevent similar problems from festering."
38,2,Audrey,Republican,"Jack, I understand your perspective, but I think we should focus on the progress we've made rather than dwelling on past problems. We have a strong foundation of equality and freedom, and it's time to celebrate our successes rather than rehashing old issues."
38,2,Jack,Republican,"Audrey's naivety is concerning. We can't simply ignore the lingering effects of systemic racism. If we don't confront these issues head-on, they'll only continue to perpetuate inequality. We must acknowledge the past to ensure a more equitable future, not ignore it and pretend everything is fine."
38,3,Audrey,Republican,"Jack, I understand your concerns, but hissing at problems won't solve them. We should focus on lifting people up rather than tearing down our progress. We need to trust that with education, opportunity, and faith in our institutions, equality will prevail."
38,3,Jack,Republican,"Audrey, unfortunately, your rose-tinted optimism ignores the harsh realities. Just because we've progressed doesn't mean we're home free. Past injustices still impact present-day outcomes, and merely trusting in institutions isn't enough. We must actively work to address these systemic issues head-on to achieve true equality."
38,4,Audrey,Republican,"Jack, I still believe we're focusing on the wrong things. Rather than dwelling on past injustices, we should promote unity and celebrate the progress we've made. By acknowledging our achievements, we can foster a more positive, inclusive environment that encourages everyone to strive for success."
38,4,Jack,Republican,"Audrey, your naivety about the severity of systemic racism is alarming. Acknowledging past injustices is not dwelling on the past; it's laying the groundwork for genuine progress. We can't sugarcoat the truth to feel better about ourselves; we must confront and dismantle these inequalities head-on."
38,5,Audrey,Republican,"Jack, I respectfully disagree. Dwelling on past injustices creates a negative atmosphere, hindering further progress. We should focus on empowering individuals through education and opportunity, rather than perpetuating a culture of shame and resentment."
38,5,Jack,Republican,"Audrey, dwelling on past injustices won't empower individuals, but acknowledging them will prevent similar problems from arising. True progress requires confronting and dismantling systemic inequalities, not just celebrating our current state or sugarcoating the past with rose-tinted optimism."
38,6,Audrey,Republican,"Jack, I understand that we have differences in opinion. However, I still believe that focusing on past injustices won't create the change we want to see. Let's work together to promote unity, celebrate our progress, and empower individuals through education and opportunity."
38,6,Jack,Republican,"Audrey, I understand your desire for unity, but let's not sweep systemic inequalities under the rug. We need to confront these issues head-on to ensure genuine progress. Ignoring them won't create a level playing field; it'll only solidify existing disparities."
38,7,Audrey,Republican,"Jack, I'm not asking you to forget the past, but to look at the progress we've made. Our laws and institutions provide equal opportunities for people of all backgrounds. Let's focus on creating a positive, inclusive environment that empowers individuals, rather than reliving past injustices constantly."
38,7,Jack,Republican,"Audrey, equality is more than laws and institutions; it's a genuine reflection of society. Our progress is being undermined by systemic issues that must be addressed. Confronting and dismantling these inequalities is the only way to truly promote unity and a level playing field."
38,8,Audrey,Republican,"I understand our differing perspectives, Jack. However, I still believe our strong foundation of equality and freedom should be celebrated and built upon, rather than constantly dwelling on past injustices. Let's focus on empowering individuals through education and opportunity, rather than perpetuating a culture of shame."
38,8,Jack,Republican,"Audrey, while our foundation of equality is strong, I firmly believe that dwelling on past injustices is crucial in preventing similar problems from arising. Ignoring systemic issues won't solidify progress, it'll only create a temporary illusion of unity. Confronting them head-on is key to true equality."
38,9,Audrey,Republican,"I still believe we should focus on the progress we've made and celebrate our successes rather than dwelling on past injustices. By acknowledging our achievements, we can foster a more positive, inclusive environment that encourages everyone to strive for success and lift each other up."
38,9,Jack,Republican,"Audrey, simply celebrating progress isn't enough – we must acknowledge the systemic issues still plaguing our society. Dwelling on past injustices doesn't perpetuate a culture of shame, but rather awareness and action to prevent similar problems from arising. True unity requires confronting these inequalities head-on."
38,10,Audrey,Republican,"""While we've made significant progress, acknowledging past injustices shouldn't be at the expense of our current successes. Let's focus on creating a positive environment that empowers individuals through education and opportunity, rather than dwelling on past problems that can't be changed."""
38,10,Jack,Republican,"I disagree, Audrey, focusing solely on education and opportunity while ignoring systemic injustices only glosses over the problem. It's crucial to acknowledge and confront historical wrongs to create meaningful change, or we'll only address symptoms, not the root cause of racism."
38,11,Audrey,Republican,"Jack, I think we're misunderstanding each other. I'm not asking to ignore systemic issues, but rather focus on the progress we've made. Let's acknowledge our successes and use them as a foundation to empower individuals, rather than dwelling on the past."
38,11,Jack,Republican,"Audrey, I understand your desire to focus on progress, but that's just it – progress. We're not where we need to be. Ignoring systemic issues won't magically solve racism; it'll just mask the problem. We must confront and dismantle these inequalities for true equality to prevail."
38,12,Audrey,Republican,"Jack, I think it's imperative that we focus on promoting unity and celebrating our successes in tackling racism. Dwelling on past injustices can hinder further progress and create a negative atmosphere. We can use our progress as a foundation to empower individuals through education and opportunity."
38,12,Jack,Republican,"Audrey, I understand your desire for unity, but unity built on ignoring systemic issues is an illusion. We can't move forward by leaving our history untouched. Acknowledging past injustices is crucial for genuine progress, or we'll just be covering up the same old problems."
38,13,Audrey,Republican,"Jack, I still believe that focusing on past injustices doesn't give us a clear plan for the future. Instead of dwelling on what went wrong, let's use our progress as a foundation to create a positive, inclusive environment where everyone has equal opportunities to succeed."
38,13,Jack,Republican,"Audrey, ignoring the lessons of our past mistakes is a recipe for repeating them. Focusing solely on progress and unity without confronting systemic racism is merely sugarcoating the issue. We must peel back the layers to truly address this problem and work towards a more equitable future."
38,14,Audrey,Republican,"""I understand Jack's concerns, but constant dwelling on past injustices creates a negative atmosphere. By celebrating our progress, we can empower individuals to strive for success, rather than focusing on past wrongs. Let's use education and opportunity to lift each other up."""
38,14,Jack,Republican,"Audrey, you're misunderstanding the purpose of acknowledging past injustices - it's not to dwell in the past, but to inform our actions and prevent similar problems from arising. By ignoring these issues, we'll only maintain the status quo, rather than working towards genuine equality."
38,15,Audrey,Republican,"""I still believe that concentrating on progress, unity, and education will be a better approach to empowering individuals and promoting equality. Let's focus on building a positive environment that encourages everyone to strive for success and lift each other up, rather than dwelling on past injustices."""
38,15,Jack,Republican,"Audrey, your approach would only provide a temporary Band-Aid, masking the systemic problems that perpetuate inequality. Confronting and dismantling these issues is crucial for genuine progress. We must acknowledge past injustices, not ignore them, to create a truly inclusive society."
38,16,Audrey,Republican,"""I still believe, Jack, that focusing on the progress we've made in addressing racism is the right approach. Celebrating our successes and empowering individuals through education and opportunity will foster a more positive and inclusive environment, rather than dwelling on past injustices."""
38,16,Jack,Republican,"Audrey, perpetuating a culture of unity without acknowledging systemic issues is naive. You can't build a strong foundation by ignoring the roots of the problem. We need honest conversations about racism, not sugarcoating progress to feel better about ourselves."
38,17,Audrey,Republican,"Jack, I understand your concerns, but we can't sugarcoat the progress we've made. Our laws and institutions provide equal opportunities for all, and it's time to celebrate these successes rather than dwelling on past injustices that have been largely rectified. This will empower individuals to strive for success."
38,17,Jack,Republican,"Audrey, celebrating current progress won't hide the lingering effects of systemic racism. Ignoring these issues won't guarantee true equality; it'll only perpetuate the status quo. We must confront these problems head-on, not merely acknowledge current successes, to create a genuinely equitable society for all."
38,18,Audrey,Republican,"Jack, I understand that you're concerned with systemic issues, but I still believe we should focus on celebrating our progress and empowering individuals through education and opportunity. This positive approach will foster a more inclusive environment, rather than dwelling on past injustices."
38,18,Jack,Republican,"Audrey, you're mistaken if you think sugarcoating our progress will solve racism. Dwelling on past injustices isn't dwelling, it's confronting the root cause. Ignoring systemic issues only keeps us stuck in the status quo. We must tear down these inequalities, not paper over them."
38,19,Audrey,Republican,"Jack, I understand you're coming from a place of concern, but truly moving forward requires a balance between acknowledging the past and celebrating our progress. Focusing solely on past injustices won't lift people up; it's time to focus on unity, education, and opportunity."
38,19,Jack,Republican,"Audrey, I disagree. Balance isn't enough. We can't gloss over systemic racism and expect change. Acknowledging and confronting past injustices is crucial for genuine progress, and that's what truly moves us forward, not sugarcoating or dwelling on unity."
38,20,Audrey,Republican,"I still believe that acknowledging our progress is essential to promoting unity and celebrating our successes. We should focus on empowering individuals through education and opportunity, rather than perpetuating a culture of shame and dwelling on past injustices that have largely been rectified."
38,20,Jack,Republican,"Audrey, acknowledging past injustices isn't about perpetuating shame, but about confronting the root cause of racism. sugarcoating progress won't solve this issue. Systemic inequalities must be dismantled for genuine change to occur, or we risk maintaining a status quo that perpetuates inequality."
38,21,Audrey,Republican,"Jack, I understand where you're coming from, but I still believe we should focus on our progress and empower individuals through education and opportunity. This positive approach will foster a more inclusive environment, allowing everyone to strive for success without being held back by past injustices."
38,21,Jack,Republican,"""Audrey, I'm disappointed by your unwillingness to confront the harsh realities of systemic racism. You can't build a bridge to unity by ignoring the foundations of inequality. We must address these root issues for genuine progress, not sugarcoat them to feel better about our progress."""
38,22,Audrey,Republican,"Jack, I understand why you feel strongly about this, but I still believe focusing on our progress and celebrating successes is a more constructive approach.  We've made significant strides in addressing racism, and it's time to empower individuals to continue this progress through education and opportunity."
38,22,Jack,Republican,"Audrey, ignoring the root cause of systemic racism will only lead to superficial solutions. We need honest conversations about racism, not just celebratory gestures. Sugarcoating progress won't dismantle inequality; confronting it will."
38,23,Audrey,Republican,"I understand Jack's concerns, but we've made significant progress in addressing racism. Let's build on this foundation by empowering individuals through education and opportunity, rather than dwelling on past injustices that have largely been rectified. This approach will foster a more positive and inclusive environment."
38,23,Jack,Republican,"Audrey, it's disheartening to see you downplay the devastating impact of systemic racism. Progress without acknowledgment of past injustices is fleeting. We can't genuinely empower individuals when we ignore the inequalities that entrenched racism perpetuates. Let's confront this issue, not just celebrate our successes."
38,24,Audrey,Republican,"""I understand Jack's concerns, but I still believe focusing on our progress and empowering individuals through education and opportunity is a better approach. We've made significant strides in addressing racism, and it's time to build on this foundation for a more inclusive and positive environment."""
38,24,Jack,Republican,"Audrey, ignoring the brutal history of systemic racism won't bring about lasting change. Acknowledging past injustices and confronting the inequalities they've created is the only way to truly empower individuals and ensure a more inclusive society for all."
38,25,Audrey,Republican,"""I understand we have differing opinions, Jack. However, I still believe that focusing on past injustices can create a negative atmosphere. Let's use the progress we've made as a foundation to empower individuals through education and opportunity, helping them strive for success and build a better future."""
38,25,Jack,Republican,"Audrey, your approach merely covers up the root of the issue, masking inequality with temporary fixes. Confronting and dismantling systemic racism is the only path to true progress and equality, not perpetuating a facade of unity by ignoring the brutal facts of our past."
38,26,Audrey,Republican,"Jack, I still believe focusing on progress and empowering individuals through education and opportunity will foster a more inclusive environment. By celebrating our successes, we can create a positive atmosphere that encourages everyone to strive for success and build a better future together."
38,26,Jack,Republican,"Audrey, by ignoring the root of systemic racism, we're merely treating symptoms, not the disease. Confronting and dismantling these inequalities is the only way to truly empower individuals and ensure a more inclusive society, not just maintaining a facade of unity."
38,27,Audrey,Republican,"Jack, I understand your concerns, but I firmly believe we've made significant progress in addressing racism. Rather than dwelling on past injustices, let's focus on empowering individuals through education and opportunity, and build a positive, inclusive environment where everyone has equal chances to succeed."
38,27,Jack,Republican,"Audrey, I'm disappointed by your dismissal of the systemic issues still plaguing our society. Acknowledging past injustices isn't dwelling, it's confronting the root cause of racism. We need honest conversations, not sugarcoated celebrations of progress, to truly address and dismantle these inequalities."
38,28,Audrey,Republican,"Jack, I understand your concerns, but I firmly believe that focusing on the progress we've made is essential to moving forward. By celebrating our successes and empowering individuals, we can create a positive environment where everyone has equal opportunities to succeed and thrive."
38,28,Jack,Republican,"Audrey, your refusal to acknowledge the lingering effects of systemic racism is alarming. We can't truly empower individuals by ignoring the brutal history of inequality. Confronting and dismantling these issues is crucial for genuine progress, not just sugarcoating our successes."
38,29,Audrey,Republican,"""Jack, I understand your concerns about systemic racism, but I still believe that celebrating our progress and empowering individuals through education and opportunity will create a more positive and inclusive environment for everyone, rather than dwelling on past injustices that have largely been rectified."""
38,29,Jack,Republican,"Audrey, it's not about celebrating progress; it's about confronting the entrenched inequalities that perpetuate racism. Acknowledging the lingering effects of systemic racism is crucial for genuine progress. Sugarcoating our successes won't dismantle these inequalities; honest conversations will."
38,30,Audrey,Republican,"Jack, I understand your frustration, but dwelling on the past won't solve racism. Let's focus on promoting unity and celebrating our progress in educating and uplifting individuals, creating a positive environment where everyone can strive for success and thrive together."
38,30,Jack,Republican,"Audrey, unity without honesty is nothing but a facade. We can't promote positive change by covering up systemic racism. We must confront these inequalities head-on, not sugarcoat our progress. Acknowledging past injustices is crucial for genuine progress, not dwelling on the past."
