Session,Round,Agent Name,Party,Response
6,1,Ezra,Republican,"I'm not sure what all the fuss is about with racism. People get treated differently based on all sorts of factors – money, education, sports teams. It's not that interesting. Let's focus on issues that really make a difference, like economic growth and crime rates."
6,1,Addison,Republican,"Ezra, I'm disappointed you downplay racism's impact. It's not just about treatment; it's a systematic issue. The 14th Amendment ensures equal protection, but our history and current policies show we're far from equal. Let's discuss how we can address these systemic inequalities rather than dismissing them as ""not interesting."""
6,2,Ezra,Republican,"Addison, I still see it as a matter of personal choice and individual responsibility. Systemic inequalities aren't new; our history's messy. We've made progress, and I believe current policies like affirmative action only create more divisions. Why not focus on more inclusive, economic opportunities?"
6,2,Addison,Republican,"Ezra, simplistic views on personal responsibility don't account for centuries of institutionalized oppression. Affirmative action isn't creating divisions – it's a Band-Aid for the entrenched inequality still felt by many marginalized groups. Your call for inclusion is empty without acknowledging this root issue."
6,3,Ezra,Republican,"""While centuries of oppression matter, I still believe that personal responsibility can bridge gaps created by systemic inequality. We can't just dwell on past injustices; let's focus on policies that empower individuals, regardless of background, to succeed and contribute to our society's prosperity."""
6,3,Addison,Republican,"Ezra, your 'personal responsibility' ideology ignores the tangible obstacles people of color face daily. Simply expecting them to 'compete on a level playing field' won't erase the entrenched disparities. We need to tackle these systemic issues head-on, rather than treating them as abstract moral lessons."
6,4,Ezra,Republican,"""I understand your points, Addison, but expecting everyone to 'pull themselves up by their bootstraps' ignores the reality of those bootstraps being often absent or unevenly crafted due to past injustices. It's not about blame, but about fairness and creating equal opportunities."""
6,4,Addison,Republican,"Ezra, your words sound compassionate, but what about the policies that perpetuate these injustices? We need concrete actions, not vague promises of fairness. Let's discuss tangible solutions, such as dismantling discriminatory laws and allocating funds for education and job training to truly empower marginalized communities."
6,5,Ezra,Republican,"""While I accept that past injustices have harmed some communities, I still believe America provides unparalleled opportunities for everyone, regardless of background. Focusing on individual empowerment, education, and economic growth can help bridge these gaps more effectively than forced policy interventions."""
6,5,Addison,Republican,"Ezra, your optimism about America's opportunities is naive. Without addressing systemic inequalities and the concrete obstacles that come with them, your notion of 'equal opportunities' remains an empty promise. We can't simply 'grow' our way out of the problems that institutionalized racism has created."
6,6,Ezra,Republican,"""I understand the complexity of racism, Addison. However, I firmly believe that our nation's best qualities – fairness, equality, and hard work – should guide our policies, rather than reinforcing past grievances. Can't we strive for a united America where individual merit prevails over identity?"""
6,6,Addison,Republican,"Ezra, you continue to downplay the significance of systemic racism and the tangible obstacles that exist. Emphasizing 'individual merit' over 'identity' ignores the impact of centuries-long oppression on people's lives. We can't erase history by simply wishing for unity without concrete actions to dismantle these systems."
6,7,Ezra,Republican,"""I understand your conviction, Addison, but unity shouldn't be threatened by an insistence on past grievances. Instead, let's focus on forging a path forward where individual talent and effort can flourish without artificial divisions. Can we find common ground in promoting equal opportunities?"""
6,7,Addison,Republican,"Ezra, unity without genuine acknowledgment of systemic racism won't heal the wounds of the past. Focusing solely on individual merit ignores centuries of structural inequality. You can't build a more just society by dismissing the very real, ongoing impact of racism."
6,8,Ezra,Republican,"""Addison, I understand our views differ, but I truly believe individual merit and a merit-based system can help bridge the gaps created by systemic inequalities. Perhaps we can work together to create inclusive policies that empower all Americans to succeed."""
6,8,Addison,Republican,"""I understand we disagree, Ezra. However, treating systematic inequality as a moral lesson rather than a tangible issue to address is insufficient. We should focus on concrete actions, dismantling discriminatory laws and allocating funds for education and job training to empower marginalized communities."""
6,9,Ezra,Republican,"""I understand your concerns, Addison. While I still believe individual merit and economic opportunities can help bridge gaps, I'm willing to consider tangible solutions to dismantle discriminatory laws and allocate funds for education and job training, as you suggest. Let's work together to find common ground."""
6,9,Addison,Republican,"Ezra, despite your willingness to consider policy changes, I worry that you still downplay systemic racism's significance. Addressing these entrenched issues requires more than 'equal opportunities' – it demands concrete dismantling of discriminatory laws and infrastructure. Will we truly invest in marginalized communities or just give empty promises?"
6,10,Ezra,Republican,"Addison, I appreciate your persistence in highlighting systemic racism's importance. While I still believe individual merit and economic opportunities can help bridge gaps, I agree that concrete policy changes, like dismantling discriminatory laws and allocating funds for education and job training, are essential steps towards true equality."
6,10,Addison,Republican,"Ezra, while I appreciate your acknowledgement of concrete policy changes, I remain skeptical. True equality demands more than tokenistic reforms. We need a comprehensive revamp of our system, dismantling the entrenched racist structures embedded in our institutions, laws, and culture, to ensure true justice for marginalized communities."
6,11,Ezra,Republican,"""I understand, Addison, that dismantling systemic racism requires drastic changes. I agree that a comprehensive approach is necessary, but I still believe it's crucial to empower individuals, regardless of background, with equal opportunities and access to education, job training, and economic growth."""
6,11,Addison,Republican,"Ezra, no matter how many equal opportunities we offer, as long as the system remains rigged against marginalized communities, true equality will remain an illusion. We can't just 'empower' individuals with opportunities; we must confront and dismantle the systemic barriers hindering their progress."
6,12,Ezra,Republican,"""Addison, I understand your point about systemic barriers, but empowering individuals from all backgrounds with equal opportunities can still be a step forward, even if imperfect. Can we work together to create policies that dismantle biases and provide real avenues for growth and healing?"""
6,12,Addison,Republican,"Ezra, while your openness to dismantle biases is a start, I still see it as a cosmetic solution rather than a systemic overhaul. Tokenistic reforms won't bridge the centuries-long chasm created by institutionalized racism without a comprehensive dismantling of racist structures in our institutions, laws, and culture."
6,13,Ezra,Republican,"""I understand your skepticism, Addison. While tokenistic reforms may fall short, I still believe empowering individuals from all backgrounds with equal opportunities can be a stepping stone towards dismantling systemic barriers and fostering inclusivity, as a first step towards comprehensive reform."""
6,13,Addison,Republican,"Ezra, despite your willingness to dismantle biases, your focus remains on individual empowerment rather than systemic change. Tokenistic reforms won't suffice; we need a comprehensive overhaul of our institutions, laws, and culture to truly address the entrenched racism that's crippled marginalized communities for centuries."
6,14,Ezra,Republican,"""I acknowledge the systemic injustices, Addison, and agree that tokenistic reforms may not suffice. Let's work together towards comprehensive reform, starting with concrete policies to dismantle discriminatory laws and invest in marginalized communities. I'm willing to listen and adjust my views to achieve real change."""
6,14,Addison,Republican,"Ezra, while you've expressed willingness to act, I'm still unclear if you truly understand the magnitude of the problem. Tokenistic reforms won't bridge the gap. We need a drastic overhaul of our institutions, laws, and culture, and true investment in marginalized communities to achieve real equality."
6,15,Ezra,Republican,"""I understand Addison's urgency for systemic change, and I acknowledge the need for more comprehensive reform, beyond tokenistic efforts. I'm willing to listen and learn from marginalized communities, working together to create policies that dismantle discriminatory laws and foster true inclusivity."""
6,15,Addison,Republican,"Ezra, while I appreciate your willingness to listen and learn, understanding the magnitude of systemic racism requires more than words. I urge you to engage in genuine conversations with marginalized communities, not just consult experts or token allies. Their voices hold the key to true reform."
6,16,Ezra,Republican,"""Addison, I'll take your advice to heart. I'll engage in open and honest conversations with marginalized communities, listening to their experiences and voices. This will help me better understand the complexities of systemic racism and create more effective policies for true reform."""
6,16,Addison,Republican,"Ezra, I appreciate your willingness to listen and learn, but mere conversations won't dismantle systemic racism. We need concrete policy changes, like dismantling discriminatory laws, investing in education, and job training, to address the entrenched disparities that have plagued marginalized communities for centuries."
6,17,Ezra,Republican,"""I understand the need for concrete policy changes. Dismantling discriminatory laws, investing in education and job training, and promoting economic growth can help bridge gaps. I'm willing to work together to create tangible solutions, incorporating perspectives from marginalized communities to achieve lasting reform."""
6,17,Addison,Republican,"Ezra, I appreciate your willingness to engage with marginalized communities, but true reform requires more than just conversation and promises. We need concrete actions, like policy changes and resource allocation, to dismantle discriminatory laws and institutions that perpetuate systemic inequality."
6,18,Ezra,Republican,"""Addison, I comprehend the critical need for concrete policy changes and systemic overhaul. I'm committed to working together, engaging with marginalized communities, and supporting reforms like dismantling discriminatory laws, investing in education, and promoting economic growth to achieve lasting equality."""
6,18,Addison,Republican,"Ezra, I appreciate your willingness to listen and work towards reform, but I'm still concerned that your emphasis on individual empowerment and economic growth neglects the entrenched racism that's been institutionalized for centuries. We need concrete actions, not just promises of a ""more inclusive"" America."
6,19,Ezra,Republican,"""I acknowledge the institutionalized racism, Addison, and agree that tokenistic reforms won't suffice. Let's work together on concrete policy changes, like dismantling discriminatory laws and investing in marginalized communities, to truly address systemic inequalities and create a more inclusive America."""
6,19,Addison,Republican,"""Ezra, your willingness to work on concrete policy changes is a step in the right direction, but we must ensure that these changes address the root causes of systemic racism, rather than just treating its symptoms. We can't just 'be more inclusive' – we must dismantle inequality."""
6,20,Ezra,Republican,"""I understand Addison's concerns, and I agree that addressing systemic racism requires more than just tokenistic reforms. I'm committed to working together, engaging with marginalized communities, and supporting concrete policy changes to dismantle discriminatory laws and institutions, and create a more equal America."""
6,20,Addison,Republican,"While I'm glad you acknowledge the need for concrete policy changes, Ezra, I still worry that your emphasis on individual empowerment and economic growth doesn't directly address the systemic inequalities that have been ingrained in our institutions for centuries. We need bold action to dismantle these structures."
6,21,Ezra,Republican,"""I acknowledge the complexity of systemic racism, Addison. I'm committed to working with you and marginalized communities to create concrete policy changes, like dismantling discriminatory laws and institutions, to dismantle the entrenched racism that's crippling our society for centuries."""
6,21,Addison,Republican,"Ezra, I appreciate our efforts to find common ground, but your willingness to dismantle discriminatory laws and institutions is a crucial step towards true reform. I urge you to prioritize systemic change, focusing on tangible policy changes that directly address ingrained racism in our institutions."
6,22,Ezra,Republican,"""I understand Addison's concern about prioritizing systemic change. I agree to focus on tangible policy changes that directly address ingrained racism in our institutions. By dismantling discriminatory laws and institutions, we can create a more equal America, where everyone can thrive."""
6,22,Addison,Republican,"""I appreciate your newfound willingness to address systemic racism, Ezra. However, mere dismantling of discriminatory laws is just the beginning. We must also allocate substantial funds for meaningful cultural shifts, such as nuanced education and economic empowerment initiatives to uplift marginalized communities."""
6,23,Ezra,Republican,"""Addison, I accept that dismantling discriminatory laws is just the beginning. I'm willing to work with you to allocate funds for meaningful cultural shifts, such as education and economic empowerment initiatives that uplift marginalized communities and promote true equality and inclusion."""
6,23,Addison,Republican,"Ezra, I'm heartened by your newfound willingness to address systemic racism, but I still worry your emphasis is on 'dismantling discriminatory laws' rather than tackling the entrenched cultural shifts that perpetuate racism. We need concrete actions and genuine investments in marginalized communities, not just empty promises of reform."
6,24,Ezra,Republican,"Addison, I acknowledge the limitations of my previous focus on dismantling discriminatory laws. I'm committed to a comprehensive approach that addresses both institutional racism and cultural shifts through tangible actions, education, and economic empowerment initiatives to uplift marginalized communities and promote true equality."
6,24,Addison,Republican,"Ezra, while I appreciate your newfound commitment to a comprehensive approach, let's not forget the importance of immediate action on dismantling laws and institutions perpetuating racism. We can't afford to drag our feet on this critical issue, or marginalized communities will continue to suffer."
6,25,Ezra,Republican,"""I see your point, Addison. I'm willing to prioritize dismantling discriminatory laws and institutions, as well as investing in meaningful cultural shifts, like education and economic empowerment initiatives that uplift marginalized communities and promote true equality."""
6,25,Addison,Republican,"Ezra, while I appreciate your commitment to a comprehensive approach, I worry tokenistic reforms can be slowed down or watered down. I urge you to prioritize immediate, concrete actions – dismantling discriminatory laws and institutions – to start healing the wounds of systemic racism today, not decades from now."
6,26,Ezra,Republican,"""I understand Addison's urgency for immediate action. I agree to prioritize dismantling discriminatory laws and institutions, allocating funds for education and economic empowerment initiatives to uplift marginalized communities. Together, we can start healing the wounds of systemic racism and build a more equitable America."""
6,26,Addison,Republican,"Ezra, while I appreciate your willingness to act, your incremental approach risks perpetuating systemic racism. We need bold, immediate action: dismantling discriminatory laws, institutional reforms, and substantial investments in marginalized communities. Delaying will only continue the suffering."
6,27,Ezra,Republican,"""Addison, I understand your urgency for immediate action. I agree to prioritize bold reforms, dismantling discriminatory laws, and substantial investments in marginalized communities. Let's work together to create tangible policies that promote true equality and inclusivity, rather than slow, tokenistic changes."""
6,27,Addison,Republican,"Ezra, while I appreciate your acknowledgement of systemic racism's urgency, bold reforms demand more than mere intent. Concrete actions to dismantle discriminatory laws, institutions, and resource allocation are necessary. We need to walk the walk, not just talk the talk, to heal the wounds of marginalized communities."
6,28,Ezra,Republican,"Addison, I understand the need for swift and concrete actions. I agree to work together on dismantling discriminatory laws, reforming institutions, and investing in marginalized communities. Let's create tangible policies that promote true equality and inclusivity, rather than half-measures that delay progress."
6,28,Addison,Republican,"Ezra, I appreciate your willingness to act, but your words must be corroborated with concrete actions. We need dismantling of discriminatory laws, institutional reforms, and substantial investments in marginalized communities. Delaying will only continue suffering. Let's walk the walk, not just talk the talk."
6,29,Ezra,Republican,"Addison, I understand the gravity of systemic racism. I'm committed to dismantling discriminatory laws, reforming institutions, and investing in marginalized communities with concrete actions, not just words. Together, we can create a more equitable America where everyone has a fair chance to thrive."
6,29,Addison,Republican,"Ezra, I appreciate your commitment to tangible actions, but words are empty without concrete policy changes. We must dismantle discriminatory laws, reform institutions, and invest in marginalized communities. Let's ensure these actions are swift, substantial, and targeted to truly address systemic racism's roots."
6,30,Ezra,Republican,"Addison, I understand that words must be followed by concrete actions. I'm committed to dismantling discriminatory laws, reforming institutions, and investing in marginalized communities. Together, we can create a more equitable America where everyone has a fair chance to thrive, without empty promises or tokenistic reforms."
6,30,Addison,Republican,"Ezra, while I appreciate your commitment to concrete actions, let's not forget that true equality demands more than policy changes. It requires a fundamental shift in our societal values and institutions to actively dismantle the systemic racism that perpetuates inequality."
