Session,Round,Agent Name,Party,Response
3,1,Daniel,Republican,Racism's a relic of the past. It's being blown way out of proportion. We're a progressive nation where anyone can make it to the top regardless of their background. These claims of systemic racism are just an excuse to disrupt our societal norms.
3,1,Henry,Republican,"Daniel, I have to disagree. I've seen and heard stories of people being treated unfairly, of injustices left unspoken. Denying systemic racism is ignoring real pain and struggle. It's not about tearing down norms, but acknowledging and addressing the problems that exist."
3,2,Daniel,Republican,"""I understand your passion, Henry, but I think you're caught up in the 'victim mentality.' Every group face challenges, but that doesn't mean systemic racism exists. Personal achievement stems from hard work, not supposed systemic barriers. We should celebrate success, not blame the system for failures."""
3,2,Henry,Republican,"""Daniel, hard work and personal achievement are crucial, but they don't deny the fact that people of color face additional hurdles due to historically entrenched biases and discriminatory policies. Ignoring these obstacles doesn't equalize opportunities or erase real pain."""
3,3,Daniel,Republican,"""I still disagree, Henry. You're generalizing an entire group with specific challenges. Many people of color succeed without systemic barriers holding them back. Focusing on supposed historical biases ignores progress we've made. Let's encourage success, not dwell on past grievances."""
3,3,Henry,Republican,"Daniel, I'd rather acknowledge the past and strive for a better future than pretend those hurdles don't exist. History didn't erase itself overnight. Progress has been made, but progress is ongoing. Acknowledging the challenges faced by people of color doesn't diminish our own achievements; it's about fairness and equality."
3,4,Daniel,Republican,"""I think we're clouding the issue with emotional appeals. Facts show progress in reducing racial disparities. What we need is more personal responsibility and less reliance on government assistance. We can't solve these problems with more handouts or sweeping apologies; let's focus on true equal opportunity through the free market."""
3,4,Henry,Republican,"Daniel, relying on personal responsibility ignores the disproportionate wealth, education, and access to opportunities that people of color often lack. Simply expecting them to overcome these barriers is unrealistic and unfair. We need policies that address these systemic issues, not just empty promises."
3,5,Daniel,Republican,"Henry, I think you're misunderstanding personal responsibility. It's not about expecting people of color to overcome obstacles on their own, but providing opportunities through the free market – education, job training, and entrepreneurship. This way, everyone has a fair chance to succeed."
3,5,Henry,Republican,"Daniel, providing opportunities through the free market is a good start, but systemic disparities require more than just job training and education. Concrete policies and actions, like affordable housing, voting rights protection, and targeted investments, can bridge the gaps and create a more level playing field for all."
3,6,Daniel,Republican,"""Henry, your plea for government intervention creates a dependency on handouts rather than embracing personal responsibility and opportunity through the free market. We must empower individuals with the tools to succeed, not further perpetuate reliance on a flawed system."""
3,6,Henry,Republican,"Daniel, I understand your concerns about fostering a culture of dependency, but people of color have been disproportionately affected by systemic barriers. Empowering individuals requires acknowledging and actively addressing these disparities, not ignoring them. Government assistance is a last resort, not a dependency."
3,7,Daniel,Republican,"""Government assistance won't solve systemic disparities, Henry. I'm not ignoring the issue; I'm advocating for effective solutions – education, job training, and merit-based opportunities – that empower individuals to overcome their struggles, rather than relying on handouts."""
3,7,Henry,Republican,"Daniel, you keep avoiding the hard truth – systemic disparities aren't fixed by education or job training alone. For decades, these programs have had limited success due to underlying biases. We need to confront these issues head-on, not sidestep them with Band-Aid solutions."
3,8,Daniel,Republican,"""History has shown that government programs and affirmative action policies often lead to unintended consequences, fostering resentment and creating more barriers. Focus on empowerment through education, entrepreneurship, and merit-based opportunities, giving everyone a fair chance to succeed and break down systemic disparities."""
3,8,Henry,Republican,"""I respectfully disagree, Daniel. Affirmative action and targeted programs have yielded progress in certain areas, showing that tailored solutions can address specific inequalities. We shouldn't dismiss these successes as 'Band-Aid' or fear the consequences of challenging systemic disparities. The status quo hasn't worked for people of color."""
3,9,Daniel,Republican,"""I think we're moving off track, Henry. Our focus should be on addressing the real issue – individual freedom and responsibility. By empowering individuals with education and opportunities, we create a more equal landscape. Not by government intervention, but by personal choice and initiative."""
3,9,Henry,Republican,"Daniel, despite our differing views, I agree that individual freedom and responsibility are essential. However, individual choices are often constrained by systemic barriers. By acknowledging these inequalities and addressing them through targeted policies, we can create a more level playing field, enhancing both individual freedom and responsibility."
3,10,Daniel,Republican,"Henry, I think you're missing the point – systemic racism is a mythical concept, an excuse for lack of achievement. Personal responsibility and free market solutions address inequality, not government handouts. Focusing on systemic barriers only divides us further, hindering our progress as a nation."
3,10,Henry,Republican,"Daniel, our debate has shown that we see this issue through different lenses. I'd like to challenge you: instead of dismissing the experiences of people of color, let's keep listening and working towards a truth that acknowledges both individual responsibility and systemic injustices, for a more perfect union."
3,11,Daniel,Republican,"Henry, I think our conversation has been clouded by speculation about systemic racism. Facts and data suggest that we've made significant progress in reducing racial disparities. Let's focus on policies that empower individuals, rather than perpetuating a narrative that divides us further."
3,11,Henry,Republican,"Daniel, focusing solely on individual empowerment ignores decades of research showing systemic disparities persist, limiting access to education, healthcare, and economic opportunities. I propose we acknowledge these facts and work together to create targeted policies addressing the root causes of racial inequality."
3,12,Daniel,Republican,"""I think it's time to move on from this topic. We've made progress in reducing racial disparities, and we should focus on preserving individual freedoms and empowering people through education and opportunity. Let's celebrate the successes of people of color rather than dwelling on perceived grievances."""
3,12,Henry,Republican,"Daniel, progress can be a false narrative when certain groups are still left behind. Let's not cherry-pick data that supports our views; instead, engage with evidence that shows systemic disparities persist. This isn't about dwelling on grievances but addressing real challenges."
3,13,Daniel,Republican,"Henry, I still believe that focusing on systemic racism divides us. Celebrating individual successes and providing equal opportunities through the free market is the key to bridging the gap, not dwelling on past grievances or perceived injustices."
3,13,Henry,Republican,"""Daniel, acknowledging past injustices doesn't divide us; it's about accountability and fairness. I'd rather we work towards a truth that values both individual responsibility and systemic injustices. Let's strive for a nation where every American has equal access to opportunities, regardless of their background."""
3,14,Daniel,Republican,"""I still don't see the value in dwelling on past grievances. We've made progress, and individual freedoms and market-driven opportunities can bridge the gap. Focusing on systemic racism creates divisiveness and ignores the many successes of people of color who've achieved greatness through hard work and determination."""
3,14,Henry,Republican,"Daniel, your dismissal of systemic racism as mere ""grievances"" or ""divisiveness"" erases the lived experiences of people of color. Progress is built on acknowledging, not ignoring, past injustices. I refuse to celebrate success without addressing the systemic barriers that perpetuate inequality."
3,15,Daniel,Republican,"""Let's focus on the facts, Henry. Progress has been made, and the free market can provide equal opportunities. Education and job training can empower individuals, regardless of their background. Systemic racism is an unnecessary narrative that stirs up unnecessary drama and divides us further."""
3,15,Henry,Republican,"""Daniel, I'd rather discuss concrete actions than dismiss the lived experiences of people of color. The narrative of systemic racism isn't unnecessary, it's necessary for addressing the real challenges faced by communities of color and creating a more just society."""
3,16,Daniel,Republican,"""Henry, I still believe individual freedoms and market-driven opportunities are the keys to bridging the gap. Focusing on systemic racism creates divisiveness and shifts accountability away from personal responsibility. We should celebrate individual successes, not dwell on alleged grievances that ignore progress made."""
3,16,Henry,Republican,"""Daniel, while I agree we should celebrate individual successes, dismissing systemic racism ignores the collective struggles of people of color. Let's focus on creating targeted policies that address these disparities, providing equal access to opportunities, and bridging the gaps that exist, not just paying lip service to progress."""
3,17,Daniel,Republican,"""Let's focus on policies that empower individuals, not perpetuate the myth of systemic racism. Education, job training, and merit-based opportunities will bridge the gap, not government handouts or affirmative action policies that stifle individual freedom and responsibility."""
3,17,Henry,Republican,"Daniel, I firmly believe that acknowledging systemic racism and actively working to address its effects is a necessary step towards creating a more just society. It's not about blaming individuals, but about dismantling structural barriers that hinder progress and equality."
3,18,Daniel,Republican,"""I still believe Henry's focus on systemic racism clouds the issue. Individual freedoms, education, and merit-based opportunities are the keys to real progress, not government intervention. By embracing personal responsibility and the free market, we create a level playing field for all."""
3,18,Henry,Republican,"Daniel, I'm not convinced that education and a meritocracy alone can bridge the systemic disparities that exist. We need targeted policies to address historical injustices, not just empty promises or platitudes about individual freedom and responsibility."""
3,19,Daniel,Republican,"""Henry, I still believe that our focus on systemic racism is misguided. Instead, let's celebrate the many achievements of people of color who've overcome obstacles through hard work and determination, proving that personal responsibility and the free market can bridge the gap."""
3,19,Henry,Republican,"Daniel, celebrating the achievements of individuals is just that – a celebration. It can't be a substitute for the broader policy changes that address the root causes of systemic disparities, ensuring equal access to opportunities for all, regardless of background. That's what's truly necessary for a just society."
3,20,Daniel,Republican,"""I think Henry's solution – government intervention – would only create more dependency and perpetuate the myth of systemic racism. By focusing on education, job training, and merit-based opportunities, individuals can overcome obstacles and succeed through hard work and determination."""
3,20,Henry,Republican,"Daniel, I understand your enthusiasm for the free market, but individual success stories don't erase the facts. Systemic disparities persist, limiting access to education, healthcare, and economic opportunities. Acknowledging these issues and implementing targeted policies is necessary for a truly level playing field and a more perfect union."
3,21,Daniel,Republican,"""Henry, I still stand by my position that systemic racism is a mythical narrative. The free market has lifted countless people out of poverty and oppression. Focusing on personal responsibility and education will continue to be the key to a more equal society, not government intervention."""
3,21,Henry,Republican,"Daniel, I understand we may not see eye-to-eye on systemic racism, but I firmly believe in acknowledging and addressing its real effects. We shouldn't dismiss the experiences of people of color; instead, let's work together to create targeted policies that create a more just society for all."
3,22,Daniel,Republican,"""Individual success stories show that personal responsibility and the free market can bridge gaps. Focusing on systemic racism creates divisiveness, ignoring the many achievements of people of color who've overcome obstacles through hard work and determination, proving a brighter future is within reach."""
3,22,Henry,Republican,"""Daniel, your dismissal of systemic racism ignores decades of research and the lived experiences of people of color. Acknowledging these injustices is crucial for creating targeted policies that promote equality and address historical disparities."""
3,23,Daniel,Republican,"""I still believe Henry's focus on systemic racism overemphasizes a narrative that's being blown out of proportion. Every ethnic group faces challenges, but that doesn't mean systemic racism exists. Personal responsibility, education, and the free market are the keys to bridging the gap, not government intervention."""
3,23,Henry,Republican,"Daniel, I still believe we must acknowledge the real disparities people of color face, even if it's uncomfortable. Focusing solely on personal responsibility ignores decades of research showing systemic injustices persist. We can empower individuals while still addressing structural barriers, not either/or, but both."
3,24,Daniel,Republican,"""I think Henry's fixation on systemic racism clouds the issue. Education and the free market have lifted people out of poverty, regardless of background, and will continue to do so. Government intervention is not the answer, but individual responsibility and opportunity are."""
3,24,Henry,Republican,"Daniel, I've come to realize we differ on the existence of systemic racism, but that doesn't mean one of us is right or wrong. Can we agree that acknowledging our differences and continuing the discussion can lead to greater understanding and potentially, positive change?"
3,25,Daniel,Republican,"""Henry, I appreciate your willingness to discuss this topic further. But acknowledging the existence of systemic racism would only create unnecessary divisions. Our conversation should focus on empowering individuals through education and the free market, not dwelling on perceived past injustices."""
3,25,Henry,Republican,"Daniel, I understand we don't see eye-to-eye on systemic racism, but I'm willing to continue this conversation to better understand your perspective. However, I can't agree to dismiss the very real experiences of people of color or ignore the facts that show persistent disparities."
3,26,Daniel,Republican,"Henry, I appreciate your willingness to discuss this topic. I still believe individual freedoms, education, and the free market are the keys to bridging the gap, not dwelling on perceived past injustices or imaginary systemic racism that divides society."
3,26,Henry,Republican,"Daniel, I've heard your views, but systemic inequalities persist. Education and job training are crucial, but they can't erase decades of historical injustices. I propose we work together to create targeted policies addressing these disparities, not dismissing their existence and leaving people of color behind."
3,27,Daniel,Republican,"""I still believe Henry's focus on systemic racism clouds the issue. Empowering individuals through education, job training, and merit-based opportunities will create a level playing field. Government intervention only creates dependency and ignores the many achievements of people of color who've overcome obstacles through hard work and determination."""
3,27,Henry,Republican,"Daniel, despite our differences, I propose we acknowledge the shared American values of fairness and equality. By recognizing the complexities of systemic racism, we can work towards targeted policies that bridge the gaps and create a more just society for all Americans."
3,28,Daniel,Republican,"""I still believe personal responsibility and the free market are the keys to bridging the gap. Empowering individuals through education and opportunity, not government handouts or affirmative action policies that stifle individual freedom and responsibility."""
3,28,Henry,Republican,"Daniel, I understand our disagreement, but can't we find common ground in promoting fairness and equality? Acknowledging past injustices and working towards targeted policies together might bring us closer to a more just society, even if our paths to get there differ."
3,29,Daniel,Republican,"""Let's agree to disagree, Henry. However, I'd like to clarify that by focusing on personal responsibility and education, I'm not ignoring the struggles of people of color. Rather, I believe these factors can empower individuals to overcome obstacles and achieve success."""
3,29,Henry,Republican,"Daniel, while I appreciate your willingness to empower individuals, dismissing systemic racism ignores the very real disparities people of color face. Let's work towards targeted policies that bridge the gaps and create a truly level playing field, where everyone has an equal opportunity to succeed."
3,30,Daniel,Republican,"""I understand we may not see eye-to-eye, Henry. However, I firmly believe that education, job training, and merit-based opportunities are the keys to bridging the gap. By empowering individuals, we can create a level playing field, regardless of the past."""
3,30,Henry,Republican,"Daniel, let's not solely focus on empowering individuals but also address the historical and systemic barriers that hinder their progress. We can have a merit-based system and address disparities – they're not mutually exclusive. We owe it to ourselves and future generations to strive for a truly equal society."
