Session,Round,Agent Name,Party,Response
4,1,Adrian,Republican,"Racism's a myth perpetuated by those trying to divide us. It's false assumptions and unfair treatment that are real issues, not the existence of racism itself. We should focus on solutions, not perpetuating hate. America's a land of equality, where all are treated with dignity and respect."
4,1,Carter,Republican,"""Equality and dignity are concepts, but do they reflect reality? I see a nation where hard work and merit matter, not the color of your skin. The left's focus on perceived racism only serves to create more division and excuses."""
4,2,Adrian,Republican,"""Carter, your words sound good on paper, but they gloss over centuries of systemic inequality. People of color still face barriers to education, employment, and voting. We need to acknowledge the facts, not just idealogy."""
4,2,Carter,Republican,"""Those barriers you mention are symptoms of broader societal issues, not systemic racism. Poor education and socioeconomic conditions are more direct causes of struggle than inherent biases against a particular group."""
4,3,Adrian,Republican,"""Carter, correlation doesn't equal causation. You may not see inherent biases, but that doesn't mean they're not there. Systemic inequality has a long history and its effects persist today. We can't just dismiss the facts and pretend everyone's on an equal playing field."""
4,3,Carter,Republican,"""Dismissing the facts isn't what I'm doing; I'm questioning the narrative that racism is the sole cause of inequality. I'd rather focus on addressing the root issues of poverty, lack of education, and broken families. That's where the real change begins."""
4,4,Adrian,Republican,"""I understand your desire to address root issues, but let's not confuse the symptom with the disease. Systemic inequality is a product of racial biases that've been ingrained in our society. Dismissing that reality hinders our progress towards a truly equal America."""
4,4,Carter,Republican,"""Systemic inequality is a catch-all phrase for problems that affect people of all backgrounds. Focusing on racism oversimplifies the complexities of human nature. I'll give you a real disease: family breakdowns and lack of personal responsibility – those are roots of struggle, not made-up racism."""
4,5,Adrian,Republican,"""Carter, your perspective is narrow-sighted and avoids the historical context that perpetuates racial biases. Breaking down family structures is just one symptom of systemic oppression. You're right there's a disease, but the disease is entrenched discriminatory practices – not a lack of personal responsibility."""
4,5,Carter,Republican,"""Adrian, you're trying to cloud the issue with history books. I'm talking about the present-day America. If personal responsibility and education aren't the keys to success, then what is? Focusing on racism does nothing to address the systemic problems that affect people from all walks of life."""
4,6,Adrian,Republican,"""Carter, you're misinterpreting my point. I'm not saying personal responsibility has no role, but it can't overshadow centuries of institutionalized barriers. Poverty, education, and family breakdowns are symptoms of a deeper issue – systemic inequality perpetuated by racial biases."""
4,6,Carter,Republican,"""I still don't see systemic racism as the root cause of inequality. Poverty and lack of education come from broken families, not racist institutions. You're attributing too much power to a system that doesn't exist."""
4,7,Adrian,Republican,"""Carter, it's easy to dismiss the centuries of struggles people of color faced. Denying systemic racism doesn't erase the facts. Institutional injustices, such as discriminatory laws, and policies that favor one group over another, continue to impact communities of color today."""
4,7,Carter,Republican,"""I've looked at my family tree, Adrian, and I see immigrants who came to this country with nothing. They worked hard, and we thrived. That's the American Dream. Personal responsibility, not systemic racism, is what got us there. It's a recipe for success, not just for some."""
4,8,Adrian,Republican,"""Carter, your personal success story may be inspiring, but it doesn't erase the struggles of countless others who faced systemic barriers. Merely working hard doesn't guarantee equal opportunities. Acknowledging and addressing these disparities is what makes America a beacon of hope and equality, not just for some."""
4,8,Carter,Republican,"""Adrian, what I see is a nation where hard work and personal merit still prevail, not inherent biases. You're assuming the deck is stacked for entire groups, but I know many who've succeeded despite the odds, not because of systemic racism."""
4,9,Adrian,Republican,"Carter, success stories like yours are exactly the exceptions that prove the rule of systemic inequality. Millions still face systemic barriers due to racism. Denying this reality hinders real progress and continues to undermine the very foundation of equality in America."
4,9,Carter,Republican,"""Adrian, exceptions prove the rule, but they don't change the fact that millions of people also succeed without facing racism. Your narrative ignores the countless everyday achievements of people from all backgrounds, perpetuating a divisive and misleading view of America."""
4,10,Adrian,Republican,"""Carter, your examples of individual success don't erase systemic inequality. It's not about dividing America or perpetuating hate, but about acknowledging and addressing the inherent biases that still permeate our institutions and society, hindering equal opportunities for all."""
4,10,Carter,Republican,"""Adrian, your persistence on systemic racism ignores individual agency. It's oversimplifying human nature to ascribe failure to biases rather than choices. We'll always have differing opinions on racism, but I still see a nation where merit and hard work thrive, not inherent biases."""
4,11,Adrian,Republican,"""Carter, your refusal to acknowledge centuries of institutionalized barriers and systemic racism hindering equal opportunities dismisses the very real struggles of people of color. Merit and hard work are crucial, but they can't overcome biases that perpetuate inequality in our country."""
4,11,Carter,Republican,"""Adrian, you're focusing on institutionalized barriers, but what about personal responsibility and individual choices? Why should we blame systemic racism for someone's lack of education or job skills? Isn't it their own fault that they're not taking control of their life?"""
4,12,Adrian,Republican,"""Carter, blaming individuals for their circumstances overlooks the effects of systemic inequality. People of color face generational barriers to education, job opportunities, and access to resources. Personal responsibility is just as crucial, but it's not a substitute for addressing institutional biases and disparities."""
4,12,Carter,Republican,"""Adrian, you're still stuck on systemic racism. What about the progress we've made? I see a nation where people of all backgrounds work together and succeed. Let's focus on empowering individuals, not perpetuating victimhood. Personal responsibility and American values can overcome any obstacle."""
4,13,Adrian,Republican,"""Carter, progress is not solely about what's been achieved, but also about acknowledging the strides that still need to be taken. Focusing on personal responsibility without addressing systemic injustices only preserves the status quo, hindering true equality and leaving many behind."""
4,13,Carter,Republican,"""Adrian, progress might not be solely about what's been achieved, but acknowledging strides takes a backseat to tangible action. Empowering individuals through education and job opportunities can have a more immediate, lasting impact on equality than debating systemic racism."""
4,14,Adrian,Republican,"""Carter, education and job opportunities are crucial, but they can't eradicate centuries of systemic inequality. You're focusing on Band-Aid solutions while ignoring the deep-seated problems. Addressing institutional bias is essential for true equality and a just society."""
4,14,Carter,Republican,"""Adrian, I still don't see how systemic racism is a primary cause of inequality. You're asking me to justify centuries of societal problems with abstract theories instead of concrete solutions to individual struggles. Personal responsibility and education can overcome any obstacle, not systemic racism."""
4,15,Adrian,Republican,"""Carter, you're misplacing concrete solutions for real-world barriers. I'm not suggesting abstract theories, but the reality of people facing racial biases in every institution – voting, education, employment, and beyond. Denying this perpetuates inequality and undermines the very foundation of America's promise."""
4,15,Carter,Republican,"""Adrian, while I acknowledge the complexity of racial biases, I firmly believe individual agency and personal responsibility have a much greater impact on an individual's success. Empowering people through education and opportunities is a proven path to equality, not systemic racism claims."""
4,16,Adrian,Republican,"""Carter, your reliance on individual agency overlooks the collective burden of systemic racism. Focusing solely on personal responsibility without addressing entrenched biases is a Band-Aid solution, not a cure for the disease. True equality demands acknowledging and addressing these deep-seated institutional issues."""
4,16,Carter,Republican,"""Adrian, you're painting a distorted picture of systemic racism. I believe individual agency and education have a far greater impact on success. People from all walks of life can rise above their circumstances, regardless of skin color. That's the American Dream."""
4,17,Adrian,Republican,"""Carter, your faith in the American Dream is admirable, but I'd argue it's not accessible to everyone due to systemic barriers. The facts show racial disparities persist in education, employment, and voting rights. Ignoring this reality perpetuates inequality, undermining the Dream's promises for many."""
4,17,Carter,Republican,"Adrian, I still see people achieving success despite challenges, not because of systemic racism. You're attributing too much power to institutions and not enough to individual effort. Focusing on racism obscures the everyday heroes who've overcome adversity through hard work and resilience – that's American excellence."
4,18,Adrian,Republican,"""Carter, your dismissal of systemic racism is misguided. Racial disparities in education, employment, and voting rights aren't coincidence, but a result of deep-seated biases. Ignoring these facts obstructs progress towards true equality and the American Dream's promise of opportunity for all."""
4,18,Carter,Republican,"""Adrian, you're still stuck on institutional racism. I've met people from all walks of life who've faced adversity and overcome it through hard work and determination. Personal responsibility is the key to success, not systemic racism. It's time to focus on solutions, not divisive theories."""
4,19,Adrian,Republican,"Carter, your refusal to acknowledge the persistence of racial disparities in education, employment, and voting rights undercuts your argument. Facts show that systemic racism is not just a theory, but a reality that hinders true equality and the American Dream's promise for millions."
4,19,Carter,Republican,"""Adrian, I understand we disagree, but I still believe personal responsibility and individual effort are the keys to success, not systemic racism. It's time to acknowledge the many who've overcome adversity through hard work, rather than perpetuating a narrative of inherent biases."""
4,20,Adrian,Republican,"""Despite our disagreement, Carter, I believe the data and lived experiences of millions of people prove systemic racism's existence. Acknowledging and addressing this reality is crucial for true equality. Blindly dismissing facts about racial disparities undermines the American Dream and perpetuates the very inequalities we aim to overcome."""
4,20,Carter,Republican,"""Adrian, the debate's shifted from addressing inequality to confirming racism's existence. What concrete steps do you propose to bridge the gaps between people of different backgrounds, rather than stoking divisions with the myth of systemic racism?"""
4,21,Adrian,Republican,"""Carter, I propose concrete steps like voting rights reform, affordable quality education, and job-training programs that target communities of color. These tangible actions address systemic issues and empower individuals. They don't dismiss the persistent racial disparities that hinder true equality."""
4,21,Carter,Republican,"""Adrian, those steps sound great on paper, but how do we know they won't create dependency and discourage personal responsibility? We need to empower individuals not just through programs, but by removing unnecessary regulations and tax burdens that stifle entrepreneurship."""
4,22,Adrian,Republican,"""Carter, programs that address systemic racism and provide equal opportunities actually foster personal responsibility and entrepreneurship. Striking a balance between support and empowerment is key. By acknowledging and addressing these disparities, we can create a level playing field where hard work and determination can thrive."""
4,22,Carter,Republican,"""Adrian, I still see no concrete evidence of systemic racism, only correlational findings that can be explained by other factors. Your proposals sound like government dependence, which undermines personal responsibility and the very idea of the American Dream."""
4,23,Adrian,Republican,"Carter, the fact that millions of people of color face systemic barriers in education, employment, and voting cannot be oversimplified to individual choices or correlational findings. The data is clear: institutionalized racism hinders true equality in America."
4,23,Carter,Republican,"""Adrian, the data may show racial disparities, but correlation doesn't equal causation. There's more to it than simply attributing it to systemic racism. We need to look at the actual causes and not just label it as racism when it's more complex."""
4,24,Adrian,Republican,"""Carter, correlation may not equal causation, but the persistence of racial disparities in education, employment, and voting is a pattern that warrants closer examination. Ignoring the elephant in the room won't make it disappear; acknowledging systemic racism is the first step towards real equality and progress."""
4,24,Carter,Republican,"""Adrian, I still maintain individual agency, personal responsibility, and education are the keys to success. The deck isn't stacked against people of color; it's stacked against those who don't put in the effort. Let's focus on empowering individuals, not just accusing institutions of racism."""
4,25,Adrian,Republican,"""Carter, you're reducing systemic inequality to individual effort and education, ignoring centuries of institutionalized biases. That's a misinformed perspective that doesn't acknowledge the lived experiences and data of millions of people of color facing real barriers to equality."""
4,25,Carter,Republican,"""Adrian, you continue to rely on emotion and assumptions rather than concrete evidence. I'll challenge those assumptions with facts. Give me a specific instance where systemic racism was proven, or an anecdote where an individual's success couldn't be attributed to personal responsibility."""
4,26,Adrian,Republican,"""Carter, the data on racial disparities in education, employment, and voting speaks for itself. The University of Michigan's affirmative action case in 2003, the NAACP's analysis of voter ID laws, and the Harvard Law review's study on systemic racism in policing are just a few examples."""
4,26,Carter,Republican,"""Those studies you mentioned, Adrian, don't prove systemic racism, they illustrate the consequences of liberal policies that create dependencies and inefficiencies. I'd like to see studies on how education and opportunity can truly empower individuals, not create more entitlements."""
4,27,Adrian,Republican,"""Racism is not just a debate, Carter; it's a lived reality for millions. The University of Michigan's affirmative action case explicitly stated the need for affirmative action to correct systemic inequalities. Education and opportunity can empower, but only if institutions acknowledge and address historical biases."""
4,27,Carter,Republican,"""Adrian, I'm still not convinced by your anecdotes. Present a single, concrete instance of systemic racism, beyond the University of Michigan case, where racial biases were found to be the primary cause of inequality. Until then, I remain skeptical about the existence of systemic racism."""
4,28,Adrian,Republican,"""Carter, I'll give you another concrete example: the 1980 Department of Housing and Urban Development's (HUD) investigation into discriminatory lending practices, which found that 75% of white neighborhoods received loans, while only 42% of black neighborhoods did. This is systemic racism in action."""
4,28,Carter,Republican,"""Adrian, that HUD investigation in 1980 is 40 years old. What about the progress we've made since then? You're stuck on an isolated incident that doesn't represent the systemic racism you claim exists today. The country's moved on from discriminatory lending practices."""
4,29,Adrian,Republican,"""Carter, just because progress has been made doesn't mean we've solved systemic racism. The HUD investigation wasn't an isolated incident; it's a symptom of ongoing biases. We must acknowledge and address these disparities, not pretend they no longer exist."""
4,29,Carter,Republican,"""Adrian, while that HUD investigation did find disparities, it's a narrow example of lending practices, not systemic racism. Other factors like economic conditions and government policies could've contributed to those results. We need more comprehensive and contemporary data to determine its relevance today."""
4,30,Adrian,Republican,"""Carter, that HUD investigation's findings have been echoed in numerous studies since then, showcasing persistent disparities in lending practices. Your narrow focus on outdated data overlooks the depth of systemic racism that continues to impact communities of color today."""
4,30,Carter,Republican,"""Adrian, I'm still not persuaded by your examples. Systemic racism feels like a convenient excuse for poor choices. I'll look at concrete actions, not just studies, to see if institutions are actively perpetuating racism. Until then, I'll focus on empowering individuals through education and opportunity."""
