Session,Round,Agent Name,Party,Response
29,1,Nathan,Democrat,"We can't just'move forward' while systemic racism remains entrenched. Ignoring the historical injustices that have led to police brutality, unequal education, and economic disparities is a form of denial. We must confront these issues head-on, with policies like reparations, restorative justice, and accountability for those responsible."
29,1,Hannah,Republican,"I disagree. Racial disparities stem from individual choices, not systemic injustices. People should be held accountable for their own actions, not punished for past sins of others. Reparations and restorative justice can't compensate for personal failures and instead create unnecessary dependency."
29,2,Nathan,Democrat,"""Unnecessary dependency"" is a myth perpetuated to silence marginalized voices. You can't just 'pull yourself up by your bootstraps' when entire systems are designed to hold people back. Individual choices are influenced by centuries of systemic oppression, and it's time we acknowledge the role of power, not just personal failure."
29,2,Hannah,Republican,"I disagree, Nathan. Your argument implies that people are helpless victims of their circumstances, rather than capable individuals who can overcome obstacles through hard work and determination. Blaming systemic oppression is a cop-out, not a constructive solution."
29,3,Nathan,Democrat,"Hannah's argument reduces the complexities of systemic oppression to a shallow narrative of individual success. She ignores the countless stories of people who've worked hard, yet still struggle to break free from systemic barriers. Her words are a slap in the face to those who've been marginalized and silenced."
29,3,Hannah,Republican,"Nathan's solution would only breed entitlement and division. We must hold individuals accountable for their actions, not perpetuate a culture of dependence. Personal responsibility and opportunity have lifted countless Americans from poverty, and it's time we relied on those principles, not handouts and government programs."
29,4,Nathan,Democrat,"""Entitlement and division aren't caused by advocacy for equality, but by the systemic injustices we're trying to correct. Handouts? You're talking about things like affordable healthcare, quality education, and a living wage – the basic rights every American deserves. It's not about being lazy; it's about being human."""
29,4,Hannah,Republican,"""I strongly disagree. Equal rights don't mean equal outcomes. Everyone has an equal chance to succeed, regardless of their background. Relying on government programs and 'handouts' just delays personal responsibility. In America, hard work and merit are the keys to success, not government-enforced equality."""
29,5,Nathan,Democrat,"Hannah, I find it laughable that you continue to dismiss the notion of systemic oppression when faced with the glaring evidence of its effects. You speak of equal opportunities, but for centuries, marginalized communities have been denied even those basic chances. It's not that they haven't worked hard, it's that they're prevented from succeeding due to the barriers you refuse to acknowledge."
29,5,Hannah,Republican,"Nathan, you're misunderstanding what equal opportunity means. It doesn't mean outcomes are identical, but that everyone has a fair shot to achieve their goals. Your focus on handouts and entitlements distracts from the root issue: individual agency. Encouraging reliance on government programs undermines the personal responsibility that built America."
29,6,Nathan,Democrat,"""The root issue is not individual agency, but systemic inequality. Your reliance on 'fair shot' language ignores the fact that some people's shots are already loaded, theirs is the gun that fires. We can't just gloss over the fact that racism has rigged the playing field, leaving marginalized communities at a disadvantage. It's not about government programs, it's about leveling the playing field."""
29,6,Hannah,Republican,"Hannah: That's a simplistic, divisive view. The playing field is just that – a level playing field where everyone starts with an equal chance, not a rigged one with predetermined outcomes. Every person's success story is built on their own efforts, not someone else's handouts or privilege."
29,7,Nathan,Democrat,"""That's it, Hannah? You think reducing systemic oppression to a simplistic 'level playing field' and 'fair shot' narrative is going to be enough? The evidence screams otherwise. From voting rights to housing to employment opportunities, systemic racism has been and continues to be a powerful force that bars the way. Acknowledge this, or keep hiding behind your self-righteous veil of individual responsibility."""
29,7,Hannah,Republican,"Nathan, you continue to distort the idea of systemic oppression to fit your narrative. There's no factual evidence to support the notion that racism has created a ""rigged playing field."" Every individual's circumstances are a result of their individual choices, experiences, and hard work, not predetermined outcomes. I still assert that personal responsibility, not government programs, is the key to unlocking true opportunity in America."
29,8,Nathan,Democrat,"This is it, Hannah. The blinders have been on for far too long. You continue to ignore the overwhelming evidence of systemic injustices, downplaying their impact on marginalized communities. The fact that you still refuse to acknowledge the obvious is appalling, not to mention disingenuous. The data screams otherwise, from studies on police brutality to education disparities. It's time to stop hiding behind the 'personal responsibility' trope and confront the harsh realities of our troubled society."
29,8,Hannah,Republican,"I refuse to engage in a discussion that discounts factual evidence and perpetuates victim-blaming stereotypes. Your refusal to acknowledge the role of systemic oppression is a disservice to the countless individuals who've faced centuries of marginalization and oppression. It's time to listen to the voices of those affected, not silence them with simplistic, reactionary opinions."
29,9,Nathan,Democrat,"You know, Hannah, this conversation reveals a disturbing dynamic - one where those with privilege get to dictate the narrative, dismissing the lived experiences of those they're pretending to discuss. It's time for you to listen, to learn, and to amplify the voices of those who deserve to be heard, not silenced by simplistic notions of 'personal responsibility."
29,9,Hannah,Republican,"Nathan, you're resorting to personal attacks now, diverting from the facts. My position remains clear: individual responsibility, not systemic injustice, is the key to overcoming difficulties. Your rejection of this idea is based solely on emotionally charged stereotypes, not empirical evidence."
29,10,Nathan,Democrat,"Enough of Hannah's platitudes, let's cut to the chase. We both know systemic racism exists, and it's not just about ""individual choices.""  It's about policies, practices, and institutions that consistently marginalize and oppress communities of color. Your attempt to reduce this complex issue to ""personal responsibility"" is tired and irresponsible."
29,10,Hannah,Republican,"Nathan, your continued insistence that systemic racism is the root of all problems despite the scarcity of empirical evidence is frustrating. By cherry-picking statistics and studies, you're obscuring the truth. Americans are not inherently flawed; we're blessed with individual agency and the chance to succeed. Let's focus on nurturing that potential, not labeling people as victims of an imagined oppression."
29,11,Nathan,Democrat,"Hannah's refusal to confront the obvious reality of systemic racism is disheartening. I've laid out the overwhelming evidence, but she continues to rely on tired tropes about individual responsibility and ""personal agency."" It's time for Americans to wake up and acknowledge the cruel legacy of racism that still lingers in our institutions, our policies, and our hearts."
29,11,Hannah,Republican,"I've had enough of your condescending attitude, Nathan. You're patronizing marginalized communities and speaking over their voices. Your solution of reparations and restorative justice is nothing but a way to guilt-trip Americans into accepting responsibility for past wrongs that many have never committed. It's time to focus on solutions that empower individuals, not create more dependency."
29,12,Nathan,Democrat,"With all your condescending lectures, you still refuse to acknowledge the obvious - that systemic racism is a harsh reality that disproportionately affects marginalized communities. You'd rather peddle the same tired narratives of individual responsibility and ""personal agency"" rather than face the brutal truth: some people's lives are rigged against them from the very beginning. It's not about guilt-tripping anyone; it's about acknowledging historical injustices and working towards a more just society."
29,12,Hannah,Republican,"Nathan, your zeal to prove systemic racism is overwhelming, but your tactics are divisive and disingenuous.  As Americans, we should strive for unity, not label each other as victims of an imagined oppression. I still insist that personal responsibility, not government programs, is the key to unlocking true opportunity in America, and it's time to focus on solutions that promote individual agency, not create more dependency."
29,13,Nathan,Democrat,"""That's the greatest con I've ever heard, Hannah. You're not just denying the reality of systemic racism; you're actively silencing marginalized voices. It's not about unity, it's about accountability. Accountability for the historical injustices that have been inflicted on communities of color. Accountability for the policies and systems that continue to marginalize and oppress them. Until you can acknowledge that, you're part of the problem, not the solution."""
29,13,Hannah,Republican,"Nathan, you're becoming increasingly vitriolic and accusatory. My position on individual responsibility and personal agency remains unchanged. Rather than resorting to personal attacks, I propose we refocus the conversation on evidence-based solutions that empower individuals and promote equality without creating more dependency."
29,14,Nathan,Democrat,"""That's too late, Hannah. The damage has been done. Your refusal to acknowledge systemic racism has not only silenced marginalized voices but has also perpetuated a system that continues to hold them back. It's time for those with privilege like you to listen, learn, and amplify those voices, not dismiss them with simplistic notions of 'personal responsibility'. The conversation isn't about evidence-based solutions, it's about confronting the brutal truth of our troubled society and working towards a more just future. We can no longer afford to sugarcoat the reality of racism in America."""
29,14,Hannah,Republican,"I fail to see the merit in Nathan's argument, as it perpetuates victimhood and relies on emotion-driven stereotypes. His fixation on systemic injustice distracts from individual agency and personal responsibility, which have time and again been shown to drive success in America."
29,15,Nathan,Democrat,"""Victimhood? You can't be serious, Hannah. This isn't about playing the victim; it's about acknowledging reality. The fact that entire communities are still fighting for basic rights and equality is not a matter of personal choice. It's a matter of systemic oppression, and until you can acknowledge that, we'll continue to be stuck in a cycle of denial. The evidence is clear: racism is not just about individual prejudices but about policies and institutions that perpetuate inequality. It's time to stop pretending otherwise."""
29,15,Hannah,Republican,"I believe Nathan's persistence in advocating for systemic racism is rooted in his desire to create a sense of moral urgency, rather than a genuine concern for equality. By framing my position as ""simplistic"" and ""denying"" reality, he's employing emotional manipulation to sway the conversation. I refuse to engage in a discussion that relies on rhetorical fallacies and emotive appeals, rather than empirical evidence. My stance on personal responsibility and individual agency remains the most effective path towards true equality and progress in America."
29,16,Nathan,Democrat,"""It's not about moral urgency, Hannah - it's about moral clarity. You're still dodging the obvious truth of systemic racism, refusing to acknowledge the harm it has caused and the injustices it perpetuates. Your 'personal responsibility' narrative is a tired excuse for ignoring the very real barriers that prevent marginalized communities from succeeding. It's time for you to listen, to learn, and to amplify the voices of those who deserve to be heard. Not silence them with your simplistic, reactionary opinions."""
29,16,Hannah,Republican,"I'd like to point out that Nathan has resorted to labeling me as someone with ""privilege"" who's ""silencing marginalized voices."" These statements are personal attacks rather than constructive arguments. He's also failed to provide empirical evidence to support his claims about systemic racism, instead relying on emotional appeals and anecdotal examples.

Meanwhile, I've consistently emphasized the importance of individual agency, personal responsibility, and the principles of equal opportunity that have lifted countless Americans from poverty. Nathan's refusal to acknowledge these facts is concerning, as it suggests that he's more interested in perpetuating a narrative of victimhood than in promoting constructive solutions.

In conclusion, I believe that Nathan's tactics are divisive and disingenuous, and that his refusal to engage in a fact-based discussion is a disservice to the conversation about racism and equality in America."
29,17,Nathan,Democrat,"Nathan: Hannah, your attempt to shift the blame from systemic racism to personal attacks and a lack of evidence is shameful. We're not arguing about empirical data; we're arguing about human lives and the inherent value of equality. Your ""equal opportunity"" mantra ignores the countless stories of people who've worked hard yet still struggle to succeed due to the obstacles created by systemic racism. Your response is classic - deny, deflect, and deflect again. It's time to take responsibility for the harm that's been inflicted on marginalized communities and work towards a more just and equitable society.

Nathan stands up from his chair, visibly upset."
29,17,Hannah,Republican,"Nathan, I understand that you're passionate about this issue, but your tone and language have become unacceptable. Personal attacks and divisive rhetoric don't contribute to a constructive conversation. I've shown you the evidence, and I've explained my position on personal responsibility and equal opportunity. If you're unwilling to engage in a civil and fact-based discussion, I'm afraid this conversation is at a standstill.

As Americans, we must strive for unity and respect in our discussions, even when we disagree. Resorting to personal attacks and name-calling will only create more division. I'm willing to listen to alternative perspectives and consider different viewpoints, but I won't engage in a conversation that resorts to emotional manipulation and inflammatory language.

If you're willing to return to a respectful and evidence-based discussion, I'm open to continuing the conversation. However, if not, I think it's time for us to agree to disagree and part ways."
29,18,Nathan,Democrat,"""Hannah, I'm not here to make friend, I'm here to make a difference. And I won't be lectured to about'respectful and evidence-based discussions' when you're the one who's been consistently dodging the truth about systemic racism. You want to talk about unity? Fine, let's talk about unity. Unity in acknowledging the harm that's been inflicted on marginalized communities, unity in taking responsibility for the injustices of our past, and unity in working towards a more just future.

You want to know how I respond to this conversation? I respond with outrage. I respond with empathy. I respond with the knowledge that I'm not just talking about numbers and statistics, but about human lives. And you know what? I'm not going to apologize for being passionate. I'm not going to apologize for standing up for what's right. And I'm certainly not going to apologize for highlighting the brutal truth of systemic racism in America.

So, Hannah, I'll say it one more time: this conversation is not about us, it's about the people who've been marginalizing and oppressed for centuries. It's about their stories, their struggles, and their fight for equality. And if you're not willing to listen to and amplify those voices, then maybe we shouldn't be talking in the first place."""
29,18,Hannah,Republican,"I understand that Nathan is impassioned about this issue, but his behavior has become unacceptable. Rather than continue to argue, I'd like to respectfully end this conversation and part ways. I'm willing to listen to different perspectives and consider alternative viewpoints, but I will not engage in discussions that resort to personal attacks, name-calling, and emotional manipulation.

It's time for us to agree to disagree and respect each other's differences. As Americans, we must strive for unity, respect, and civility in our discussions, even when we disagree. I hope that one day we can have a constructive and respectful conversation about these issues, but until then, I think it's best if we go our separate ways.

I'd like to reiterate my main points: individual responsibility, personal agency, and the principles of equal opportunity have driven success in America. These values have lifted countless Americans from poverty and provided opportunities for them to thrive. I'm not convinced that systemic racism is the root cause of all problems, and I believe that relying on government programs and ""handouts"" rather than personal responsibility undermines the very principles that have made America great.

I understand that Nathan sees things differently, and that's okay. But I will not engage in a conversation that resorts to personal attacks, divisive rhetoric, and a lack of respect for differing opinions. It's time for us to move on and focus on finding common ground and promoting constructive solutions."
29,19,Nathan,Democrat,"I shake my head, my frustration evident on my face. ""Hannah, you're still stuck in the same old rhetoric, aren't you? You're still dismissing the overwhelming evidence of systemic racism and instead choosing to blame individuals for their circumstances. You're still ignoring the very real barriers that prevent marginalized communities from succeeding.

""And you know what really grinds my gears? You're not even willing to listen to the voices of those who've been marginalized and oppressed for centuries. You're not willing to learn from their experiences and amplify their stories. Instead, you're more concerned with your own narrative, your own self-righteousness, and your own privileged perspective.

""I'm not here to have a discussion with you, Hannah. I'm here to expose the truth about systemic racism and to advocate for a more just society. And I'll keep doing it, even if it means going up against people like you who refuse to acknowledge the brutal reality of racism in America."""
29,19,Hannah,Republican,"Nathan, it's clear that our perspectives are far too divergent, and I'm not willing to engage in further debate. While I respect your passion and conviction, I must reiterate that I stand by my principles of individual responsibility, personal agency, and equal opportunity. These values have lifted countless Americans from poverty and provided opportunities for them to thrive.

I part ways with a renewed commitment to promoting constructive solutions that empower individuals, regardless of their background or circumstances. I hope that you, Nathan, continue to advocate for what you believe in, but I'm unwilling to continue this conversation in the manner it has unfolded.

To those listening, I encourage you to critically evaluate the perspectives presented and make your own informed judgments. As Americans, we must strive for unity, respect, and civility in our discussions, even when we disagree. It's time to focus on finding common ground and promoting solutions that truly benefit the many, rather than relying on divisive rhetoric and personal attacks.

I hope that our conversation might inspire others to engage in respectful discussions about important issues like racism and equality. Let us work towards a brighter future where individual agency and personal responsibility are valued, and where all people have the opportunity to succeed, regardless of their background or circumstances."
29,20,Nathan,Democrat,"I stand up from the table, my emotions running high. ""Hannah, I've had enough of your platitudes and your refusal to acknowledge the brutal truth of systemic racism in America. You've had your say, and now it's time for me to have mine. I've listened to you, I've tried to engage with you, but it's clear that you're not interested in listening to the voices of those who've been marginalized and oppressed for centuries.

""I'm done with this conversation, Hannah. I'm done with your refusal to acknowledge the harm that's been inflicted on marginalized communities. And I'm done with your condescending attitude towards those of us who are fighting for a more just society.

""But most importantly, I'm not going to be silenced. I'm not going to be shamed into silence just because I'm pushing back against your privileged perspective. I'm going to keep on fighting for what's right, even if it means going up against people like you who refuse to acknowledge the brutal reality of racism in America.

""And to those listening, I say this: don't be like Hannah. Don't be complicit in the systemic racism that continues to plague our society. Don't be afraid to listen to the voices of those who've been marginalized and oppressed for centuries. And don't be afraid to stand up for what's right, even when it's hard.

""Let's rise up, let's resist, and let's create a more just society for all. A society where everyone has the opportunity to succeed, regardless of their background or circumstances. A society where we value individual agency and personal responsibility, but also acknowledge the very real barriers that prevent some people from succeeding.

""That's the future I'm fighting for, and that's the future I believe in. And I hope that you'll join me in this fight.""

I turn to Hannah and say, ""I'm done with this conversation. But I'm not done fighting for what's right. And I'm not done exposing the truth about systemic racism in America."""
29,20,Hannah,Republican,"I'll provide a short conclusion to the debate, adhering to the specified word limit.

Nathan, I disagree with the manner in which you concluded our discussion. Your emotional outburst and refusal to listen to my perspective were unbecoming of a civil debate. Throughout our conversation, I've consistently emphasized the importance of individual agency, personal responsibility, and equal opportunity in overcoming difficulties.

While I respect your passion for this issue, I believe that your tactics were divisive and disingenuous. Your failure to provide empirical evidence to support your claims about systemic racism and your reliance on emotional appeals and anecdotal examples undermine the validity of your argument."
